Unnamed: 0.2,Unnamed: 0.1,Unnamed: 0,index,line,character,quote,scene,location,view,episode,date,series,file,sentiment
23668,23668,23668,23668,77,NATIMA,(looking around the bar) You seem to have kept busy.,10   INT. QUARK'S,QUARK'S,INT.,Profit and Loss,1994-01-13,Deep Space Nine,438.txt,0.0
23669,23669,23669,23669,78,QUARK,"Oh, yes. I'm very successful. But as the two hundred and twenty-third Rule of Acquisition says...",10   INT. QUARK'S,QUARK'S,INT.,Profit and Loss,1994-01-13,Deep Space Nine,438.txt,0.0
23670,23670,23670,23670,79,NATIMA,"Please. I haven't heard a Rule of Acquisition in seven years. And I don't want to hear one now. You never apologized, Quark. You never admitted you were wrong. I think that hurt more than anything.",10   INT. QUARK'S,QUARK'S,INT.,Profit and Loss,1994-01-13,Deep Space Nine,438.txt,0.0
23671,23671,23671,23671,80,QUARK,Would it really have made any difference?,10   INT. QUARK'S,QUARK'S,INT.,Profit and Loss,1994-01-13,Deep Space Nine,438.txt,0.0
23672,23672,23672,23672,81,NATIMA,Maybe not. But it would've been nice if you'd tried.,10   INT. QUARK'S,QUARK'S,INT.,Profit and Loss,1994-01-13,Deep Space Nine,438.txt,0.0
23673,23673,23673,23673,82,QUARK,All right. I'm sorry. I was wrong.,10   INT. QUARK'S,QUARK'S,INT.,Profit and Loss,1994-01-13,Deep Space Nine,438.txt,0.0
23674,23674,23674,23674,83,NATIMA,It's too late.,10   INT. QUARK'S,QUARK'S,INT.,Profit and Loss,1994-01-13,Deep Space Nine,438.txt,0.0
23675,23675,23675,23675,84,QUARK,It's never too late. So how long are you going to be on the station?,10   INT. QUARK'S,QUARK'S,INT.,Profit and Loss,1994-01-13,Deep Space Nine,438.txt,0.0
23676,23676,23676,23676,85,GARAK,Thank you for another enjoyable lunch. Doctor.,10   INT. QUARK'S,QUARK'S,INT.,Profit and Loss,1994-01-13,Deep Space Nine,438.txt,0.6597
23677,23677,23677,23677,86,NATIMA,I didn't think there'd be any Cardassians left on the station.,10   INT. QUARK'S,QUARK'S,INT.,Profit and Loss,1994-01-13,Deep Space Nine,438.txt,0.0
23678,23678,23678,23678,87,QUARK,He's the only one.,10   INT. QUARK'S,QUARK'S,INT.,Profit and Loss,1994-01-13,Deep Space Nine,438.txt,0.0
23679,23679,23679,23679,88,HOGUE,What do we do now?,10   INT. QUARK'S,QUARK'S,INT.,Profit and Loss,1994-01-13,Deep Space Nine,438.txt,0.0
23680,23680,23680,23680,89,QUARK,Why? Is something wrong?,10   INT. QUARK'S,QUARK'S,INT.,Profit and Loss,1994-01-13,Deep Space Nine,438.txt,0.0
23681,23681,23681,23681,90,NATIMA,"We have to leave... as soon as possible. Goodbye, Quark. Thanks for the drink.",10   INT. QUARK'S,QUARK'S,INT.,Profit and Loss,1994-01-13,Deep Space Nine,438.txt,0.0
23682,23682,23682,23682,91,QUARK,But you didn't touch it.,10   INT. QUARK'S,QUARK'S,INT.,Profit and Loss,1994-01-13,Deep Space Nine,438.txt,0.0
23683,23683,23683,23683,92,SISKO,How are your repairs coming?,16   INT. OPS,OPS,INT.,Profit and Loss,1994-01-13,Deep Space Nine,438.txt,0.0
23684,23684,23684,23684,93,O'BRIEN,The damage is more extensive than I thought. They were lucky to survive the attack.,16   INT. OPS,OPS,INT.,Profit and Loss,1994-01-13,Deep Space Nine,438.txt,0.0
23685,23685,23685,23685,94,SISKO,The attack?,16   INT. OPS,OPS,INT.,Profit and Loss,1994-01-13,Deep Space Nine,438.txt,0.0
23686,23686,23686,23686,95,O'BRIEN,They weren't in any meteor swarm. Their ship was hit by Cardassian disrupters.,16   INT. OPS,OPS,INT.,Profit and Loss,1994-01-13,Deep Space Nine,438.txt,0.0
23687,23687,23687,23687,96,KIRA,That doesn't make sense. Why would Cardassians fire on other Cardassians?,16   INT. OPS,OPS,INT.,Profit and Loss,1994-01-13,Deep Space Nine,438.txt,0.0
23688,23688,23688,23688,97,DAX,Maybe you should ask her.,16   INT. OPS,OPS,INT.,Profit and Loss,1994-01-13,Deep Space Nine,438.txt,0.0
23689,23689,23689,23689,98,NATIMA,"I hate to be an imposition, Commander, but I need my ship.",16   INT. OPS,OPS,INT.,Profit and Loss,1994-01-13,Deep Space Nine,438.txt,0.0
23690,23690,23690,23690,99,SISKO,"That's not possible. Mister O'Brien is still working on it. Your ship sustained more damage than we originally thought, in fact...",16   INT. OPS,OPS,INT.,Profit and Loss,1994-01-13,Deep Space Nine,438.txt,0.0
23691,23691,23691,23691,100,NATIMA,"You suspect our ship was damaged by Cardassian weapons. You're right, of course.",16   INT. OPS,OPS,INT.,Profit and Loss,1994-01-13,Deep Space Nine,438.txt,0.0
23692,23692,23692,23692,101,HOGUE,Professor...,16   INT. OPS,OPS,INT.,Profit and Loss,1994-01-13,Deep Space Nine,438.txt,0.0
23693,23693,23693,23693,102,NATIMA,"It's all right, Hogue. I should've told them the truth in the first place.",16   INT. OPS,OPS,INT.,Profit and Loss,1994-01-13,Deep Space Nine,438.txt,0.0
23694,23694,23694,23694,103,KIRA,Then why didn't you?,16   INT. OPS,OPS,INT.,Profit and Loss,1994-01-13,Deep Space Nine,438.txt,0.0
23695,23695,23695,23695,104,NATIMA,Because Cardassians don't involve outsiders in their internal politics. Especially Bajorans.,16   INT. OPS,OPS,INT.,Profit and Loss,1994-01-13,Deep Space Nine,438.txt,0.0
23696,23696,23696,23696,105,SISKO,Being shot at by your own people goes a little beyond politics.,16   INT. OPS,OPS,INT.,Profit and Loss,1994-01-13,Deep Space Nine,438.txt,0.0
23697,23697,23697,23697,106,NATIMA,"We take our politics very seriously. Commander, if I don't get my students to safety they're going to be killed. And if they die, the future of Cardassia may die with them.",16   INT. OPS,OPS,INT.,Profit and Loss,1994-01-13,Deep Space Nine,438.txt,0.0
23698,23698,23698,23698,107,REKELEN,"To put it simply, not everyone inside the Cardassian Empire is satisfied with the way the Central Command governs.",17   INT. COMMANDER'S OFFICE,COMMANDER'S OFFICE,INT.,Profit and Loss,1994-01-13,Deep Space Nine,438.txt,0.0
23699,23699,23699,23699,108,SISKO,"Not everyone outside, either.",17   INT. COMMANDER'S OFFICE,COMMANDER'S OFFICE,INT.,Profit and Loss,1994-01-13,Deep Space Nine,438.txt,0.0
23700,23700,23700,23700,109,NATIMA,There are some who believe the future of Cardassia shouldn't remain in the hands of the military.,17   INT. COMMANDER'S OFFICE,COMMANDER'S OFFICE,INT.,Profit and Loss,1994-01-13,Deep Space Nine,438.txt,0.0
23701,23701,23701,23701,110,SISKO,And you're among them?,17   INT. COMMANDER'S OFFICE,COMMANDER'S OFFICE,INT.,Profit and Loss,1994-01-13,Deep Space Nine,438.txt,0.0
23702,23702,23702,23702,111,HOGUE,"Yes, we are.",17   INT. COMMANDER'S OFFICE,COMMANDER'S OFFICE,INT.,Profit and Loss,1994-01-13,Deep Space Nine,438.txt,0.0
23703,23703,23703,23703,112,NATIMA,Rekelen and Hogue are two of the most important leaders of our movement.,17   INT. COMMANDER'S OFFICE,COMMANDER'S OFFICE,INT.,Profit and Loss,1994-01-13,Deep Space Nine,438.txt,0.0
23704,23704,23704,23704,113,SISKO,Which makes you fugitives.,17   INT. COMMANDER'S OFFICE,COMMANDER'S OFFICE,INT.,Profit and Loss,1994-01-13,Deep Space Nine,438.txt,0.0
23705,23705,23705,23705,114,HOGUE,The military's afraid to let us speak our minds.,17   INT. COMMANDER'S OFFICE,COMMANDER'S OFFICE,INT.,Profit and Loss,1994-01-13,Deep Space Nine,438.txt,0.0
23706,23706,23706,23706,115,NATIMA,"We only want a better future for all Cardassians. A future based on peace and non-violence. But if we achieve peace, true peace, both inside and outside our borders, the military will no longer be able to justify their control of the Empire.",17   INT. COMMANDER'S OFFICE,COMMANDER'S OFFICE,INT.,Profit and Loss,1994-01-13,Deep Space Nine,438.txt,0.9408
23707,23707,23707,23707,116,SISKO,Military governments are notoriously reluctant to give up power.,17   INT. COMMANDER'S OFFICE,COMMANDER'S OFFICE,INT.,Profit and Loss,1994-01-13,Deep Space Nine,438.txt,0.0
23708,23708,23708,23708,117,NATIMA,Ours is no exception.,17   INT. COMMANDER'S OFFICE,COMMANDER'S OFFICE,INT.,Profit and Loss,1994-01-13,Deep Space Nine,438.txt,0.0
23709,23709,23709,23709,118,REKELEN,They've already tried to kill us once... they're sure to try again.,17   INT. COMMANDER'S OFFICE,COMMANDER'S OFFICE,INT.,Profit and Loss,1994-01-13,Deep Space Nine,438.txt,0.0
23710,23710,23710,23710,119,NATIMA,Which is why I have to get them off this station... as soon as possible.,17   INT. COMMANDER'S OFFICE,COMMANDER'S OFFICE,INT.,Profit and Loss,1994-01-13,Deep Space Nine,438.txt,0.0
23711,23711,23711,23711,120,SISKO,I'll dispatch additional work crews to help repair your ship.,17   INT. COMMANDER'S OFFICE,COMMANDER'S OFFICE,INT.,Profit and Loss,1994-01-13,Deep Space Nine,438.txt,0.0
23712,23712,23712,23712,121,NATIMA,"The sooner the better, Commander.",17   INT. COMMANDER'S OFFICE,COMMANDER'S OFFICE,INT.,Profit and Loss,1994-01-13,Deep Space Nine,438.txt,0.0
23713,23713,23713,23713,122,HOGUE,We saw another Cardassian aboard the station... in the bar.,17   INT. COMMANDER'S OFFICE,COMMANDER'S OFFICE,INT.,Profit and Loss,1994-01-13,Deep Space Nine,438.txt,0.0
23714,23714,23714,23714,123,SISKO,Garak? He saw you?,17   INT. COMMANDER'S OFFICE,COMMANDER'S OFFICE,INT.,Profit and Loss,1994-01-13,Deep Space Nine,438.txt,0.0
23715,23715,23715,23715,124,NATIMA,I'm certain of it.,17   INT. COMMANDER'S OFFICE,COMMANDER'S OFFICE,INT.,Profit and Loss,1994-01-13,Deep Space Nine,438.txt,0.0
23716,23716,23716,23716,125,SISKO,Then... we may have a problem. Mister Garak is a bit of a mystery to us. One of my officers is convinced he works for Cardassian Intelligence. For all I know he could be right.,17   INT. COMMANDER'S OFFICE,COMMANDER'S OFFICE,INT.,Profit and Loss,1994-01-13,Deep Space Nine,438.txt,0.0
23717,23717,23717,23717,126,REKELEN,Why don't you arrest him?,17   INT. COMMANDER'S OFFICE,COMMANDER'S OFFICE,INT.,Profit and Loss,1994-01-13,Deep Space Nine,438.txt,0.0
23718,23718,23718,23718,127,SISKO,On what charge?,17   INT. COMMANDER'S OFFICE,COMMANDER'S OFFICE,INT.,Profit and Loss,1994-01-13,Deep Space Nine,438.txt,0.0
23719,23719,23719,23719,128,REKELEN,You're the commander. You don't need a reason.,17   INT. COMMANDER'S OFFICE,COMMANDER'S OFFICE,INT.,Profit and Loss,1994-01-13,Deep Space Nine,438.txt,0.0
23720,23720,23720,23720,129,SISKO,That's not how we do things here.,17   INT. COMMANDER'S OFFICE,COMMANDER'S OFFICE,INT.,Profit and Loss,1994-01-13,Deep Space Nine,438.txt,0.0
23721,23721,23721,23721,130,NATIMA,Nor should it be.,17   INT. COMMANDER'S OFFICE,COMMANDER'S OFFICE,INT.,Profit and Loss,1994-01-13,Deep Space Nine,438.txt,0.0
23722,23722,23722,23722,131,SISKO,I'll assign you some guest quarters. You'll be safe there until your ship is ready.,17   INT. COMMANDER'S OFFICE,COMMANDER'S OFFICE,INT.,Profit and Loss,1994-01-13,Deep Space Nine,438.txt,0.0
23723,23723,23723,23723,132,NATIMA,"We appreciate your assistance, Commander.",17   INT. COMMANDER'S OFFICE,COMMANDER'S OFFICE,INT.,Profit and Loss,1994-01-13,Deep Space Nine,438.txt,0.0
23724,23724,23724,23724,133,GARAK,"Mister Quark, this is a surprise. I don't believe you've ever been in my establishment before.",18   INT. GARAK'S SHOP,GARAK'S SHOP,INT.,Profit and Loss,1994-01-13,Deep Space Nine,438.txt,0.0
23725,23725,23725,23725,134,QUARK,"You usually don't frequent mine, either... though I did see you in there today.",18   INT. GARAK'S SHOP,GARAK'S SHOP,INT.,Profit and Loss,1994-01-13,Deep Space Nine,438.txt,0.0
23726,23726,23726,23726,135,GARAK,The Replimat was a little crowded. So what brings you here now?,18   INT. GARAK'S SHOP,GARAK'S SHOP,INT.,Profit and Loss,1994-01-13,Deep Space Nine,438.txt,0.0
23727,23727,23727,23727,136,QUARK,"Oh, I just wanted to see what you're offering.",18   INT. GARAK'S SHOP,GARAK'S SHOP,INT.,Profit and Loss,1994-01-13,Deep Space Nine,438.txt,0.0
23728,23728,23728,23728,137,QUARK,What do you get for this?,18   INT. GARAK'S SHOP,GARAK'S SHOP,INT.,Profit and Loss,1994-01-13,Deep Space Nine,438.txt,0.0
23729,23729,23729,23729,138,GARAK,Seventeen strips of latinum.,18   INT. GARAK'S SHOP,GARAK'S SHOP,INT.,Profit and Loss,1994-01-13,Deep Space Nine,438.txt,0.0
23730,23730,23730,23730,139,QUARK,"Tell you what, I'll give you twenty.",18   INT. GARAK'S SHOP,GARAK'S SHOP,INT.,Profit and Loss,1994-01-13,Deep Space Nine,438.txt,0.0
23731,23731,23731,23731,140,GARAK,Twenty? How uncharacteristically generous... for a Ferengi.,18   INT. GARAK'S SHOP,GARAK'S SHOP,INT.,Profit and Loss,1994-01-13,Deep Space Nine,438.txt,0.0
23732,23732,23732,23732,141,QUARK,Just one businessman trying to help out another. I figure we have to stick together.,18   INT. GARAK'S SHOP,GARAK'S SHOP,INT.,Profit and Loss,1994-01-13,Deep Space Nine,438.txt,0.0
23733,23733,23733,23733,142,GARAK,This is the latest style on my homeworld. Do you like it?,18   INT. GARAK'S SHOP,GARAK'S SHOP,INT.,Profit and Loss,1994-01-13,Deep Space Nine,438.txt,0.0
23734,23734,23734,23734,143,QUARK,I'm no expert on Cardassian fashions. What do you think?,18   INT. GARAK'S SHOP,GARAK'S SHOP,INT.,Profit and Loss,1994-01-13,Deep Space Nine,438.txt,0.0
23735,23735,23735,23735,144,GARAK,I don't know. It's been so long since I've had a Cardassian customer.,18   INT. GARAK'S SHOP,GARAK'S SHOP,INT.,Profit and Loss,1994-01-13,Deep Space Nine,438.txt,0.0
23736,23736,23736,23736,145,QUARK,Then you're in luck. There're some on the station right now.,18   INT. GARAK'S SHOP,GARAK'S SHOP,INT.,Profit and Loss,1994-01-13,Deep Space Nine,438.txt,0.0
23737,23737,23737,23737,146,GARAK,"Now that you mention it, I think your lady friend may find this style very appealing. You are old friends, aren't you?",18   INT. GARAK'S SHOP,GARAK'S SHOP,INT.,Profit and Loss,1994-01-13,Deep Space Nine,438.txt,0.0
23738,23738,23738,23738,147,QUARK,"You're very perceptive, for a Cardassian.",18   INT. GARAK'S SHOP,GARAK'S SHOP,INT.,Profit and Loss,1994-01-13,Deep Space Nine,438.txt,0.0
23739,23739,23739,23739,148,GARAK,It would've been hard to miss the way you were looking at her.,18   INT. GARAK'S SHOP,GARAK'S SHOP,INT.,Profit and Loss,1994-01-13,Deep Space Nine,438.txt,0.0
23740,23740,23740,23740,149,QUARK,It would've been hard to miss the way you were looking at her.,18   INT. GARAK'S SHOP,GARAK'S SHOP,INT.,Profit and Loss,1994-01-13,Deep Space Nine,438.txt,0.0
23741,23741,23741,23741,150,GARAK,I always try to observe the fashions of visitors to the station.,18   INT. GARAK'S SHOP,GARAK'S SHOP,INT.,Profit and Loss,1994-01-13,Deep Space Nine,438.txt,0.0
23742,23742,23742,23742,151,GARAK,"Personally I find this style a bit too radical, but your friend seems the type who appreciates that sort of thing.",18   INT. GARAK'S SHOP,GARAK'S SHOP,INT.,Profit and Loss,1994-01-13,Deep Space Nine,438.txt,0.0
23743,23743,23743,23743,152,QUARK,"Different tastes for different people. Nothing wrong with that, is there?",18   INT. GARAK'S SHOP,GARAK'S SHOP,INT.,Profit and Loss,1994-01-13,Deep Space Nine,438.txt,0.0
23744,23744,23744,23744,153,GARAK,"You'd be surprised how detrimental a poor choice of fashion can be. Take this dress. It may be all the rage now... but it could quickly become tiresome, an affront to the eyes. Certain people may even find it... objectionable. And then... Nothing but rags.",18   INT. GARAK'S SHOP,GARAK'S SHOP,INT.,Profit and Loss,1994-01-13,Deep Space Nine,438.txt,0.0
23745,23745,23745,23745,154,QUARK,I see.,18   INT. GARAK'S SHOP,GARAK'S SHOP,INT.,Profit and Loss,1994-01-13,Deep Space Nine,438.txt,0.0
23746,23746,23746,23746,155,GARAK,"Mister Quark, may I offer you some free advice?",18   INT. GARAK'S SHOP,GARAK'S SHOP,INT.,Profit and Loss,1994-01-13,Deep Space Nine,438.txt,0.0
23747,23747,23747,23747,156,QUARK,As long as I'm under no obligation to follow it.,18   INT. GARAK'S SHOP,GARAK'S SHOP,INT.,Profit and Loss,1994-01-13,Deep Space Nine,438.txt,0.0
23748,23748,23748,23748,157,GARAK,I've been in this business a long time.,18   INT. GARAK'S SHOP,GARAK'S SHOP,INT.,Profit and Loss,1994-01-13,Deep Space Nine,438.txt,0.0
23749,23749,23749,23749,158,GARAK ,And I know there's nothing worse than following the wrong trend. Now you're a smart fellow. (glances at Quark's clothing) With your own inimitable style. Perhaps you should mention that to your lady friend. I'd hate to see her become... a victim of fashion.,18   INT. GARAK'S SHOP,GARAK'S SHOP,INT.,Profit and Loss,1994-01-13,Deep Space Nine,438.txt,0.0
23750,23750,23750,23750,159,QUARK,Would you like to explain that?,18   INT. GARAK'S SHOP,GARAK'S SHOP,INT.,Profit and Loss,1994-01-13,Deep Space Nine,438.txt,0.0
23751,23751,23751,23751,160,GARAK,She's chosen to associate herself with some rather flamboyant companions. It would be a tragedy if she got in the way when her friends... went out of style.,18   INT. GARAK'S SHOP,GARAK'S SHOP,INT.,Profit and Loss,1994-01-13,Deep Space Nine,438.txt,0.0
23752,23752,23752,23752,161,QUARK,"(no longer dancing around) If anyone tries to hurt her, they're going to have to deal with me.",18   INT. GARAK'S SHOP,GARAK'S SHOP,INT.,Profit and Loss,1994-01-13,Deep Space Nine,438.txt,0.0
23753,23753,23753,23753,162,GARAK,What're you going to do? Shortchange them at the dabo table?,18   INT. GARAK'S SHOP,GARAK'S SHOP,INT.,Profit and Loss,1994-01-13,Deep Space Nine,438.txt,0.0
23754,23754,23754,23754,163,QUARK,I think I'll buy this dress after all. See that it's mended.,18   INT. GARAK'S SHOP,GARAK'S SHOP,INT.,Profit and Loss,1994-01-13,Deep Space Nine,438.txt,0.0
23755,23755,23755,23755,164,REKELEN,"Professor, we have to do something.",19   INT. NATIMA'S QUARTERS,NATIMA'S QUARTERS,INT.,Profit and Loss,1994-01-13,Deep Space Nine,438.txt,0.0
23756,23756,23756,23756,165,NATIMA,"If you want to do something constructive, stop pacing... the both of you.",19   INT. NATIMA'S QUARTERS,NATIMA'S QUARTERS,INT.,Profit and Loss,1994-01-13,Deep Space Nine,438.txt,0.0
23757,23757,23757,23757,166,HOGUE,We can't just sit here while everything we've worked for is slipping away.,19   INT. NATIMA'S QUARTERS,NATIMA'S QUARTERS,INT.,Profit and Loss,1994-01-13,Deep Space Nine,438.txt,0.0
23758,23758,23758,23758,167,NATIMA,Have faith. Your work is just beginning.,19   INT. NATIMA'S QUARTERS,NATIMA'S QUARTERS,INT.,Profit and Loss,1994-01-13,Deep Space Nine,438.txt,0.0
23759,23759,23759,23759,168,REKELEN,How can you say that? The movement is in shambles... we're fleeing for our lives... the military's hold is stronger than ever. Things are no better than when we started.,19   INT. NATIMA'S QUARTERS,NATIMA'S QUARTERS,INT.,Profit and Loss,1994-01-13,Deep Space Nine,438.txt,0.0
23760,23760,23760,23760,169,NATIMA,That's not true. Look at all you've accomplished. Five years ago there was no hope for progress. The military's rule wasn't even questioned. That's all changed now.,19   INT. NATIMA'S QUARTERS,NATIMA'S QUARTERS,INT.,Profit and Loss,1994-01-13,Deep Space Nine,438.txt,0.0
23761,23761,23761,23761,170,HOGUE,We could never have done it without your support.,19   INT. NATIMA'S QUARTERS,NATIMA'S QUARTERS,INT.,Profit and Loss,1994-01-13,Deep Space Nine,438.txt,0.0
23762,23762,23762,23762,171,NATIMA,"What we've started can't be undone. Don't you see, they can kill me... they can kill you, but they can't kill our ideas... our hope for a better Cardassia.",19   INT. NATIMA'S QUARTERS,NATIMA'S QUARTERS,INT.,Profit and Loss,1994-01-13,Deep Space Nine,438.txt,0.0
23763,23763,23763,23763,172,HOGUE,"(worried, but putting up a good front) You're right, Professor.",19   INT. NATIMA'S QUARTERS,NATIMA'S QUARTERS,INT.,Profit and Loss,1994-01-13,Deep Space Nine,438.txt,0.0
23764,23764,23764,23764,173,NATIMA,"Don't worry, Hogue. I have no intention of letting you become martyrs. I'll get you out of this somehow. (venting her own frustration) If we could only get to Sadera Six and join up with the others...",19   INT. NATIMA'S QUARTERS,NATIMA'S QUARTERS,INT.,Profit and Loss,1994-01-13,Deep Space Nine,438.txt,0.0
23765,23765,23765,23765,174,COM,"(Quark's voice, disguised) Lieutenant Smith to Professor Lang. Commander Sisko is on his way to your quarters. He'd like to speak to you in private.",19   INT. NATIMA'S QUARTERS,NATIMA'S QUARTERS,INT.,Profit and Loss,1994-01-13,Deep Space Nine,438.txt,0.0
23766,23766,23766,23766,175,NATIMA,Thank you. I'll be waiting. Why don't you two go see if Chief O'Brien's made any progress with our ship?,19   INT. NATIMA'S QUARTERS,NATIMA'S QUARTERS,INT.,Profit and Loss,1994-01-13,Deep Space Nine,438.txt,0.0
23767,23767,23767,23767,176,NATIMA,Enter.,19   INT. NATIMA'S QUARTERS,NATIMA'S QUARTERS,INT.,Profit and Loss,1994-01-13,Deep Space Nine,438.txt,0.0
23768,23768,23768,23768,177,NATIMA,Quark. I can't talk now. I'm expecting Commander Sisko.,19   INT. NATIMA'S QUARTERS,NATIMA'S QUARTERS,INT.,Profit and Loss,1994-01-13,Deep Space Nine,438.txt,0.0
23769,23769,23769,23769,178,QUARK,He's not coming.,19   INT. NATIMA'S QUARTERS,NATIMA'S QUARTERS,INT.,Profit and Loss,1994-01-13,Deep Space Nine,438.txt,0.0
23770,23770,23770,23770,179,NATIMA,What do you mean he's not coming?,19   INT. NATIMA'S QUARTERS,NATIMA'S QUARTERS,INT.,Profit and Loss,1994-01-13,Deep Space Nine,438.txt,0.0
23771,23771,23771,23771,180,QUARK,Trust me.,19   INT. NATIMA'S QUARTERS,NATIMA'S QUARTERS,INT.,Profit and Loss,1994-01-13,Deep Space Nine,438.txt,0.0
23772,23772,23772,23772,181,NATIMA,Lieutenant Smith?,19   INT. NATIMA'S QUARTERS,NATIMA'S QUARTERS,INT.,Profit and Loss,1994-01-13,Deep Space Nine,438.txt,0.0
23773,23773,23773,23773,182,QUARK,At your service.,19   INT. NATIMA'S QUARTERS,NATIMA'S QUARTERS,INT.,Profit and Loss,1994-01-13,Deep Space Nine,438.txt,0.0
23774,23774,23774,23774,183,NATIMA,You haven't changed a bit.,19   INT. NATIMA'S QUARTERS,NATIMA'S QUARTERS,INT.,Profit and Loss,1994-01-13,Deep Space Nine,438.txt,0.0
23775,23775,23775,23775,184,QUARK,"You're wrong, Natima. I haven't been the same since you left.",19   INT. NATIMA'S QUARTERS,NATIMA'S QUARTERS,INT.,Profit and Loss,1994-01-13,Deep Space Nine,438.txt,0.0
23776,23776,23776,23776,185,NATIMA,What is it you want from me?,19   INT. NATIMA'S QUARTERS,NATIMA'S QUARTERS,INT.,Profit and Loss,1994-01-13,Deep Space Nine,438.txt,0.0
23777,23777,23777,23777,186,QUARK,I know you're in trouble. I want to help you.,19   INT. NATIMA'S QUARTERS,NATIMA'S QUARTERS,INT.,Profit and Loss,1994-01-13,Deep Space Nine,438.txt,0.0
23778,23778,23778,23778,187,NATIMA,I don't want your help.,19   INT. NATIMA'S QUARTERS,NATIMA'S QUARTERS,INT.,Profit and Loss,1994-01-13,Deep Space Nine,438.txt,0.0
23779,23779,23779,23779,188,QUARK,"But I owe you. You saved my life. If you had turned me over to the authorities, I'd've been executed.",19   INT. NATIMA'S QUARTERS,NATIMA'S QUARTERS,INT.,Profit and Loss,1994-01-13,Deep Space Nine,438.txt,0.0
23780,23780,23780,23780,189,NATIMA,I admired your courage. It was a brave thing you were doing... selling food to the Bajorans. I thought you were a man of honor.,19   INT. NATIMA'S QUARTERS,NATIMA'S QUARTERS,INT.,Profit and Loss,1994-01-13,Deep Space Nine,438.txt,0.0
23781,23781,23781,23781,190,QUARK,I'm a Ferengi. You should've known better.,19   INT. NATIMA'S QUARTERS,NATIMA'S QUARTERS,INT.,Profit and Loss,1994-01-13,Deep Space Nine,438.txt,0.0
23782,23782,23782,23782,191,NATIMA,You're right. I should have. Instead...,19   INT. NATIMA'S QUARTERS,NATIMA'S QUARTERS,INT.,Profit and Loss,1994-01-13,Deep Space Nine,438.txt,0.0
23783,23783,23783,23783,192,QUARK,Can't you even say it?,19   INT. NATIMA'S QUARTERS,NATIMA'S QUARTERS,INT.,Profit and Loss,1994-01-13,Deep Space Nine,438.txt,0.0
23784,23784,23784,23784,193,NATIMA,I can't even think it.,19   INT. NATIMA'S QUARTERS,NATIMA'S QUARTERS,INT.,Profit and Loss,1994-01-13,Deep Space Nine,438.txt,0.0
23785,23785,23785,23785,194,QUARK,"Okay, then I'll say it for you. We fell in love. And that month we spent together was the best time of our lives... and you know it.",19   INT. NATIMA'S QUARTERS,NATIMA'S QUARTERS,INT.,Profit and Loss,1994-01-13,Deep Space Nine,438.txt,0.0
23786,23786,23786,23786,195,NATIMA,I think you're confusing lust with love.,19   INT. NATIMA'S QUARTERS,NATIMA'S QUARTERS,INT.,Profit and Loss,1994-01-13,Deep Space Nine,438.txt,0.0
23787,23787,23787,23787,196,QUARK,"I admit... I'm capable of it. But not this time. I loved you, Natima.",19   INT. NATIMA'S QUARTERS,NATIMA'S QUARTERS,INT.,Profit and Loss,1994-01-13,Deep Space Nine,438.txt,0.0
23788,23788,23788,23788,197,NATIMA,Then how could you have betrayed me?,19   INT. NATIMA'S QUARTERS,NATIMA'S QUARTERS,INT.,Profit and Loss,1994-01-13,Deep Space Nine,438.txt,-0.6124
23789,23789,23789,23789,198,QUARK,I didn't betray you.,19   INT. NATIMA'S QUARTERS,NATIMA'S QUARTERS,INT.,Profit and Loss,1994-01-13,Deep Space Nine,438.txt,0.5216
23790,23790,23790,23790,199,NATIMA,"Don't lie to me, Quark. I know better. You used my personal access codes to authorize payments for goods you never provided.",19   INT. NATIMA'S QUARTERS,NATIMA'S QUARTERS,INT.,Profit and Loss,1994-01-13,Deep Space Nine,438.txt,0.4404
23791,23791,23791,23791,200,QUARK,So I took a little money from the Cardassian Communication Service. They could afford it.,19   INT. NATIMA'S QUARTERS,NATIMA'S QUARTERS,INT.,Profit and Loss,1994-01-13,Deep Space Nine,438.txt,0.0
23792,23792,23792,23792,201,NATIMA,You stole that money.,19   INT. NATIMA'S QUARTERS,NATIMA'S QUARTERS,INT.,Profit and Loss,1994-01-13,Deep Space Nine,438.txt,0.0
23793,23793,23793,23793,202,QUARK,I saw a chance for profit and I took it. Maybe that was wrong. I don't know. But what I really regret was betraying your trust. That was the worst mistake of my life.,19   INT. NATIMA'S QUARTERS,NATIMA'S QUARTERS,INT.,Profit and Loss,1994-01-13,Deep Space Nine,438.txt,0.0
23794,23794,23794,23794,203,NATIMA,"And you'd do it again in a second. I believed in you, Quark. But you were using me. Like you use everyone. For profit.",19   INT. NATIMA'S QUARTERS,NATIMA'S QUARTERS,INT.,Profit and Loss,1994-01-13,Deep Space Nine,438.txt,0.0
23795,23795,23795,23795,204,QUARK,Then let me make it up to you. Let me help you. I ask for nothing in return.,19   INT. NATIMA'S QUARTERS,NATIMA'S QUARTERS,INT.,Profit and Loss,1994-01-13,Deep Space Nine,438.txt,0.0
23796,23796,23796,23796,205,NATIMA,Nothing?,19   INT. NATIMA'S QUARTERS,NATIMA'S QUARTERS,INT.,Profit and Loss,1994-01-13,Deep Space Nine,438.txt,0.0
