Unnamed: 0.2,Unnamed: 0.1,Unnamed: 0,index,line,character,quote,scene,location,view,episode,date,series,file,sentiment
39698,39698,39698,39698,146,KIRA,I can verify that.,24   INT. HOLDING CELL AREA (CONTINUOUS),HOLDING CELL AREA,INT.,Duet,1993-03-26,Deep Space Nine,419.txt,0.0
39699,39699,39699,39699,147,MARRITZA,Be my guest.,24   INT. HOLDING CELL AREA (CONTINUOUS),HOLDING CELL AREA,INT.,Duet,1993-03-26,Deep Space Nine,419.txt,0.0
39700,39700,39700,39700,148,KIRA,I still think you're a liar.,24   INT. HOLDING CELL AREA (CONTINUOUS),HOLDING CELL AREA,INT.,Duet,1993-03-26,Deep Space Nine,419.txt,0.0
39701,39701,39701,39701,149,MARRITZA,Ah. So much for our search for the truth. Now we exchange insults.,24   INT. HOLDING CELL AREA (CONTINUOUS),HOLDING CELL AREA,INT.,Duet,1993-03-26,Deep Space Nine,419.txt,0.0
39702,39702,39702,39702,150,KIRA,You admit you worked under Gul Darhe'el.,24   INT. HOLDING CELL AREA (CONTINUOUS),HOLDING CELL AREA,INT.,Duet,1993-03-26,Deep Space Nine,419.txt,0.0
39703,39703,39703,39703,151,MARRITZA,We all did.,24   INT. HOLDING CELL AREA (CONTINUOUS),HOLDING CELL AREA,INT.,Duet,1993-03-26,Deep Space Nine,419.txt,0.0
39704,39704,39704,39704,152,KIRA,"I take it, then... you witnessed the atrocities.",24   INT. HOLDING CELL AREA (CONTINUOUS),HOLDING CELL AREA,INT.,Duet,1993-03-26,Deep Space Nine,419.txt,0.0
39705,39705,39705,39705,153,MARRITZA,Atrocities? What atrocities?,24   INT. HOLDING CELL AREA (CONTINUOUS),HOLDING CELL AREA,INT.,Duet,1993-03-26,Deep Space Nine,419.txt,0.0
39706,39706,39706,39706,154,MARRITZA,"Oh, I do vaguely recall hearing a scream now and then, but... Atrocities?",24   INT. HOLDING CELL AREA (CONTINUOUS),HOLDING CELL AREA,INT.,Duet,1993-03-26,Deep Space Nine,419.txt,0.0
39707,39707,39707,39707,155,KIRA,Do you expect me to believe you knew nothing about the murders... the torture... You never saw the bodies?,24   INT. HOLDING CELL AREA (CONTINUOUS),HOLDING CELL AREA,INT.,Duet,1993-03-26,Deep Space Nine,419.txt,0.0
39708,39708,39708,39708,156,MARRITZA,Well of course I saw bodies. People died at Gallitep all the time. Mining accidents; illnesses; feuds among the workers...,24   INT. HOLDING CELL AREA (CONTINUOUS),HOLDING CELL AREA,INT.,Duet,1993-03-26,Deep Space Nine,419.txt,0.0
39709,39709,39709,39709,157,KIRA,You're saying Bajorans killed each other?,24   INT. HOLDING CELL AREA (CONTINUOUS),HOLDING CELL AREA,INT.,Duet,1993-03-26,Deep Space Nine,419.txt,0.0
39710,39710,39710,39710,158,MARRITZA,"At times. Over food; a blanket; a woman... Conditions were harsh, after all. It was a labor camp, Major.",24   INT. HOLDING CELL AREA (CONTINUOUS),HOLDING CELL AREA,INT.,Duet,1993-03-26,Deep Space Nine,419.txt,0.0
39711,39711,39711,39711,159,KIRA,I helped liberate that camp. I saw those bodies. I saw how they died.,24   INT. HOLDING CELL AREA (CONTINUOUS),HOLDING CELL AREA,INT.,Duet,1993-03-26,Deep Space Nine,419.txt,0.0
39712,39712,39712,39712,160,MARRITZA,"You saw what we wanted you to see. Do you know who started the rumors about brutality at Gallitep? Gul Darhe'el himself. Now there was a leader. A brilliant, extraordinary man. He knew that to rule by fear was to rule completely. Why bother with actual mass murder, when the mere reports of such incidents achieved the same effect.",24   INT. HOLDING CELL AREA (CONTINUOUS),HOLDING CELL AREA,INT.,Duet,1993-03-26,Deep Space Nine,419.txt,0.0
39713,39713,39713,39713,161,KIRA,Which was?,24   INT. HOLDING CELL AREA (CONTINUOUS),HOLDING CELL AREA,INT.,Duet,1993-03-26,Deep Space Nine,419.txt,0.0
39714,39714,39714,39714,162,MARRITZA,"Major, you know that as well as I do. To keep you Bajorans thinking of yourselves as victims. To keep you scared... and helpless.",24   INT. HOLDING CELL AREA (CONTINUOUS),HOLDING CELL AREA,INT.,Duet,1993-03-26,Deep Space Nine,419.txt,0.0
39715,39715,39715,39715,163,KIRA,It turned out we weren't so helpless. We did get rid of you.,24   INT. HOLDING CELL AREA (CONTINUOUS),HOLDING CELL AREA,INT.,Duet,1993-03-26,Deep Space Nine,419.txt,0.0
39716,39716,39716,39716,164,MARRITZA,"Leaving was a political decision. Now I've enjoyed reminiscing with you, Major; but I really do think it's time you let me out of here.",24   INT. HOLDING CELL AREA (CONTINUOUS),HOLDING CELL AREA,INT.,Duet,1993-03-26,Deep Space Nine,419.txt,0.0
39717,39717,39717,39717,165,KIRA,I can't do that.,24   INT. HOLDING CELL AREA (CONTINUOUS),HOLDING CELL AREA,INT.,Duet,1993-03-26,Deep Space Nine,419.txt,0.0
39718,39718,39718,39718,166,MARRITZA,"No, of course not. You see, Major, you're the one who's lying now, not me. You're not interested in truth. All you want is vengeance.",24   INT. HOLDING CELL AREA (CONTINUOUS),HOLDING CELL AREA,INT.,Duet,1993-03-26,Deep Space Nine,419.txt,0.0
39719,39719,39719,39719,167,DUKAT,"Commander, I was led to believe that the Federation guaranteed safe and unrestricted passage to all travelers visiting your station.",27   INT. COMMANDER'S OFFICE (OPTICAL),COMMANDER'S OFFICE,INT.,Duet,1993-03-26,Deep Space Nine,419.txt,0.0
39720,39720,39720,39720,168,SISKO,That's correct.,27   INT. COMMANDER'S OFFICE (OPTICAL),COMMANDER'S OFFICE,INT.,Duet,1993-03-26,Deep Space Nine,419.txt,0.0
39721,39721,39721,39721,169,DUKAT,Then how do you explain your detention of a Cardassian citizen?,27   INT. COMMANDER'S OFFICE (OPTICAL),COMMANDER'S OFFICE,INT.,Duet,1993-03-26,Deep Space Nine,419.txt,0.0
39722,39722,39722,39722,170,SISKO,"Marritza came here seeking medical attention. Right now, he's under our doctor's care. All we're trying to do is verify his identity. A simple matter, if you'll give us some assistance.",27   INT. COMMANDER'S OFFICE (OPTICAL),COMMANDER'S OFFICE,INT.,Duet,1993-03-26,Deep Space Nine,419.txt,0.0
39723,39723,39723,39723,171,DUKAT,"I assure you, Commander, you don't require our assistance. If your patient says his name is Marritza, then that's who he is. I hope you're not suggesting you don't trust him simply because he's Cardassian.",27   INT. COMMANDER'S OFFICE (OPTICAL),COMMANDER'S OFFICE,INT.,Duet,1993-03-26,Deep Space Nine,419.txt,0.0
39724,39724,39724,39724,172,SISKO,I don't trust him because he's already lied to us about his being at Gallitep.,27   INT. COMMANDER'S OFFICE (OPTICAL),COMMANDER'S OFFICE,INT.,Duet,1993-03-26,Deep Space Nine,419.txt,0.0
39725,39725,39725,39725,173,DUKAT,"Is that what you're charging him with, Commander? Lying?",27   INT. COMMANDER'S OFFICE (OPTICAL),COMMANDER'S OFFICE,INT.,Duet,1993-03-26,Deep Space Nine,419.txt,0.0
39726,39726,39726,39726,174,SISKO,"So far, we haven't charged him with anything.",27   INT. COMMANDER'S OFFICE (OPTICAL),COMMANDER'S OFFICE,INT.,Duet,1993-03-26,Deep Space Nine,419.txt,0.0
39727,39727,39727,39727,175,DUKAT,Then let him go.,27   INT. COMMANDER'S OFFICE (OPTICAL),COMMANDER'S OFFICE,INT.,Duet,1993-03-26,Deep Space Nine,419.txt,0.0
39728,39728,39728,39728,176,SISKO,I'd like nothing better. But first I need to know who it is I'm letting go.,27   INT. COMMANDER'S OFFICE (OPTICAL),COMMANDER'S OFFICE,INT.,Duet,1993-03-26,Deep Space Nine,419.txt,0.0
39729,39729,39729,39729,177,DUKAT,"I appreciate the awkwardness of your position, Commander. This Bajoran obsession with alleged Cardassian improprieties during the occupation, is really quite distasteful.",27   INT. COMMANDER'S OFFICE (OPTICAL),COMMANDER'S OFFICE,INT.,Duet,1993-03-26,Deep Space Nine,419.txt,-0.1027
39730,39730,39730,39730,178,SISKO,"I suppose if you're a Bajoran, so was the occupation.",27   INT. COMMANDER'S OFFICE (OPTICAL),COMMANDER'S OFFICE,INT.,Duet,1993-03-26,Deep Space Nine,419.txt,0.0
39731,39731,39731,39731,179,DUKAT,I remind you that neither one of us is Bajoran. I'd hate their bitterness to cause conflict between Cardassia and the Federation.,27   INT. COMMANDER'S OFFICE (OPTICAL),COMMANDER'S OFFICE,INT.,Duet,1993-03-26,Deep Space Nine,419.txt,-0.8271
39732,39732,39732,39732,180,SISKO,"I hope to avoid that, too... with your help.",27   INT. COMMANDER'S OFFICE (OPTICAL),COMMANDER'S OFFICE,INT.,Duet,1993-03-26,Deep Space Nine,419.txt,0.0
39733,39733,39733,39733,181,DUKAT,"Commander, you don't need my help to safeguard one Cardassian on your own station. If those Bajoran hate- mongers get their hands on him, I'm holding you responsible.",27   INT. COMMANDER'S OFFICE (OPTICAL),COMMANDER'S OFFICE,INT.,Duet,1993-03-26,Deep Space Nine,419.txt,0.0
39734,39734,39734,39734,182,DAX,What're you looking for?,27AA   INT. PROMENADE - SECOND LEVEL,PROMENAD,INT.,Duet,1993-03-26,Deep Space Nine,419.txt,0.0
39735,39735,39735,39735,183,KIRA,Answers.,27AA   INT. PROMENADE - SECOND LEVEL,PROMENAD,INT.,Duet,1993-03-26,Deep Space Nine,419.txt,0.0
39736,39736,39736,39736,184,DAX,Found any yet?,27AA   INT. PROMENADE - SECOND LEVEL,PROMENAD,INT.,Duet,1993-03-26,Deep Space Nine,419.txt,0.0
39737,39737,39737,39737,185,KIRA,Marritza says I don't care about the truth. That all I want is vengeance.,27AA   INT. PROMENADE - SECOND LEVEL,PROMENAD,INT.,Duet,1993-03-26,Deep Space Nine,419.txt,0.0
39738,39738,39738,39738,186,DAX,Are you worried he might be right... ?,27AA   INT. PROMENADE - SECOND LEVEL,PROMENAD,INT.,Duet,1993-03-26,Deep Space Nine,419.txt,0.0
39739,39739,39739,39739,187,KIRA,All I want is to see him punished.,27AA   INT. PROMENADE - SECOND LEVEL,PROMENAD,INT.,Duet,1993-03-26,Deep Space Nine,419.txt,0.0
39740,39740,39740,39740,188,DAX,Even if he is just a file clerk?,27AA   INT. PROMENADE - SECOND LEVEL,PROMENAD,INT.,Duet,1993-03-26,Deep Space Nine,419.txt,0.0
39741,39741,39741,39741,189,KIRA,That's just it... I don't want him to be a file clerk. I want him to be... I don't know... worse than that...,27AA   INT. PROMENADE - SECOND LEVEL,PROMENAD,INT.,Duet,1993-03-26,Deep Space Nine,419.txt,0.0
39742,39742,39742,39742,190,DAX,You want him to be guilty.,27AA   INT. PROMENADE - SECOND LEVEL,PROMENAD,INT.,Duet,1993-03-26,Deep Space Nine,419.txt,0.0
39743,39743,39743,39743,191,KIRA,"As far as I'm concerned, if he was at Gallitep, he is guilty. They were all guilty. Don't you see, his punishment will make all of Bajor feel... some... ...satisfaction.",27AA   INT. PROMENADE - SECOND LEVEL,PROMENAD,INT.,Duet,1993-03-26,Deep Space Nine,419.txt,0.0
39744,39744,39744,39744,192,DAX,"It sounds like you're trying too hard to believe what you're saying. You already know if you punish him without reason, it won't mean anything. And you already know vengeance isn't enough.",27AA   INT. PROMENADE - SECOND LEVEL,PROMENAD,INT.,Duet,1993-03-26,Deep Space Nine,419.txt,0.0
39745,39745,39745,39745,193,O'BRIEN,Re-route the signal enhancement module to the main sensor array.,28   INT. OPS - CLOSE ON O'BRIEN,OP,INT.,Duet,1993-03-26,Deep Space Nine,419.txt,0.0
39746,39746,39746,39746,194,NEELA,"Aye, Sir.",28   INT. OPS - CLOSE ON O'BRIEN,OP,INT.,Duet,1993-03-26,Deep Space Nine,419.txt,0.0
39747,39747,39747,39747,195,O'BRIEN,How's it look?,28   INT. OPS - CLOSE ON O'BRIEN,OP,INT.,Duet,1993-03-26,Deep Space Nine,419.txt,0.0
39748,39748,39748,39748,196,NEELA,Give me a second; I'll run a diagnostic. It's ready.,28   INT. OPS - CLOSE ON O'BRIEN,OP,INT.,Duet,1993-03-26,Deep Space Nine,419.txt,0.0
39749,39749,39749,39749,197,ODO,"I've checked with the Bajoran Archives, and they do have a Marritza on record as being a file clerk at Gallitep. I also checked with the military academy on Kora Two. Marritza has been teaching filing there just as he claims.",28   INT. OPS - CLOSE ON O'BRIEN,OP,INT.,Duet,1993-03-26,Deep Space Nine,419.txt,0.0
39750,39750,39750,39750,198,O'BRIEN,"All set, Commander.",28   INT. OPS - CLOSE ON O'BRIEN,OP,INT.,Duet,1993-03-26,Deep Space Nine,419.txt,0.0
39751,39751,39751,39751,199,SISKO,Major? How many images were sent from the Bajoran archives?,28   INT. OPS - CLOSE ON O'BRIEN,OP,INT.,Duet,1993-03-26,Deep Space Nine,419.txt,0.0
39752,39752,39752,39752,200,KIRA,Only one. It's the only picture they could find of Gallitep that had Marritza in it. The Cardassians destroyed almost all records of the occupation.,28   INT. OPS - CLOSE ON O'BRIEN,OP,INT.,Duet,1993-03-26,Deep Space Nine,419.txt,0.0
39753,39753,39753,39753,201,O'BRIEN,The image enhancement and transformation functions are patched directly into your console.,28   INT. OPS - CLOSE ON O'BRIEN,OP,INT.,Duet,1993-03-26,Deep Space Nine,419.txt,0.0
39754,39754,39754,39754,202,SISKO,"Major, what if this image confirms that Marritza was a file clerk? What do you expect us to do, then?",28   INT. OPS - CLOSE ON O'BRIEN,OP,INT.,Duet,1993-03-26,Deep Space Nine,419.txt,0.0
39755,39755,39755,39755,203,KIRA,I suppose you'll let him go.,28   INT. OPS - CLOSE ON O'BRIEN,OP,INT.,Duet,1993-03-26,Deep Space Nine,419.txt,0.0
39756,39756,39756,39756,204,SISKO,I'm glad we understand each other.,28   INT. OPS - CLOSE ON O'BRIEN,OP,INT.,Duet,1993-03-26,Deep Space Nine,419.txt,0.0
39757,39757,39757,39757,205,DAX,I've got it.,28   INT. OPS - CLOSE ON O'BRIEN,OP,INT.,Duet,1993-03-26,Deep Space Nine,419.txt,0.0
39758,39758,39758,39758,206,SISKO,On screen.,28   INT. OPS - CLOSE ON O'BRIEN,OP,INT.,Duet,1993-03-26,Deep Space Nine,419.txt,0.0
39759,39759,39759,39759,207,SISKO,Which one is Marritza?,28   INT. OPS - CLOSE ON O'BRIEN,OP,INT.,Duet,1993-03-26,Deep Space Nine,419.txt,0.0
39760,39760,39760,39760,208,DAX,"Let's see... According to the caption, he's the one in the background; on the far right.",28   INT. OPS - CLOSE ON O'BRIEN,OP,INT.,Duet,1993-03-26,Deep Space Nine,419.txt,0.0
39761,39761,39761,39761,209,SISKO,Isolate and magnify.,28   INT. OPS - CLOSE ON O'BRIEN,OP,INT.,Duet,1993-03-26,Deep Space Nine,419.txt,0.0
39762,39762,39762,39762,210,SISKO,We're going to have to do better than that.,28   INT. OPS - CLOSE ON O'BRIEN,OP,INT.,Duet,1993-03-26,Deep Space Nine,419.txt,0.0
39763,39763,39763,39763,211,DAX,Give me a minute; I'm running an image enhancement sequence.,28   INT. OPS - CLOSE ON O'BRIEN,OP,INT.,Duet,1993-03-26,Deep Space Nine,419.txt,0.0
39764,39764,39764,39764,212,KIRA,It's not him.,28   INT. OPS - CLOSE ON O'BRIEN,OP,INT.,Duet,1993-03-26,Deep Space Nine,419.txt,0.0
39765,39765,39765,39765,213,SISKO,Are you sure we're looking at the right man?,28   INT. OPS - CLOSE ON O'BRIEN,OP,INT.,Duet,1993-03-26,Deep Space Nine,419.txt,0.0
39766,39766,39766,39766,214,DAX,(double-checking console) Background... far right... Aamin Marritza.,28   INT. OPS - CLOSE ON O'BRIEN,OP,INT.,Duet,1993-03-26,Deep Space Nine,419.txt,0.0
39767,39767,39767,39767,215,KIRA,It can't be.,28   INT. OPS - CLOSE ON O'BRIEN,OP,INT.,Duet,1993-03-26,Deep Space Nine,419.txt,0.0
39768,39768,39768,39768,216,SISKO,"If that's Marritza, then who are we holding?",28   INT. OPS - CLOSE ON O'BRIEN,OP,INT.,Duet,1993-03-26,Deep Space Nine,419.txt,0.0
39769,39769,39769,39769,217,SISKO,Lieutenant... Isolate the Cardassians in the foreground.,28   INT. OPS - CLOSE ON O'BRIEN,OP,INT.,Duet,1993-03-26,Deep Space Nine,419.txt,0.0
39770,39770,39770,39770,218,SISKO,"The one in profile on the left... What can you give us, Dax?",28   INT. OPS - CLOSE ON O'BRIEN,OP,INT.,Duet,1993-03-26,Deep Space Nine,419.txt,0.0
39771,39771,39771,39771,219,KIRA,That's him... That's Marritza.,28   INT. OPS - CLOSE ON O'BRIEN,OP,INT.,Duet,1993-03-26,Deep Space Nine,419.txt,0.0
39772,39772,39772,39772,220,DAX,Not according to the caption.,28   INT. OPS - CLOSE ON O'BRIEN,OP,INT.,Duet,1993-03-26,Deep Space Nine,419.txt,0.0
39773,39773,39773,39773,221,KIRA,What d'you mean?,28   INT. OPS - CLOSE ON O'BRIEN,OP,INT.,Duet,1993-03-26,Deep Space Nine,419.txt,0.0
39774,39774,39774,39774,222,DAX,According to this... It's Gul Darhe'el.,28   INT. OPS - CLOSE ON O'BRIEN,OP,INT.,Duet,1993-03-26,Deep Space Nine,419.txt,0.0
39775,39775,39775,39775,223,MARRITZA,Ah. Let me guess. You've come back to learn the secret of my filing system.,35   INT. HOLDING CELL AREA,HOLDING CELL AREA,INT.,Duet,1993-03-26,Deep Space Nine,419.txt,0.0
39776,39776,39776,39776,224,KIRA,I know all your secrets now.,35   INT. HOLDING CELL AREA,HOLDING CELL AREA,INT.,Duet,1993-03-26,Deep Space Nine,419.txt,0.0
39777,39777,39777,39777,225,MARRITZA,Is that so.,35   INT. HOLDING CELL AREA,HOLDING CELL AREA,INT.,Duet,1993-03-26,Deep Space Nine,419.txt,0.0
39778,39778,39778,39778,226,KIRA,"What did you do? Kill the real Marritza, so you could take his place? Well, you'll pay for that death; and all the others you're responsible for.",35   INT. HOLDING CELL AREA,HOLDING CELL AREA,INT.,Duet,1993-03-26,Deep Space Nine,419.txt,0.0
39779,39779,39779,39779,227,MARRITZA,"I'm afraid I couldn't possibly pay for all of them, Major. After all, there were so many... and you can only execute me once.",35   INT. HOLDING CELL AREA,HOLDING CELL AREA,INT.,Duet,1993-03-26,Deep Space Nine,419.txt,0.0
39780,39780,39780,39780,228,KIRA,"That's my only regret. But I'll settle for knowing that Bajor will finally have the satisfaction of punishing ""The Butcher of Gallitep.""",35   INT. HOLDING CELL AREA,HOLDING CELL AREA,INT.,Duet,1993-03-26,Deep Space Nine,419.txt,0.0
39781,39781,39781,39781,229,MARRITZA,"Tell me, Major; did you figure it all out by yourself, or did you need help from your Federation masters?",35   INT. HOLDING CELL AREA,HOLDING CELL AREA,INT.,Duet,1993-03-26,Deep Space Nine,419.txt,0.4019
39782,39782,39782,39782,230,KIRA,I'll let you wonder about that. It'll keep you occupied while we're waiting for the provisional government to prepare your war crimes tribunal.,35   INT. HOLDING CELL AREA,HOLDING CELL AREA,INT.,Duet,1993-03-26,Deep Space Nine,419.txt,-0.5994
39783,39783,39783,39783,231,MARRITZA,"War crimes? How could there be war crimes, when there wasn't any war? Of course, I can understand how you might wish there had been a war... Your need to indulge some pathetic fantasy of brave Bajoran soldiers marching to an honorable defeat. But in fact, Major, you and I both know there was no war; no glory; Bajor didn't resist. It just surrendered.",35   INT. HOLDING CELL AREA,HOLDING CELL AREA,INT.,Duet,1993-03-26,Deep Space Nine,419.txt,-0.8992
39784,39784,39784,39784,232,KIRA,The Bajorans were a peaceful people before you came. We were no threat to you. We could never understand why you had to be so brutal.,35   INT. HOLDING CELL AREA,HOLDING CELL AREA,INT.,Duet,1993-03-26,Deep Space Nine,419.txt,0.0
39785,39785,39785,39785,233,MARRITZA,"Well we can't have that. You see, Major, I don't want there to be any more secrets between us. So whatever you don't understand, I'll explain.",35   INT. HOLDING CELL AREA,HOLDING CELL AREA,INT.,Duet,1993-03-26,Deep Space Nine,419.txt,0.0
39786,39786,39786,39786,234,KIRA,"Thank you, but I think I've heard enough of your lies.",35   INT. HOLDING CELL AREA,HOLDING CELL AREA,INT.,Duet,1993-03-26,Deep Space Nine,419.txt,0.0
39787,39787,39787,39787,235,MARRITZA,"What lies? You mean my failure to divulge my true identity? Believe me, I yearned to tell you. But I knew how much more satisfying it would be for you to find out for yourself. And believe me, Major; that was my only deception. Marritza? He was a magnificent file clerk. And I, Gul Darhe'el? I hope you won't think it immodest of me when I say that I was a magnificent leader. You never saw Gallitep at its height. As a labor camp, it was the very model of order and efficiency. And why? For that, you must look to the top. To me!",35   INT. HOLDING CELL AREA,HOLDING CELL AREA,INT.,Duet,1993-03-26,Deep Space Nine,419.txt,0.0
39788,39788,39788,39788,236,MARRITZA,"My word, my merest glance, was law. And my verdict was always the same: Guilty.",35   INT. HOLDING CELL AREA,HOLDING CELL AREA,INT.,Duet,1993-03-26,Deep Space Nine,419.txt,0.0
39789,39789,39789,39789,237,KIRA,You're insane.,35   INT. HOLDING CELL AREA,HOLDING CELL AREA,INT.,Duet,1993-03-26,Deep Space Nine,419.txt,0.0
39790,39790,39790,39790,238,MARRITZA,"No, no, no, Major... I'm sorry, but you can't dismiss me that easily. I did what needed to be done.",35   INT. HOLDING CELL AREA,HOLDING CELL AREA,INT.,Duet,1993-03-26,Deep Space Nine,419.txt,0.0
39791,39791,39791,39791,239,MARRITZA,"My men understood that... which is why they loved me. I'd order them to go out and murder Bajoran scum, and they would do it... They'd come back covered in blood... and still feel clean. Yes, Major... clean. And why did they feel that way?... Because they were clean!",35   INT. HOLDING CELL AREA,HOLDING CELL AREA,INT.,Duet,1993-03-26,Deep Space Nine,419.txt,0.0
39792,39792,39792,39792,240,KIRA,So then you admit your atrocities.,35   INT. HOLDING CELL AREA,HOLDING CELL AREA,INT.,Duet,1993-03-26,Deep Space Nine,419.txt,0.0
39793,39793,39793,39793,241,MARRITZA,"I admit everything. Why not? I was the best at what I did. My accomplishments speak for themselves. Can you say the same? You and that little Shakaar resistance cell you belonged to. You did nothing but annoy Cardassians, while I was busy exterminating Bajorans.",35   INT. HOLDING CELL AREA,HOLDING CELL AREA,INT.,Duet,1993-03-26,Deep Space Nine,419.txt,0.3989
39794,39794,39794,39794,242,KIRA,Make sure you tell that to the tribunal.,35   INT. HOLDING CELL AREA,HOLDING CELL AREA,INT.,Duet,1993-03-26,Deep Space Nine,419.txt,0.3182
39795,39795,39795,39795,243,MARRITZA,"Oh, I will.",35   INT. HOLDING CELL AREA,HOLDING CELL AREA,INT.,Duet,1993-03-26,Deep Space Nine,419.txt,0.0
39796,39796,39796,39796,244,KIRA,And they'll sentence you to death.,35   INT. HOLDING CELL AREA,HOLDING CELL AREA,INT.,Duet,1993-03-26,Deep Space Nine,419.txt,0.0
39797,39797,39797,39797,245,MARRITZA,"Let them. Don't you see; it'll change nothing! Kill me. Torture me... it doesn't matter. You've already lost, Major. You can never undo what I've accomplished. The dead will still be dead!",35   INT. HOLDING CELL AREA,HOLDING CELL AREA,INT.,Duet,1993-03-26,Deep Space Nine,419.txt,0.0
39798,39798,39798,39798,246,MARRITZA,"(laughs; calls after her) What're you going to do now, Major? Withhold my medicine?",35   INT. HOLDING CELL AREA,HOLDING CELL AREA,INT.,Duet,1993-03-26,Deep Space Nine,419.txt,0.0
39799,39799,39799,39799,247,KIRA,What is it?,36   INT. SECURITY OFFICE,SECURITY OFFICE,INT.,Duet,1993-03-26,Deep Space Nine,419.txt,0.0
39800,39800,39800,39800,248,ODO,Maraltian Seev-ale; from Quark's private stock.,36   INT. SECURITY OFFICE,SECURITY OFFICE,INT.,Duet,1993-03-26,Deep Space Nine,419.txt,0.0
39801,39801,39801,39801,249,ODO,Better?,36   INT. SECURITY OFFICE,SECURITY OFFICE,INT.,Duet,1993-03-26,Deep Space Nine,419.txt,0.0
39802,39802,39802,39802,250,KIRA,"You know, Odo... I wonder how many others like Darhe'el are still out there... Still free... unpunished...",36   INT. SECURITY OFFICE,SECURITY OFFICE,INT.,Duet,1993-03-26,Deep Space Nine,419.txt,0.0
39803,39803,39803,39803,251,ODO,"Quite a few, no doubt. But thanks to you, there's one less out there now.",36   INT. SECURITY OFFICE,SECURITY OFFICE,INT.,Duet,1993-03-26,Deep Space Nine,419.txt,0.0
39804,39804,39804,39804,252,KIRA,You should've heard him... He bragged about what happened at Gallitep. The torture... the rape... the humiliation. He's proud of what he did to us.,36   INT. SECURITY OFFICE,SECURITY OFFICE,INT.,Duet,1993-03-26,Deep Space Nine,419.txt,0.0
39805,39805,39805,39805,253,ODO,"Why don't you go to your quarters, and lie down for a while. We'll leave him alone with his Cardassian pride.",36   INT. SECURITY OFFICE,SECURITY OFFICE,INT.,Duet,1993-03-26,Deep Space Nine,419.txt,0.0
39806,39806,39806,39806,254,KIRA,I don't want to lie down. That's what he'd like. Another Bajoran hiding in a corner. He's probably in there laughing at me now.,36   INT. SECURITY OFFICE,SECURITY OFFICE,INT.,Duet,1993-03-26,Deep Space Nine,419.txt,0.0
39807,39807,39807,39807,255,ODO,He won't be laughing very long.,36   INT. SECURITY OFFICE,SECURITY OFFICE,INT.,Duet,1993-03-26,Deep Space Nine,419.txt,0.0
39808,39808,39808,39808,256,KIRA,"I hate him, Odo. I hate that smirking, superior Cardassian face. When I was fighting with the resistance, we used to lie awake at night plotting the assassination of men like him. And now I have to stand there and listen to him belittle the Shakaar and everything it stood for.",36   INT. SECURITY OFFICE,SECURITY OFFICE,INT.,Duet,1993-03-26,Deep Space Nine,419.txt,0.0
39809,39809,39809,39809,257,ODO,Perhaps you should avoid discussing your personal history with a creature like that.,36   INT. SECURITY OFFICE,SECURITY OFFICE,INT.,Duet,1993-03-26,Deep Space Nine,419.txt,0.0
39810,39810,39810,39810,258,KIRA,I didn't.,36   INT. SECURITY OFFICE,SECURITY OFFICE,INT.,Duet,1993-03-26,Deep Space Nine,419.txt,0.0
39811,39811,39811,39811,259,ODO,Then how did he know you were with the Shakaar?,36   INT. SECURITY OFFICE,SECURITY OFFICE,INT.,Duet,1993-03-26,Deep Space Nine,419.txt,0.0
39812,39812,39812,39812,260,KIRA,I don't know... He was an important military leader...,36   INT. SECURITY OFFICE,SECURITY OFFICE,INT.,Duet,1993-03-26,Deep Space Nine,419.txt,0.0
39813,39813,39813,39813,261,ODO,"That doesn't explain it. If he'd been in charge of quelling Bajoran resistance, then he might've had your name on file. But he commanded a forced labor camp. Something's not right here.",36   INT. SECURITY OFFICE,SECURITY OFFICE,INT.,Duet,1993-03-26,Deep Space Nine,419.txt,0.0
39814,39814,39814,39814,262,ODO,Where are you going?,36   INT. SECURITY OFFICE,SECURITY OFFICE,INT.,Duet,1993-03-26,Deep Space Nine,419.txt,0.0
39815,39815,39815,39815,263,KIRA,To have another little chat with Gul Darhe'el.,36   INT. SECURITY OFFICE,SECURITY OFFICE,INT.,Duet,1993-03-26,Deep Space Nine,419.txt,0.0
39816,39816,39816,39816,264,ODO,Computer... Review all off-station requests for information regarding Major Kira Nerys within the last eight months.,36   INT. SECURITY OFFICE,SECURITY OFFICE,INT.,Duet,1993-03-26,Deep Space Nine,419.txt,0.0
39817,39817,39817,39817,265,COMPUTER,...Working...,36   INT. SECURITY OFFICE,SECURITY OFFICE,INT.,Duet,1993-03-26,Deep Space Nine,419.txt,0.0
39818,39818,39818,39818,266,MARRITZA,"Back again to see ""the butcher""... Am I really that fascinating?",36B  INT. HOLDING CELL AREA,HOLDING CELL AREA,INT.,Duet,1993-03-26,Deep Space Nine,419.txt,0.0
