Unnamed: 0.2,Unnamed: 0.1,Unnamed: 0,index,line,character,quote,scene,location,view,episode,date,series,file,sentiment
21000,21000,21000,21000,260,O'BRIEN,"If you do find the cure and they hear about it, what do you think they'll do?",48   INT. INFIRMARY,INFIRMARY,INT.,Tacking into the Wind,1999-02-24,Deep Space Nine,572.txt,0.0
21001,21001,21001,21001,261,BASHIR,Well... I would imagine that they'd be concerned. The very existence of a cure would jeopardize their entire plan to eradicate the Founders. So I wouldn't be surprised if Sloan or another operative suddenly showed up here on the station and tried to destroy my work.,48   INT. INFIRMARY,INFIRMARY,INT.,Tacking into the Wind,1999-02-24,Deep Space Nine,572.txt,0.0
21002,21002,21002,21002,262,BASHIR ,What are you getting at?,48   INT. INFIRMARY,INFIRMARY,INT.,Tacking into the Wind,1999-02-24,Deep Space Nine,572.txt,0.0
21003,21003,21003,21003,263,O'BRIEN,I think you should send a message to Starfleet Medical saying that you have found the cure.,48   INT. INFIRMARY,INFIRMARY,INT.,Tacking into the Wind,1999-02-24,Deep Space Nine,572.txt,0.0
21004,21004,21004,21004,264,BASHIR,You're trying to lure someone from Section Thirty-one to the station...,48   INT. INFIRMARY,INFIRMARY,INT.,Tacking into the Wind,1999-02-24,Deep Space Nine,572.txt,0.0
21005,21005,21005,21005,265,O'BRIEN,That's right.,48   INT. INFIRMARY,INFIRMARY,INT.,Tacking into the Wind,1999-02-24,Deep Space Nine,572.txt,0.0
21006,21006,21006,21006,266,BASHIR,And once this operative gets here... ?,48   INT. INFIRMARY,INFIRMARY,INT.,Tacking into the Wind,1999-02-24,Deep Space Nine,572.txt,0.0
21007,21007,21007,21007,267,O'BRIEN,"We capture him. Then, all we have to do is figure out a way to get some information out of him.",48   INT. INFIRMARY,INFIRMARY,INT.,Tacking into the Wind,1999-02-24,Deep Space Nine,572.txt,0.0
21008,21008,21008,21008,268,BASHIR,He may not know anything about the disease.,48   INT. INFIRMARY,INFIRMARY,INT.,Tacking into the Wind,1999-02-24,Deep Space Nine,572.txt,0.0
21009,21009,21009,21009,269,O'BRIEN,Maybe not... but I bet he'll know who does. So... what do you think?,48   INT. INFIRMARY,INFIRMARY,INT.,Tacking into the Wind,1999-02-24,Deep Space Nine,572.txt,0.0
21010,21010,21010,21010,270,BASHIR,I think... it's a good plan. A very good plan. When did you become so devious?,48   INT. INFIRMARY,INFIRMARY,INT.,Tacking into the Wind,1999-02-24,Deep Space Nine,572.txt,0.0
21011,21011,21011,21011,271,O'BRIEN,I think I've been around you too long. I'm starting to learn how to build wheels within wheels.,48   INT. INFIRMARY,INFIRMARY,INT.,Tacking into the Wind,1999-02-24,Deep Space Nine,572.txt,0.0
21012,21012,21012,21012,272,BASHIR,Not a bad skill for an engineer.,48   INT. INFIRMARY,INFIRMARY,INT.,Tacking into the Wind,1999-02-24,Deep Space Nine,572.txt,0.431
21013,21013,21013,21013,273,O'BRIEN,"All the same, it's not one I'd like to perfect. Let's just hope this works and we can cure Odo -- that's all I care about.",48   INT. INFIRMARY,INFIRMARY,INT.,Tacking into the Wind,1999-02-24,Deep Space Nine,572.txt,0.8267
21014,21014,21014,21014,274,BASHIR,"Me too, Miles. Me too.",48   INT. INFIRMARY,INFIRMARY,INT.,Tacking into the Wind,1999-02-24,Deep Space Nine,572.txt,0.0
21015,21015,21015,21015,275,KIRA,How much longer?,51   INT. JEM'HADAR BRIDGE,JEM'HADAR BRIDGE,INT.,Tacking into the Wind,1999-02-24,Deep Space Nine,572.txt,0.0
21016,21016,21016,21016,276,GARAK,I'm not certain... they appear to be having trouble connecting the secondary relays...,51   INT. JEM'HADAR BRIDGE,JEM'HADAR BRIDGE,INT.,Tacking into the Wind,1999-02-24,Deep Space Nine,572.txt,0.0
21017,21017,21017,21017,277,ODO,Yes... don't worry... I'm...,51   INT. JEM'HADAR BRIDGE,JEM'HADAR BRIDGE,INT.,Tacking into the Wind,1999-02-24,Deep Space Nine,572.txt,0.0
21018,21018,21018,21018,278,ODO,Sorry...,51   INT. JEM'HADAR BRIDGE,JEM'HADAR BRIDGE,INT.,Tacking into the Wind,1999-02-24,Deep Space Nine,572.txt,0.0
21019,21019,21019,21019,279,KIRA,There's nothing to be sorry about...,51   INT. JEM'HADAR BRIDGE,JEM'HADAR BRIDGE,INT.,Tacking into the Wind,1999-02-24,Deep Space Nine,572.txt,0.0
21020,21020,21020,21020,280,KIRA,"Stay with me, Odo. We're going to get out of here. Just hang on a little longer.",51   INT. JEM'HADAR BRIDGE,JEM'HADAR BRIDGE,INT.,Tacking into the Wind,1999-02-24,Deep Space Nine,572.txt,0.0
21021,21021,21021,21021,281,RUSOT,It's over.,51   INT. JEM'HADAR BRIDGE,JEM'HADAR BRIDGE,INT.,Tacking into the Wind,1999-02-24,Deep Space Nine,572.txt,0.0
21022,21022,21022,21022,282,KIRA,"Shut up, Rusot!",51   INT. JEM'HADAR BRIDGE,JEM'HADAR BRIDGE,INT.,Tacking into the Wind,1999-02-24,Deep Space Nine,572.txt,0.0
21023,21023,21023,21023,283,RUSOT,The Shape-shifter is useless. The whole plan is coming apart! We have to get out of here!,51   INT. JEM'HADAR BRIDGE,JEM'HADAR BRIDGE,INT.,Tacking into the Wind,1999-02-24,Deep Space Nine,572.txt,0.0
21024,21024,21024,21024,284,KIRA,Go back to your post!,51   INT. JEM'HADAR BRIDGE,JEM'HADAR BRIDGE,INT.,Tacking into the Wind,1999-02-24,Deep Space Nine,572.txt,0.0
21025,21025,21025,21025,285,RUSOT,"No! No, more! We're leaving now!",51   INT. JEM'HADAR BRIDGE,JEM'HADAR BRIDGE,INT.,Tacking into the Wind,1999-02-24,Deep Space Nine,572.txt,0.0
21026,21026,21026,21026,286,GARAK,That would be unwise.,51   INT. JEM'HADAR BRIDGE,JEM'HADAR BRIDGE,INT.,Tacking into the Wind,1999-02-24,Deep Space Nine,572.txt,0.0
21027,21027,21027,21027,287,RUSOT,"You're still a Cardassian, Garak. You're not going to kill one of your own people for a Bajoran woman.",51   INT. JEM'HADAR BRIDGE,JEM'HADAR BRIDGE,INT.,Tacking into the Wind,1999-02-24,Deep Space Nine,572.txt,0.0
21028,21028,21028,21028,288,GARAK,How little you understand me.,51   INT. JEM'HADAR BRIDGE,JEM'HADAR BRIDGE,INT.,Tacking into the Wind,1999-02-24,Deep Space Nine,572.txt,0.0
21029,21029,21029,21029,289,DAMAR,"Enough! Put your weapons down, both of you!",51   INT. JEM'HADAR BRIDGE,JEM'HADAR BRIDGE,INT.,Tacking into the Wind,1999-02-24,Deep Space Nine,572.txt,0.0
21030,21030,21030,21030,290,RUSOT,"You want her dead too, Damar. I know you do. But you're the leader of the rebellion and you don't want to kill someone wearing a Starfleet uniform. Let me do it for you.",51   INT. JEM'HADAR BRIDGE,JEM'HADAR BRIDGE,INT.,Tacking into the Wind,1999-02-24,Deep Space Nine,572.txt,0.0
21031,21031,21031,21031,291,DAMAR,They've finished installing the dampening weapon.,51   INT. JEM'HADAR BRIDGE,JEM'HADAR BRIDGE,INT.,Tacking into the Wind,1999-02-24,Deep Space Nine,572.txt,0.0
21032,21032,21032,21032,292,KIRA,Then let's all get the hell out,51   INT. JEM'HADAR BRIDGE,JEM'HADAR BRIDGE,INT.,Tacking into the Wind,1999-02-24,Deep Space Nine,572.txt,0.0
21033,21033,21033,21033,293,RUSOT,Not you.,51   INT. JEM'HADAR BRIDGE,JEM'HADAR BRIDGE,INT.,Tacking into the Wind,1999-02-24,Deep Space Nine,572.txt,0.0
21034,21034,21034,21034,294,GARAK,"(phaser never wavering) I'm still here, Rusot.",51   INT. JEM'HADAR BRIDGE,JEM'HADAR BRIDGE,INT.,Tacking into the Wind,1999-02-24,Deep Space Nine,572.txt,0.0
21035,21035,21035,21035,295,RUSOT,"Damar, shoot him. We can kill them both and keep the Breen weapon for ourselves. I believe in you, Damar. I know you're the right man to restore the Empire we loyally served. The Empire we loved. Together we can lead our people to greatness again! Just aim and fire.",51   INT. JEM'HADAR BRIDGE,JEM'HADAR BRIDGE,INT.,Tacking into the Wind,1999-02-24,Deep Space Nine,572.txt,0.0
21036,21036,21036,21036,296,DAMAR,He was my friend. But his Cardassia is dead... and it won't be coming back.,51   INT. JEM'HADAR BRIDGE,JEM'HADAR BRIDGE,INT.,Tacking into the Wind,1999-02-24,Deep Space Nine,572.txt,0.0
21037,21037,21037,21037,297,KIRA,Flood all compartments with the gas.,51   INT. JEM'HADAR BRIDGE,JEM'HADAR BRIDGE,INT.,Tacking into the Wind,1999-02-24,Deep Space Nine,572.txt,0.0
21038,21038,21038,21038,298,KIRA ,Clear all moorings. Bow thrusters ahead full.,51   INT. JEM'HADAR BRIDGE,JEM'HADAR BRIDGE,INT.,Tacking into the Wind,1999-02-24,Deep Space Nine,572.txt,0.0
21039,21039,21039,21039,299,GARAK,We've cleared their defense perimeter.,56   INT. JEM'HADAR BRIDGE,JEM'HADAR BRIDGE,INT.,Tacking into the Wind,1999-02-24,Deep Space Nine,572.txt,0.0
21040,21040,21040,21040,300,KIRA,Take the helm.,56   INT. JEM'HADAR BRIDGE,JEM'HADAR BRIDGE,INT.,Tacking into the Wind,1999-02-24,Deep Space Nine,572.txt,0.0
21041,21041,21041,21041,301,ODO,You're probably... angry...,56   INT. JEM'HADAR BRIDGE,JEM'HADAR BRIDGE,INT.,Tacking into the Wind,1999-02-24,Deep Space Nine,572.txt,0.0
21042,21042,21042,21042,302,KIRA,Why?,56   INT. JEM'HADAR BRIDGE,JEM'HADAR BRIDGE,INT.,Tacking into the Wind,1999-02-24,Deep Space Nine,572.txt,0.0
21043,21043,21043,21043,303,ODO,I... hid my... true condition..,56   INT. JEM'HADAR BRIDGE,JEM'HADAR BRIDGE,INT.,Tacking into the Wind,1999-02-24,Deep Space Nine,572.txt,0.0
21044,21044,21044,21044,304,KIRA,Odo... I've known all along.,56   INT. JEM'HADAR BRIDGE,JEM'HADAR BRIDGE,INT.,Tacking into the Wind,1999-02-24,Deep Space Nine,572.txt,0.0
21045,21045,21045,21045,305,KIRA,"But, it's not over. I'm sure Julian's working on a cure and --",56   INT. JEM'HADAR BRIDGE,JEM'HADAR BRIDGE,INT.,Tacking into the Wind,1999-02-24,Deep Space Nine,572.txt,0.0
21046,21046,21046,21046,306,ODO,Let's not... talk about it. Just... sit here with me.,56   INT. JEM'HADAR BRIDGE,JEM'HADAR BRIDGE,INT.,Tacking into the Wind,1999-02-24,Deep Space Nine,572.txt,0.0
21047,21047,21047,21047,307,KIRA,All right.,56   INT. JEM'HADAR BRIDGE,JEM'HADAR BRIDGE,INT.,Tacking into the Wind,1999-02-24,Deep Space Nine,572.txt,0.0
21048,21048,21048,21048,308,GOWRON,Our next target... Sarpedion Five.,56A  INT. KLINGON WARDROOM (FORMERLY SCENE 49),KLINGON WARDROOM,INT.,Tacking into the Wind,1999-02-24,Deep Space Nine,572.txt,0.0
21049,21049,21049,21049,309,MARTOK,Sarpedion is the headquarters for the entire Twelfth Order.,56A  INT. KLINGON WARDROOM (FORMERLY SCENE 49),KLINGON WARDROOM,INT.,Tacking into the Wind,1999-02-24,Deep Space Nine,572.txt,0.0
21050,21050,21050,21050,310,GOWRON,Yes. You'll take fifteen Vorcha- class battle cruisers in first to soften their defenses. Then --,56A  INT. KLINGON WARDROOM (FORMERLY SCENE 49),KLINGON WARDROOM,INT.,Tacking into the Wind,1999-02-24,Deep Space Nine,572.txt,0.0
21051,21051,21051,21051,311,MARTOK,Chancellor. That world is one of,56A  INT. KLINGON WARDROOM (FORMERLY SCENE 49),KLINGON WARDROOM,INT.,Tacking into the Wind,1999-02-24,Deep Space Nine,572.txt,0.0
21052,21052,21052,21052,312,GOWRON,"If you lack the courage to fight an uphill battle, then perhaps you should retire to your bed.",56A  INT. KLINGON WARDROOM (FORMERLY SCENE 49),KLINGON WARDROOM,INT.,Tacking into the Wind,1999-02-24,Deep Space Nine,572.txt,0.0
21053,21053,21053,21053,313,MARTOK,"I will fight any battle, anywhere... for the Empire.",56A  INT. KLINGON WARDROOM (FORMERLY SCENE 49),KLINGON WARDROOM,INT.,Tacking into the Wind,1999-02-24,Deep Space Nine,572.txt,0.0
21054,21054,21054,21054,314,GOWRON,Spoken like a true warrior.,56A  INT. KLINGON WARDROOM (FORMERLY SCENE 49),KLINGON WARDROOM,INT.,Tacking into the Wind,1999-02-24,Deep Space Nine,572.txt,0.0
21055,21055,21055,21055,315,GOWRON,After Martok has softened their defenses --,56A  INT. KLINGON WARDROOM (FORMERLY SCENE 49),KLINGON WARDROOM,INT.,Tacking into the Wind,1999-02-24,Deep Space Nine,572.txt,0.0
21056,21056,21056,21056,316,WORF,No.,56A  INT. KLINGON WARDROOM (FORMERLY SCENE 49),KLINGON WARDROOM,INT.,Tacking into the Wind,1999-02-24,Deep Space Nine,572.txt,0.0
21057,21057,21057,21057,317,WORF,We cannot attack Sarpedion.,56A  INT. KLINGON WARDROOM (FORMERLY SCENE 49),KLINGON WARDROOM,INT.,Tacking into the Wind,1999-02-24,Deep Space Nine,572.txt,0.0
21058,21058,21058,21058,318,GOWRON,I decide what can and cannot be done.,56A  INT. KLINGON WARDROOM (FORMERLY SCENE 49),KLINGON WARDROOM,INT.,Tacking into the Wind,1999-02-24,Deep Space Nine,572.txt,0.0
21059,21059,21059,21059,319,WORF,"You rule without wisdom and without honor. The warriors gathered here will not say this to you... but I will. You are squandering our ships and our lives in a petty act of vengeance. You do not care what happens to the Empire, you only care about Gowron.",56A  INT. KLINGON WARDROOM (FORMERLY SCENE 49),KLINGON WARDROOM,INT.,Tacking into the Wind,1999-02-24,Deep Space Nine,572.txt,0.0
21060,21060,21060,21060,320,GOWRON,"I should've known better than to trust you again. If you were a true Klingon, I would kill you where you stand. Fortunately for you, that child's uniform shields you from your rightful fate.",56A  INT. KLINGON WARDROOM (FORMERLY SCENE 49),KLINGON WARDROOM,INT.,Tacking into the Wind,1999-02-24,Deep Space Nine,572.txt,0.0
21061,21061,21061,21061,321,WORF,"What I say now, I say as a member of the House of Martok, not as a Starfleet officer... you have dishonored yourself and the Empire. You are not worthy of leading the Council.",56A  INT. KLINGON WARDROOM (FORMERLY SCENE 49),KLINGON WARDROOM,INT.,Tacking into the Wind,1999-02-24,Deep Space Nine,572.txt,0.0
21062,21062,21062,21062,322,GOWRON,There can be only one answer to that.,56A  INT. KLINGON WARDROOM (FORMERLY SCENE 49),KLINGON WARDROOM,INT.,Tacking into the Wind,1999-02-24,Deep Space Nine,572.txt,0.0
21063,21063,21063,21063,323,MARTOK,"Worf, this is madness...",56A  INT. KLINGON WARDROOM (FORMERLY SCENE 49),KLINGON WARDROOM,INT.,Tacking into the Wind,1999-02-24,Deep Space Nine,572.txt,0.0
21064,21064,21064,21064,324,GOWRON,You will... not... have this... day...,56A  INT. KLINGON WARDROOM (FORMERLY SCENE 49),KLINGON WARDROOM,INT.,Tacking into the Wind,1999-02-24,Deep Space Nine,572.txt,0.0
21065,21065,21065,21065,325,GOWRON,Victory... is... mine...,56A  INT. KLINGON WARDROOM (FORMERLY SCENE 49),KLINGON WARDROOM,INT.,Tacking into the Wind,1999-02-24,Deep Space Nine,572.txt,0.0
21066,21066,21066,21066,326,MARTOK,Hail Worf! Leader of the Empire! Worf! Worf! Worf!,56A  INT. KLINGON WARDROOM (FORMERLY SCENE 49),KLINGON WARDROOM,INT.,Tacking into the Wind,1999-02-24,Deep Space Nine,572.txt,0.3544
21067,21067,21067,21067,327,ALL,Worf! Worf! Worf! Worf!,56A  INT. KLINGON WARDROOM (FORMERLY SCENE 49),KLINGON WARDROOM,INT.,Tacking into the Wind,1999-02-24,Deep Space Nine,572.txt,0.0
21068,21068,21068,21068,328,WORF,Wait! Hear me!,56A  INT. KLINGON WARDROOM (FORMERLY SCENE 49),KLINGON WARDROOM,INT.,Tacking into the Wind,1999-02-24,Deep Space Nine,572.txt,0.0
21069,21069,21069,21069,329,WORF,What I have done... was for the Empire... not for me. A new day must dawn for our people... a day bright with the promise of restoring our honor and our dignity. I am not the man to usher in that day. But there is a man here who can.,56A  INT. KLINGON WARDROOM (FORMERLY SCENE 49),KLINGON WARDROOM,INT.,Tacking into the Wind,1999-02-24,Deep Space Nine,572.txt,0.0
21070,21070,21070,21070,330,MARTOK,Worf... I do not seek the leadership.,56A  INT. KLINGON WARDROOM (FORMERLY SCENE 49),KLINGON WARDROOM,INT.,Tacking into the Wind,1999-02-24,Deep Space Nine,572.txt,0.0
21071,21071,21071,21071,331,WORF,"Kahless said, ""Great men do not seek power, they have power thrust upon them.""",56A  INT. KLINGON WARDROOM (FORMERLY SCENE 49),KLINGON WARDROOM,INT.,Tacking into the Wind,1999-02-24,Deep Space Nine,572.txt,0.0
21072,21072,21072,21072,332,ALL,Martok! Martok! Martok! Martok! Martok! Martok! etc.,56A  INT. KLINGON WARDROOM (FORMERLY SCENE 49),KLINGON WARDROOM,INT.,Tacking into the Wind,1999-02-24,Deep Space Nine,572.txt,0.0
21073,21073,21073,21073,333,QUARK,A bottle of bloodwine and two mugs... I thought you hated bloodwine.,57   INT. QUARK'S - SECOND LEVEL,QUARK',INT.,Tacking into the Wind,1999-02-24,Deep Space Nine,572.txt,0.0
21074,21074,21074,21074,334,EZRI,It's a special occasion.,57   INT. QUARK'S - SECOND LEVEL,QUARK',INT.,Tacking into the Wind,1999-02-24,Deep Space Nine,572.txt,0.0
21075,21075,21075,21075,335,QUARK,Oh? Maybe I should join you.,57   INT. QUARK'S - SECOND LEVEL,QUARK',INT.,Tacking into the Wind,1999-02-24,Deep Space Nine,572.txt,0.0
21076,21076,21076,21076,336,WORF,Maybe not.,57   INT. QUARK'S - SECOND LEVEL,QUARK',INT.,Tacking into the Wind,1999-02-24,Deep Space Nine,572.txt,0.0
21077,21077,21077,21077,337,QUARK,Maybe not.,57   INT. QUARK'S - SECOND LEVEL,QUARK',INT.,Tacking into the Wind,1999-02-24,Deep Space Nine,572.txt,0.0
21078,21078,21078,21078,338,WORF,To Chancellor Martok.,57   INT. QUARK'S - SECOND LEVEL,QUARK',INT.,Tacking into the Wind,1999-02-24,Deep Space Nine,572.txt,0.0
21079,21079,21079,21079,339,EZRI,To Chancellor Worf.,57   INT. QUARK'S - SECOND LEVEL,QUARK',INT.,Tacking into the Wind,1999-02-24,Deep Space Nine,572.txt,0.0
21080,21080,21080,21080,340,WORF,My reign was... brief.,57   INT. QUARK'S - SECOND LEVEL,QUARK',INT.,Tacking into the Wind,1999-02-24,Deep Space Nine,572.txt,0.0
21081,21081,21081,21081,341,EZRI,"Kahless also said, ""A leader is judged not by the length of his reign but by the decisions he makes."" And your decision may have been one of the greatest in Klingon history. I'm proud of you, Worf.",57   INT. QUARK'S - SECOND LEVEL,QUARK',INT.,Tacking into the Wind,1999-02-24,Deep Space Nine,572.txt,0.0
21082,21082,21082,21082,342,EZRI,"So... how did it feel to stand on the mountaintop? To know that for that moment, the entire Klingon Empire lay at your feet?",57   INT. QUARK'S - SECOND LEVEL,QUARK',INT.,Tacking into the Wind,1999-02-24,Deep Space Nine,572.txt,0.0
21083,21083,21083,21083,343,WORF,In truth... all I could think of was my father. I wish he could've known that his son became chancellor... even if only for a moment.,57   INT. QUARK'S - SECOND LEVEL,QUARK',INT.,Tacking into the Wind,1999-02-24,Deep Space Nine,572.txt,0.0
21084,21084,21084,21084,344,EZRI,I think he knows... and so does Jadzia.,57   INT. QUARK'S - SECOND LEVEL,QUARK',INT.,Tacking into the Wind,1999-02-24,Deep Space Nine,572.txt,0.0
21085,21085,21085,21085,345,EZRI,To Chancellor Worf?,57   INT. QUARK'S - SECOND LEVEL,QUARK',INT.,Tacking into the Wind,1999-02-24,Deep Space Nine,572.txt,0.0
21086,21086,21086,21086,0,VIC ,Sure I remember the Alamo.,1    INT. VIC'S LOUNGE - NIGHT,VIC'S LOUNG,INT.,Badda-bing Badda-bang,1998-12-09,Deep Space Nine,566.txt,0.0
21087,21087,21087,21087,1,BASHIR,I told you he would.,1    INT. VIC'S LOUNGE - NIGHT,VIC'S LOUNG,INT.,Badda-bing Badda-bang,1998-12-09,Deep Space Nine,566.txt,0.0
21088,21088,21088,21088,2,VIC,"Laurence Harvey, Richard Widmark and John Wayne as Davy Crockett. Great battle scenes, nice sets, but way too long.",1    INT. VIC'S LOUNGE - NIGHT,VIC'S LOUNG,INT.,Badda-bing Badda-bang,1998-12-09,Deep Space Nine,566.txt,0.0
21089,21089,21089,21089,3,O'BRIEN,We're not talking about a movie.,1    INT. VIC'S LOUNGE - NIGHT,VIC'S LOUNG,INT.,Badda-bing Badda-bang,1998-12-09,Deep Space Nine,566.txt,0.0
21090,21090,21090,21090,4,BASHIR,We're talking about our holosuite program.,1    INT. VIC'S LOUNGE - NIGHT,VIC'S LOUNG,INT.,Badda-bing Badda-bang,1998-12-09,Deep Space Nine,566.txt,0.0
21091,21091,21091,21091,5,VIC,"Oh, that Alamo. What about it?",1    INT. VIC'S LOUNGE - NIGHT,VIC'S LOUNG,INT.,Badda-bing Badda-bang,1998-12-09,Deep Space Nine,566.txt,0.0
21092,21092,21092,21092,6,BASHIR,We've got Holosuite Four reserved for an hour and we thought maybe you'd like to join us.,1    INT. VIC'S LOUNGE - NIGHT,VIC'S LOUNG,INT.,Badda-bing Badda-bang,1998-12-09,Deep Space Nine,566.txt,0.0
21093,21093,21093,21093,7,VIC,"Look fellas, I'm touched by the offer, but I don't know...",1    INT. VIC'S LOUNGE - NIGHT,VIC'S LOUNG,INT.,Badda-bing Badda-bang,1998-12-09,Deep Space Nine,566.txt,0.0
21094,21094,21094,21094,8,O'BRIEN,We could transfer your matrix into the Alamo program.,1    INT. VIC'S LOUNGE - NIGHT,VIC'S LOUNG,INT.,Badda-bing Badda-bang,1998-12-09,Deep Space Nine,566.txt,0.0
21095,21095,21095,21095,9,BASHIR,"You've got to get out of Vegas every once in a while, right?",1    INT. VIC'S LOUNGE - NIGHT,VIC'S LOUNG,INT.,Badda-bing Badda-bang,1998-12-09,Deep Space Nine,566.txt,0.0
21096,21096,21096,21096,10,VIC,"True, but I'm afraid I've gotta say no.",1    INT. VIC'S LOUNGE - NIGHT,VIC'S LOUNG,INT.,Badda-bing Badda-bang,1998-12-09,Deep Space Nine,566.txt,0.0
21097,21097,21097,21097,11,BASHIR,Why?,1    INT. VIC'S LOUNGE - NIGHT,VIC'S LOUNG,INT.,Badda-bing Badda-bang,1998-12-09,Deep Space Nine,566.txt,0.0
21098,21098,21098,21098,12,VIC,I don't look good in buckskin.,1    INT. VIC'S LOUNGE - NIGHT,VIC'S LOUNG,INT.,Badda-bing Badda-bang,1998-12-09,Deep Space Nine,566.txt,0.0
21099,21099,21099,21099,13,VIC,I'll tell you what I'll do though...,1    INT. VIC'S LOUNGE - NIGHT,VIC'S LOUNG,INT.,Badda-bing Badda-bang,1998-12-09,Deep Space Nine,566.txt,0.0
21100,21100,21100,21100,14,VIC,How about a little tune to get you into a Texas state of mind.,1    INT. VIC'S LOUNGE - NIGHT,VIC'S LOUNG,INT.,Badda-bing Badda-bang,1998-12-09,Deep Space Nine,566.txt,0.0
21101,21101,21101,21101,15,VIC,What the hell -- ?,1    INT. VIC'S LOUNGE - NIGHT,VIC'S LOUNG,INT.,Badda-bing Badda-bang,1998-12-09,Deep Space Nine,566.txt,0.0
21102,21102,21102,21102,16,BASHIR,What's all this?,1    INT. VIC'S LOUNGE - NIGHT,VIC'S LOUNG,INT.,Badda-bing Badda-bang,1998-12-09,Deep Space Nine,566.txt,0.0
21103,21103,21103,21103,17,VIC,Don't ask me.,1    INT. VIC'S LOUNGE - NIGHT,VIC'S LOUNG,INT.,Badda-bing Badda-bang,1998-12-09,Deep Space Nine,566.txt,0.0
21104,21104,21104,21104,18,O'BRIEN,Maybe there's a pointer fault in the holosuite parameter's file...,1    INT. VIC'S LOUNGE - NIGHT,VIC'S LOUNG,INT.,Badda-bing Badda-bang,1998-12-09,Deep Space Nine,566.txt,0.0
21105,21105,21105,21105,19,MALE  ,Well look who's here...,1    INT. VIC'S LOUNGE - NIGHT,VIC'S LOUNG,INT.,Badda-bing Badda-bang,1998-12-09,Deep Space Nine,566.txt,0.0
21106,21106,21106,21106,20,FRANKIE,The pretty boy singer himself.,1    INT. VIC'S LOUNGE - NIGHT,VIC'S LOUNG,INT.,Badda-bing Badda-bang,1998-12-09,Deep Space Nine,566.txt,0.0
21107,21107,21107,21107,21,VIC,Frankie Eyes... what are you doing in Vegas?,1    INT. VIC'S LOUNGE - NIGHT,VIC'S LOUNG,INT.,Badda-bing Badda-bang,1998-12-09,Deep Space Nine,566.txt,0.0
21108,21108,21108,21108,22,FRANKIE,"What happened to ""Hello, Frankie, long time no see. Make yourself at home. Can I get you anything?"" You believe this guy?",1    INT. VIC'S LOUNGE - NIGHT,VIC'S LOUNG,INT.,Badda-bing Badda-bang,1998-12-09,Deep Space Nine,566.txt,0.0
21109,21109,21109,21109,23,CICCI,No manners.,1    INT. VIC'S LOUNGE - NIGHT,VIC'S LOUNG,INT.,Badda-bing Badda-bang,1998-12-09,Deep Space Nine,566.txt,0.0
21110,21110,21110,21110,24,FRANKIE,Were you born in a barn or something?,1    INT. VIC'S LOUNGE - NIGHT,VIC'S LOUNG,INT.,Badda-bing Badda-bang,1998-12-09,Deep Space Nine,566.txt,0.0
21111,21111,21111,21111,25,BASHIR,"(to Vic, re: Frankie) Is this gentleman a friend of yours?",1    INT. VIC'S LOUNGE - NIGHT,VIC'S LOUNG,INT.,Badda-bing Badda-bang,1998-12-09,Deep Space Nine,566.txt,0.0
21112,21112,21112,21112,26,VIC,We know each other.,1    INT. VIC'S LOUNGE - NIGHT,VIC'S LOUNG,INT.,Badda-bing Badda-bang,1998-12-09,Deep Space Nine,566.txt,0.0
21113,21113,21113,21113,27,FRANKIE,"We're a long way from South Philly, ain't we Vic?",1    INT. VIC'S LOUNGE - NIGHT,VIC'S LOUNG,INT.,Badda-bing Badda-bang,1998-12-09,Deep Space Nine,566.txt,0.0
21114,21114,21114,21114,28,VIC,You here on business or pleasure?,1    INT. VIC'S LOUNGE - NIGHT,VIC'S LOUNG,INT.,Badda-bing Badda-bang,1998-12-09,Deep Space Nine,566.txt,0.0
21115,21115,21115,21115,29,FRANKIE,"Let's just say I'm here to stay. While you, Vicky-boy, are about to take a powder.",1    INT. VIC'S LOUNGE - NIGHT,VIC'S LOUNG,INT.,Badda-bing Badda-bang,1998-12-09,Deep Space Nine,566.txt,0.0
21116,21116,21116,21116,30,VIC,I'm not going anywhere.,1    INT. VIC'S LOUNGE - NIGHT,VIC'S LOUNG,INT.,Badda-bing Badda-bang,1998-12-09,Deep Space Nine,566.txt,0.0
21117,21117,21117,21117,31,FRANKIE,"I got news for you, pal. I just bought this hotel. You're history.",1    INT. VIC'S LOUNGE - NIGHT,VIC'S LOUNG,INT.,Badda-bing Badda-bang,1998-12-09,Deep Space Nine,566.txt,0.0
21118,21118,21118,21118,32,VIC,You can't fire me. I have a contract.,1    INT. VIC'S LOUNGE - NIGHT,VIC'S LOUNG,INT.,Badda-bing Badda-bang,1998-12-09,Deep Space Nine,566.txt,0.0
21119,21119,21119,21119,33,FRANKIE,"And you can paper your walls with it. You're finished in this town, Vic.",1    INT. VIC'S LOUNGE - NIGHT,VIC'S LOUNG,INT.,Badda-bing Badda-bang,1998-12-09,Deep Space Nine,566.txt,0.0
21120,21120,21120,21120,34,VIC,You're blackballing me?,1    INT. VIC'S LOUNGE - NIGHT,VIC'S LOUNG,INT.,Badda-bing Badda-bang,1998-12-09,Deep Space Nine,566.txt,0.0
21121,21121,21121,21121,35,FRANKIE,"As of this moment, you couldn't get a job as a singing busboy. Now are you gonna walk out of here, or do you have to be carried out? Makes no difference to me.",1    INT. VIC'S LOUNGE - NIGHT,VIC'S LOUNG,INT.,Badda-bing Badda-bang,1998-12-09,Deep Space Nine,566.txt,0.0
21122,21122,21122,21122,36,O'BRIEN,"Let me handle this. Computer. Delete characters Frankie Eyes and -- I'm sorry, I didn't catch your name.",1    INT. VIC'S LOUNGE - NIGHT,VIC'S LOUNG,INT.,Badda-bing Badda-bang,1998-12-09,Deep Space Nine,566.txt,0.0
21123,21123,21123,21123,37,CICCI,Cicci.,1    INT. VIC'S LOUNGE - NIGHT,VIC'S LOUNG,INT.,Badda-bing Badda-bang,1998-12-09,Deep Space Nine,566.txt,0.0
21124,21124,21124,21124,38,O'BRIEN,And Cicci from this holosuite program.,1    INT. VIC'S LOUNGE - NIGHT,VIC'S LOUNG,INT.,Badda-bing Badda-bang,1998-12-09,Deep Space Nine,566.txt,0.0
21125,21125,21125,21125,39,CICCI,What's a holosuite?,1    INT. VIC'S LOUNGE - NIGHT,VIC'S LOUNG,INT.,Badda-bing Badda-bang,1998-12-09,Deep Space Nine,566.txt,0.0
21126,21126,21126,21126,40,FRANKIE,Beats me.,1    INT. VIC'S LOUNGE - NIGHT,VIC'S LOUNG,INT.,Badda-bing Badda-bang,1998-12-09,Deep Space Nine,566.txt,0.0
