Unnamed: 0.2,Unnamed: 0.1,Unnamed: 0,index,line,character,quote,scene,location,view,episode,date,series,file,sentiment
73745,73745,73745,73745,46,GEORDI,... whereas actually everything was dying...,6    EXT. DATA'S PLANET (OPTICAL),DATA'S PLANET,EXT.,Datalore,1987-10-26,The Next Generation,114.txt,0.0
73746,73746,73746,73746,47,DATA,"(interrupting; indicating) I was found twenty meters in that direction, sir.",6    EXT. DATA'S PLANET (OPTICAL),DATA'S PLANET,EXT.,Datalore,1987-10-26,The Next Generation,114.txt,0.0
73747,73747,73747,73747,48,TASHA,"Data, any idea at all why you were given the colonists' memories?",6    EXT. DATA'S PLANET (OPTICAL),DATA'S PLANET,EXT.,Datalore,1987-10-26,The Next Generation,114.txt,0.0
73748,73748,73748,73748,49,DATA,"I have always felt that it was done hurriedly, but I know little more.",6    EXT. DATA'S PLANET (OPTICAL),DATA'S PLANET,EXT.,Datalore,1987-10-26,The Next Generation,114.txt,0.0
73749,73749,73749,73749,50,DATA,"Here, sir. This is where the cruiser's landing party found the signal device that had led them here. And they found me lying there, sir.",6    EXT. DATA'S PLANET (OPTICAL),DATA'S PLANET,EXT.,Datalore,1987-10-26,The Next Generation,114.txt,0.0
73750,73750,73750,73750,51,TASHA,"You were just lying out in the open? No identity record, no instructions... ?",6    EXT. DATA'S PLANET (OPTICAL),DATA'S PLANET,EXT.,Datalore,1987-10-26,The Next Generation,114.txt,0.0
73751,73751,73751,73751,52,DATA,Only a layer of dust.,6    EXT. DATA'S PLANET (OPTICAL),DATA'S PLANET,EXT.,Datalore,1987-10-26,The Next Generation,114.txt,0.0
73752,73752,73752,73752,53,DATA,"There's much more of it now, after twenty-six years.",6    EXT. DATA'S PLANET (OPTICAL),DATA'S PLANET,EXT.,Datalore,1987-10-26,The Next Generation,114.txt,0.0
73753,73753,73753,73753,54,RIKER,"What is the first thing you remember, Data?",6    EXT. DATA'S PLANET (OPTICAL),DATA'S PLANET,EXT.,Datalore,1987-10-26,The Next Generation,114.txt,0.0
73754,73754,73754,73754,55,DATA,"Opening my eyes and finding myself looking into the eyes of the Tripoli landing party, sir.",6    EXT. DATA'S PLANET (OPTICAL),DATA'S PLANET,EXT.,Datalore,1987-10-26,The Next Generation,114.txt,0.0
73755,73755,73755,73755,56,DATA ,"(indicating the path back) They believed that the signal device sensed their presence, and activated me.",6    EXT. DATA'S PLANET (OPTICAL),DATA'S PLANET,EXT.,Datalore,1987-10-26,The Next Generation,114.txt,0.0
73756,73756,73756,73756,57,TASHA,Then this very spot was your birthplace...,6    EXT. DATA'S PLANET (OPTICAL),DATA'S PLANET,EXT.,Datalore,1987-10-26,The Next Generation,114.txt,0.0
73757,73757,73757,73757,58,DATA,"But not at all like a human birth. Having the colonists' memories, I knew immediately how to speak, who I was, where I was...",6    EXT. DATA'S PLANET (OPTICAL),DATA'S PLANET,EXT.,Datalore,1987-10-26,The Next Generation,114.txt,0.0
73758,73758,73758,73758,59,TASHA,You were born and became fully knowledgeable at the same instant!,6    EXT. DATA'S PLANET (OPTICAL),DATA'S PLANET,EXT.,Datalore,1987-10-26,The Next Generation,114.txt,0.0
73759,73759,73759,73759,60,DATA,"I had no idea that was unusual, of course.",6    EXT. DATA'S PLANET (OPTICAL),DATA'S PLANET,EXT.,Datalore,1987-10-26,The Next Generation,114.txt,0.0
73760,73760,73760,73760,61,TASHA,It's such a strange place to be born.,6    EXT. DATA'S PLANET (OPTICAL),DATA'S PLANET,EXT.,Datalore,1987-10-26,The Next Generation,114.txt,0.0
73761,73761,73761,73761,62,RIKER,So was a manger.,6    EXT. DATA'S PLANET (OPTICAL),DATA'S PLANET,EXT.,Datalore,1987-10-26,The Next Generation,114.txt,0.0
73762,73762,73762,73762,63,WORF,"A ""manger,"" sir?",6    EXT. DATA'S PLANET (OPTICAL),DATA'S PLANET,EXT.,Datalore,1987-10-26,The Next Generation,114.txt,0.0
73763,73763,73763,73763,64,RIKER,"I won't even try to explain that one, Worf...",6    EXT. DATA'S PLANET (OPTICAL),DATA'S PLANET,EXT.,Datalore,1987-10-26,The Next Generation,114.txt,0.0
73764,73764,73764,73764,65,GEORDI,"I understand now, sir! I've got this figured!",6    EXT. DATA'S PLANET (OPTICAL),DATA'S PLANET,EXT.,Datalore,1987-10-26,The Next Generation,114.txt,0.0
73765,73765,73765,73765,66,GEORDI,It was really very cleverly done to make this look like a natural hollow in the terrain here. Signs of it being constructed hurriedly...,6    EXT. DATA'S PLANET (OPTICAL),DATA'S PLANET,EXT.,Datalore,1987-10-26,The Next Generation,114.txt,0.0
73766,73766,73766,73766,67,GEORDI,... as if to hide something here.,6    EXT. DATA'S PLANET (OPTICAL),DATA'S PLANET,EXT.,Datalore,1987-10-26,The Next Generation,114.txt,0.0
73767,73767,73767,73767,68,DATA,"Yes, that was it, Geordi. This has awakened a memory remnant of how the colonists hoped to remain hidden... ... but their fear of being discovered led to their storing information in me.",6    EXT. DATA'S PLANET (OPTICAL),DATA'S PLANET,EXT.,Datalore,1987-10-26,The Next Generation,114.txt,0.0
73768,73768,73768,73768,69,GEORDI,"Yes, I thought so.",6    EXT. DATA'S PLANET (OPTICAL),DATA'S PLANET,EXT.,Datalore,1987-10-26,The Next Generation,114.txt,0.0
73769,73769,73769,73769,70,TASHA,"No life readings in here either, sir.",10   INT. UNDERGROUND COMPLEX - ANGLE INTO THE ENTRY,UNDERGROUND COMPLE,INT.,Datalore,1987-10-26,The Next Generation,114.txt,0.0
73770,73770,73770,73770,71,RIKER,"The colony laboratory, I'd guess. Extremely well equipped. Does this place stir any memories, Data?",12   INT. COLONY LABORATORY,COLONY LABORATORY,INT.,Datalore,1987-10-26,The Next Generation,114.txt,0.0
73771,73771,73771,73771,72,DATA,"Only vague impressions of some of my functions being tested here, sir...",12   INT. COLONY LABORATORY,COLONY LABORATORY,INT.,Datalore,1987-10-26,The Next Generation,114.txt,0.0
73772,73772,73772,73772,73,RIKER,Posted by a proud parent...,12   INT. COLONY LABORATORY,COLONY LABORATORY,INT.,Datalore,1987-10-26,The Next Generation,114.txt,0.0
73773,73773,73773,73773,74,DATA,"This pictures something that feels familiar, sir. And dangerous, although I have no idea what it represents. And that is all...",12   INT. COLONY LABORATORY,COLONY LABORATORY,INT.,Datalore,1987-10-26,The Next Generation,114.txt,0.0
73774,73774,73774,73774,75,DATA,"... except for an impression that this was a... ""Doctor Soong's"" work area.",12   INT. COLONY LABORATORY,COLONY LABORATORY,INT.,Datalore,1987-10-26,The Next Generation,114.txt,0.2263
73775,73775,73775,73775,76,RIKER,Who? You can't mean Doctor Noonien Soong?,12   INT. COLONY LABORATORY,COLONY LABORATORY,INT.,Datalore,1987-10-26,The Next Generation,114.txt,0.0
73776,73776,73776,73776,77,DATA,"He was called that here... although, his memories indicate he traveled here under a different name.",12   INT. COLONY LABORATORY,COLONY LABORATORY,INT.,Datalore,1987-10-26,The Next Generation,114.txt,0.0
73777,73777,73777,73777,78,GEORDI,"Doctor Noonien Soong, my friend, just happens to have been Earth's foremost robotics scientist!",12   INT. COLONY LABORATORY,COLONY LABORATORY,INT.,Datalore,1987-10-26,The Next Generation,114.txt,0.0
73778,73778,73778,73778,79,TASHA,Until he tried to make Asimov's dream of a positronic brain come true.,12   INT. COLONY LABORATORY,COLONY LABORATORY,INT.,Datalore,1987-10-26,The Next Generation,114.txt,0.0
73779,73779,73779,73779,80,RIKER,"The positronic brain. He promised it would do so much. When it failed completely, Doctor Soong disappeared. Now we know he went off somewhere to try a second time. Geordi, Data, we'll take a close look at this lab. You and Lieutenant Worf reconnoiter where the rest of these corridors lead.",12   INT. COLONY LABORATORY,COLONY LABORATORY,INT.,Datalore,1987-10-26,The Next Generation,114.txt,0.0
73780,73780,73780,73780,81,GEORDI,Data... it's you.,12   INT. COLONY LABORATORY,COLONY LABORATORY,INT.,Datalore,1987-10-26,The Next Generation,114.txt,0.0
73781,73781,73781,73781,82,RIKER,"An epidermal mold, I'd guess. Made to give your exterior the desired finish.",12   INT. COLONY LABORATORY,COLONY LABORATORY,INT.,Datalore,1987-10-26,The Next Generation,114.txt,0.0
73782,73782,73782,73782,83,TASHA,Lieutenant Yar to Commander Riker.,12   INT. COLONY LABORATORY,COLONY LABORATORY,INT.,Datalore,1987-10-26,The Next Generation,114.txt,0.0
73783,73783,73783,73783,84,RIKER,"Come in, Lieutenant.",12   INT. COLONY LABORATORY,COLONY LABORATORY,INT.,Datalore,1987-10-26,The Next Generation,114.txt,0.0
73784,73784,73784,73784,85,TASHA,Sir... this installation is big enough to hold hundreds of people. But all that's here now is empty beds.,12   INT. COLONY LABORATORY,COLONY LABORATORY,INT.,Datalore,1987-10-26,The Next Generation,114.txt,0.0
73785,73785,73785,73785,86,RIKER,"Thank you, Lieutenant. Complete your record scans, then report back here.",12   INT. COLONY LABORATORY,COLONY LABORATORY,INT.,Datalore,1987-10-26,The Next Generation,114.txt,0.0
73786,73786,73786,73786,87,GEORDI,Sir... Seems to be a storage area here...,12   INT. COLONY LABORATORY,COLONY LABORATORY,INT.,Datalore,1987-10-26,The Next Generation,114.txt,0.0
73787,73787,73787,73787,88,RIKER,How many more Datas are there?,12   INT. COLONY LABORATORY,COLONY LABORATORY,INT.,Datalore,1987-10-26,The Next Generation,114.txt,0.0
73788,73788,73788,73788,89,GEORDI,Looks like just these two... I mean that and the real Data.,12   INT. COLONY LABORATORY,COLONY LABORATORY,INT.,Datalore,1987-10-26,The Next Generation,114.txt,0.0
73789,73789,73789,73789,90,DATA,"Commander, can this be another me? Or perhaps my brother?",12   INT. COLONY LABORATORY,COLONY LABORATORY,INT.,Datalore,1987-10-26,The Next Generation,114.txt,0.0
73790,73790,73790,73790,91,RIKER,"I honestly don't know, Data.",12   INT. COLONY LABORATORY,COLONY LABORATORY,INT.,Datalore,1987-10-26,The Next Generation,114.txt,0.0
73791,73791,73791,73791,92,DATA,He needs assembling.,12   INT. COLONY LABORATORY,COLONY LABORATORY,INT.,Datalore,1987-10-26,The Next Generation,114.txt,0.0
73792,73792,73792,73792,93,RIKER,"""He?"" Data, we don't know that this could become ""alive.""",12   INT. COLONY LABORATORY,COLONY LABORATORY,INT.,Datalore,1987-10-26,The Next Generation,114.txt,0.0
73793,73793,73793,73793,94,DATA,"It is of great interest to me to find out, sir. I never believed it possible I might have a link with some form like my own.",12   INT. COLONY LABORATORY,COLONY LABORATORY,INT.,Datalore,1987-10-26,The Next Generation,114.txt,0.0
73794,73794,73794,73794,95,RIKER,"Understood. We'll take it back to the ship, of course.",12   INT. COLONY LABORATORY,COLONY LABORATORY,INT.,Datalore,1987-10-26,The Next Generation,114.txt,0.0
73795,73795,73795,73795,96,TASHA,"Captain, I have a subspace reply to your request. Starfleet considers it vital we begin our ship's computer upgrade at Starbase Armus Nine on schedule.",18   INT. MAIN BRIDGE - WIDE ANGLE,MAIN BRIDG,INT.,Datalore,1987-10-26,The Next Generation,114.txt,0.0
73796,73796,73796,73796,97,PICARD,Damn. Can anyone see why they've turned down a perfectly legitimate request to finish this investigation here?,18   INT. MAIN BRIDGE - WIDE ANGLE,MAIN BRIDG,INT.,Datalore,1987-10-26,The Next Generation,114.txt,0.0
73797,73797,73797,73797,98,WESLEY,Sir... you asked for the kind of computer upgrade that only the Bynars can handle. And they're available only at this time.,18   INT. MAIN BRIDGE - WIDE ANGLE,MAIN BRIDG,INT.,Datalore,1987-10-26,The Next Generation,114.txt,0.0
73798,73798,73798,73798,99,PICARD,"Then, get us there on schedule, Number One. (to Wesley; controlling self) Thank you, Wesley. I'd completely forgotten that.",18   INT. MAIN BRIDGE - WIDE ANGLE,MAIN BRIDG,INT.,Datalore,1987-10-26,The Next Generation,114.txt,0.0
73799,73799,73799,73799,100,RIKER,"Take us out of orbit, Mister La Forge.",18   INT. MAIN BRIDGE - WIDE ANGLE,MAIN BRIDG,INT.,Datalore,1987-10-26,The Next Generation,114.txt,0.0
73800,73800,73800,73800,101,PICARD ,"Captain's log, Stardate 41242.45. Despite having only a few hours in which to explore Data's home planet...",19   EXT. SPACE - ENTERPRISE (OPTICAL),SPACE - ENTERPRISE,EXT.,Datalore,1987-10-26,The Next Generation,114.txt,0.0
73801,73801,73801,73801,102,PICARD ,... we have discovered something which may explain Data's beginnings... if we can properly assemble and communicate with what we've found.,20   INT. SICKBAY,SICKBAY,INT.,Datalore,1987-10-26,The Next Generation,114.txt,0.0
73802,73802,73802,73802,103,BEVERLY,Signal from the captain. They need you at the debriefing.,20   INT. SICKBAY,SICKBAY,INT.,Datalore,1987-10-26,The Next Generation,114.txt,0.0
73803,73803,73803,73803,104,DATA,"I've been anxious to hear the chief engineer's opinion, Mister Argyle. Do you believe he can be made to function?",20   INT. SICKBAY,SICKBAY,INT.,Datalore,1987-10-26,The Next Generation,114.txt,0.0
73804,73804,73804,73804,105,ARGYLE,It appears to include all the components in your body. Not that we really understand your construction either...,20   INT. SICKBAY,SICKBAY,INT.,Datalore,1987-10-26,The Next Generation,114.txt,0.0
73805,73805,73805,73805,106,BEVERLY,"We'll have our top medical and engineering specialists working on its assembly, Mister Data.",20   INT. SICKBAY,SICKBAY,INT.,Datalore,1987-10-26,The Next Generation,114.txt,0.0
73806,73806,73806,73806,107,ARGYLE,"Just... one thing. Without disassembling you, of course, if we should need...",20   INT. SICKBAY,SICKBAY,INT.,Datalore,1987-10-26,The Next Generation,114.txt,0.0
73807,73807,73807,73807,108,BEVERLY,"... If we should need to compare this with the way... uh, with the way you're put together... ?",20   INT. SICKBAY,SICKBAY,INT.,Datalore,1987-10-26,The Next Generation,114.txt,0.0
73808,73808,73808,73808,109,PICARD,"Bringing it up here was the right thing to do, of course, Number One.",22   INT. OBSERVATION LOUNGE (OPTICAL),OBSERVATION LOUNGE,INT.,Datalore,1987-10-26,The Next Generation,114.txt,0.0
73809,73809,73809,73809,110,PICARD,"I was just saying, Data, that if it functions, it might answer a lot of questions for us.",22   INT. OBSERVATION LOUNGE (OPTICAL),OBSERVATION LOUNGE,INT.,Datalore,1987-10-26,The Next Generation,114.txt,0.0
73810,73810,73810,73810,111,RIKER,"Does it appear to have all your... ah, parts?",22   INT. OBSERVATION LOUNGE (OPTICAL),OBSERVATION LOUNGE,INT.,Datalore,1987-10-26,The Next Generation,114.txt,0.0
73811,73811,73811,73811,112,DATA,"Completely, sir.",22   INT. OBSERVATION LOUNGE (OPTICAL),OBSERVATION LOUNGE,INT.,Datalore,1987-10-26,The Next Generation,114.txt,0.0
73812,73812,73812,73812,113,GEORDI,"Will we know how to... to ""turn it on?""",22   INT. OBSERVATION LOUNGE (OPTICAL),OBSERVATION LOUNGE,INT.,Datalore,1987-10-26,The Next Generation,114.txt,0.0
73813,73813,73813,73813,114,PICARD,"All right, all right... (stands; hesitates, then) Legitimate questions about this need not be asked apologetically. You're uncomfortable about aspects of your duplicate, Data... we're uncomfortable, too... and none of it for any logical reason. We know that you're as ""alive"" as any of the rest of us. If you find it awkward to be reminded that Data is a ""machine""... you might remember that the rest of you are merely a different variety of machine... in our case, electro-chemical in nature.",22   INT. OBSERVATION LOUNGE (OPTICAL),OBSERVATION LOUNGE,INT.,Datalore,1987-10-26,The Next Generation,114.txt,0.0
73814,73814,73814,73814,115,PICARD ,Let's begin handling this as we would anything else.,22   INT. OBSERVATION LOUNGE (OPTICAL),OBSERVATION LOUNGE,INT.,Datalore,1987-10-26,The Next Generation,114.txt,0.0
73815,73815,73815,73815,116,GEORDI,Agreed! Love that captain!,22   INT. OBSERVATION LOUNGE (OPTICAL),OBSERVATION LOUNGE,INT.,Datalore,1987-10-26,The Next Generation,114.txt,0.0
73816,73816,73816,73816,117,PICARD,"My comments, Lieutenant, do not require applause!",22   INT. OBSERVATION LOUNGE (OPTICAL),OBSERVATION LOUNGE,INT.,Datalore,1987-10-26,The Next Generation,114.txt,0.0
73817,73817,73817,73817,118,GEORDI,"Yes, sir; sorry, sir.",22   INT. OBSERVATION LOUNGE (OPTICAL),OBSERVATION LOUNGE,INT.,Datalore,1987-10-26,The Next Generation,114.txt,0.0
73818,73818,73818,73818,119,PICARD,"Let's start with you, Data.",22   INT. OBSERVATION LOUNGE (OPTICAL),OBSERVATION LOUNGE,INT.,Datalore,1987-10-26,The Next Generation,114.txt,0.0
73819,73819,73819,73819,120,DATA,"Well... a good starting point might be, ""Why was I given human form?""",22   INT. OBSERVATION LOUNGE (OPTICAL),OBSERVATION LOUNGE,INT.,Datalore,1987-10-26,The Next Generation,114.txt,0.0
73820,73820,73820,73820,121,GEORDI,To make it easy for humans to relate to you. Had to be. But your designer may have had something else to prove also.,22   INT. OBSERVATION LOUNGE (OPTICAL),OBSERVATION LOUNGE,INT.,Datalore,1987-10-26,The Next Generation,114.txt,0.0
73821,73821,73821,73821,122,PICARD,"That human-shaped robots need not be clumsy, limited things... You certainly operate as well as we do, Data...",22   INT. OBSERVATION LOUNGE (OPTICAL),OBSERVATION LOUNGE,INT.,Datalore,1987-10-26,The Next Generation,114.txt,0.0
73822,73822,73822,73822,123,DATA,"In some ways better, sir.",22   INT. OBSERVATION LOUNGE (OPTICAL),OBSERVATION LOUNGE,INT.,Datalore,1987-10-26,The Next Generation,114.txt,0.0
73823,73823,73823,73823,124,PICARD,Ah... yes! But the important question now may be what happened to the colonists.,22   INT. OBSERVATION LOUNGE (OPTICAL),OBSERVATION LOUNGE,INT.,Datalore,1987-10-26,The Next Generation,114.txt,0.0
73824,73824,73824,73824,125,RIKER,"Agreed. (exhibits child's drawing) One of several exhibited in the lab, by proud parents, no doubt. This could be simply a child's imagination. But then, several children made similar drawings.",22   INT. OBSERVATION LOUNGE (OPTICAL),OBSERVATION LOUNGE,INT.,Datalore,1987-10-26,The Next Generation,114.txt,0.0
73825,73825,73825,73825,126,BEVERLY,"Doctor Crusher to Captain. At this point, sir, we very much need Mister Data's help.",22   INT. OBSERVATION LOUNGE (OPTICAL),OBSERVATION LOUNGE,INT.,Datalore,1987-10-26,The Next Generation,114.txt,0.0
73826,73826,73826,73826,127,PICARD,"He's on his way, Doctor.",22   INT. OBSERVATION LOUNGE (OPTICAL),OBSERVATION LOUNGE,INT.,Datalore,1987-10-26,The Next Generation,114.txt,0.0
73827,73827,73827,73827,128,DATA,"There, Doctor. Press your fingers there.",23   INT. SICKBAY - DATA AND BEVERLY,SICKBA,INT.,Datalore,1987-10-26,The Next Generation,114.txt,0.0
73828,73828,73828,73828,129,DATA ,"It operates somewhat like a ""switch,"" Doctor.",23   INT. SICKBAY - DATA AND BEVERLY,SICKBA,INT.,Datalore,1987-10-26,The Next Generation,114.txt,0.0
73829,73829,73829,73829,130,BEVERLY,And these small projections?,23   INT. SICKBAY - DATA AND BEVERLY,SICKBA,INT.,Datalore,1987-10-26,The Next Generation,114.txt,0.0
73830,73830,73830,73830,131,DATA,"An android alarm clock, Doctor. Is that amusing? It times how long I remain unconscious.",23   INT. SICKBAY - DATA AND BEVERLY,SICKBA,INT.,Datalore,1987-10-26,The Next Generation,114.txt,0.0
73831,73831,73831,73831,132,ARGYLE,"Are you certain about us using these heating devices, Data?",23   INT. SICKBAY - DATA AND BEVERLY,SICKBA,INT.,Datalore,1987-10-26,The Next Generation,114.txt,0.0
73832,73832,73832,73832,133,DATA,I will feel nothing at all.,23   INT. SICKBAY - DATA AND BEVERLY,SICKBA,INT.,Datalore,1987-10-26,The Next Generation,114.txt,0.0
73833,73833,73833,73833,134,ARGYLE,Marvelous. It should all be a lot simpler... once we can see how your circuitry's connected.,23   INT. SICKBAY - DATA AND BEVERLY,SICKBA,INT.,Datalore,1987-10-26,The Next Generation,114.txt,0.0
73834,73834,73834,73834,135,BEVERLY,I'll mention it to no one. You have my word.,23   INT. SICKBAY - DATA AND BEVERLY,SICKBA,INT.,Datalore,1987-10-26,The Next Generation,114.txt,0.0
73835,73835,73835,73835,136,DATA,If you had an off-switch Doctor... would you not keep it secret?,23   INT. SICKBAY - DATA AND BEVERLY,SICKBA,INT.,Datalore,1987-10-26,The Next Generation,114.txt,0.0
73836,73836,73836,73836,137,BEVERLY,I probably would.,23   INT. SICKBAY - DATA AND BEVERLY,SICKBA,INT.,Datalore,1987-10-26,The Next Generation,114.txt,0.0
73837,73837,73837,73837,138,ARGYLE,"Yes, notice the micro-circuitry here... and here.",27   INT. SICKBAY - WIDE ANGLE,SICKBA,INT.,Datalore,1987-10-26,The Next Generation,114.txt,0.0
73838,73838,73838,73838,139,ARGYLE ,Then another fibroid-like connection here.,27   INT. SICKBAY - WIDE ANGLE,SICKBA,INT.,Datalore,1987-10-26,The Next Generation,114.txt,0.0
73839,73839,73839,73839,140,BEVERLY,Let's close up.,27   INT. SICKBAY - WIDE ANGLE,SICKBA,INT.,Datalore,1987-10-26,The Next Generation,114.txt,0.0
73840,73840,73840,73840,141,BEVERLY,"If I've done it right, he'll switch on in a minute.",33   INT. SICKBAY - CLOSE ON DATA,SICKBA,INT.,Datalore,1987-10-26,The Next Generation,114.txt,0.0
73841,73841,73841,73841,142,ARGYLE,"It seemed to go well... ... thanks to a look inside Mister Data. But there have been no signs of consciousness, yet...",33   INT. SICKBAY - CLOSE ON DATA,SICKBA,INT.,Datalore,1987-10-26,The Next Generation,114.txt,0.0
73842,73842,73842,73842,143,RIKER,"Certainly a perfect match for Data, sir.",33   INT. SICKBAY - CLOSE ON DATA,SICKBA,INT.,Datalore,1987-10-26,The Next Generation,114.txt,0.0
73843,73843,73843,73843,144,PICARD,"Do you think so, really? I wonder which of them was made first?",33   INT. SICKBAY - CLOSE ON DATA,SICKBA,INT.,Datalore,1987-10-26,The Next Generation,114.txt,0.0
73844,73844,73844,73844,145,LORE,He was. But they found him imperfect and I was made to replace him.,33   INT. SICKBAY - CLOSE ON DATA,SICKBA,INT.,Datalore,1987-10-26,The Next Generation,114.txt,-0.4497
73845,73845,73845,73845,146,LORE,You may call me Lore.,33   INT. SICKBAY - CLOSE ON DATA,SICKBA,INT.,Datalore,1987-10-26,The Next Generation,114.txt,0.0
73846,73846,73846,73846,147,PICARD,"I'm also a bit troubled by it describing you as ""imperfect.""",38   INT. CAPTAIN'S READY ROOM,CAPTAIN'S READY ROOM,INT.,Datalore,1987-10-26,The Next Generation,114.txt,-0.4588
73847,73847,73847,73847,148,DATA,"Human language gives me difficulties too, sir. ""Imperfect"" could mean I lack abilities that he possesses.",38   INT. CAPTAIN'S READY ROOM,CAPTAIN'S READY ROOM,INT.,Datalore,1987-10-26,The Next Generation,114.txt,0.0
73848,73848,73848,73848,149,PICARD,I wonder. But the point of this is whether you and it have approximately the same capabilities.,38   INT. CAPTAIN'S READY ROOM,CAPTAIN'S READY ROOM,INT.,Datalore,1987-10-26,The Next Generation,114.txt,0.0
73849,73849,73849,73849,150,DATA,"We do, sir, and your referring to him as an ""it""... suggests I too fit into the category of a ""thing.""",38   INT. CAPTAIN'S READY ROOM,CAPTAIN'S READY ROOM,INT.,Datalore,1987-10-26,The Next Generation,114.txt,0.0
73850,73850,73850,73850,151,PICARD,"I see your point, Commander. My sincere apologies.",38   INT. CAPTAIN'S READY ROOM,CAPTAIN'S READY ROOM,INT.,Datalore,1987-10-26,The Next Generation,114.txt,0.0
73851,73851,73851,73851,152,DATA,"Gladly accepted, sir. As for Lore's abilities, his use of syntax and grammar suggests he was given human memories similar to mine.",38   INT. CAPTAIN'S READY ROOM,CAPTAIN'S READY ROOM,INT.,Datalore,1987-10-26,The Next Generation,114.txt,0.0
73852,73852,73852,73852,153,PICARD,You both have about equal physical strength and mental ability?,38   INT. CAPTAIN'S READY ROOM,CAPTAIN'S READY ROOM,INT.,Datalore,1987-10-26,The Next Generation,114.txt,0.0
73853,73853,73853,73853,154,DATA,"I believe so, sir.",38   INT. CAPTAIN'S READY ROOM,CAPTAIN'S READY ROOM,INT.,Datalore,1987-10-26,The Next Generation,114.txt,0.0
73854,73854,73854,73854,155,PICARD,Which requires I now ask you... a very serious question. Since the two of you are closely related to each other...,38   INT. CAPTAIN'S READY ROOM,CAPTAIN'S READY ROOM,INT.,Datalore,1987-10-26,The Next Generation,114.txt,0.0
73855,73855,73855,73855,156,DATA,"The answer, sir, is that my loyalty is to you and Starfleet. Completely.",38   INT. CAPTAIN'S READY ROOM,CAPTAIN'S READY ROOM,INT.,Datalore,1987-10-26,The Next Generation,114.txt,0.0
73856,73856,73856,73856,157,PICARD,"Thank you, Commander. I was certain of that.",38   INT. CAPTAIN'S READY ROOM,CAPTAIN'S READY ROOM,INT.,Datalore,1987-10-26,The Next Generation,114.txt,0.0
73857,73857,73857,73857,158,GEORDI,"And Helm control are here, with the ship's heading given in measurements, we call them ""degrees""... ... with three hundred-sixty of them in a full circle this way.",39   INT. MAIN BRIDGE,MAIN BRIDGE,INT.,Datalore,1987-10-26,The Next Generation,114.txt,0.0
73858,73858,73858,73858,159,LORE,"... Then you say ""mark""...",39   INT. MAIN BRIDGE,MAIN BRIDGE,INT.,Datalore,1987-10-26,The Next Generation,114.txt,0.0
73859,73859,73859,73859,160,GEORDI,On the nose!,39   INT. MAIN BRIDGE,MAIN BRIDGE,INT.,Datalore,1987-10-26,The Next Generation,114.txt,0.0
73860,73860,73860,73860,161,WESLEY,Which separates it from another three hundred-sixty degree full circle like this... on a right angle to that one.,39   INT. MAIN BRIDGE,MAIN BRIDGE,INT.,Datalore,1987-10-26,The Next Generation,114.txt,0.0
73861,73861,73861,73861,162,LORE,"So by ordering a heading so many degrees this way, and so many this way, the ship can travel in any direction. All three dimensions.",39   INT. MAIN BRIDGE,MAIN BRIDGE,INT.,Datalore,1987-10-26,The Next Generation,114.txt,0.0
73862,73862,73862,73862,163,RIKER,And the square of the hypotenuse of a right triangle...,39   INT. MAIN BRIDGE,MAIN BRIDGE,INT.,Datalore,1987-10-26,The Next Generation,114.txt,0.0
73863,73863,73863,73863,164,LORE,"Is equal to the sum of the square of its other two... ... its two ""somethings""... which I once heard but never understood.",39   INT. MAIN BRIDGE,MAIN BRIDGE,INT.,Datalore,1987-10-26,The Next Generation,114.txt,0.0
73864,73864,73864,73864,165,DATA,"All of which you can learn more about, when the captain has approved your being on the bridge.",39   INT. MAIN BRIDGE,MAIN BRIDGE,INT.,Datalore,1987-10-26,The Next Generation,114.txt,0.0
