Unnamed: 0.2,Unnamed: 0.1,Unnamed: 0,index,line,character,quote,scene,location,view,episode,date,series,file,sentiment
23000,23000,23000,23000,250,TAHNA,"Once you're in your comfortable bed with the Federation, you won't be",43   INT. TAHNA'S QUARTERS,TAHNA'S QUARTERS,INT.,Past Prologue,1992-10-05,Deep Space Nine,404.txt,0.5106
23001,23001,23001,23001,251,KIRA,If you expect me to help you commit some act of violence against the Federation...,43   INT. TAHNA'S QUARTERS,TAHNA'S QUARTERS,INT.,Past Prologue,1992-10-05,Deep Space Nine,404.txt,-0.0516
23002,23002,23002,23002,252,TAHNA,No. The violence is over. That's the truth. No one will be hurt. In any way. I promise you that. But I do need your help...,43   INT. TAHNA'S QUARTERS,TAHNA'S QUARTERS,INT.,Past Prologue,1992-10-05,Deep Space Nine,404.txt,-0.5647
23003,23003,23003,23003,253,KIRA,"You've already lied to me, Tahna; I know how the game works.",43   INT. TAHNA'S QUARTERS,TAHNA'S QUARTERS,INT.,Past Prologue,1992-10-05,Deep Space Nine,404.txt,0.0
23004,23004,23004,23004,254,TAHNA,"To do what we plan, we need a small ship capable of warp speed. I gambled that I could convince you to get it for us.",43   INT. TAHNA'S QUARTERS,TAHNA'S QUARTERS,INT.,Past Prologue,1992-10-05,Deep Space Nine,404.txt,0.0
23005,23005,23005,23005,255,KIRA,"Just what is this ""peaceful"" plan?",43   INT. TAHNA'S QUARTERS,TAHNA'S QUARTERS,INT.,Past Prologue,1992-10-05,Deep Space Nine,404.txt,0.0
23006,23006,23006,23006,256,TAHNA,In one move... and non-violently... we accomplish everything that both of us ever wanted for Bajor.,43   INT. TAHNA'S QUARTERS,TAHNA'S QUARTERS,INT.,Past Prologue,1992-10-05,Deep Space Nine,404.txt,0.0
23007,23007,23007,23007,257,KIRA,How?,43   INT. TAHNA'S QUARTERS,TAHNA'S QUARTERS,INT.,Past Prologue,1992-10-05,Deep Space Nine,404.txt,0.0
23008,23008,23008,23008,258,TAHNA,"I know the game, too. You know I can't risk telling you that.",43   INT. TAHNA'S QUARTERS,TAHNA'S QUARTERS,INT.,Past Prologue,1992-10-05,Deep Space Nine,404.txt,0.0
23009,23009,23009,23009,259,KIRA,How do you know I won't go straight to Sisko?,43   INT. TAHNA'S QUARTERS,TAHNA'S QUARTERS,INT.,Past Prologue,1992-10-05,Deep Space Nine,404.txt,0.0
23010,23010,23010,23010,260,TAHNA,"If you do, we'll both know where your loyalties are, won't we.",43   INT. TAHNA'S QUARTERS,TAHNA'S QUARTERS,INT.,Past Prologue,1992-10-05,Deep Space Nine,404.txt,0.0
23011,23011,23011,23011,261,TAHNA,"But I don't think you will. You want freedom for Bajor. In your heart, you know the Federation cannot give it to us. No one can give us freedom. We have to take it. You'll have to make the choice, Kira. Be with us. Or stop lying to yourself about what you've become.",43   INT. TAHNA'S QUARTERS,TAHNA'S QUARTERS,INT.,Past Prologue,1992-10-05,Deep Space Nine,404.txt,0.0
23012,23012,23012,23012,262,BASHIR,"Ah. Plain, simple Garak. How are you, today?",49A  INT. PROMENADE REPLIMAT,PROMENADE REPLIMAT,INT.,Past Prologue,1992-10-05,Deep Space Nine,404.txt,0.0
23013,23013,23013,23013,263,GARAK,"Being observant, Doctor.",49A  INT. PROMENADE REPLIMAT,PROMENADE REPLIMAT,INT.,Past Prologue,1992-10-05,Deep Space Nine,404.txt,0.0
23014,23014,23014,23014,264,BASHIR,I'm sure of it.,49A  INT. PROMENADE REPLIMAT,PROMENADE REPLIMAT,INT.,Past Prologue,1992-10-05,Deep Space Nine,404.txt,0.0
23015,23015,23015,23015,265,GARAK,"There's a time for levity, my young friend... and a time for genuine concern.",49A  INT. PROMENADE REPLIMAT,PROMENADE REPLIMAT,INT.,Past Prologue,1992-10-05,Deep Space Nine,404.txt,0.0
23016,23016,23016,23016,266,GARAK ,"... The arrival on this station, for instance... ... of those two Kohn-Ma terrorists.",49A  INT. PROMENADE REPLIMAT,PROMENADE REPLIMAT,INT.,Past Prologue,1992-10-05,Deep Space Nine,404.txt,0.0
23017,23017,23017,23017,267,,... of those two Kohn-Ma terrorists.,49A  INT. PROMENADE REPLIMAT,PROMENADE REPLIMAT,INT.,Past Prologue,1992-10-05,Deep Space Nine,404.txt,0.0
23018,23018,23018,23018,268,BASHIR,Terrorists... What are they doing here... ?,49B  ANGLE FAVORING (INT.) PROMENADE SECOND LEVEL, PROMENADE SECOND LEVEL,INT.,Past Prologue,1992-10-05,Deep Space Nine,404.txt,0.0
23019,23019,23019,23019,269,GARAK,"I'm not exactly sure; but together, we might have some success at finding out...",49B  ANGLE FAVORING (INT.) PROMENADE SECOND LEVEL, PROMENADE SECOND LEVEL,INT.,Past Prologue,1992-10-05,Deep Space Nine,404.txt,0.0
23020,23020,23020,23020,270,BASHIR,"(in over his head, now) Together. Garak, I'm a doctor, not a...",49B  ANGLE FAVORING (INT.) PROMENADE SECOND LEVEL, PROMENADE SECOND LEVEL,INT.,Past Prologue,1992-10-05,Deep Space Nine,404.txt,0.0
23021,23021,23021,23021,271,GARAK,"Once you do have the appropriate answer, I'm sure you'll know what to do with it.",49B  ANGLE FAVORING (INT.) PROMENADE SECOND LEVEL, PROMENADE SECOND LEVEL,INT.,Past Prologue,1992-10-05,Deep Space Nine,404.txt,0.0
23022,23022,23022,23022,272,BASHIR,I really must be getting along...,49B  ANGLE FAVORING (INT.) PROMENADE SECOND LEVEL, PROMENADE SECOND LEVEL,INT.,Past Prologue,1992-10-05,Deep Space Nine,404.txt,0.0
23023,23023,23023,23023,273,GARAK,"Doctor, I think it's time for you to take advantage of my shop. If you'll be there at exactly twenty fifty- five hours this evening, I promise to show you a suit that will make you into a new man.",49B  ANGLE FAVORING (INT.) PROMENADE SECOND LEVEL, PROMENADE SECOND LEVEL,INT.,Past Prologue,1992-10-05,Deep Space Nine,404.txt,0.0
23024,23024,23024,23024,274,BASHIR,"A suit? We're talking about terrorists, and you want me to buy a new suit?",49B  ANGLE FAVORING (INT.) PROMENADE SECOND LEVEL, PROMENADE SECOND LEVEL,INT.,Past Prologue,1992-10-05,Deep Space Nine,404.txt,0.0
23025,23025,23025,23025,275,GARAK,"Doctor, am I making myself clear? I want you to buy a new suit tonight at twenty-fifty-five. Exactly.",49B  ANGLE FAVORING (INT.) PROMENADE SECOND LEVEL, PROMENADE SECOND LEVEL,INT.,Past Prologue,1992-10-05,Deep Space Nine,404.txt,0.0
23026,23026,23026,23026,276,BASHIR,I see. Yes... If you'll excuse me now...,49B  ANGLE FAVORING (INT.) PROMENADE SECOND LEVEL, PROMENADE SECOND LEVEL,INT.,Past Prologue,1992-10-05,Deep Space Nine,404.txt,0.0
23027,23027,23027,23027,277,SISKO ,Major... ?,50   INT. OPS,OPS,INT.,Past Prologue,1992-10-05,Deep Space Nine,404.txt,0.0
23028,23028,23028,23028,278,KIRA,"Yes, Commander.",50   INT. OPS,OPS,INT.,Past Prologue,1992-10-05,Deep Space Nine,404.txt,0.0
23029,23029,23029,23029,279,SISKO,I'd like to meet the two Kohn-Ma who just arrived as soon as possible...,50   INT. OPS,OPS,INT.,Past Prologue,1992-10-05,Deep Space Nine,404.txt,0.0
23030,23030,23030,23030,280,KIRA,Of course. I'll arrange it.,50   INT. OPS,OPS,INT.,Past Prologue,1992-10-05,Deep Space Nine,404.txt,0.0
23031,23031,23031,23031,281,SISKO,How do they seem to you?,50   INT. OPS,OPS,INT.,Past Prologue,1992-10-05,Deep Space Nine,404.txt,0.0
23032,23032,23032,23032,282,KIRA,Sir?,50   INT. OPS,OPS,INT.,Past Prologue,1992-10-05,Deep Space Nine,404.txt,0.0
23033,23033,23033,23033,283,SISKO,Do you feel as secure about them as you do about Tahna Los?,50   INT. OPS,OPS,INT.,Past Prologue,1992-10-05,Deep Space Nine,404.txt,0.0
23034,23034,23034,23034,284,KIRA,Absolutely.,50   INT. OPS,OPS,INT.,Past Prologue,1992-10-05,Deep Space Nine,404.txt,0.0
23035,23035,23035,23035,285,BASHIR,Commander Sisko...,50   INT. OPS,OPS,INT.,Past Prologue,1992-10-05,Deep Space Nine,404.txt,0.0
23036,23036,23036,23036,286,BASHIR,... I need some guidance...,50   INT. OPS,OPS,INT.,Past Prologue,1992-10-05,Deep Space Nine,404.txt,0.0
23037,23037,23037,23037,287,SISKO,"Yes, Doctor... ?",50   INT. OPS,OPS,INT.,Past Prologue,1992-10-05,Deep Space Nine,404.txt,0.0
23038,23038,23038,23038,288,BASHIR,"It's about... Garak, the Cardassian... I'm afraid this... relationship... has gotten a little out of hand.",50   INT. OPS,OPS,INT.,Past Prologue,1992-10-05,Deep Space Nine,404.txt,0.0
23039,23039,23039,23039,289,SISKO,How's that?,50   INT. OPS,OPS,INT.,Past Prologue,1992-10-05,Deep Space Nine,404.txt,0.0
23040,23040,23040,23040,290,BASHIR,He wants me to buy a suit.,50   INT. OPS,OPS,INT.,Past Prologue,1992-10-05,Deep Space Nine,404.txt,0.0
23041,23041,23041,23041,291,SISKO,A suit.,50   INT. OPS,OPS,INT.,Past Prologue,1992-10-05,Deep Space Nine,404.txt,0.0
23042,23042,23042,23042,292,BASHIR,At exactly twenty-fifty-five tonight.,50   INT. OPS,OPS,INT.,Past Prologue,1992-10-05,Deep Space Nine,404.txt,0.0
23043,23043,23043,23043,293,SISKO,Why twenty-fifty-five?,50   INT. OPS,OPS,INT.,Past Prologue,1992-10-05,Deep Space Nine,404.txt,0.0
23044,23044,23044,23044,294,BASHIR,I don't know... but it has something to do with the Bajoran terrorists on board.,50   INT. OPS,OPS,INT.,Past Prologue,1992-10-05,Deep Space Nine,404.txt,0.0
23045,23045,23045,23045,295,BASHIR,"He... he says that together, he and I might discover what they're really doing here. (Sisko reacts, muses, a beat) I don't understand why he wants me involved...",50   INT. OPS,OPS,INT.,Past Prologue,1992-10-05,Deep Space Nine,404.txt,0.0
23046,23046,23046,23046,296,SISKO,"Sometimes, communications can't be conducted through official channels. Maybe this is their way of telling us that we have a common enemy.",50   INT. OPS,OPS,INT.,Past Prologue,1992-10-05,Deep Space Nine,404.txt,0.0
23047,23047,23047,23047,297,BASHIR,What do you want me to do?,50   INT. OPS,OPS,INT.,Past Prologue,1992-10-05,Deep Space Nine,404.txt,0.0
23048,23048,23048,23048,298,SISKO,"I think, Doctor, that you could definitely use a new suit.",50   INT. OPS,OPS,INT.,Past Prologue,1992-10-05,Deep Space Nine,404.txt,0.0
23049,23049,23049,23049,299,KIRA,Busy?,50C  INT. SECURITY OFFICE,SECURITY OFFICE,INT.,Past Prologue,1992-10-05,Deep Space Nine,404.txt,0.0
23050,23050,23050,23050,300,ODO,What can I do for you?,50C  INT. SECURITY OFFICE,SECURITY OFFICE,INT.,Past Prologue,1992-10-05,Deep Space Nine,404.txt,0.0
23051,23051,23051,23051,301,KIRA,Are all the security measures in place for the trip to the Ministers' Court... ?,50C  INT. SECURITY OFFICE,SECURITY OFFICE,INT.,Past Prologue,1992-10-05,Deep Space Nine,404.txt,0.0
23052,23052,23052,23052,302,ODO,I told you they'd be taken care of and they will.,50C  INT. SECURITY OFFICE,SECURITY OFFICE,INT.,Past Prologue,1992-10-05,Deep Space Nine,404.txt,0.0
23053,23053,23053,23053,303,KIRA,Fine.,50C  INT. SECURITY OFFICE,SECURITY OFFICE,INT.,Past Prologue,1992-10-05,Deep Space Nine,404.txt,0.0
23054,23054,23054,23054,304,ODO,"You know, there's one thing about you humanoids I can't imitate very well...",50C  INT. SECURITY OFFICE,SECURITY OFFICE,INT.,Past Prologue,1992-10-05,Deep Space Nine,404.txt,0.0
23055,23055,23055,23055,305,KIRA,What's that?,50C  INT. SECURITY OFFICE,SECURITY OFFICE,INT.,Past Prologue,1992-10-05,Deep Space Nine,404.txt,0.0
23056,23056,23056,23056,306,ODO,Pretense. There's a special talent to it. It's as hard for me as creating one of your noses.,50C  INT. SECURITY OFFICE,SECURITY OFFICE,INT.,Past Prologue,1992-10-05,Deep Space Nine,404.txt,0.0
23057,23057,23057,23057,307,KIRA,"Maybe, that's why I've learned to respect your opinion, Constable. Never any... pretense. How much do you know about me, Odo?",50C  INT. SECURITY OFFICE,SECURITY OFFICE,INT.,Past Prologue,1992-10-05,Deep Space Nine,404.txt,0.0
23058,23058,23058,23058,308,ODO,More than you probably realize.,50C  INT. SECURITY OFFICE,SECURITY OFFICE,INT.,Past Prologue,1992-10-05,Deep Space Nine,404.txt,0.0
23059,23059,23059,23059,309,KIRA,I've done some things I'm not proud of. I still have nightmares about the raids on the Haru outposts. But at least I was sure of what I was doing then.,50C  INT. SECURITY OFFICE,SECURITY OFFICE,INT.,Past Prologue,1992-10-05,Deep Space Nine,404.txt,0.0
23060,23060,23060,23060,310,ODO,And there's something you're not sure of now.,50C  INT. SECURITY OFFICE,SECURITY OFFICE,INT.,Past Prologue,1992-10-05,Deep Space Nine,404.txt,0.0
23061,23061,23061,23061,311,KIRA,You have no more love for the Federation than I do.,50C  INT. SECURITY OFFICE,SECURITY OFFICE,INT.,Past Prologue,1992-10-05,Deep Space Nine,404.txt,0.0
23062,23062,23062,23062,312,ODO,Meaning?,50C  INT. SECURITY OFFICE,SECURITY OFFICE,INT.,Past Prologue,1992-10-05,Deep Space Nine,404.txt,0.0
23063,23063,23063,23063,313,KIRA,Maybe there are still wars to be fought and I'm just making a fool of myself doing what I'm doing here.,50C  INT. SECURITY OFFICE,SECURITY OFFICE,INT.,Past Prologue,1992-10-05,Deep Space Nine,404.txt,0.0
23064,23064,23064,23064,314,ODO,Sounds like you're trying to talk yourself into something. Or out of something.,50C  INT. SECURITY OFFICE,SECURITY OFFICE,INT.,Past Prologue,1992-10-05,Deep Space Nine,404.txt,0.3612
23065,23065,23065,23065,315,KIRA,"Either way, I have to betray someone.",50C  INT. SECURITY OFFICE,SECURITY OFFICE,INT.,Past Prologue,1992-10-05,Deep Space Nine,404.txt,-0.6369
23066,23066,23066,23066,316,ODO,Only important thing is not to betray yourself. he looks at him... a beat... they both know what they're talking about here.,50C  INT. SECURITY OFFICE,SECURITY OFFICE,INT.,Past Prologue,1992-10-05,Deep Space Nine,404.txt,0.6331
23067,23067,23067,23067,317,KIRA,How could I possibly turn against my own people?,50C  INT. SECURITY OFFICE,SECURITY OFFICE,INT.,Past Prologue,1992-10-05,Deep Space Nine,404.txt,0.0
23068,23068,23068,23068,318,ODO,Are they? Your own people?,50C  INT. SECURITY OFFICE,SECURITY OFFICE,INT.,Past Prologue,1992-10-05,Deep Space Nine,404.txt,0.0
23069,23069,23069,23069,319,KIRA,They're no different than I used to be.,50C  INT. SECURITY OFFICE,SECURITY OFFICE,INT.,Past Prologue,1992-10-05,Deep Space Nine,404.txt,0.0
23070,23070,23070,23070,320,ODO,Used to be.,50C  INT. SECURITY OFFICE,SECURITY OFFICE,INT.,Past Prologue,1992-10-05,Deep Space Nine,404.txt,0.0
23071,23071,23071,23071,321,KIRA,I could just refuse to help them. Ignore the whole thing.,50C  INT. SECURITY OFFICE,SECURITY OFFICE,INT.,Past Prologue,1992-10-05,Deep Space Nine,404.txt,0.0
23072,23072,23072,23072,322,ODO,The Joranian ostrich hides by sticking its head under water. Sometimes even until it drowns.,50C  INT. SECURITY OFFICE,SECURITY OFFICE,INT.,Past Prologue,1992-10-05,Deep Space Nine,404.txt,0.0
23073,23073,23073,23073,323,KIRA,They'd find a way to do whatever they want to do anyway... and I'd still feel responsible for the consequences.,50C  INT. SECURITY OFFICE,SECURITY OFFICE,INT.,Past Prologue,1992-10-05,Deep Space Nine,404.txt,0.0
23074,23074,23074,23074,324,KIRA,It was so much easier when I knew who the enemy was.,50C  INT. SECURITY OFFICE,SECURITY OFFICE,INT.,Past Prologue,1992-10-05,Deep Space Nine,404.txt,0.0
23075,23075,23075,23075,325,SISKO,Go ahead.,50C  INT. SECURITY OFFICE,SECURITY OFFICE,INT.,Past Prologue,1992-10-05,Deep Space Nine,404.txt,0.0
23076,23076,23076,23076,326,ODO,"There's someone down here in security who wants to talk to you, Commander.",50C  INT. SECURITY OFFICE,SECURITY OFFICE,INT.,Past Prologue,1992-10-05,Deep Space Nine,404.txt,0.0
23077,23077,23077,23077,327,GARAK,"Doctor, it's Twenty-fifty-seven. You're late. Come in quickly, please.",55   INT. GARAK'S SHOP - FAVORING CLOSED ENTRANCE,GARAK'S SHO,INT.,Past Prologue,1992-10-05,Deep Space Nine,404.txt,0.0
23078,23078,23078,23078,328,BASHIR,I... I was...,55   INT. GARAK'S SHOP - FAVORING CLOSED ENTRANCE,GARAK'S SHO,INT.,Past Prologue,1992-10-05,Deep Space Nine,404.txt,0.0
23079,23079,23079,23079,329,GARAK,"You just try that on as many times as you like, and be very, very quiet.",55   INT. GARAK'S SHOP - FAVORING CLOSED ENTRANCE,GARAK'S SHO,INT.,Past Prologue,1992-10-05,Deep Space Nine,404.txt,0.0
23080,23080,23080,23080,330,GARAK  ,"Ah, right on time. Welcome.",56   INT. FITTING ROOM,FITTING ROOM,INT.,Past Prologue,1992-10-05,Deep Space Nine,404.txt,0.0
23081,23081,23081,23081,331,,"Ah, right on time. Welcome.",56   INT. FITTING ROOM,FITTING ROOM,INT.,Past Prologue,1992-10-05,Deep Space Nine,404.txt,0.0
23082,23082,23082,23082,332,B'ETOR,"Save your ""welcomes,"" Cardassian. Do your people want the Bajoran or not?",56   INT. FITTING ROOM,FITTING ROOM,INT.,Past Prologue,1992-10-05,Deep Space Nine,404.txt,0.0
23083,23083,23083,23083,333,GARAK,"I can now venture to say, with some certainty, that you will receive the agreed-upon payment on delivery.",56   INT. FITTING ROOM,FITTING ROOM,INT.,Past Prologue,1992-10-05,Deep Space Nine,404.txt,0.0
23084,23084,23084,23084,334,LURSA,We will complete our business with Tahna Los in four hours...,57   INT. GARAK'S SHOP,GARAK'S SHOP,INT.,Past Prologue,1992-10-05,Deep Space Nine,404.txt,0.0
23085,23085,23085,23085,335,GARAK,And what business might that be?,57   INT. GARAK'S SHOP,GARAK'S SHOP,INT.,Past Prologue,1992-10-05,Deep Space Nine,404.txt,0.0
23086,23086,23086,23086,336,B'ETOR,That is not your concern.,57   INT. GARAK'S SHOP,GARAK'S SHOP,INT.,Past Prologue,1992-10-05,Deep Space Nine,404.txt,0.0
23087,23087,23087,23087,337,GARAK,"If it requires that those I represent must take extra precautions, it becomes my concern.",57   INT. GARAK'S SHOP,GARAK'S SHOP,INT.,Past Prologue,1992-10-05,Deep Space Nine,404.txt,0.0
23088,23088,23088,23088,338,LURSA,We are delivering a cylinder of Bilitrium to him.,57   INT. GARAK'S SHOP,GARAK'S SHOP,INT.,Past Prologue,1992-10-05,Deep Space Nine,404.txt,0.0
23089,23089,23089,23089,339,B'ETOR,The rendezvous will be on the dark side of Bajor Eight's lower moon.,57   INT. GARAK'S SHOP,GARAK'S SHOP,INT.,Past Prologue,1992-10-05,Deep Space Nine,404.txt,0.0
23090,23090,23090,23090,340,B'ETOR,The Cardassians can have him then.,58   INT. FITTING ROOM,FITTING ROOM,INT.,Past Prologue,1992-10-05,Deep Space Nine,404.txt,0.0
23091,23091,23091,23091,341,BASHIR,What's Bilitrium?,58   INT. FITTING ROOM,FITTING ROOM,INT.,Past Prologue,1992-10-05,Deep Space Nine,404.txt,0.0
23092,23092,23092,23092,342,GARAK,"A rare crystalline element, that can be an incredibly powerful source of energy... Provided, of course, that one also has an anti-matter converter. Unfortunately, that's why Cardassians were chasing Tahna Los when he arrived here. He stole one.",58   INT. FITTING ROOM,FITTING ROOM,INT.,Past Prologue,1992-10-05,Deep Space Nine,404.txt,0.0
23093,23093,23093,23093,343,BASHIR,But if he's got both...,58   INT. FITTING ROOM,FITTING ROOM,INT.,Past Prologue,1992-10-05,Deep Space Nine,404.txt,0.0
23094,23094,23094,23094,344,GARAK,"Quite right, Doctor. He will have the ingredients for a bomb. A bomb of significant destructive capability.",58   INT. FITTING ROOM,FITTING ROOM,INT.,Past Prologue,1992-10-05,Deep Space Nine,404.txt,0.0
23095,23095,23095,23095,345,SISKO,We have nothing to hold them on.... they haven't committed any crime yet...,60   INT. OPS,OPS,INT.,Past Prologue,1992-10-05,Deep Space Nine,404.txt,0.0
23096,23096,23096,23096,346,ODO,Conspiracy is a crime...,60   INT. OPS,OPS,INT.,Past Prologue,1992-10-05,Deep Space Nine,404.txt,0.0
23097,23097,23097,23097,347,BASHIR,But conspiracy to what? We don't even know what their plan is...,60   INT. OPS,OPS,INT.,Past Prologue,1992-10-05,Deep Space Nine,404.txt,0.0
23098,23098,23098,23098,348,O'BRIEN,"Once the exchange is made, with the Klingons, you've got them holding the components to an explosive device... that's enough evidence right there...",60   INT. OPS,OPS,INT.,Past Prologue,1992-10-05,Deep Space Nine,404.txt,0.0
23099,23099,23099,23099,349,KIRA,Chief O'Brien's right. We have to let them have a runabout.,60   INT. OPS,OPS,INT.,Past Prologue,1992-10-05,Deep Space Nine,404.txt,0.0
23100,23100,23100,23100,350,SISKO,Agreed.,60   INT. OPS,OPS,INT.,Past Prologue,1992-10-05,Deep Space Nine,404.txt,0.0
23101,23101,23101,23101,351,KIRA,And I have to be on it.,60   INT. OPS,OPS,INT.,Past Prologue,1992-10-05,Deep Space Nine,404.txt,0.0
23102,23102,23102,23102,352,SISKO,Not agreed. Major...,60   INT. OPS,OPS,INT.,Past Prologue,1992-10-05,Deep Space Nine,404.txt,0.0
23103,23103,23103,23103,353,KIRA,"Commander, Tahna doesn't know if he can trust me as it is... if I try to stay behind, he won't buy into this. The only way to convince him is if I'm on board. If Tahna fails, I promise you others will try. At least, this way you can find out what they're up to.",60   INT. OPS,OPS,INT.,Past Prologue,1992-10-05,Deep Space Nine,404.txt,0.0
23104,23104,23104,23104,354,SISKO,"Mister O'Brien, you and I will take a Runabout to a point behind the second moon of Bajor Eight to avoid detection.",60   INT. OPS,OPS,INT.,Past Prologue,1992-10-05,Deep Space Nine,404.txt,0.0
23105,23105,23105,23105,355,O'BRIEN,"Aye, Sir...",60   INT. OPS,OPS,INT.,Past Prologue,1992-10-05,Deep Space Nine,404.txt,0.0
23106,23106,23106,23106,356,SISKO,"Dax, stay in touch with us on a secured channel... keep an eye on the Cardassians; they'll be coming to the party too...",60   INT. OPS,OPS,INT.,Past Prologue,1992-10-05,Deep Space Nine,404.txt,0.0
23107,23107,23107,23107,357,SISKO,"You get him there, Major... we'll be waiting...",60   INT. OPS,OPS,INT.,Past Prologue,1992-10-05,Deep Space Nine,404.txt,0.0
23108,23108,23108,23108,358,KIRA,This'll be the first time a Bajoran officer's taken out a Federation Runabout alone...,62   INT. TURBOLIFT,TURBOLIFT,INT.,Past Prologue,1992-10-05,Deep Space Nine,404.txt,0.0
23109,23109,23109,23109,359,KIRA,It might get Sisko's attention. We'd better initialize pre-launch the minute we get on board...,63   INT. AIRLOCK - CONTINUOUS,AIRLOC,INT.,Past Prologue,1992-10-05,Deep Space Nine,404.txt,0.0
23110,23110,23110,23110,360,ODO,They're moving into the Runabout...,64   INT. SECURITY,SECURITY,INT.,Past Prologue,1992-10-05,Deep Space Nine,404.txt,0.0
23111,23111,23111,23111,361,DAX,Acknowledged. DS Nine to Ganges.,65   INT. OPS,OPS,INT.,Past Prologue,1992-10-05,Deep Space Nine,404.txt,0.0
23112,23112,23112,23112,362,SISKO,"Go ahead, Dax.",65   INT. OPS,OPS,INT.,Past Prologue,1992-10-05,Deep Space Nine,404.txt,0.0
23113,23113,23113,23113,363,DAX,Major Kira and Tahna are preparing to leave in the Yangtzee Kiang.,65   INT. OPS,OPS,INT.,Past Prologue,1992-10-05,Deep Space Nine,404.txt,0.0
23114,23114,23114,23114,364,DAX,They're initializing pre-launch systems now...,66   INT. RUNABOUT GANGES (OPTICAL),RUNABOUT GANGES,INT.,Past Prologue,1992-10-05,Deep Space Nine,404.txt,0.0
23115,23115,23115,23115,365,SISKO,"Understood, Lieutenant. ... Shut down all main power systems.",66   INT. RUNABOUT GANGES (OPTICAL),RUNABOUT GANGES,INT.,Past Prologue,1992-10-05,Deep Space Nine,404.txt,0.0
23116,23116,23116,23116,366,O'BRIEN,Main power systems down. ... Dead quiet...,66   INT. RUNABOUT GANGES (OPTICAL),RUNABOUT GANGES,INT.,Past Prologue,1992-10-05,Deep Space Nine,404.txt,0.0
23117,23117,23117,23117,367,KIRA,Bajor Eight in one-hundred-twenty thousand kilometers. Dropping to impulse. What is that?,70   INT. YANGTZEE KIANG (OPTICAL),YANGTZEE KIANG,INT.,Past Prologue,1992-10-05,Deep Space Nine,404.txt,0.0
23118,23118,23118,23118,368,TAHNA,An anti-matter converter... I'm transferring power from the ship's warp drive into the storage cells.,70   INT. YANGTZEE KIANG (OPTICAL),YANGTZEE KIANG,INT.,Past Prologue,1992-10-05,Deep Space Nine,404.txt,0.0
23119,23119,23119,23119,369,KIRA,We've got a Klingon Bird of Prey decloaking dead ahead.,70   INT. YANGTZEE KIANG (OPTICAL),YANGTZEE KIANG,INT.,Past Prologue,1992-10-05,Deep Space Nine,404.txt,0.0
23120,23120,23120,23120,370,TAHNA,Calm down... we're here to meet them...,70   INT. YANGTZEE KIANG (OPTICAL),YANGTZEE KIANG,INT.,Past Prologue,1992-10-05,Deep Space Nine,404.txt,0.0
23121,23121,23121,23121,371,KIRA,"Klingons, why?",70   INT. YANGTZEE KIANG (OPTICAL),YANGTZEE KIANG,INT.,Past Prologue,1992-10-05,Deep Space Nine,404.txt,0.0
23122,23122,23122,23122,372,TAHNA,You'll know soon enough.,70   INT. YANGTZEE KIANG (OPTICAL),YANGTZEE KIANG,INT.,Past Prologue,1992-10-05,Deep Space Nine,404.txt,0.0
23123,23123,23123,23123,373,O'BRIEN,The Klingons have powered up their transporters...,71   INT. RUNABOUT GANGES,RUNABOUT GANGES,INT.,Past Prologue,1992-10-05,Deep Space Nine,404.txt,0.0
23124,23124,23124,23124,374,SISKO,Prepare to go to full impulse.,71   INT. RUNABOUT GANGES,RUNABOUT GANGES,INT.,Past Prologue,1992-10-05,Deep Space Nine,404.txt,0.0
23125,23125,23125,23125,375,TAHNA,Thirteen kilograms of gold-press Latinum; as promised.,73   INT. RUNABOUT YANGTZEE KIANG (OPTICAL),RUNABOUT YANGTZEE KIANG,INT.,Past Prologue,1992-10-05,Deep Space Nine,404.txt,0.3612
23126,23126,23126,23126,376,LURSA,This is yours.,73   INT. RUNABOUT YANGTZEE KIANG (OPTICAL),RUNABOUT YANGTZEE KIANG,INT.,Past Prologue,1992-10-05,Deep Space Nine,404.txt,0.0
23127,23127,23127,23127,377,B'ETOR,'eH. HImaH!,73   INT. RUNABOUT YANGTZEE KIANG (OPTICAL),RUNABOUT YANGTZEE KIANG,INT.,Past Prologue,1992-10-05,Deep Space Nine,404.txt,0.0
23128,23128,23128,23128,378,KIRA,What is it?,73   INT. RUNABOUT YANGTZEE KIANG (OPTICAL),RUNABOUT YANGTZEE KIANG,INT.,Past Prologue,1992-10-05,Deep Space Nine,404.txt,0.0
23129,23129,23129,23129,379,TAHNA,Bajoran independence.,73   INT. RUNABOUT YANGTZEE KIANG (OPTICAL),RUNABOUT YANGTZEE KIANG,INT.,Past Prologue,1992-10-05,Deep Space Nine,404.txt,0.0
23130,23130,23130,23130,380,O'BRIEN,Bird of Prey is moving off... and cloaking.,74   INT. RUNABOUT GANGES,RUNABOUT GANGES,INT.,Past Prologue,1992-10-05,Deep Space Nine,404.txt,0.0
23131,23131,23131,23131,381,SISKO,Set an intercept course with the Runabout.,74   INT. RUNABOUT GANGES,RUNABOUT GANGES,INT.,Past Prologue,1992-10-05,Deep Space Nine,404.txt,0.0
23132,23132,23132,23132,382,O'BRIEN,"Intercept in one minute, twelve seconds.",74   INT. RUNABOUT GANGES,RUNABOUT GANGES,INT.,Past Prologue,1992-10-05,Deep Space Nine,404.txt,0.0
23133,23133,23133,23133,383,DAX,DS Nine to Ganges...,75   INT. OPS,OPS,INT.,Past Prologue,1992-10-05,Deep Space Nine,404.txt,0.0
23134,23134,23134,23134,384,SISKO,Ganges...,75   INT. OPS,OPS,INT.,Past Prologue,1992-10-05,Deep Space Nine,404.txt,0.0
