Unnamed: 0.2,Unnamed: 0.1,Unnamed: 0,index,line,character,quote,scene,location,view,episode,date,series,file,sentiment
90766,90766,90766,90766,154,CASTILLO,We were negotiating a peace treaty with the Klingons when I left...,30A  INT. ENTERPRISE-C BRIDGE,ENTERPRISE-C BRIDGE,INT.,Yesterday's Enterprise,1989-12-08,The Next Generation,163.txt,0.0
90767,90767,90767,90767,155,TASHA,"A lot of changes, Lieutenant. A lot of changes.",30A  INT. ENTERPRISE-C BRIDGE,ENTERPRISE-C BRIDGE,INT.,Yesterday's Enterprise,1989-12-08,The Next Generation,163.txt,0.0
90768,90768,90768,90768,156,CASTILLO,"When we get a break, maybe you could fill me in on some of them.",30A  INT. ENTERPRISE-C BRIDGE,ENTERPRISE-C BRIDGE,INT.,Yesterday's Enterprise,1989-12-08,The Next Generation,163.txt,0.0
90769,90769,90769,90769,157,TASHA,Photon banks are depleted... auxiliary fusion generators are down...,30A  INT. ENTERPRISE-C BRIDGE,ENTERPRISE-C BRIDGE,INT.,Yesterday's Enterprise,1989-12-08,The Next Generation,163.txt,0.0
90770,90770,90770,90770,158,DATA,"The probability is high that the temporal rift is symmetrical, Captain.",30B  INT. MAIN BRIDGE - ENTERPRISE-D,MAIN BRIDG,INT.,Yesterday's Enterprise,1989-12-08,The Next Generation,163.txt,0.0
90771,90771,90771,90771,159,PICARD,"If that is the case, what would happen if the Enterprise-C were to fly back through it?",30B  INT. MAIN BRIDGE - ENTERPRISE-D,MAIN BRIDG,INT.,Yesterday's Enterprise,1989-12-08,The Next Generation,163.txt,0.0
90772,90772,90772,90772,160,DATA,"Back, sir? The Enterprise-C would emerge in her own time period at almost the same instant she left.",30B  INT. MAIN BRIDGE - ENTERPRISE-D,MAIN BRIDG,INT.,Yesterday's Enterprise,1989-12-08,The Next Generation,163.txt,0.0
90773,90773,90773,90773,161,PICARD,Right in the middle of her battle with the Romulans.,30B  INT. MAIN BRIDGE - ENTERPRISE-D,MAIN BRIDG,INT.,Yesterday's Enterprise,1989-12-08,The Next Generation,163.txt,0.0
90774,90774,90774,90774,162,DATA,"Yes, sir.",30B  INT. MAIN BRIDGE - ENTERPRISE-D,MAIN BRIDG,INT.,Yesterday's Enterprise,1989-12-08,The Next Generation,163.txt,0.0
90775,90775,90775,90775,163,PICARD,"Based on the logs of the Enterprise-C, is there any possibility she could survive that battle?",30B  INT. MAIN BRIDGE - ENTERPRISE-D,MAIN BRIDG,INT.,Yesterday's Enterprise,1989-12-08,The Next Generation,163.txt,0.0
90776,90776,90776,90776,164,DATA,"None, sir.",30B  INT. MAIN BRIDGE - ENTERPRISE-D,MAIN BRIDG,INT.,Yesterday's Enterprise,1989-12-08,The Next Generation,163.txt,0.0
90777,90777,90777,90777,165,PICARD,Then sending them back would be condemning them to death.,30B  INT. MAIN BRIDGE - ENTERPRISE-D,MAIN BRIDG,INT.,Yesterday's Enterprise,1989-12-08,The Next Generation,163.txt,0.0
90778,90778,90778,90778,166,CASTILLO,Unbelievable.,32   INT. TRANSPORTER ROOM (OPTICAL) (FORMERLY 25A),TRANSPORTER ROOM,INT.,Yesterday's Enterprise,1989-12-08,The Next Generation,163.txt,0.0
90779,90779,90779,90779,167,TASHA,Lieutenant... ?,32   INT. TRANSPORTER ROOM (OPTICAL) (FORMERLY 25A),TRANSPORTER ROOM,INT.,Yesterday's Enterprise,1989-12-08,The Next Generation,163.txt,0.0
90780,90780,90780,90780,168,TASHA,She was the first Galaxy Class warship built by the Federation... forty-two decks... capable of transporting over six thousand troops...,33   INT. CORRIDOR - CONTINUOUS (FORMERLY 25B),CORRIDOR - CONTINUOUS,INT.,Yesterday's Enterprise,1989-12-08,The Next Generation,163.txt,0.0
90781,90781,90781,90781,169,CASTILLO,How long have you been on board?,33   INT. CORRIDOR - CONTINUOUS (FORMERLY 25B),CORRIDOR - CONTINUOUS,INT.,Yesterday's Enterprise,1989-12-08,The Next Generation,163.txt,0.0
90782,90782,90782,90782,170,TASHA,Four years. Straight out of the Academy. I was lucky to get the Enterprise.,33   INT. CORRIDOR - CONTINUOUS (FORMERLY 25B),CORRIDOR - CONTINUOUS,INT.,Yesterday's Enterprise,1989-12-08,The Next Generation,163.txt,0.0
90783,90783,90783,90783,171,CASTILLO,"Yeah, me too. I mean... my Enterprise.",33   INT. CORRIDOR - CONTINUOUS (FORMERLY 25B),CORRIDOR - CONTINUOUS,INT.,Yesterday's Enterprise,1989-12-08,The Next Generation,163.txt,0.0
90784,90784,90784,90784,172,GARRETT,"Lieutenant, how's the ship?",34   INT. SICKBAY (FORMERLY 26),SICKBAY,INT.,Yesterday's Enterprise,1989-12-08,The Next Generation,163.txt,0.0
90785,90785,90785,90785,173,CASTILLO,We've restored minimal shields and the forward phaser banks. Still no photon launchers or warp drive.,34   INT. SICKBAY (FORMERLY 26),SICKBAY,INT.,Yesterday's Enterprise,1989-12-08,The Next Generation,163.txt,0.0
90786,90786,90786,90786,174,GARRETT,"Concentrate on the weapon systems. From what Captain Picard has told me, the Federation can use all the help it can get.",34   INT. SICKBAY (FORMERLY 26),SICKBAY,INT.,Yesterday's Enterprise,1989-12-08,The Next Generation,163.txt,0.0
90787,90787,90787,90787,175,TASHA,"And soon. Our sensors have picked up Klingon warships in this sector, Captain.",34   INT. SICKBAY (FORMERLY 26),SICKBAY,INT.,Yesterday's Enterprise,1989-12-08,The Next Generation,163.txt,0.0
90788,90788,90788,90788,176,GARRETT,"Why wasn't I informed, Mister Castillo... ?",34   INT. SICKBAY (FORMERLY 26),SICKBAY,INT.,Yesterday's Enterprise,1989-12-08,The Next Generation,163.txt,0.0
90789,90789,90789,90789,177,CASTILLO,"Captain, you shouldn't --",34   INT. SICKBAY (FORMERLY 26),SICKBAY,INT.,Yesterday's Enterprise,1989-12-08,The Next Generation,163.txt,0.0
90790,90790,90790,90790,178,GARRETT,"As senior officer, I want you to be my liaison to the Enterprise- D... coordinate with Tactical...",34   INT. SICKBAY (FORMERLY 26),SICKBAY,INT.,Yesterday's Enterprise,1989-12-08,The Next Generation,163.txt,0.0
90791,90791,90791,90791,179,TASHA,"That's me, Captain.",34   INT. SICKBAY (FORMERLY 26),SICKBAY,INT.,Yesterday's Enterprise,1989-12-08,The Next Generation,163.txt,0.0
90792,90792,90792,90792,180,BEVERLY,Where do you think you're going?,34   INT. SICKBAY (FORMERLY 26),SICKBAY,INT.,Yesterday's Enterprise,1989-12-08,The Next Generation,163.txt,0.0
90793,90793,90793,90793,181,GARRETT,I'm ready to resume my duties.,34   INT. SICKBAY (FORMERLY 26),SICKBAY,INT.,Yesterday's Enterprise,1989-12-08,The Next Generation,163.txt,0.0
90794,90794,90794,90794,182,BEVERLY,"Captain, you need at least another twenty-four hours...",34   INT. SICKBAY (FORMERLY 26),SICKBAY,INT.,Yesterday's Enterprise,1989-12-08,The Next Generation,163.txt,0.0
90795,90795,90795,90795,183,GARRETT,Nonsense. Doctors always over-protect their patients.,34   INT. SICKBAY (FORMERLY 26),SICKBAY,INT.,Yesterday's Enterprise,1989-12-08,The Next Generation,163.txt,0.0
90796,90796,90796,90796,184,BEVERLY,And captains always push themselves too hard.,34   INT. SICKBAY (FORMERLY 26),SICKBAY,INT.,Yesterday's Enterprise,1989-12-08,The Next Generation,163.txt,0.0
90797,90797,90797,90797,185,GARRETT,"Doctor, my ship and crew need me -- now. Twenty-four hours might as well be twenty-four years.",34   INT. SICKBAY (FORMERLY 26),SICKBAY,INT.,Yesterday's Enterprise,1989-12-08,The Next Generation,163.txt,0.0
90798,90798,90798,90798,186,PICARD,I need more.,35   INT. OBSERVATION LOUNGE,OBSERVATION LOUNGE,INT.,Yesterday's Enterprise,1989-12-08,The Next Generation,163.txt,0.0
90799,90799,90799,90799,187,GUINAN,"There is no more. I wish there was, Captain. I wish I could prove it. I can't.",35   INT. OBSERVATION LOUNGE,OBSERVATION LOUNGE,INT.,Yesterday's Enterprise,1989-12-08,The Next Generation,163.txt,0.0
90800,90800,90800,90800,188,PICARD,Then I can't send them back.,35   INT. OBSERVATION LOUNGE,OBSERVATION LOUNGE,INT.,Yesterday's Enterprise,1989-12-08,The Next Generation,163.txt,0.0
90801,90801,90801,90801,189,GUINAN,You must.,35   INT. OBSERVATION LOUNGE,OBSERVATION LOUNGE,INT.,Yesterday's Enterprise,1989-12-08,The Next Generation,163.txt,0.0
90802,90802,90802,90802,190,PICARD,"Dammit, Guinan, they will die moments after they return... how can I ask them to sacrifice their lives based solely on your... intuition?",35   INT. OBSERVATION LOUNGE,OBSERVATION LOUNGE,INT.,Yesterday's Enterprise,1989-12-08,The Next Generation,163.txt,0.0
90803,90803,90803,90803,191,GUINAN,I don't know.,35   INT. OBSERVATION LOUNGE,OBSERVATION LOUNGE,INT.,Yesterday's Enterprise,1989-12-08,The Next Generation,163.txt,0.0
90804,90804,90804,90804,192,GUINAN,This is a mistake. Every cell in my body knows this is a mistake. I cannot explain it to myself so I cannot explain it to you. I... just know.,35   INT. OBSERVATION LOUNGE,OBSERVATION LOUNGE,INT.,Yesterday's Enterprise,1989-12-08,The Next Generation,163.txt,0.0
90805,90805,90805,90805,193,PICARD,Who is to say this history is any less proper than the other?,35   INT. OBSERVATION LOUNGE,OBSERVATION LOUNGE,INT.,Yesterday's Enterprise,1989-12-08,The Next Generation,163.txt,0.0
90806,90806,90806,90806,194,GUINAN,I guess I am.,35   INT. OBSERVATION LOUNGE,OBSERVATION LOUNGE,INT.,Yesterday's Enterprise,1989-12-08,The Next Generation,163.txt,0.0
90807,90807,90807,90807,195,PICARD,Not good enough. Not good enough. I will not ask them to die.,35   INT. OBSERVATION LOUNGE,OBSERVATION LOUNGE,INT.,Yesterday's Enterprise,1989-12-08,The Next Generation,163.txt,0.0
90808,90808,90808,90808,196,GUINAN,Forty billion have died in the war...,35   INT. OBSERVATION LOUNGE,OBSERVATION LOUNGE,INT.,Yesterday's Enterprise,1989-12-08,The Next Generation,163.txt,0.0
90809,90809,90809,90809,197,PICARD,I cannot justify readjusting history on the basis of saving lives in war... shall I return to Sarajevo and stop the assassination of Archduke Ferdinand... or go back to warn Station-Salem Four of the Bel-zon raid...,35   INT. OBSERVATION LOUNGE,OBSERVATION LOUNGE,INT.,Yesterday's Enterprise,1989-12-08,The Next Generation,163.txt,0.0
90810,90810,90810,90810,198,GUINAN,This war was never meant to be. They must return to their own time to correct that.,35   INT. OBSERVATION LOUNGE,OBSERVATION LOUNGE,INT.,Yesterday's Enterprise,1989-12-08,The Next Generation,163.txt,0.0
90811,90811,90811,90811,199,PICARD,And what is the guarantee that by going back they will succeed... ?,35   INT. OBSERVATION LOUNGE,OBSERVATION LOUNGE,INT.,Yesterday's Enterprise,1989-12-08,The Next Generation,163.txt,0.0
90812,90812,90812,90812,200,PICARD,"In fact, they could conceivably create a third time line.",35   INT. OBSERVATION LOUNGE,OBSERVATION LOUNGE,INT.,Yesterday's Enterprise,1989-12-08,The Next Generation,163.txt,0.0
90813,90813,90813,90813,201,GUINAN,Yes.,35   INT. OBSERVATION LOUNGE,OBSERVATION LOUNGE,INT.,Yesterday's Enterprise,1989-12-08,The Next Generation,163.txt,0.0
90814,90814,90814,90814,202,PICARD,Every instinct tells me it's wrong and dangerous and futile.,35   INT. OBSERVATION LOUNGE,OBSERVATION LOUNGE,INT.,Yesterday's Enterprise,1989-12-08,The Next Generation,163.txt,0.0
90815,90815,90815,90815,203,GUINAN,"Picard, we have been together for twenty-two years. I have been your advisor, your confidant, your friend and in all those twenty-two years, I have never led you astray. This time line cannot be allowed to continue. I've told you what you must do. You have only your faith in me to help you decide.",35   INT. OBSERVATION LOUNGE,OBSERVATION LOUNGE,INT.,Yesterday's Enterprise,1989-12-08,The Next Generation,163.txt,0.0
90816,90816,90816,90816,204,TASHA,"Deflector shield technology has advanced considerably during the war... our heat-dissipation rates are probably double those of the Enterprise-C, so we can hang in a firefight longer...",37   INT. TEN-FORWARD - WITH TASHA AND CASTILLO,TEN-FORWAR,INT.,Yesterday's Enterprise,1989-12-08,The Next Generation,163.txt,0.25
90817,90817,90817,90817,205,TASHA,Guinan... ?,37   INT. TEN-FORWARD - WITH TASHA AND CASTILLO,TEN-FORWAR,INT.,Yesterday's Enterprise,1989-12-08,The Next Generation,163.txt,0.0
90818,90818,90818,90818,206,GUINAN,"Have you ordered yet, Tasha?",37   INT. TEN-FORWARD - WITH TASHA AND CASTILLO,TEN-FORWAR,INT.,Yesterday's Enterprise,1989-12-08,The Next Generation,163.txt,0.0
90819,90819,90819,90819,207,TASHA,"Not yet... Is something wrong, Guinan?",37   INT. TEN-FORWARD - WITH TASHA AND CASTILLO,TEN-FORWAR,INT.,Yesterday's Enterprise,1989-12-08,The Next Generation,163.txt,0.0
90820,90820,90820,90820,208,GUINAN,Not a thing. What can I get you?,37   INT. TEN-FORWARD - WITH TASHA AND CASTILLO,TEN-FORWAR,INT.,Yesterday's Enterprise,1989-12-08,The Next Generation,163.txt,0.0
90821,90821,90821,90821,209,TASHA,"Just a couple of T-K-L meal rations... we're in a hurry. Oh, this is, Lieutenant Castillo...",37   INT. TEN-FORWARD - WITH TASHA AND CASTILLO,TEN-FORWAR,INT.,Yesterday's Enterprise,1989-12-08,The Next Generation,163.txt,0.0
90822,90822,90822,90822,210,TASHA,First time for everything.,37   INT. TEN-FORWARD - WITH TASHA AND CASTILLO,TEN-FORWAR,INT.,Yesterday's Enterprise,1989-12-08,The Next Generation,163.txt,0.0
90823,90823,90823,90823,211,CASTILLO,First time?,37   INT. TEN-FORWARD - WITH TASHA AND CASTILLO,TEN-FORWAR,INT.,Yesterday's Enterprise,1989-12-08,The Next Generation,163.txt,0.0
90824,90824,90824,90824,212,TASHA,It's just that I've never seen anything bother her before...,37   INT. TEN-FORWARD - WITH TASHA AND CASTILLO,TEN-FORWAR,INT.,Yesterday's Enterprise,1989-12-08,The Next Generation,163.txt,0.0
90825,90825,90825,90825,213,CASTILLO,What's a T-K-L?,37   INT. TEN-FORWARD - WITH TASHA AND CASTILLO,TEN-FORWAR,INT.,Yesterday's Enterprise,1989-12-08,The Next Generation,163.txt,0.0
90826,90826,90826,90826,214,TASHA,Standard rations. Food replicators are on minimum power...,37   INT. TEN-FORWARD - WITH TASHA AND CASTILLO,TEN-FORWAR,INT.,Yesterday's Enterprise,1989-12-08,The Next Generation,163.txt,0.0
90827,90827,90827,90827,215,TASHA ,Everything else is diverted to defensive systems. So where was I...,37   INT. TEN-FORWARD - WITH TASHA AND CASTILLO,TEN-FORWAR,INT.,Yesterday's Enterprise,1989-12-08,The Next Generation,163.txt,0.0258
90828,90828,90828,90828,216,CASTILLO,You've told me more about tactical in an hour than I learned my last year in the Academy...,37   INT. TEN-FORWARD - WITH TASHA AND CASTILLO,TEN-FORWAR,INT.,Yesterday's Enterprise,1989-12-08,The Next Generation,163.txt,0.0
90829,90829,90829,90829,217,TASHA,"You're gonna need it, Lieutenant...",37   INT. TEN-FORWARD - WITH TASHA AND CASTILLO,TEN-FORWAR,INT.,Yesterday's Enterprise,1989-12-08,The Next Generation,163.txt,0.0
90830,90830,90830,90830,218,CASTILLO,"Hey, I've known you a whole day now, Lieutenant. I won't salute if you won't. What did she call you... Tasha?",37   INT. TEN-FORWARD - WITH TASHA AND CASTILLO,TEN-FORWAR,INT.,Yesterday's Enterprise,1989-12-08,The Next Generation,163.txt,0.0
90831,90831,90831,90831,219,TASHA,Yeah.,37   INT. TEN-FORWARD - WITH TASHA AND CASTILLO,TEN-FORWAR,INT.,Yesterday's Enterprise,1989-12-08,The Next Generation,163.txt,0.0
90832,90832,90832,90832,220,CASTILLO,Most everybody just calls me Castillo. My mother calls me Richard.,37   INT. TEN-FORWARD - WITH TASHA AND CASTILLO,TEN-FORWAR,INT.,Yesterday's Enterprise,1989-12-08,The Next Generation,163.txt,0.0
90833,90833,90833,90833,221,TASHA,"Okay, Castillo.",37   INT. TEN-FORWARD - WITH TASHA AND CASTILLO,TEN-FORWAR,INT.,Yesterday's Enterprise,1989-12-08,The Next Generation,163.txt,0.0
90834,90834,90834,90834,222,CASTILLO,"Naw, I think maybe I'd like it better if you called me Richard...",37   INT. TEN-FORWARD - WITH TASHA AND CASTILLO,TEN-FORWAR,INT.,Yesterday's Enterprise,1989-12-08,The Next Generation,163.txt,0.0
90835,90835,90835,90835,223,TASHA,Richard.,37   INT. TEN-FORWARD - WITH TASHA AND CASTILLO,TEN-FORWAR,INT.,Yesterday's Enterprise,1989-12-08,The Next Generation,163.txt,0.0
90836,90836,90836,90836,224,PICARD,This is the captain. Senior officers will report to my Ready Room immediately.,37   INT. TEN-FORWARD - WITH TASHA AND CASTILLO,TEN-FORWAR,INT.,Yesterday's Enterprise,1989-12-08,The Next Generation,163.txt,0.3612
90837,90837,90837,90837,225,TASHA,So much for lunch.,37   INT. TEN-FORWARD - WITH TASHA AND CASTILLO,TEN-FORWAR,INT.,Yesterday's Enterprise,1989-12-08,The Next Generation,163.txt,0.0
90838,90838,90838,90838,226,BEVERLY,"Captain, are you suggesting they should return and attempt to complete their mission?",46   INT. READY ROOM,READY ROOM,INT.,Yesterday's Enterprise,1989-12-08,The Next Generation,163.txt,0.0
90839,90839,90839,90839,227,PICARD,"I am, Doctor.",46   INT. READY ROOM,READY ROOM,INT.,Yesterday's Enterprise,1989-12-08,The Next Generation,163.txt,0.0
90840,90840,90840,90840,228,BEVERLY,Based on Guinan's intuition... ?,46   INT. READY ROOM,READY ROOM,INT.,Yesterday's Enterprise,1989-12-08,The Next Generation,163.txt,0.0
90841,90841,90841,90841,229,RIKER,But it won't accomplish anything. There's no way they can save Narendra Three...,46   INT. READY ROOM,READY ROOM,INT.,Yesterday's Enterprise,1989-12-08,The Next Generation,163.txt,-0.1275
90842,90842,90842,90842,230,TASHA,Captain Garrett says there were four Romulan warbirds. The Enterprise-C would be outmanned and outgunned...,46   INT. READY ROOM,READY ROOM,INT.,Yesterday's Enterprise,1989-12-08,The Next Generation,163.txt,0.0
90843,90843,90843,90843,231,GEORDI,Unless we were to re-arm them with modern...,46   INT. READY ROOM,READY ROOM,INT.,Yesterday's Enterprise,1989-12-08,The Next Generation,163.txt,0.0
90844,90844,90844,90844,232,PICARD,We can't do that. If we send this ship back with new technology... we would be altering the past...,46   INT. READY ROOM,READY ROOM,INT.,Yesterday's Enterprise,1989-12-08,The Next Generation,163.txt,0.0
90845,90845,90845,90845,233,RIKER,"But that's what you're talking about doing anyway, isn't it? Altering the past.",46   INT. READY ROOM,READY ROOM,INT.,Yesterday's Enterprise,1989-12-08,The Next Generation,163.txt,0.0
90846,90846,90846,90846,234,PICARD,We're talking about restoring the past.,46   INT. READY ROOM,READY ROOM,INT.,Yesterday's Enterprise,1989-12-08,The Next Generation,163.txt,0.296
90847,90847,90847,90847,235,GEORDI,How could Guinan know that history has been altered... if she's been altered along with the rest of us?,46   INT. READY ROOM,READY ROOM,INT.,Yesterday's Enterprise,1989-12-08,The Next Generation,163.txt,0.0
90848,90848,90848,90848,236,DATA,Perhaps her species has a perception that goes beyond linear time.,46   INT. READY ROOM,READY ROOM,INT.,Yesterday's Enterprise,1989-12-08,The Next Generation,163.txt,0.0
90849,90849,90849,90849,237,PICARD,"There are many things about her species that cannot be easily explained. Even she cannot explain how or why she senses that history has been altered. And yet it is very possible she is correct. A ship from the past has traveled through time. Who among us could know what effect that event has had on the present. Indeed, we will never know for certain if Guinan is correct. But I, for one, have decided the consequences of that possibility are too grave to ignore.",46   INT. READY ROOM,READY ROOM,INT.,Yesterday's Enterprise,1989-12-08,The Next Generation,163.txt,0.0
90850,90850,90850,90850,238,RIKER,"Sir, if you wish my opinion...",46   INT. READY ROOM,READY ROOM,INT.,Yesterday's Enterprise,1989-12-08,The Next Generation,163.txt,0.0
90851,90851,90851,90851,239,PICARD,"I think I know your opinion, Commander. This is a briefing. I'm not seeking your consent.",46   INT. READY ROOM,READY ROOM,INT.,Yesterday's Enterprise,1989-12-08,The Next Generation,163.txt,0.0
90852,90852,90852,90852,240,RIKER,"With all due respect, Captain, we'd be asking one hundred and twenty-five people to die a meaningless death.",46   INT. READY ROOM,READY ROOM,INT.,Yesterday's Enterprise,1989-12-08,The Next Generation,163.txt,0.0
90853,90853,90853,90853,241,DATA,"Not necessarily meaningless, Commander. Klingons place honor above all else.",46   INT. READY ROOM,READY ROOM,INT.,Yesterday's Enterprise,1989-12-08,The Next Generation,163.txt,0.0
90854,90854,90854,90854,242,DATA ,"If the crew of the Enterprise-C had died fighting for the survival of a Klingon outpost, that would have been considered a meaningful act of honor by the Klingon Empire.",46   INT. READY ROOM,READY ROOM,INT.,Yesterday's Enterprise,1989-12-08,The Next Generation,163.txt,0.0
90855,90855,90855,90855,243,PICARD,Even their deaths... might have prevented the war.,46   INT. READY ROOM,READY ROOM,INT.,Yesterday's Enterprise,1989-12-08,The Next Generation,163.txt,0.0
90856,90856,90856,90856,244,PICARD,"If the Enterprise-C returns to the battle and its mission is a success, history will be irrevocably changed. This time line will cease to exist... and a new future will have been created. I've weighed the alternatives. I will follow Guinan's recommendations. Dismissed.",46   INT. READY ROOM,READY ROOM,INT.,Yesterday's Enterprise,1989-12-08,The Next Generation,163.txt,0.0
90857,90857,90857,90857,245,BEVERLY,If she's right... we may not even be in the alternate time line...,47A  INT. BRIDGE,BRIDGE,INT.,Yesterday's Enterprise,1989-12-08,The Next Generation,163.txt,0.0
90858,90858,90858,90858,246,GEORDI,"Yeah, who knows if we're dead or alive...",47A  INT. BRIDGE,BRIDGE,INT.,Yesterday's Enterprise,1989-12-08,The Next Generation,163.txt,0.0
90859,90859,90859,90859,247,DATA,Engineering.,49   INT. TURBOLIFT,TURBOLIFT,INT.,Yesterday's Enterprise,1989-12-08,The Next Generation,163.txt,0.0
90860,90860,90860,90860,248,DATA,Is Engineering your destination as well?,49   INT. TURBOLIFT,TURBOLIFT,INT.,Yesterday's Enterprise,1989-12-08,The Next Generation,163.txt,0.0
90861,90861,90861,90861,249,TASHA,Oh... Deck six... sorry...,49   INT. TURBOLIFT,TURBOLIFT,INT.,Yesterday's Enterprise,1989-12-08,The Next Generation,163.txt,0.0
90862,90862,90862,90862,250,DATA,"If I interpret your facial expression correctly, you were preoccupied with something unpleasant.",49   INT. TURBOLIFT,TURBOLIFT,INT.,Yesterday's Enterprise,1989-12-08,The Next Generation,163.txt,0.0
90863,90863,90863,90863,251,TASHA,"I was just thinking... a lot of things... I've been working with one of the officers from the Enterprise-C... he's nice, you know? I like him. I'm worried about what's going to happen to him.",49   INT. TURBOLIFT,TURBOLIFT,INT.,Yesterday's Enterprise,1989-12-08,The Next Generation,163.txt,0.0
90864,90864,90864,90864,252,DATA,"We may never know what happens, Tasha. If they succeed, we will not even realize any of these events occurred.",49   INT. TURBOLIFT,TURBOLIFT,INT.,Yesterday's Enterprise,1989-12-08,The Next Generation,163.txt,0.0
90865,90865,90865,90865,253,TASHA,"Data, how different do you think your life would be in the other time line?",49A  INT. TURBOLIFT,TURBOLIFT,INT.,Yesterday's Enterprise,1989-12-08,The Next Generation,163.txt,0.0
90866,90866,90866,90866,254,DATA,"The possibilities are too numerous even for me to calculate, Tasha.",49A  INT. TURBOLIFT,TURBOLIFT,INT.,Yesterday's Enterprise,1989-12-08,The Next Generation,163.txt,0.0
90867,90867,90867,90867,255,TASHA,"Kind of scary, isn't it?",49A  INT. TURBOLIFT,TURBOLIFT,INT.,Yesterday's Enterprise,1989-12-08,The Next Generation,163.txt,0.0
90868,90868,90868,90868,256,DATA,Scary? I would not know.,49A  INT. TURBOLIFT,TURBOLIFT,INT.,Yesterday's Enterprise,1989-12-08,The Next Generation,163.txt,0.0
90869,90869,90869,90869,257,CASTILLO,Shields are up to seventy-two percent... That's better...,51   EXT. ENTERPRISE-C BRIDGE,ENTERPRISE-C BRIDGE,EXT.,Yesterday's Enterprise,1989-12-08,The Next Generation,163.txt,0.0
90870,90870,90870,90870,258,GARRETT,You believe this woman...,51   EXT. ENTERPRISE-C BRIDGE,ENTERPRISE-C BRIDGE,EXT.,Yesterday's Enterprise,1989-12-08,The Next Generation,163.txt,0.0
90871,90871,90871,90871,259,PICARD,"I discovered long ago that she has a special wisdom... I've learned to trust it. If you wish, I can arrange for you to speak with her...",51   EXT. ENTERPRISE-C BRIDGE,ENTERPRISE-C BRIDGE,EXT.,Yesterday's Enterprise,1989-12-08,The Next Generation,163.txt,0.0
90872,90872,90872,90872,260,GARRETT,"Captain, I'd be lying to you if I told you there was a chance in hell of coming out of this alive. And my crew means a lot to me.",51   EXT. ENTERPRISE-C BRIDGE,ENTERPRISE-C BRIDGE,EXT.,Yesterday's Enterprise,1989-12-08,The Next Generation,163.txt,0.0
90873,90873,90873,90873,261,GARRETT,Why doesn't your ship come back with us? The Romulans would be no match for your weaponry...,51   EXT. ENTERPRISE-C BRIDGE,ENTERPRISE-C BRIDGE,EXT.,Yesterday's Enterprise,1989-12-08,The Next Generation,163.txt,0.0
90874,90874,90874,90874,262,PICARD,I can't do that.,51   EXT. ENTERPRISE-C BRIDGE,ENTERPRISE-C BRIDGE,EXT.,Yesterday's Enterprise,1989-12-08,The Next Generation,163.txt,0.0
90875,90875,90875,90875,263,GARRETT,"(beat, agrees on closer examination) No, I suppose not. You don't belong in our time... any more than we belong in yours. To be honest, Picard, there are some members of my crew who have expressed a desire to return... even knowing the odds. Some because they can't bear to live without their loved ones... some who don't like the idea that we slipped out in the middle of a fight. But I've told them... that in the here and now, the Federation needs another ship against the Klingons... and we better get used to being in the here and now...",51   EXT. ENTERPRISE-C BRIDGE,ENTERPRISE-C BRIDGE,EXT.,Yesterday's Enterprise,1989-12-08,The Next Generation,163.txt,0.0
90876,90876,90876,90876,264,PICARD,"By going back, you may be a great deal more helpful. The war is going badly for the Federation. Much worse than is generally known.",51   EXT. ENTERPRISE-C BRIDGE,ENTERPRISE-C BRIDGE,EXT.,Yesterday's Enterprise,1989-12-08,The Next Generation,163.txt,0.0
90877,90877,90877,90877,265,PICARD,Starfleet Command believes defeat is inevitable... that within six months we will have no choice but to surrender...,51   EXT. ENTERPRISE-C BRIDGE,ENTERPRISE-C BRIDGE,EXT.,Yesterday's Enterprise,1989-12-08,The Next Generation,163.txt,0.0
90878,90878,90878,90878,266,GARRETT,And you're saying all this may be a result of our arrival here.,51   EXT. ENTERPRISE-C BRIDGE,ENTERPRISE-C BRIDGE,EXT.,Yesterday's Enterprise,1989-12-08,The Next Generation,163.txt,0.0
