Unnamed: 0.2,Unnamed: 0.1,Unnamed: 0,index,line,character,quote,scene,location,view,episode,date,series,file,sentiment
35656,35656,35656,35656,191,BASHIR,This is astonishing.,31   INT. MELORA'S QUARTERS (OPTICAL),MELORA'S QUARTERS,INT.,Melora,1993-08-26,Deep Space Nine,426.txt,0.0
35657,35657,35657,35657,192,BASHIR,I can't tell you how curious I was about this...,31   INT. MELORA'S QUARTERS (OPTICAL),MELORA'S QUARTERS,INT.,Melora,1993-08-26,Deep Space Nine,426.txt,0.0
35658,35658,35658,35658,193,MELORA,"Most people are. Sometimes they make me feel like a carnival attraction. So, usually, I prefer to keep everyone out...",31   INT. MELORA'S QUARTERS (OPTICAL),MELORA'S QUARTERS,INT.,Melora,1993-08-26,Deep Space Nine,426.txt,0.0
35659,35659,35659,35659,194,BASHIR,Thank you... for letting me in.,31   INT. MELORA'S QUARTERS (OPTICAL),MELORA'S QUARTERS,INT.,Melora,1993-08-26,Deep Space Nine,426.txt,0.0
35660,35660,35660,35660,195,MELORA,He's my brother.,31   INT. MELORA'S QUARTERS (OPTICAL),MELORA'S QUARTERS,INT.,Melora,1993-08-26,Deep Space Nine,426.txt,0.0
35661,35661,35661,35661,196,BASHIR,Oh.,31   INT. MELORA'S QUARTERS (OPTICAL),MELORA'S QUARTERS,INT.,Melora,1993-08-26,Deep Space Nine,426.txt,0.0
35662,35662,35662,35662,197,MELORA,Setting course... twenty-eight mark one-forty-two.,34   INT. ORINOCO,ORINOCO,INT.,Melora,1993-08-26,Deep Space Nine,426.txt,0.0
35663,35663,35663,35663,198,MELORA,"Computer, play us something by Delvok.",34   INT. ORINOCO,ORINOCO,INT.,Melora,1993-08-26,Deep Space Nine,426.txt,0.0
35664,35664,35664,35664,199,DAX,Delvok never seems Vulcan to me... there's too much emotion in his music...,34   INT. ORINOCO,ORINOCO,INT.,Melora,1993-08-26,Deep Space Nine,426.txt,0.0
35665,35665,35665,35665,200,MELORA,It's pretty.,34   INT. ORINOCO,ORINOCO,INT.,Melora,1993-08-26,Deep Space Nine,426.txt,0.4939
35666,35666,35666,35666,201,MELORA,"Tell me something, Lieutenant... you think there's room for... romance... in Starfleet?",34   INT. ORINOCO,ORINOCO,INT.,Melora,1993-08-26,Deep Space Nine,426.txt,0.0
35667,35667,35667,35667,202,DAX,I think so.,34   INT. ORINOCO,ORINOCO,INT.,Melora,1993-08-26,Deep Space Nine,426.txt,0.0
35668,35668,35668,35668,203,MELORA,You've made it work... ?,34   INT. ORINOCO,ORINOCO,INT.,Melora,1993-08-26,Deep Space Nine,426.txt,0.0
35669,35669,35669,35669,204,DAX,Now and then...,34   INT. ORINOCO,ORINOCO,INT.,Melora,1993-08-26,Deep Space Nine,426.txt,0.0
35670,35670,35670,35670,205,MELORA,"I mean, really work...",34   INT. ORINOCO,ORINOCO,INT.,Melora,1993-08-26,Deep Space Nine,426.txt,0.0
35671,35671,35671,35671,206,DAX,"Oh, really work. For that, I've got to go back... (beat, smiling at the memory) ... about a hundred and fifty years.",34   INT. ORINOCO,ORINOCO,INT.,Melora,1993-08-26,Deep Space Nine,426.txt,0.0
35672,35672,35672,35672,207,MELORA,That's a long time...,34   INT. ORINOCO,ORINOCO,INT.,Melora,1993-08-26,Deep Space Nine,426.txt,0.0
35673,35673,35673,35673,208,DAX,She was a hard act to follow.,34   INT. ORINOCO,ORINOCO,INT.,Melora,1993-08-26,Deep Space Nine,426.txt,0.0
35674,35674,35674,35674,209,DAX,Could it be Doctor Bashir's bedside manner has won you over... ?,34   INT. ORINOCO,ORINOCO,INT.,Melora,1993-08-26,Deep Space Nine,426.txt,0.0
35675,35675,35675,35675,210,MELORA,Our species are just so... different.,34   INT. ORINOCO,ORINOCO,INT.,Melora,1993-08-26,Deep Space Nine,426.txt,0.0
35676,35676,35676,35676,211,DAX,Since when has that ever stopped anybody?... I knew a hydrogen-breathing Lothra who fell hopelessly in love with an Oxygene...,34   INT. ORINOCO,ORINOCO,INT.,Melora,1993-08-26,Deep Space Nine,426.txt,0.0
35677,35677,35677,35677,212,MELORA,You're kidding... how could they even stay in the same room?,34   INT. ORINOCO,ORINOCO,INT.,Melora,1993-08-26,Deep Space Nine,426.txt,0.0
35678,35678,35678,35678,213,DAX,Forty minutes a day without their breathing apparatus... that's all. Lovely couple... fifty-seven years they were together.,34   INT. ORINOCO,ORINOCO,INT.,Melora,1993-08-26,Deep Space Nine,426.txt,0.0
35679,35679,35679,35679,214,MELORA,What about career conflicts? Two friends of mine from the Academy got engaged even though they knew they were assigned to different starships...,34   INT. ORINOCO,ORINOCO,INT.,Melora,1993-08-26,Deep Space Nine,426.txt,0.0
35680,35680,35680,35680,215,DAX,Subspace relationship?,34   INT. ORINOCO,ORINOCO,INT.,Melora,1993-08-26,Deep Space Nine,426.txt,0.0
35681,35681,35681,35681,216,MELORA,Uh huh.,34   INT. ORINOCO,ORINOCO,INT.,Melora,1993-08-26,Deep Space Nine,426.txt,0.0
35682,35682,35682,35682,217,DAX,That's a tough one.,34   INT. ORINOCO,ORINOCO,INT.,Melora,1993-08-26,Deep Space Nine,426.txt,0.0
35683,35683,35683,35683,218,MELORA,They may not be together for a year or more... and even then only for a few weeks...,34   INT. ORINOCO,ORINOCO,INT.,Melora,1993-08-26,Deep Space Nine,426.txt,0.0
35684,35684,35684,35684,219,DAX,Love across light years is just so...,34   INT. ORINOCO,ORINOCO,INT.,Melora,1993-08-26,Deep Space Nine,426.txt,0.0
35685,35685,35685,35685,220,MELORA,... it lacks intimacy...,34   INT. ORINOCO,ORINOCO,INT.,Melora,1993-08-26,Deep Space Nine,426.txt,0.0
35686,35686,35686,35686,221,DAX,... you could say that.,34   INT. ORINOCO,ORINOCO,INT.,Melora,1993-08-26,Deep Space Nine,426.txt,0.0
35687,35687,35687,35687,222,MELORA,I finish my mission here... I move on to the next one... what kind of future is that for a romance?,34   INT. ORINOCO,ORINOCO,INT.,Melora,1993-08-26,Deep Space Nine,426.txt,0.5574
35688,35688,35688,35688,223,DAX,Look at the alternative.,34   INT. ORINOCO,ORINOCO,INT.,Melora,1993-08-26,Deep Space Nine,426.txt,0.0
35689,35689,35689,35689,224,MELORA,I guess...,34   INT. ORINOCO,ORINOCO,INT.,Melora,1993-08-26,Deep Space Nine,426.txt,0.0
35690,35690,35690,35690,225,DAX,Maybe it's better not to look to the future... just look to tonight.,34   INT. ORINOCO,ORINOCO,INT.,Melora,1993-08-26,Deep Space Nine,426.txt,0.0
35691,35691,35691,35691,226,MELORA,I guess...,34   INT. ORINOCO,ORINOCO,INT.,Melora,1993-08-26,Deep Space Nine,426.txt,0.0
35692,35692,35692,35692,227,DAX,"Smile, Ensign, you're in love.",34   INT. ORINOCO,ORINOCO,INT.,Melora,1993-08-26,Deep Space Nine,426.txt,0.0
35693,35693,35693,35693,228,ODO,Oh. It's you.,37   INT. SECURITY OFFICE,SECURITY OFFICE,INT.,Melora,1993-08-26,Deep Space Nine,426.txt,0.0
35694,35694,35694,35694,229,QUARK,Don't be so happy to see me...,37   INT. SECURITY OFFICE,SECURITY OFFICE,INT.,Melora,1993-08-26,Deep Space Nine,426.txt,0.0
35695,35695,35695,35695,230,ODO,"All right, I won't.",37   INT. SECURITY OFFICE,SECURITY OFFICE,INT.,Melora,1993-08-26,Deep Space Nine,426.txt,0.0
35696,35696,35696,35696,231,QUARK,"Odo, there's a desperate criminal on board the station...",37   INT. SECURITY OFFICE,SECURITY OFFICE,INT.,Melora,1993-08-26,Deep Space Nine,426.txt,0.0
35697,35697,35697,35697,232,ODO,You wouldn't be talking about Fallit,37   INT. SECURITY OFFICE,SECURITY OFFICE,INT.,Melora,1993-08-26,Deep Space Nine,426.txt,0.0
35698,35698,35698,35698,233,ODO,"... who just finished eight years in a labor camp for hijacking a shipment of Romulan ale. (stops working, turns to Quark) ... whose name was right next to yours on the original indictment... ?",37   INT. SECURITY OFFICE,SECURITY OFFICE,INT.,Melora,1993-08-26,Deep Space Nine,426.txt,0.0
35699,35699,35699,35699,234,QUARK,I had nothing to do with the hijacking itself. I was... only the middleman...,37   INT. SECURITY OFFICE,SECURITY OFFICE,INT.,Melora,1993-08-26,Deep Space Nine,426.txt,0.0
35700,35700,35700,35700,235,ODO,Trafficking in stolen goods should have been enough to get you your own cell at that Romulan camp... unless you sold out your partner...,37   INT. SECURITY OFFICE,SECURITY OFFICE,INT.,Melora,1993-08-26,Deep Space Nine,426.txt,-0.4939
35701,35701,35701,35701,236,QUARK,I can honestly say that justice was served.,37   INT. SECURITY OFFICE,SECURITY OFFICE,INT.,Melora,1993-08-26,Deep Space Nine,426.txt,0.7506
35702,35702,35702,35702,237,ODO,I would imagine that Fallit Kot is looking for his own kind of justice now.,37   INT. SECURITY OFFICE,SECURITY OFFICE,INT.,Melora,1993-08-26,Deep Space Nine,426.txt,0.4779
35703,35703,35703,35703,238,QUARK,He's threatened to kill me.,37   INT. SECURITY OFFICE,SECURITY OFFICE,INT.,Melora,1993-08-26,Deep Space Nine,426.txt,-0.8271
35704,35704,35704,35704,239,QUARK,"What?! (""are you looking at"" implied) Odo resumes his usual stern expression, sighs...",37   INT. SECURITY OFFICE,SECURITY OFFICE,INT.,Melora,1993-08-26,Deep Space Nine,426.txt,0.0
35705,35705,35705,35705,240,ODO,Nothing. Just a passing thought...,37   INT. SECURITY OFFICE,SECURITY OFFICE,INT.,Melora,1993-08-26,Deep Space Nine,426.txt,0.0
35706,35706,35706,35706,241,QUARK,"Odo, he means it. Nothing I do seems to change his mind. You've got to do something.",37   INT. SECURITY OFFICE,SECURITY OFFICE,INT.,Melora,1993-08-26,Deep Space Nine,426.txt,0.0
35707,35707,35707,35707,242,ODO,"I'll do my job, Quark.",37   INT. SECURITY OFFICE,SECURITY OFFICE,INT.,Melora,1993-08-26,Deep Space Nine,426.txt,0.0
35708,35708,35708,35708,243,ODO,Unfortunately...,37   INT. SECURITY OFFICE,SECURITY OFFICE,INT.,Melora,1993-08-26,Deep Space Nine,426.txt,0.0
35709,35709,35709,35709,244,MELORA,"Racht, anyone?",38   INT. INFIRMARY,INFIRMARY,INT.,Melora,1993-08-26,Deep Space Nine,426.txt,0.0
35710,35710,35710,35710,245,BASHIR,I've been waiting for you. I want to show you something.,38   INT. INFIRMARY,INFIRMARY,INT.,Melora,1993-08-26,Deep Space Nine,426.txt,0.0
35711,35711,35711,35711,246,MELORA,(reacts to the complexity) What is it?,38   INT. INFIRMARY,INFIRMARY,INT.,Melora,1993-08-26,Deep Space Nine,426.txt,0.0
35712,35712,35712,35712,247,MELORA,The neuromuscular adaptation theory?,38   INT. INFIRMARY,INFIRMARY,INT.,Melora,1993-08-26,Deep Space Nine,426.txt,0.0
35713,35713,35713,35713,248,BASHIR,"(excited at the prospects) It was a theory thirty years ago, Melora... but with the development of neo-analeptic transmitters during the last decade, it's not even that complicated... it's just that no one's gone back to reexamine the ideas of Nathaniel Teros... Until now.",38   INT. INFIRMARY,INFIRMARY,INT.,Melora,1993-08-26,Deep Space Nine,426.txt,0.0
35714,35714,35714,35714,249,MELORA,This... can actually work... ?,38   INT. INFIRMARY,INFIRMARY,INT.,Melora,1993-08-26,Deep Space Nine,426.txt,0.0
35715,35715,35715,35715,250,BASHIR,No more servo controls. No more chair.,38   INT. INFIRMARY,INFIRMARY,INT.,Melora,1993-08-26,Deep Space Nine,426.txt,0.0
35716,35716,35716,35716,251,FALLIT KOT,Have I done something wrong?,41   INT. SECURITY,SECURITY,INT.,Melora,1993-08-26,Deep Space Nine,426.txt,0.0
35717,35717,35717,35717,252,ODO,Not that I'm aware of. (Kot studies him evenly a beat) We have something in common.,41   INT. SECURITY,SECURITY,INT.,Melora,1993-08-26,Deep Space Nine,426.txt,0.0
35718,35718,35718,35718,253,FALLIT KOT,We do?,41   INT. SECURITY,SECURITY,INT.,Melora,1993-08-26,Deep Space Nine,426.txt,0.0
35719,35719,35719,35719,254,ODO,"I don't like Quark either. (beat, he looks up for the first time) But I can't let you kill him.",41   INT. SECURITY,SECURITY,INT.,Melora,1993-08-26,Deep Space Nine,426.txt,0.0
35720,35720,35720,35720,255,FALLIT KOT,Kill him... did he tell you I was going to do that?,41   INT. SECURITY,SECURITY,INT.,Melora,1993-08-26,Deep Space Nine,426.txt,0.0
35721,35721,35721,35721,256,ODO,I know your history together.,41   INT. SECURITY,SECURITY,INT.,Melora,1993-08-26,Deep Space Nine,426.txt,0.0
35722,35722,35722,35722,257,FALLIT KOT,Let bygones be bygones I always say.,41   INT. SECURITY,SECURITY,INT.,Melora,1993-08-26,Deep Space Nine,426.txt,0.0
35723,35723,35723,35723,258,ODO,I always say you can tell a man's intentions by the way he walks.,41   INT. SECURITY,SECURITY,INT.,Melora,1993-08-26,Deep Space Nine,426.txt,0.0
35724,35724,35724,35724,259,FALLIT KOT,How do I walk?,41   INT. SECURITY,SECURITY,INT.,Melora,1993-08-26,Deep Space Nine,426.txt,0.0
35725,35725,35725,35725,260,ODO,Like someone carrying a lot of weight on his shoulders.,41   INT. SECURITY,SECURITY,INT.,Melora,1993-08-26,Deep Space Nine,426.txt,0.0
35726,35726,35726,35726,261,FALLIT KOT,Must be the memory of those Romulan bricks I carried for eight years.,41   INT. SECURITY,SECURITY,INT.,Melora,1993-08-26,Deep Space Nine,426.txt,0.0
35727,35727,35727,35727,262,ODO,Must be.,41   INT. SECURITY,SECURITY,INT.,Melora,1993-08-26,Deep Space Nine,426.txt,0.0
35728,35728,35728,35728,263,FALLIT KOT,"But you can't lock a man up for the way he walks, can you?",41   INT. SECURITY,SECURITY,INT.,Melora,1993-08-26,Deep Space Nine,426.txt,0.0
35729,35729,35729,35729,264,QUARK,Well?,42   INT. PROMENADE,PROMENADE,INT.,Melora,1993-08-26,Deep Space Nine,426.txt,0.0
35730,35730,35730,35730,265,ODO,I'd say he's a man with nothing to lose.,42   INT. PROMENADE,PROMENADE,INT.,Melora,1993-08-26,Deep Space Nine,426.txt,0.0
35731,35731,35731,35731,266,QUARK,As opposed to me.,42   INT. PROMENADE,PROMENADE,INT.,Melora,1993-08-26,Deep Space Nine,426.txt,0.0
35732,35732,35732,35732,267,ODO,I have no reason to hold him for now and he knows it. I'll watch him the best I can.,42   INT. PROMENADE,PROMENADE,INT.,Melora,1993-08-26,Deep Space Nine,426.txt,0.0
35733,35733,35733,35733,268,ODO,But I suggest you carry a combadge with you at all times.,42   INT. PROMENADE,PROMENADE,INT.,Melora,1993-08-26,Deep Space Nine,426.txt,0.0
35734,35734,35734,35734,269,ODO,Call me at the first sign of trouble.,42   INT. PROMENADE,PROMENADE,INT.,Melora,1993-08-26,Deep Space Nine,426.txt,0.0
35735,35735,35735,35735,270,QUARK,What if the first sign is the last sign?,42   INT. PROMENADE,PROMENADE,INT.,Melora,1993-08-26,Deep Space Nine,426.txt,0.0
35736,35736,35736,35736,271,ODO,"You people sell pieces of yourself after you die, don't you?",42   INT. PROMENADE,PROMENADE,INT.,Melora,1993-08-26,Deep Space Nine,426.txt,0.0
35737,35737,35737,35737,272,QUARK,Yes...,42   INT. PROMENADE,PROMENADE,INT.,Melora,1993-08-26,Deep Space Nine,426.txt,0.0
35738,35738,35738,35738,273,ODO,I'll buy one.,42   INT. PROMENADE,PROMENADE,INT.,Melora,1993-08-26,Deep Space Nine,426.txt,0.0
35739,35739,35739,35739,274,MELORA,My heart is pounding...,43   INT. INFIRMARY,INFIRMARY,INT.,Melora,1993-08-26,Deep Space Nine,426.txt,0.0
35740,35740,35740,35740,275,BASHIR,I'd like to think that has more to do with me than the neo-analeptic infusion...,43   INT. INFIRMARY,INFIRMARY,INT.,Melora,1993-08-26,Deep Space Nine,426.txt,0.0
35741,35741,35741,35741,276,MELORA,Would that also explain why my backside is getting warm...,43   INT. INFIRMARY,INFIRMARY,INT.,Melora,1993-08-26,Deep Space Nine,426.txt,0.0
35742,35742,35742,35742,277,BASHIR,That's more likely the result of the neuromuscular tissue stimulation due to increased activity in the motor cortex...,43   INT. INFIRMARY,INFIRMARY,INT.,Melora,1993-08-26,Deep Space Nine,426.txt,0.0
35743,35743,35743,35743,278,BASHIR,I'd say that's enough for the first time out...,43   INT. INFIRMARY,INFIRMARY,INT.,Melora,1993-08-26,Deep Space Nine,426.txt,0.0
35744,35744,35744,35744,279,BASHIR,It's good that you've already been using your muscles in this gravity environment... it'll make it easier to adapt...,43   INT. INFIRMARY,INFIRMARY,INT.,Melora,1993-08-26,Deep Space Nine,426.txt,0.0
35745,35745,35745,35745,280,BASHIR,Feel any different?,43   INT. INFIRMARY,INFIRMARY,INT.,Melora,1993-08-26,Deep Space Nine,426.txt,0.0
35746,35746,35746,35746,281,MELORA,No.,43   INT. INFIRMARY,INFIRMARY,INT.,Melora,1993-08-26,Deep Space Nine,426.txt,0.0
35747,35747,35747,35747,282,BASHIR,Nothing at all?,43   INT. INFIRMARY,INFIRMARY,INT.,Melora,1993-08-26,Deep Space Nine,426.txt,0.0
35748,35748,35748,35748,283,MELORA,"I'm sorry, Julian.",43   INT. INFIRMARY,INFIRMARY,INT.,Melora,1993-08-26,Deep Space Nine,426.txt,0.0
35749,35749,35749,35749,284,BASHIR,The acetylcholine absorption was precisely at fourteen percent above normal...,43   INT. INFIRMARY,INFIRMARY,INT.,Melora,1993-08-26,Deep Space Nine,426.txt,0.0
35750,35750,35750,35750,285,BASHIR ,... increased tensile strength would be the inevitable result...,43   INT. INFIRMARY,INFIRMARY,INT.,Melora,1993-08-26,Deep Space Nine,426.txt,0.0
35751,35751,35751,35751,286,MELORA,Julian...,43   INT. INFIRMARY,INFIRMARY,INT.,Melora,1993-08-26,Deep Space Nine,426.txt,0.0
35752,35752,35752,35752,287,MELORA,I can lift my leg.,43   INT. INFIRMARY,INFIRMARY,INT.,Melora,1993-08-26,Deep Space Nine,426.txt,0.0
35753,35753,35753,35753,288,BASHIR,"Your neural pathways are getting used to the changes. Endurance and coordination might take awhile, but you should be walking within the hour.",43   INT. INFIRMARY,INFIRMARY,INT.,Melora,1993-08-26,Deep Space Nine,426.txt,0.0
35754,35754,35754,35754,289,O'BRIEN,and Dax at his station as Sisko walks out of his office towards them.,48   INT. OPS,OPS,INT.,Melora,1993-08-26,Deep Space Nine,426.txt,0.0
35755,35755,35755,35755,290,SISKO,How's the upgrade coming?,48   INT. OPS,OPS,INT.,Melora,1993-08-26,Deep Space Nine,426.txt,0.0
35756,35756,35756,35756,291,O'BRIEN,"We've been able to get it to about seventy percent of what we'd get with a standard EPS, but it looks like that's as far as it's gonna...",48   INT. OPS,OPS,INT.,Melora,1993-08-26,Deep Space Nine,426.txt,0.0
35757,35757,35757,35757,292,O'BRIEN,I'll be damned.,48   INT. OPS,OPS,INT.,Melora,1993-08-26,Deep Space Nine,426.txt,0.0
35758,35758,35758,35758,293,MELORA,"I wanted to give you our first day's mission summary myself, Commander.",48   INT. OPS,OPS,INT.,Melora,1993-08-26,Deep Space Nine,426.txt,0.0
35759,35759,35759,35759,294,SISKO,"A pleasure, Ensign.",48   INT. OPS,OPS,INT.,Melora,1993-08-26,Deep Space Nine,426.txt,0.0
35760,35760,35760,35760,295,DAX,"Julian, how did you...",48   INT. OPS,OPS,INT.,Melora,1993-08-26,Deep Space Nine,426.txt,0.0
35761,35761,35761,35761,296,BASHIR,"Simply a matter of increasing the output from the brain's motor cortex... someone else's research actually... I just dotted the ""i""s and crossed the ""t""s...",48   INT. OPS,OPS,INT.,Melora,1993-08-26,Deep Space Nine,426.txt,0.0
35762,35762,35762,35762,297,O'BRIEN,You'll get your name into the medical journals for this one.,48   INT. OPS,OPS,INT.,Melora,1993-08-26,Deep Space Nine,426.txt,0.0
35763,35763,35763,35763,298,BASHIR,I know.,48   INT. OPS,OPS,INT.,Melora,1993-08-26,Deep Space Nine,426.txt,0.0
35764,35764,35764,35764,299,MELORA,"Julian, I don't know how to say this but... I'm not sure I can get back down...",48   INT. OPS,OPS,INT.,Melora,1993-08-26,Deep Space Nine,426.txt,0.0
35765,35765,35765,35765,300,BASHIR,Whups! Easy does it now. First treatment's beginning to wear off. Nothing to be concerned about...,48   INT. OPS,OPS,INT.,Melora,1993-08-26,Deep Space Nine,426.txt,0.0
35766,35766,35766,35766,301,BASHIR,Let's get you back to your quarters... I want you to get a good night's rest.,48   INT. OPS,OPS,INT.,Melora,1993-08-26,Deep Space Nine,426.txt,0.0
35767,35767,35767,35767,302,BASHIR,"With each progressive treatment, you should get stronger and the effect should last longer...",50   INT. MELORA'S QUARTERS,MELORA'S QUARTERS,INT.,Melora,1993-08-26,Deep Space Nine,426.txt,0.0
35768,35768,35768,35768,303,MELORA,What about this?,50   INT. MELORA'S QUARTERS,MELORA'S QUARTERS,INT.,Melora,1993-08-26,Deep Space Nine,426.txt,0.0
35769,35769,35769,35769,304,BASHIR,A low-grav environment now would really confuse your motor cortex.,50   INT. MELORA'S QUARTERS,MELORA'S QUARTERS,INT.,Melora,1993-08-26,Deep Space Nine,426.txt,0.0
35770,35770,35770,35770,305,MELORA,I understand. Julian...,50   INT. MELORA'S QUARTERS,MELORA'S QUARTERS,INT.,Melora,1993-08-26,Deep Space Nine,426.txt,0.0
35771,35771,35771,35771,306,BASHIR,You let me fly for the first time... I let you walk. We're even.,50   INT. MELORA'S QUARTERS,MELORA'S QUARTERS,INT.,Melora,1993-08-26,Deep Space Nine,426.txt,0.0
35772,35772,35772,35772,307,BASHIR,See you in the morning.,50   INT. MELORA'S QUARTERS,MELORA'S QUARTERS,INT.,Melora,1993-08-26,Deep Space Nine,426.txt,0.0
35773,35773,35773,35773,308,QUARK,Lights...,52   INT. QUARK'S QUARTERS,QUARK'S QUARTERS,INT.,Melora,1993-08-26,Deep Space Nine,426.txt,0.0
35774,35774,35774,35774,309,QUARK,"Computer, turn on the...",52   INT. QUARK'S QUARTERS,QUARK'S QUARTERS,INT.,Melora,1993-08-26,Deep Space Nine,426.txt,0.0
35775,35775,35775,35775,310,QUARK,Quark to mmmppph...,52   INT. QUARK'S QUARTERS,QUARK'S QUARTERS,INT.,Melora,1993-08-26,Deep Space Nine,426.txt,0.0
35776,35776,35776,35776,311,FALLIT KOT,"No one can hear you, Quark... it's just you and me...",52   INT. QUARK'S QUARTERS,QUARK'S QUARTERS,INT.,Melora,1993-08-26,Deep Space Nine,426.txt,0.0
35777,35777,35777,35777,312,QUARK,Fallit... I wasn't prepared to entertain this evening but please... make yourself at home...,52   INT. QUARK'S QUARTERS,QUARK'S QUARTERS,INT.,Melora,1993-08-26,Deep Space Nine,426.txt,0.0
35778,35778,35778,35778,313,FALLIT KOT,I already have...,52   INT. QUARK'S QUARTERS,QUARK'S QUARTERS,INT.,Melora,1993-08-26,Deep Space Nine,426.txt,0.0
35779,35779,35779,35779,314,QUARK,What's mine is yours... all you have to do is ask... !,52   INT. QUARK'S QUARTERS,QUARK'S QUARTERS,INT.,Melora,1993-08-26,Deep Space Nine,426.txt,0.0
35780,35780,35780,35780,315,FALLIT KOT,"I'm tired of your gifts, Quark. All I want is your miserable life.",52   INT. QUARK'S QUARTERS,QUARK'S QUARTERS,INT.,Melora,1993-08-26,Deep Space Nine,426.txt,0.0
35781,35781,35781,35781,316,QUARK,"Wait! Everything's negotiable... believe me, I'm worth much more to you alive... ! (grabbing the first straw he thinks of) How does one hundred and ninety-nine bars of gold-pressed latinum sound to you?",52   INT. QUARK'S QUARTERS,QUARK'S QUARTERS,INT.,Melora,1993-08-26,Deep Space Nine,426.txt,0.0
35782,35782,35782,35782,317,FALLIT KOT,It's a start.,52   INT. QUARK'S QUARTERS,QUARK'S QUARTERS,INT.,Melora,1993-08-26,Deep Space Nine,426.txt,0.0
35783,35783,35783,35783,318,MELORA,The mattress felt like rocks... and every one of my muscles ached all night long...,54   INT. INFIRMARY,INFIRMARY,INT.,Melora,1993-08-26,Deep Space Nine,426.txt,0.0
35784,35784,35784,35784,319,BASHIR,You'll adjust to that after a few treatments...,54   INT. INFIRMARY,INFIRMARY,INT.,Melora,1993-08-26,Deep Space Nine,426.txt,0.0
35785,35785,35785,35785,320,BASHIR,This time you should feel the effects for several hours...,54   INT. INFIRMARY,INFIRMARY,INT.,Melora,1993-08-26,Deep Space Nine,426.txt,0.0
35786,35786,35786,35786,321,MELORA,(tries to make it sound in passing) Exactly when does it become irreversible?,54   INT. INFIRMARY,INFIRMARY,INT.,Melora,1993-08-26,Deep Space Nine,426.txt,0.0
35787,35787,35787,35787,322,BASHIR,"(studies her a long beat) Melora, if you're not certain...",54   INT. INFIRMARY,INFIRMARY,INT.,Melora,1993-08-26,Deep Space Nine,426.txt,0.0
35788,35788,35788,35788,323,MELORA,"Oh, I'm sure it's just some strange form of ""buyers remorse""... I'll be fine...",54   INT. INFIRMARY,INFIRMARY,INT.,Melora,1993-08-26,Deep Space Nine,426.txt,0.0
35789,35789,35789,35789,324,BASHIR,Tell me exactly what you're feeling...,54   INT. INFIRMARY,INFIRMARY,INT.,Melora,1993-08-26,Deep Space Nine,426.txt,0.0
35790,35790,35790,35790,325,MELORA,"Last night, I just missed... I didn't feel like me...",54   INT. INFIRMARY,INFIRMARY,INT.,Melora,1993-08-26,Deep Space Nine,426.txt,0.0
35791,35791,35791,35791,326,BASHIR,"If you want to end your dependence on the chair and the servo controls, you have to give up the low-grav environment, Melora. You knew that was the trade-off.",54   INT. INFIRMARY,INFIRMARY,INT.,Melora,1993-08-26,Deep Space Nine,426.txt,0.0
35792,35792,35792,35792,327,MELORA,It seemed like a good trade... until I realized I couldn't do it anymore... if I could just spend...,54   INT. INFIRMARY,INFIRMARY,INT.,Melora,1993-08-26,Deep Space Nine,426.txt,0.0
35793,35793,35793,35793,328,BASHIR,I'm concerned that going back and forth would ultimately lead to a loss of fine motor control.,54   INT. INFIRMARY,INFIRMARY,INT.,Melora,1993-08-26,Deep Space Nine,426.txt,0.0
35794,35794,35794,35794,329,MELORA,Meaning?,54   INT. INFIRMARY,INFIRMARY,INT.,Melora,1993-08-26,Deep Space Nine,426.txt,0.0
35795,35795,35795,35795,330,BASHIR,Your ability to perform complex tasks could be affected.,54   INT. INFIRMARY,INFIRMARY,INT.,Melora,1993-08-26,Deep Space Nine,426.txt,0.0
35796,35796,35796,35796,331,BASHIR,"The effect is fully reversible for a few more days. We can pull the plug anytime before then. After that, if all goes well, your motor cortex impulses will kick in on their own. Permanently.",54   INT. INFIRMARY,INFIRMARY,INT.,Melora,1993-08-26,Deep Space Nine,426.txt,0.0
35797,35797,35797,35797,332,MELORA,It's beginning to wear off again...,56   INT. ORINOCO,ORINOCO,INT.,Melora,1993-08-26,Deep Space Nine,426.txt,0.0
35798,35798,35798,35798,333,MELORA,I don't understand myself... how can I possibly have second thoughts... this would mean real independence... it's everything I ever wished for... But then I start to think about home... and how I won't ever be able to go back... maybe just for a short visit... but never really go back...,56   INT. ORINOCO,ORINOCO,INT.,Melora,1993-08-26,Deep Space Nine,426.txt,0.0
35799,35799,35799,35799,334,DAX,The Little Mermaid.,56   INT. ORINOCO,ORINOCO,INT.,Melora,1993-08-26,Deep Space Nine,426.txt,0.0
35800,35800,35800,35800,335,MELORA,Mermaid?,56   INT. ORINOCO,ORINOCO,INT.,Melora,1993-08-26,Deep Space Nine,426.txt,0.0
35801,35801,35801,35801,336,DAX,It's an Earth fable by Hans Christian Andersen. She trades her magical life under the sea for a pair of legs to walk on land.,56   INT. ORINOCO,ORINOCO,INT.,Melora,1993-08-26,Deep Space Nine,426.txt,0.0
35802,35802,35802,35802,337,MELORA,What happened? Didn't she live happily ever after?,56   INT. ORINOCO,ORINOCO,INT.,Melora,1993-08-26,Deep Space Nine,426.txt,0.0
