Unnamed: 0.2,Unnamed: 0.1,Unnamed: 0,index,line,character,quote,scene,location,view,episode,date,series,file,sentiment
35525,35525,35525,35525,60,FALLIT KOT,"That's right. (leans in; no brag, just fact) I've come to kill you, Quark.",7    INT. QUARK'S,QUARK'S,INT.,Melora,1993-08-26,Deep Space Nine,426.txt,0.0
35526,35526,35526,35526,61,DAX,I've gone through her mission profile. She certainly knows what she's doing...,9    INT. COMMANDER'S OFFICE,COMMANDER'S OFFICE,INT.,Melora,1993-08-26,Deep Space Nine,426.txt,0.0
35527,35527,35527,35527,62,SISKO,"Nevertheless, this is her first deep space assignment... and it doesn't make sense to me to... (rising, interrupting himself) Here she is...",9    INT. COMMANDER'S OFFICE,COMMANDER'S OFFICE,INT.,Melora,1993-08-26,Deep Space Nine,426.txt,0.0
35528,35528,35528,35528,63,SISKO,"Ensign, I'm Commander Benjamin Sisko...",11   INT. OPS,OPS,INT.,Melora,1993-08-26,Deep Space Nine,426.txt,0.0
35529,35529,35529,35529,64,MELORA,Am I late?,11   INT. OPS,OPS,INT.,Melora,1993-08-26,Deep Space Nine,426.txt,0.0
35530,35530,35530,35530,65,SISKO,Not at all.,11   INT. OPS,OPS,INT.,Melora,1993-08-26,Deep Space Nine,426.txt,0.0
35531,35531,35531,35531,66,MELORA,It looked like the meeting had already begun.,11   INT. OPS,OPS,INT.,Melora,1993-08-26,Deep Space Nine,426.txt,0.0
35532,35532,35532,35532,67,SISKO,Dax and Bashir were just telling me about your request to pilot a runabout alone.,11   INT. OPS,OPS,INT.,Melora,1993-08-26,Deep Space Nine,426.txt,0.0
35533,35533,35533,35533,68,MELORA,Wouldn't it have been appropriate to include me in that conversation?,11   INT. OPS,OPS,INT.,Melora,1993-08-26,Deep Space Nine,426.txt,0.0
35534,35534,35534,35534,69,SISKO,"I was getting a briefing by my senior officers, Ensign. We talk about personnel matters all the time.",11   INT. OPS,OPS,INT.,Melora,1993-08-26,Deep Space Nine,426.txt,0.0
35535,35535,35535,35535,70,MELORA,"I'm sorry if I seem overly sensitive. But I'm used to being shut out of the ""Melora"" problem. The truth is there is no ""Melora"" problem. Until people create one.",11   INT. OPS,OPS,INT.,Melora,1993-08-26,Deep Space Nine,426.txt,0.0
35536,35536,35536,35536,71,MELORA,"This may sound ungrateful, because Doctor Bashir has been wonderfully helpful in the preparations for my arrival, but frankly, I wonder why a medical opinion is necessary in this discussion.",12   INT. COMMANDER'S OFFICE - CONTINUOUS,COMMANDER'S OFFIC,INT.,Melora,1993-08-26,Deep Space Nine,426.txt,0.0
35537,35537,35537,35537,72,DAX,Julian knows more about your capabilities than any of us.,12   INT. COMMANDER'S OFFICE - CONTINUOUS,COMMANDER'S OFFIC,INT.,Melora,1993-08-26,Deep Space Nine,426.txt,0.0
35538,35538,35538,35538,73,MELORA,I don't need a medical opinion to tell me my own capabilities...,12   INT. COMMANDER'S OFFICE - CONTINUOUS,COMMANDER'S OFFIC,INT.,Melora,1993-08-26,Deep Space Nine,426.txt,0.0
35539,35539,35539,35539,74,BASHIR,I also know the station and the runabouts...,12   INT. COMMANDER'S OFFICE - CONTINUOUS,COMMANDER'S OFFIC,INT.,Melora,1993-08-26,Deep Space Nine,426.txt,0.0
35540,35540,35540,35540,75,MELORA,I've studied the station's schematics... and I've flown runabouts...,12   INT. COMMANDER'S OFFICE - CONTINUOUS,COMMANDER'S OFFIC,INT.,Melora,1993-08-26,Deep Space Nine,426.txt,0.0
35541,35541,35541,35541,76,SISKO,Ensign...,12   INT. COMMANDER'S OFFICE - CONTINUOUS,COMMANDER'S OFFIC,INT.,Melora,1993-08-26,Deep Space Nine,426.txt,0.0
35542,35542,35542,35542,77,MELORA,I simply object to being treated like someone who is ill.,12   INT. COMMANDER'S OFFICE - CONTINUOUS,COMMANDER'S OFFIC,INT.,Melora,1993-08-26,Deep Space Nine,426.txt,0.0
35543,35543,35543,35543,78,SISKO,I don't see anybody doing that.,12   INT. COMMANDER'S OFFICE - CONTINUOUS,COMMANDER'S OFFIC,INT.,Melora,1993-08-26,Deep Space Nine,426.txt,0.0
35544,35544,35544,35544,79,MELORA,"Try sitting in the chair, Commander. No one can understand until they sit in the chair.",12   INT. COMMANDER'S OFFICE - CONTINUOUS,COMMANDER'S OFFIC,INT.,Melora,1993-08-26,Deep Space Nine,426.txt,0.0
35545,35545,35545,35545,80,MELORA,"I've been in one chair or another since I left my homeworld. My family gave me this cane made from the wood of a garlanic tree. (chuckles at the naivete) ... they had no idea what it would be like to live off-world... in what you consider ""normal"" gravity. Only a handful of Elaysians have ever left home. But I always knew I had to be one of them.",12   INT. COMMANDER'S OFFICE - CONTINUOUS,COMMANDER'S OFFIC,INT.,Melora,1993-08-26,Deep Space Nine,426.txt,0.0
35546,35546,35546,35546,81,MELORA ,"I dreamed about exploring the stars as a girl. And I wasn't going to allow any... ""handicap,"" not a chair, not a Cardassian station... to stop me from chasing that dream.",12   INT. COMMANDER'S OFFICE - CONTINUOUS,COMMANDER'S OFFIC,INT.,Melora,1993-08-26,Deep Space Nine,426.txt,0.0
35547,35547,35547,35547,82,SISKO,You must feel a great deal of pride in what you've been able to achieve.,12   INT. COMMANDER'S OFFICE - CONTINUOUS,COMMANDER'S OFFIC,INT.,Melora,1993-08-26,Deep Space Nine,426.txt,0.0
35548,35548,35548,35548,83,MELORA,"And I've achieved it without being dependent on anybody. To be honest, I prefer working alone. It's simply easier for me.",12   INT. COMMANDER'S OFFICE - CONTINUOUS,COMMANDER'S OFFIC,INT.,Melora,1993-08-26,Deep Space Nine,426.txt,0.0
35549,35549,35549,35549,84,SISKO,I'm not comfortable sending you alone into the Gamma Quadrant.,12   INT. COMMANDER'S OFFICE - CONTINUOUS,COMMANDER'S OFFIC,INT.,Melora,1993-08-26,Deep Space Nine,426.txt,0.0
35550,35550,35550,35550,85,MELORA,"Sir, I can focus on the job better, I can work at my own pace without bothering anyone else...",12   INT. COMMANDER'S OFFICE - CONTINUOUS,COMMANDER'S OFFIC,INT.,Melora,1993-08-26,Deep Space Nine,426.txt,0.0
35551,35551,35551,35551,86,SISKO,Lieutenant Dax will be going with you.,12   INT. COMMANDER'S OFFICE - CONTINUOUS,COMMANDER'S OFFIC,INT.,Melora,1993-08-26,Deep Space Nine,426.txt,0.0
35552,35552,35552,35552,87,MELORA,"Yes sir. When do you wish to leave, Lieutenant?",12   INT. COMMANDER'S OFFICE - CONTINUOUS,COMMANDER'S OFFIC,INT.,Melora,1993-08-26,Deep Space Nine,426.txt,0.0
35553,35553,35553,35553,88,DAX,Your schedule is fine with me.,12   INT. COMMANDER'S OFFICE - CONTINUOUS,COMMANDER'S OFFIC,INT.,Melora,1993-08-26,Deep Space Nine,426.txt,0.0
35554,35554,35554,35554,89,MELORA,Come in.,13   INT. HABITAT CORRIDOR,HABITAT CORRIDOR,INT.,Melora,1993-08-26,Deep Space Nine,426.txt,0.0
35555,35555,35555,35555,90,BASHIR,Is it working? The low-grav field actuator... I just heard it go off.,14   INT. MELORA'S QUARTERS,MELORA'S QUARTERS,INT.,Melora,1993-08-26,Deep Space Nine,426.txt,0.0
35556,35556,35556,35556,91,MELORA,It's working fine.,14   INT. MELORA'S QUARTERS,MELORA'S QUARTERS,INT.,Melora,1993-08-26,Deep Space Nine,426.txt,0.0
35557,35557,35557,35557,92,BASHIR,So you were just...,14   INT. MELORA'S QUARTERS,MELORA'S QUARTERS,INT.,Melora,1993-08-26,Deep Space Nine,426.txt,0.0
35558,35558,35558,35558,93,MELORA,"For me, it's like slipping into a hot tub at the end of a long day.",14   INT. MELORA'S QUARTERS,MELORA'S QUARTERS,INT.,Melora,1993-08-26,Deep Space Nine,426.txt,0.0
35559,35559,35559,35559,94,BASHIR,"Really. (because he can't ask what he wants to ask) I'm... a shower man, myself.",14   INT. MELORA'S QUARTERS,MELORA'S QUARTERS,INT.,Melora,1993-08-26,Deep Space Nine,426.txt,0.0
35560,35560,35560,35560,95,BASHIR,Look at this. Is that your husband... ? Boyfriend... ?,14   INT. MELORA'S QUARTERS,MELORA'S QUARTERS,INT.,Melora,1993-08-26,Deep Space Nine,426.txt,0.0
35561,35561,35561,35561,96,MELORA,"If you came for an apology, Doctor, I apologize.",14   INT. MELORA'S QUARTERS,MELORA'S QUARTERS,INT.,Melora,1993-08-26,Deep Space Nine,426.txt,0.0
35562,35562,35562,35562,97,BASHIR,Apology?,14   INT. MELORA'S QUARTERS,MELORA'S QUARTERS,INT.,Melora,1993-08-26,Deep Space Nine,426.txt,0.0
35563,35563,35563,35563,98,MELORA,My speech was not intended to attack you personally.,14   INT. MELORA'S QUARTERS,MELORA'S QUARTERS,INT.,Melora,1993-08-26,Deep Space Nine,426.txt,0.0
35564,35564,35564,35564,99,BASHIR,I'm sure you never set out to attack anyone personally. But you do seem... to attack a lot.,14   INT. MELORA'S QUARTERS,MELORA'S QUARTERS,INT.,Melora,1993-08-26,Deep Space Nine,426.txt,0.0
35565,35565,35565,35565,100,MELORA,"That's rather insensitive of you, Doctor.",14   INT. MELORA'S QUARTERS,MELORA'S QUARTERS,INT.,Melora,1993-08-26,Deep Space Nine,426.txt,0.0
35566,35566,35566,35566,101,BASHIR,Julian. I'm no longer your doctor.,14   INT. MELORA'S QUARTERS,MELORA'S QUARTERS,INT.,Melora,1993-08-26,Deep Space Nine,426.txt,0.0
35567,35567,35567,35567,102,MELORA,I see. You've decided I need a friend.,14   INT. MELORA'S QUARTERS,MELORA'S QUARTERS,INT.,Melora,1993-08-26,Deep Space Nine,426.txt,0.0
35568,35568,35568,35568,103,BASHIR,"Was that an attack? You do it so well, with such charm, it's hard to tell.",14   INT. MELORA'S QUARTERS,MELORA'S QUARTERS,INT.,Melora,1993-08-26,Deep Space Nine,426.txt,0.0
35569,35569,35569,35569,104,MELORA,I really don't mean to...,14   INT. MELORA'S QUARTERS,MELORA'S QUARTERS,INT.,Melora,1993-08-26,Deep Space Nine,426.txt,0.0
35570,35570,35570,35570,105,BASHIR,Sure you do.,14   INT. MELORA'S QUARTERS,MELORA'S QUARTERS,INT.,Melora,1993-08-26,Deep Space Nine,426.txt,0.0
35571,35571,35571,35571,106,MELORA,I beg your pardon?,14   INT. MELORA'S QUARTERS,MELORA'S QUARTERS,INT.,Melora,1993-08-26,Deep Space Nine,426.txt,0.0
35572,35572,35572,35572,107,MELORA,Always seemed to work pretty well. Until now.,14   INT. MELORA'S QUARTERS,MELORA'S QUARTERS,INT.,Melora,1993-08-26,Deep Space Nine,426.txt,0.0
35573,35573,35573,35573,108,BASHIR,That's the nicest thing you've said to me. Or anybody else for that matter. Are you hungry? I came here thinking about asking you to dinner.,14   INT. MELORA'S QUARTERS,MELORA'S QUARTERS,INT.,Melora,1993-08-26,Deep Space Nine,426.txt,0.0
35574,35574,35574,35574,109,MELORA,"Then afterward, we'll go dancing, I suppose.",14   INT. MELORA'S QUARTERS,MELORA'S QUARTERS,INT.,Melora,1993-08-26,Deep Space Nine,426.txt,0.0
35575,35575,35575,35575,110,BASHIR,Red alert.,14   INT. MELORA'S QUARTERS,MELORA'S QUARTERS,INT.,Melora,1993-08-26,Deep Space Nine,426.txt,0.0
35576,35576,35576,35576,111,MELORA,Sorry.,14   INT. MELORA'S QUARTERS,MELORA'S QUARTERS,INT.,Melora,1993-08-26,Deep Space Nine,426.txt,0.0
35577,35577,35577,35577,112,BASHIR,Come on... there's a new Klingon restaurant on the Promenade... if you like that sort of thing.,14   INT. MELORA'S QUARTERS,MELORA'S QUARTERS,INT.,Melora,1993-08-26,Deep Space Nine,426.txt,0.0
35578,35578,35578,35578,113,MELORA,All right.,14   INT. MELORA'S QUARTERS,MELORA'S QUARTERS,INT.,Melora,1993-08-26,Deep Space Nine,426.txt,0.0
35579,35579,35579,35579,114,QUARK,Dinner is served.,17   INT. QUARK'S,QUARK'S,INT.,Melora,1993-08-26,Deep Space Nine,426.txt,0.0
35580,35580,35580,35580,115,FALLIT KOT,I didn't order dinner.,17   INT. QUARK'S,QUARK'S,INT.,Melora,1993-08-26,Deep Space Nine,426.txt,0.0
35581,35581,35581,35581,116,QUARK,"What better way to mollify -- I mean, satisfy -- a hungry traveler than with a delicious home-cooked meal... starting with a delicate Vak clover soup...",17   INT. QUARK'S,QUARK'S,INT.,Melora,1993-08-26,Deep Space Nine,426.txt,0.8689
35582,35582,35582,35582,117,QUARK,Why spoil your appetite with soup?,17   INT. QUARK'S,QUARK'S,INT.,Melora,1993-08-26,Deep Space Nine,426.txt,0.0
35583,35583,35583,35583,118,QUARK,Here's the real treat... Jumbo Vulcan mollusks.,17   INT. QUARK'S,QUARK'S,INT.,Melora,1993-08-26,Deep Space Nine,426.txt,0.0
35584,35584,35584,35584,119,QUARK ,"Sauteed in rhombolian butter... a taste so exquisite, it's to die for... (realizes what he's just said) ... or to live for, for that matter...",17   INT. QUARK'S,QUARK'S,INT.,Melora,1993-08-26,Deep Space Nine,426.txt,0.0
35585,35585,35585,35585,120,QUARK,"Do you know dabo, Fallit?",17   INT. QUARK'S,QUARK'S,INT.,Melora,1993-08-26,Deep Space Nine,426.txt,0.0
35586,35586,35586,35586,121,QUARK,A wonderfully entertaining game and easy to learn. I took the liberty of lining up a couple of excellent tutors I happen to know...,17   INT. QUARK'S,QUARK'S,INT.,Melora,1993-08-26,Deep Space Nine,426.txt,0.0
35587,35587,35587,35587,122,QUARK,"Be sure to ask them about their ""double down"" betting strategy. If I haven't made it clear, I intend to make your stay here as delightful as you could ever imagine. So allow me to propose a toast... to... Old friends.",17   INT. QUARK'S,QUARK'S,INT.,Melora,1993-08-26,Deep Space Nine,426.txt,0.0
35588,35588,35588,35588,123,FALLIT KOT,Old debts.,17   INT. QUARK'S,QUARK'S,INT.,Melora,1993-08-26,Deep Space Nine,426.txt,0.0
35589,35589,35589,35589,124,KLINGON CHEF,Gruffs at Bashir to order --,18   INT. PROMENADE - KLINGON KIOSK - CLOSE ON A,PROMENAD,INT.,Melora,1993-08-26,Deep Space Nine,426.txt,0.0
35590,35590,35590,35590,125,CHEF,Gagh Tek Or!,18   INT. PROMENADE - KLINGON KIOSK - CLOSE ON A,PROMENAD,INT.,Melora,1993-08-26,Deep Space Nine,426.txt,0.0
35591,35591,35591,35591,126,BASHIR,Shall I order for us both?,18   INT. PROMENADE - KLINGON KIOSK - CLOSE ON A,PROMENAD,INT.,Melora,1993-08-26,Deep Space Nine,426.txt,0.0
35592,35592,35592,35592,127,MELORA,All right.,18   INT. PROMENADE - KLINGON KIOSK - CLOSE ON A,PROMENAD,INT.,Melora,1993-08-26,Deep Space Nine,426.txt,0.0
35593,35593,35593,35593,128,BASHIR,Let's see... we'll have some racht of course...,18   INT. PROMENADE - KLINGON KIOSK - CLOSE ON A,PROMENAD,INT.,Melora,1993-08-26,Deep Space Nine,426.txt,0.0
35594,35594,35594,35594,129,CHEF,Racht...,18   INT. PROMENADE - KLINGON KIOSK - CLOSE ON A,PROMENAD,INT.,Melora,1993-08-26,Deep Space Nine,426.txt,0.0
35595,35595,35595,35595,130,BASHIR,And a double order of Gladst... no sauce please...,18   INT. PROMENADE - KLINGON KIOSK - CLOSE ON A,PROMENAD,INT.,Melora,1993-08-26,Deep Space Nine,426.txt,0.0
35596,35596,35596,35596,131,CHEF,Gladst... usu bal.,18   INT. PROMENADE - KLINGON KIOSK - CLOSE ON A,PROMENAD,INT.,Melora,1993-08-26,Deep Space Nine,426.txt,0.0
35597,35597,35597,35597,132,BASHIR,"And, a side order of zilm'kach... is that too much for two people... ?",18   INT. PROMENADE - KLINGON KIOSK - CLOSE ON A,PROMENAD,INT.,Melora,1993-08-26,Deep Space Nine,426.txt,0.0
35598,35598,35598,35598,133,CHEF,Drak doo.,18   INT. PROMENADE - KLINGON KIOSK - CLOSE ON A,PROMENAD,INT.,Melora,1993-08-26,Deep Space Nine,426.txt,0.0
35599,35599,35599,35599,134,MELORA,May I? As Bashir holds it down...,18   INT. PROMENADE - KLINGON KIOSK - CLOSE ON A,PROMENAD,INT.,Melora,1993-08-26,Deep Space Nine,426.txt,0.0
35600,35600,35600,35600,135,BASHIR,Don't be alarmed.,18   INT. PROMENADE - KLINGON KIOSK - CLOSE ON A,PROMENAD,INT.,Melora,1993-08-26,Deep Space Nine,426.txt,0.0
35601,35601,35601,35601,136,MELORA,"Excuse me, Julian, I can't eat this.",18   INT. PROMENADE - KLINGON KIOSK - CLOSE ON A,PROMENAD,INT.,Melora,1993-08-26,Deep Space Nine,426.txt,0.0
35602,35602,35602,35602,137,BASHIR,I know how it looks but...,18   INT. PROMENADE - KLINGON KIOSK - CLOSE ON A,PROMENAD,INT.,Melora,1993-08-26,Deep Space Nine,426.txt,0.0
35603,35603,35603,35603,138,MELORA,P'kar tel Durg Le Frakn'l? (You call this live?),18   INT. PROMENADE - KLINGON KIOSK - CLOSE ON A,PROMENAD,INT.,Melora,1993-08-26,Deep Space Nine,426.txt,0.0
35604,35604,35604,35604,139,CHEF,"Dug a bul, rah'tar! (What's your problem, lady?)",18   INT. PROMENADE - KLINGON KIOSK - CLOSE ON A,PROMENAD,INT.,Melora,1993-08-26,Deep Space Nine,426.txt,0.0
35605,35605,35605,35605,140,MELORA,D'tel klop a bul! (This slop you call food is the problem!,18   INT. PROMENADE - KLINGON KIOSK - CLOSE ON A,PROMENAD,INT.,Melora,1993-08-26,Deep Space Nine,426.txt,0.0
35606,35606,35606,35606,141,CHEF,"Pak't pol! (If you don't like it, don't eat it!)",18   INT. PROMENADE - KLINGON KIOSK - CLOSE ON A,PROMENAD,INT.,Melora,1993-08-26,Deep Space Nine,426.txt,0.0
35607,35607,35607,35607,142,MELORA,D'kar tel G'denna! (I want to see the blood running through the veins!),18   INT. PROMENADE - KLINGON KIOSK - CLOSE ON A,PROMENAD,INT.,Melora,1993-08-26,Deep Space Nine,426.txt,0.0
35608,35608,35608,35608,143,CHEF,I like a customer who knows what she wants...,18   INT. PROMENADE - KLINGON KIOSK - CLOSE ON A,PROMENAD,INT.,Melora,1993-08-26,Deep Space Nine,426.txt,0.0
35609,35609,35609,35609,144,CHEF,Eh?,18   INT. PROMENADE - KLINGON KIOSK - CLOSE ON A,PROMENAD,INT.,Melora,1993-08-26,Deep Space Nine,426.txt,0.0
35610,35610,35610,35610,145,MELORA,G'denna.,18   INT. PROMENADE - KLINGON KIOSK - CLOSE ON A,PROMENAD,INT.,Melora,1993-08-26,Deep Space Nine,426.txt,0.0
35611,35611,35611,35611,146,MELORA,There's nothing worse then half dead Racht.,18   INT. PROMENADE - KLINGON KIOSK - CLOSE ON A,PROMENAD,INT.,Melora,1993-08-26,Deep Space Nine,426.txt,0.0
35612,35612,35612,35612,147,BASHIR,"I was ten. My father was a Federation diplomat on Invernia Two. One day we were out on a remote part of the planet when a massive ionic storm hit. While we were waiting it out, we found an Invernian girl about my age who was sick. As soon as the storm cleared, my father went for help but it was too late. I sat there... and watched her die. The next day when my father returned, his guide told us we could have treated her with a simple herb that was growing all around us.",18   INT. PROMENADE - KLINGON KIOSK - CLOSE ON A,PROMENAD,INT.,Melora,1993-08-26,Deep Space Nine,426.txt,0.0
35613,35613,35613,35613,148,BASHIR,I could have saved her life.,18   INT. PROMENADE - KLINGON KIOSK - CLOSE ON A,PROMENAD,INT.,Melora,1993-08-26,Deep Space Nine,426.txt,0.0
35614,35614,35614,35614,149,MELORA,And so you started to study medicine.,18   INT. PROMENADE - KLINGON KIOSK - CLOSE ON A,PROMENAD,INT.,Melora,1993-08-26,Deep Space Nine,426.txt,0.0
35615,35615,35615,35615,150,BASHIR,"Yes... well, actually, first I started to study tennis.",18   INT. PROMENADE - KLINGON KIOSK - CLOSE ON A,PROMENAD,INT.,Melora,1993-08-26,Deep Space Nine,426.txt,0.0
35616,35616,35616,35616,151,MELORA,Tennis?,18   INT. PROMENADE - KLINGON KIOSK - CLOSE ON A,PROMENAD,INT.,Melora,1993-08-26,Deep Space Nine,426.txt,0.0
35617,35617,35617,35617,152,BASHIR,I really thought about making a career of it for awhile...,18   INT. PROMENADE - KLINGON KIOSK - CLOSE ON A,PROMENAD,INT.,Melora,1993-08-26,Deep Space Nine,426.txt,0.0
35618,35618,35618,35618,153,MELORA,You must be very good...,18   INT. PROMENADE - KLINGON KIOSK - CLOSE ON A,PROMENAD,INT.,Melora,1993-08-26,Deep Space Nine,426.txt,0.0
35619,35619,35619,35619,154,BASHIR,"I used to think so, then I went to my first major competition... my opponent served first and I heard it bounce past me and the computer announced it was good and I knew I was in trouble... it turned out I had a bit more talent at medicine than tennis...",18   INT. PROMENADE - KLINGON KIOSK - CLOSE ON A,PROMENAD,INT.,Melora,1993-08-26,Deep Space Nine,426.txt,0.0
35620,35620,35620,35620,155,MELORA,This has been delightful. Thank you.,18   INT. PROMENADE - KLINGON KIOSK - CLOSE ON A,PROMENAD,INT.,Melora,1993-08-26,Deep Space Nine,426.txt,0.0
35621,35621,35621,35621,156,BASHIR,I'll never look at a Racht the same way again.,18   INT. PROMENADE - KLINGON KIOSK - CLOSE ON A,PROMENAD,INT.,Melora,1993-08-26,Deep Space Nine,426.txt,0.0
35622,35622,35622,35622,157,MELORA,I have an early mission tomorrow. I better get some rest.,18   INT. PROMENADE - KLINGON KIOSK - CLOSE ON A,PROMENAD,INT.,Melora,1993-08-26,Deep Space Nine,426.txt,0.0
35623,35623,35623,35623,158,BASHIR,"Of course. Come on, I'll take you home.",18   INT. PROMENADE - KLINGON KIOSK - CLOSE ON A,PROMENAD,INT.,Melora,1993-08-26,Deep Space Nine,426.txt,0.0
35624,35624,35624,35624,159,DAX,"Dax to Pazlar. Computer, level one security access...",23   INT. HABITAT CORRIDOR,HABITAT CORRIDOR,INT.,Melora,1993-08-26,Deep Space Nine,426.txt,0.0
35625,35625,35625,35625,160,DAX,Ensign Pazlar?,23   INT. HABITAT CORRIDOR,HABITAT CORRIDOR,INT.,Melora,1993-08-26,Deep Space Nine,426.txt,0.0
35626,35626,35626,35626,161,DAX,"Computer, locate Ensign Melora Pazlar.",23   INT. HABITAT CORRIDOR,HABITAT CORRIDOR,INT.,Melora,1993-08-26,Deep Space Nine,426.txt,0.0
35627,35627,35627,35627,162,COMPUTER,"Docking Level Twenty-Two, Section Fourteen.",23   INT. HABITAT CORRIDOR,HABITAT CORRIDOR,INT.,Melora,1993-08-26,Deep Space Nine,426.txt,0.0
35628,35628,35628,35628,163,DAX,Section Fourteen?,23   INT. HABITAT CORRIDOR,HABITAT CORRIDOR,INT.,Melora,1993-08-26,Deep Space Nine,426.txt,0.0
35629,35629,35629,35629,164,DAX,We've got to get you to the Infirmary...,23   INT. HABITAT CORRIDOR,HABITAT CORRIDOR,INT.,Melora,1993-08-26,Deep Space Nine,426.txt,0.0
35630,35630,35630,35630,165,MELORA,"(breathing heavily, agonizing) It's my own fault... I decided... I could use an extra astrometric array after going through the mission profile again... I came to the storage bay to get one... my mind was already in the Gamma Quadrant... I wasn't... paying enough attention to what I was doing... I guess my boot... didn't make the lip of the door... I fell on my controls...",23   INT. HABITAT CORRIDOR,HABITAT CORRIDOR,INT.,Melora,1993-08-26,Deep Space Nine,426.txt,0.0
35631,35631,35631,35631,166,DAX,Dax to Bashir. Ensign Pazlar's had a minor accident. We need to see you in the Infirmary.,23   INT. HABITAT CORRIDOR,HABITAT CORRIDOR,INT.,Melora,1993-08-26,Deep Space Nine,426.txt,0.0
35632,35632,35632,35632,167,BASHIR,Acknowledged. I'll be there in three minutes.,23   INT. HABITAT CORRIDOR,HABITAT CORRIDOR,INT.,Melora,1993-08-26,Deep Space Nine,426.txt,0.0
35633,35633,35633,35633,168,MELORA,What kind... of architect would deliberately... design a raised rim at the entrance to every door...,23   INT. HABITAT CORRIDOR,HABITAT CORRIDOR,INT.,Melora,1993-08-26,Deep Space Nine,426.txt,0.0
35634,35634,35634,35634,169,MELORA,So much for the dangers of the Gamma Quadrant... I didn't even make it there...,29   INT. INFIRMARY,INFIRMARY,INT.,Melora,1993-08-26,Deep Space Nine,426.txt,0.0
35635,35635,35635,35635,170,BASHIR,You will. There's no concussion... you can reschedule your mission for tomorrow...,29   INT. INFIRMARY,INFIRMARY,INT.,Melora,1993-08-26,Deep Space Nine,426.txt,0.0
35636,35636,35636,35636,171,MELORA,"It was so... (sighs, ""humiliating"" is implied) ... flopping back and forth... like a broken toy... I didn't want anyone to find me like that... but I couldn't get up by myself...",29   INT. INFIRMARY,INFIRMARY,INT.,Melora,1993-08-26,Deep Space Nine,426.txt,0.0
35637,35637,35637,35637,172,BASHIR,Why didn't you wait for Dax before you went into an area that wasn't modified with ramps...,29   INT. INFIRMARY,INFIRMARY,INT.,Melora,1993-08-26,Deep Space Nine,426.txt,0.0
35638,35638,35638,35638,173,MELORA,I didn't need Dax... if I'd just paid attention...,29   INT. INFIRMARY,INFIRMARY,INT.,Melora,1993-08-26,Deep Space Nine,426.txt,0.0
35639,35639,35639,35639,174,BASHIR,"Melora... no one on this station is completely independent... in space, we all depend on one another to some degree...",29   INT. INFIRMARY,INFIRMARY,INT.,Melora,1993-08-26,Deep Space Nine,426.txt,0.0
35640,35640,35640,35640,175,MELORA,I just want you all to know you can depend on me...,29   INT. INFIRMARY,INFIRMARY,INT.,Melora,1993-08-26,Deep Space Nine,426.txt,0.0
35641,35641,35641,35641,176,BASHIR,"Okay, you've proven that... what do the rest of us have to do to convince you?",29   INT. INFIRMARY,INFIRMARY,INT.,Melora,1993-08-26,Deep Space Nine,426.txt,0.0
35642,35642,35642,35642,177,MELORA,Of what?,29   INT. INFIRMARY,INFIRMARY,INT.,Melora,1993-08-26,Deep Space Nine,426.txt,0.0
35643,35643,35643,35643,178,BASHIR,That you can depend on us.,29   INT. INFIRMARY,INFIRMARY,INT.,Melora,1993-08-26,Deep Space Nine,426.txt,0.0
35644,35644,35644,35644,179,BASHIR,Have you ever heard of the work Nathaniel Teros did with low gravity species thirty years ago?,30   INT. HABITAT CORRIDOR,HABITAT CORRIDOR,INT.,Melora,1993-08-26,Deep Space Nine,426.txt,0.0
35645,35645,35645,35645,180,MELORA,Neuromuscular adaptation? It had no practical success at all.,30   INT. HABITAT CORRIDOR,HABITAT CORRIDOR,INT.,Melora,1993-08-26,Deep Space Nine,426.txt,0.0
35646,35646,35646,35646,181,BASHIR,"No, but the principles were sound... and a lot of progress has been made in neurochemistry since then...",30   INT. HABITAT CORRIDOR,HABITAT CORRIDOR,INT.,Melora,1993-08-26,Deep Space Nine,426.txt,0.0
35647,35647,35647,35647,182,MELORA,You think some day I could throw away the chair... ?,30   INT. HABITAT CORRIDOR,HABITAT CORRIDOR,INT.,Melora,1993-08-26,Deep Space Nine,426.txt,0.0
35648,35648,35648,35648,183,BASHIR,Theoretically... perhaps...,30   INT. HABITAT CORRIDOR,HABITAT CORRIDOR,INT.,Melora,1993-08-26,Deep Space Nine,426.txt,0.0
35649,35649,35649,35649,184,MELORA,Would you like to come in... ?,30   INT. HABITAT CORRIDOR,HABITAT CORRIDOR,INT.,Melora,1993-08-26,Deep Space Nine,426.txt,0.0
35650,35650,35650,35650,185,BASHIR,I know how much you look forward to turning down the gravity...,30   INT. HABITAT CORRIDOR,HABITAT CORRIDOR,INT.,Melora,1993-08-26,Deep Space Nine,426.txt,0.0
35651,35651,35651,35651,186,MELORA,Don't let that stop you...,30   INT. HABITAT CORRIDOR,HABITAT CORRIDOR,INT.,Melora,1993-08-26,Deep Space Nine,426.txt,0.0
35652,35652,35652,35652,187,MELORA,You may want to brace yourself until you get used to it...,31   INT. MELORA'S QUARTERS (OPTICAL),MELORA'S QUARTERS,INT.,Melora,1993-08-26,Deep Space Nine,426.txt,0.0
35653,35653,35653,35653,188,MELORA,"Come on, Julian.",31   INT. MELORA'S QUARTERS (OPTICAL),MELORA'S QUARTERS,INT.,Melora,1993-08-26,Deep Space Nine,426.txt,0.0
35654,35654,35654,35654,189,BASHIR,What do I do?,31   INT. MELORA'S QUARTERS (OPTICAL),MELORA'S QUARTERS,INT.,Melora,1993-08-26,Deep Space Nine,426.txt,0.0
35655,35655,35655,35655,190,MELORA,Just give a gentle push... it's easy.,31   INT. MELORA'S QUARTERS (OPTICAL),MELORA'S QUARTERS,INT.,Melora,1993-08-26,Deep Space Nine,426.txt,0.0
