Unnamed: 0.2,Unnamed: 0.1,Unnamed: 0,index,line,character,quote,scene,location,view,episode,date,series,file,sentiment
21662,21662,21662,21662,81,SOLBOR,Cancel an appearance before the Vedek Assembly?,14   INT. KAI WINN'S OFFICE,KAI WINN'S OFFICE,INT.,The Changing Face of Evil,1999-02-03,Deep Space Nine,570.txt,0.0
21663,21663,21663,21663,82,WINN,Just do it. Cancel everything.,14   INT. KAI WINN'S OFFICE,KAI WINN'S OFFICE,INT.,The Changing Face of Evil,1999-02-03,Deep Space Nine,570.txt,0.0
21664,21664,21664,21664,83,SOLBOR,As you wish. May I ask what exactly you will be doing?,14   INT. KAI WINN'S OFFICE,KAI WINN'S OFFICE,INT.,The Changing Face of Evil,1999-02-03,Deep Space Nine,570.txt,0.0
21665,21665,21665,21665,84,WINN,"You certainly may not. (controlling her temper) But if you must know, I'll be devoting most of my time to study and meditation.",14   INT. KAI WINN'S OFFICE,KAI WINN'S OFFICE,INT.,The Changing Face of Evil,1999-02-03,Deep Space Nine,570.txt,0.0
21666,21666,21666,21666,85,SOLBOR,I see.,14   INT. KAI WINN'S OFFICE,KAI WINN'S OFFICE,INT.,The Changing Face of Evil,1999-02-03,Deep Space Nine,570.txt,0.0
21667,21667,21667,21667,86,DUKAT,"Solbor, I'll have my breakfast in here this morning. Eminence, would you care for anything?",14   INT. KAI WINN'S OFFICE,KAI WINN'S OFFICE,INT.,The Changing Face of Evil,1999-02-03,Deep Space Nine,570.txt,0.0
21668,21668,21668,21668,87,WINN,I'm not hungry.,14   INT. KAI WINN'S OFFICE,KAI WINN'S OFFICE,INT.,The Changing Face of Evil,1999-02-03,Deep Space Nine,570.txt,0.0
21669,21669,21669,21669,88,DUKAT,"But you should eat. After all, Bajor is only as strong as its Kai --",14   INT. KAI WINN'S OFFICE,KAI WINN'S OFFICE,INT.,The Changing Face of Evil,1999-02-03,Deep Space Nine,570.txt,0.0
21670,21670,21670,21670,89,WINN,I said I wasn't hungry.,14   INT. KAI WINN'S OFFICE,KAI WINN'S OFFICE,INT.,The Changing Face of Evil,1999-02-03,Deep Space Nine,570.txt,0.0
21671,21671,21671,21671,90,WINN,"Do as he asks. And please, write a note to the Vedeks, expressing my sincere apologies for having to postpone our meeting.",14   INT. KAI WINN'S OFFICE,KAI WINN'S OFFICE,INT.,The Changing Face of Evil,1999-02-03,Deep Space Nine,570.txt,0.0
21672,21672,21672,21672,91,SOLBOR,(pleased by her concern) I'll see to it immediately.,14   INT. KAI WINN'S OFFICE,KAI WINN'S OFFICE,INT.,The Changing Face of Evil,1999-02-03,Deep Space Nine,570.txt,0.0
21673,21673,21673,21673,92,DUKAT,What a tiresome little man.,14   INT. KAI WINN'S OFFICE,KAI WINN'S OFFICE,INT.,The Changing Face of Evil,1999-02-03,Deep Space Nine,570.txt,0.0
21674,21674,21674,21674,93,WINN,"Sometimes, I think you forget your place, Anjohl.",14   INT. KAI WINN'S OFFICE,KAI WINN'S OFFICE,INT.,The Changing Face of Evil,1999-02-03,Deep Space Nine,570.txt,0.0
21675,21675,21675,21675,94,DUKAT,Forgive me if I've offended you in any way. I am but a moon made warm by the light of your sun.,14   INT. KAI WINN'S OFFICE,KAI WINN'S OFFICE,INT.,The Changing Face of Evil,1999-02-03,Deep Space Nine,570.txt,0.0
21676,21676,21676,21676,95,WINN,I hope you're a better farmer than you are a poet.,14   INT. KAI WINN'S OFFICE,KAI WINN'S OFFICE,INT.,The Changing Face of Evil,1999-02-03,Deep Space Nine,570.txt,0.0
21677,21677,21677,21677,96,DUKAT,Something's wrong... tell me what's bothering you?,14   INT. KAI WINN'S OFFICE,KAI WINN'S OFFICE,INT.,The Changing Face of Evil,1999-02-03,Deep Space Nine,570.txt,0.0
21678,21678,21678,21678,97,WINN,Everything! The prayers... the rituals... these robes -- I can't keep pretending I follow the path of the Prophets any longer!,14   INT. KAI WINN'S OFFICE,KAI WINN'S OFFICE,INT.,The Changing Face of Evil,1999-02-03,Deep Space Nine,570.txt,0.0
21679,21679,21679,21679,98,DUKAT,You won't have to. The Pah- wraiths are waiting to embrace you.,14   INT. KAI WINN'S OFFICE,KAI WINN'S OFFICE,INT.,The Changing Face of Evil,1999-02-03,Deep Space Nine,570.txt,0.0
21680,21680,21680,21680,99,WINN,So you keep saying -- but when is it going to happen?,14   INT. KAI WINN'S OFFICE,KAI WINN'S OFFICE,INT.,The Changing Face of Evil,1999-02-03,Deep Space Nine,570.txt,0.0
21681,21681,21681,21681,100,DUKAT,As soon as we release them from the fire caves.,14   INT. KAI WINN'S OFFICE,KAI WINN'S OFFICE,INT.,The Changing Face of Evil,1999-02-03,Deep Space Nine,570.txt,0.0
21682,21682,21682,21682,101,WINN,Release them? But... the prophecies...,14   INT. KAI WINN'S OFFICE,KAI WINN'S OFFICE,INT.,The Changing Face of Evil,1999-02-03,Deep Space Nine,570.txt,0.0
21683,21683,21683,21683,102,DUKAT,What about them?,14   INT. KAI WINN'S OFFICE,KAI WINN'S OFFICE,INT.,The Changing Face of Evil,1999-02-03,Deep Space Nine,570.txt,0.0
21684,21684,21684,21684,103,WINN,They warn that the release of the Pah-wraiths will mean the end of Bajor.,14   INT. KAI WINN'S OFFICE,KAI WINN'S OFFICE,INT.,The Changing Face of Evil,1999-02-03,Deep Space Nine,570.txt,0.0
21685,21685,21685,21685,104,DUKAT,"The old Bajor, perhaps. But a new Bajor will arise from its ashes and the Restoration will begin.",14   INT. KAI WINN'S OFFICE,KAI WINN'S OFFICE,INT.,The Changing Face of Evil,1999-02-03,Deep Space Nine,570.txt,0.0
21686,21686,21686,21686,105,WINN,And who will be left to see it?,14   INT. KAI WINN'S OFFICE,KAI WINN'S OFFICE,INT.,The Changing Face of Evil,1999-02-03,Deep Space Nine,570.txt,0.0
21687,21687,21687,21687,106,DUKAT,Those that the gods find worthy. It will be the dawn of paradise. And you... you are destined to rule it.,14   INT. KAI WINN'S OFFICE,KAI WINN'S OFFICE,INT.,The Changing Face of Evil,1999-02-03,Deep Space Nine,570.txt,0.0
21688,21688,21688,21688,107,WINN,You're sure of this?,14   INT. KAI WINN'S OFFICE,KAI WINN'S OFFICE,INT.,The Changing Face of Evil,1999-02-03,Deep Space Nine,570.txt,0.0
21689,21689,21689,21689,108,DUKAT,It is meant to be.,14   INT. KAI WINN'S OFFICE,KAI WINN'S OFFICE,INT.,The Changing Face of Evil,1999-02-03,Deep Space Nine,570.txt,0.0
21690,21690,21690,21690,109,WINN,And what will become of you?,14   INT. KAI WINN'S OFFICE,KAI WINN'S OFFICE,INT.,The Changing Face of Evil,1999-02-03,Deep Space Nine,570.txt,0.0
21691,21691,21691,21691,110,DUKAT,"I will be by your side for as ong as you need me. But first, we have to release the Pah- wraiths...",14   INT. KAI WINN'S OFFICE,KAI WINN'S OFFICE,INT.,The Changing Face of Evil,1999-02-03,Deep Space Nine,570.txt,0.0
21692,21692,21692,21692,111,WINN,And how do we do that?,14   INT. KAI WINN'S OFFICE,KAI WINN'S OFFICE,INT.,The Changing Face of Evil,1999-02-03,Deep Space Nine,570.txt,0.0
21693,21693,21693,21693,112,DUKAT,The answer is in the text of the Kosst Amojan.,14   INT. KAI WINN'S OFFICE,KAI WINN'S OFFICE,INT.,The Changing Face of Evil,1999-02-03,Deep Space Nine,570.txt,0.0
21694,21694,21694,21694,113,WINN,But it is forbidden for anyone to open that book.,14   INT. KAI WINN'S OFFICE,KAI WINN'S OFFICE,INT.,The Changing Face of Evil,1999-02-03,Deep Space Nine,570.txt,0.0
21695,21695,21695,21695,114,DUKAT,Anyone except the Kai.,14   INT. KAI WINN'S OFFICE,KAI WINN'S OFFICE,INT.,The Changing Face of Evil,1999-02-03,Deep Space Nine,570.txt,0.0
21696,21696,21696,21696,115,WINN,It is said to contain great evil...,14   INT. KAI WINN'S OFFICE,KAI WINN'S OFFICE,INT.,The Changing Face of Evil,1999-02-03,Deep Space Nine,570.txt,0.0
21697,21697,21697,21697,116,DUKAT,You have nothing to fear. I'll be right there with you.,14   INT. KAI WINN'S OFFICE,KAI WINN'S OFFICE,INT.,The Changing Face of Evil,1999-02-03,Deep Space Nine,570.txt,0.0
21698,21698,21698,21698,117,WINN,Did I say I was afraid?,14   INT. KAI WINN'S OFFICE,KAI WINN'S OFFICE,INT.,The Changing Face of Evil,1999-02-03,Deep Space Nine,570.txt,0.0
21699,21699,21699,21699,118,BASHIR ,Right here. The wooden palisade on the south wall...,16   INT. QUARK'S,QUARK'S,INT.,The Changing Face of Evil,1999-02-03,Deep Space Nine,570.txt,0.0
21700,21700,21700,21700,119,BASHIR,If we could make that part of the compound less vulnerable...,16   INT. QUARK'S,QUARK'S,INT.,The Changing Face of Evil,1999-02-03,Deep Space Nine,570.txt,0.0
21701,21701,21701,21701,120,O'BRIEN,"What are you talking about, Julian? It wasn't the south wall that was a problem. They came over the north wall. By Travis's position.",16   INT. QUARK'S,QUARK'S,INT.,The Changing Face of Evil,1999-02-03,Deep Space Nine,570.txt,0.0
21702,21702,21702,21702,121,BASHIR,"I know where they came over, Miles -- I'm Travis, remember? I say we strengthen the south wall, the north wall, and anything else that'll help keep the enemy out.",16   INT. QUARK'S,QUARK'S,INT.,The Changing Face of Evil,1999-02-03,Deep Space Nine,570.txt,0.0
21703,21703,21703,21703,122,O'BRIEN,"But if we do that, it wouldn't be the battle of the Alamo, now would it?",16   INT. QUARK'S,QUARK'S,INT.,The Changing Face of Evil,1999-02-03,Deep Space Nine,570.txt,0.0
21704,21704,21704,21704,123,BASHIR,I don't care. I just want to win -- just once.,16   INT. QUARK'S,QUARK'S,INT.,The Changing Face of Evil,1999-02-03,Deep Space Nine,570.txt,0.0
21705,21705,21705,21705,124,O'BRIEN,Then be Santa Anna. He wins every time.,16   INT. QUARK'S,QUARK'S,INT.,The Changing Face of Evil,1999-02-03,Deep Space Nine,570.txt,0.0
21706,21706,21706,21706,125,BASHIR,Maybe if we put more cannon in the long barracks...,16   INT. QUARK'S,QUARK'S,INT.,The Changing Face of Evil,1999-02-03,Deep Space Nine,570.txt,0.0
21707,21707,21707,21707,126,O'BRIEN,What are you doing? Do you know how long it took me to build this thing?,16   INT. QUARK'S,QUARK'S,INT.,The Changing Face of Evil,1999-02-03,Deep Space Nine,570.txt,0.0
21708,21708,21708,21708,127,QUARK,I don't believe the two of you. Your homeworld has been attacked. The Breen have joined forces with the Dominion. And you sit there calmly playing games.,16   INT. QUARK'S,QUARK'S,INT.,The Changing Face of Evil,1999-02-03,Deep Space Nine,570.txt,0.0
21709,21709,21709,21709,128,BASHIR,Haven't you ever heard of grace under pressure?,16   INT. QUARK'S,QUARK'S,INT.,The Changing Face of Evil,1999-02-03,Deep Space Nine,570.txt,0.0
21710,21710,21710,21710,129,QUARK,But shouldn't you be doing something more productive?,16   INT. QUARK'S,QUARK'S,INT.,The Changing Face of Evil,1999-02-03,Deep Space Nine,570.txt,0.0
21711,21711,21711,21711,130,O'BRIEN,I just spent fourteen hours recalibrating the station's weapons array.,16   INT. QUARK'S,QUARK'S,INT.,The Changing Face of Evil,1999-02-03,Deep Space Nine,570.txt,0.0
21712,21712,21712,21712,131,BASHIR,And I just finished a complete run-through of the emergency support team protocols.,16   INT. QUARK'S,QUARK'S,INT.,The Changing Face of Evil,1999-02-03,Deep Space Nine,570.txt,0.0
21713,21713,21713,21713,132,QUARK,Then you do expect an attack on the station?,16   INT. QUARK'S,QUARK'S,INT.,The Changing Face of Evil,1999-02-03,Deep Space Nine,570.txt,0.0
21714,21714,21714,21714,133,BASHIR,"Anything's possible. (to O'Brien, re: the model) What if we build a moat?",16   INT. QUARK'S,QUARK'S,INT.,The Changing Face of Evil,1999-02-03,Deep Space Nine,570.txt,0.0
21715,21715,21715,21715,134,O'BRIEN,A moat? Around the Alamo?,16   INT. QUARK'S,QUARK'S,INT.,The Changing Face of Evil,1999-02-03,Deep Space Nine,570.txt,0.0
21716,21716,21716,21716,135,BASHIR,All we have to do is widen that stream -- maybe make it a little deeper.,16   INT. QUARK'S,QUARK'S,INT.,The Changing Face of Evil,1999-02-03,Deep Space Nine,570.txt,0.0
21717,21717,21717,21717,136,QUARK,"I say we build a moat around the station. Tell me the truth, do you think this place can withstand an attack by the Breen?",16   INT. QUARK'S,QUARK'S,INT.,The Changing Face of Evil,1999-02-03,Deep Space Nine,570.txt,0.0
21718,21718,21718,21718,137,O'BRIEN,Good question.,16   INT. QUARK'S,QUARK'S,INT.,The Changing Face of Evil,1999-02-03,Deep Space Nine,570.txt,0.0
21719,21719,21719,21719,138,QUARK,"How about a good answer -- like ""yes, we can withstand an attack by the Breen""?",16   INT. QUARK'S,QUARK'S,INT.,The Changing Face of Evil,1999-02-03,Deep Space Nine,570.txt,0.0
21720,21720,21720,21720,139,O'BRIEN,Quark... I could say that. But I'd be guessing.,16   INT. QUARK'S,QUARK'S,INT.,The Changing Face of Evil,1999-02-03,Deep Space Nine,570.txt,0.0
21721,21721,21721,21721,140,QUARK,Guessing?,16   INT. QUARK'S,QUARK'S,INT.,The Changing Face of Evil,1999-02-03,Deep Space Nine,570.txt,0.0
21722,21722,21722,21722,141,BASHIR,"What he means is that there's a good chance we're going to lose the station, lose the war, and wind up dead in the process.",16   INT. QUARK'S,QUARK'S,INT.,The Changing Face of Evil,1999-02-03,Deep Space Nine,570.txt,0.0
21723,21723,21723,21723,142,QUARK,Then how can you sit there enjoying yourselves pretending nothing's wrong.,16   INT. QUARK'S,QUARK'S,INT.,The Changing Face of Evil,1999-02-03,Deep Space Nine,570.txt,0.0
21724,21724,21724,21724,143,O'BRIEN,Grace under pressure. Haven't you been listening?,16   INT. QUARK'S,QUARK'S,INT.,The Changing Face of Evil,1999-02-03,Deep Space Nine,570.txt,0.1531
21725,21725,21725,21725,144,WORF,He is a child.,16   INT. QUARK'S,QUARK'S,INT.,The Changing Face of Evil,1999-02-03,Deep Space Nine,570.txt,0.0
21726,21726,21726,21726,145,EZRI,Miles does have a certain cherubic quality...,16   INT. QUARK'S,QUARK'S,INT.,The Changing Face of Evil,1999-02-03,Deep Space Nine,570.txt,0.2732
21727,21727,21727,21727,146,WORF,"I am talking about Doctor Bashir, and you know it. Are you certain he's the one?",16   INT. QUARK'S,QUARK'S,INT.,The Changing Face of Evil,1999-02-03,Deep Space Nine,570.txt,0.0
21728,21728,21728,21728,147,EZRI,I'm not certain about anything. But he is handsome.,16   INT. QUARK'S,QUARK'S,INT.,The Changing Face of Evil,1999-02-03,Deep Space Nine,570.txt,0.0
21729,21729,21729,21729,148,WORF,"You deserve more than ""handsome."" He gets excited playing with toys.",16   INT. QUARK'S,QUARK'S,INT.,The Changing Face of Evil,1999-02-03,Deep Space Nine,570.txt,0.0
21730,21730,21730,21730,149,EZRI,"He knows how to have a good time. Besides, it's not exactly a toy... you heard Chief O'Brien, he spent hours building it.",16   INT. QUARK'S,QUARK'S,INT.,The Changing Face of Evil,1999-02-03,Deep Space Nine,570.txt,0.0
21731,21731,21731,21731,150,WORF,I see it is hopeless to try to reason with you.,16   INT. QUARK'S,QUARK'S,INT.,The Changing Face of Evil,1999-02-03,Deep Space Nine,570.txt,0.0
21732,21732,21732,21732,151,EZRI,I know. Maybe I am in love with him. You think I should tell him how I feel?,16   INT. QUARK'S,QUARK'S,INT.,The Changing Face of Evil,1999-02-03,Deep Space Nine,570.txt,0.0
21733,21733,21733,21733,152,WORF,"If that will make you happy, yes.",16   INT. QUARK'S,QUARK'S,INT.,The Changing Face of Evil,1999-02-03,Deep Space Nine,570.txt,0.0
21734,21734,21734,21734,153,EZRI,"You're a good friend, Worf.",16   INT. QUARK'S,QUARK'S,INT.,The Changing Face of Evil,1999-02-03,Deep Space Nine,570.txt,0.0
21735,21735,21735,21735,154,WORF,"I know. (then after a beat of looking back at Bashir) They are wasting their time. No matter how much planning they do, they cannot successfully defend that mission against an enemy numbering in the thousands. Not without more men.",16   INT. QUARK'S,QUARK'S,INT.,The Changing Face of Evil,1999-02-03,Deep Space Nine,570.txt,0.0
21736,21736,21736,21736,155,EZRI,If you want to go over there and help them...,16   INT. QUARK'S,QUARK'S,INT.,The Changing Face of Evil,1999-02-03,Deep Space Nine,570.txt,0.0
21737,21737,21737,21737,156,EZRI,Just a thought.,16   INT. QUARK'S,QUARK'S,INT.,The Changing Face of Evil,1999-02-03,Deep Space Nine,570.txt,0.0
21738,21738,21738,21738,157,WEYOUN,Damar? You're up early.,19   INT. DOMINION HEADQUARTERS - DAY,DOMINION HEADQUARTER,INT.,The Changing Face of Evil,1999-02-03,Deep Space Nine,570.txt,0.0
21739,21739,21739,21739,158,DAMAR,Am I?,19   INT. DOMINION HEADQUARTERS - DAY,DOMINION HEADQUARTER,INT.,The Changing Face of Evil,1999-02-03,Deep Space Nine,570.txt,0.0
21740,21740,21740,21740,159,WEYOUN,"Yes, you are. Unless you haven't gone to bed yet.",19   INT. DOMINION HEADQUARTERS - DAY,DOMINION HEADQUARTER,INT.,The Changing Face of Evil,1999-02-03,Deep Space Nine,570.txt,0.0
21741,21741,21741,21741,160,DAMAR,"Actually, I had a very restful sleep.",19   INT. DOMINION HEADQUARTERS - DAY,DOMINION HEADQUARTER,INT.,The Changing Face of Evil,1999-02-03,Deep Space Nine,570.txt,0.0
21742,21742,21742,21742,161,WEYOUN,Did you? How nice.,19   INT. DOMINION HEADQUARTERS - DAY,DOMINION HEADQUARTER,INT.,The Changing Face of Evil,1999-02-03,Deep Space Nine,570.txt,0.0
21743,21743,21743,21743,162,DAMAR,I had no idea the Breen could mobilize such a large fleet so quickly.,19   INT. DOMINION HEADQUARTERS - DAY,DOMINION HEADQUARTER,INT.,The Changing Face of Evil,1999-02-03,Deep Space Nine,570.txt,0.0
21744,21744,21744,21744,163,WEYOUN,"Our new allies are full of surprises, aren't they? You know those refrigeration suits they wear...",19   INT. DOMINION HEADQUARTERS - DAY,DOMINION HEADQUARTER,INT.,The Changing Face of Evil,1999-02-03,Deep Space Nine,570.txt,0.0
21745,21745,21745,21745,164,DAMAR,What about them?,19   INT. DOMINION HEADQUARTERS - DAY,DOMINION HEADQUARTER,INT.,The Changing Face of Evil,1999-02-03,Deep Space Nine,570.txt,0.0
21746,21746,21746,21746,165,WEYOUN,"I'm sure you've read the intelligence reports that say their homeworld is a frozen wasteland. Well, it's not true. The climate on their planet is quite comfortable.",19   INT. DOMINION HEADQUARTERS - DAY,DOMINION HEADQUARTER,INT.,The Changing Face of Evil,1999-02-03,Deep Space Nine,570.txt,0.0
21747,21747,21747,21747,166,DAMAR,Then why do they wear refrigeration suits?,19   INT. DOMINION HEADQUARTERS - DAY,DOMINION HEADQUARTER,INT.,The Changing Face of Evil,1999-02-03,Deep Space Nine,570.txt,0.0
21748,21748,21748,21748,167,WEYOUN,"They won't say. You see what I mean? They're full of surprises. There's something different about you today, Damar... I can't quite put my finger on it. It's like you're only half-dressed...",19   INT. DOMINION HEADQUARTERS - DAY,DOMINION HEADQUARTER,INT.,The Changing Face of Evil,1999-02-03,Deep Space Nine,570.txt,0.0
21749,21749,21749,21749,168,WEYOUN,You don't have a bottle in your hand...,19   INT. DOMINION HEADQUARTERS - DAY,DOMINION HEADQUARTER,INT.,The Changing Face of Evil,1999-02-03,Deep Space Nine,570.txt,0.0
21750,21750,21750,21750,169,DAMAR,Don't you have anything better to do than to stand here and --,19   INT. DOMINION HEADQUARTERS - DAY,DOMINION HEADQUARTER,INT.,The Changing Face of Evil,1999-02-03,Deep Space Nine,570.txt,0.0
21751,21751,21751,21751,170,WEYOUN,You've regained your confidence.,19   INT. DOMINION HEADQUARTERS - DAY,DOMINION HEADQUARTER,INT.,The Changing Face of Evil,1999-02-03,Deep Space Nine,570.txt,0.0
21752,21752,21752,21752,171,DAMAR,I wasn't aware I'd lost it.,19   INT. DOMINION HEADQUARTERS - DAY,DOMINION HEADQUARTER,INT.,The Changing Face of Evil,1999-02-03,Deep Space Nine,570.txt,0.0
21753,21753,21753,21753,172,WEYOUN,"Come now, Damar... you thought you'd backed the wrong side.",19   INT. DOMINION HEADQUARTERS - DAY,DOMINION HEADQUARTER,INT.,The Changing Face of Evil,1999-02-03,Deep Space Nine,570.txt,0.0
21754,21754,21754,21754,173,WEYOUN ,You thought the Dominion was going to lose this war... and drag Cardassia down with it.,19   INT. DOMINION HEADQUARTERS - DAY,DOMINION HEADQUARTER,INT.,The Changing Face of Evil,1999-02-03,Deep Space Nine,570.txt,0.0
21755,21755,21755,21755,174,DAMAR,"You must admit, things were looking rather grim.",19   INT. DOMINION HEADQUARTERS - DAY,DOMINION HEADQUARTER,INT.,The Changing Face of Evil,1999-02-03,Deep Space Nine,570.txt,0.0
21756,21756,21756,21756,175,WEYOUN,Perhaps for a moment or two... but that's no excuse to lose faith in oneself -- or in one's allies.,19   INT. DOMINION HEADQUARTERS - DAY,DOMINION HEADQUARTER,INT.,The Changing Face of Evil,1999-02-03,Deep Space Nine,570.txt,0.0
21757,21757,21757,21757,176,WEYOUN,But now... it's as if you've groped your way through a dark tunnel and stepped into the light once again. And what does that light tell you? That the Dominion will prevail. That the Federation will be conquered and a new era of peace and prosperity will blanket the Alpha Quadrant.,19   INT. DOMINION HEADQUARTERS - DAY,DOMINION HEADQUARTER,INT.,The Changing Face of Evil,1999-02-03,Deep Space Nine,570.txt,0.0
21758,21758,21758,21758,177,DAMAR,You know me so well.,19   INT. DOMINION HEADQUARTERS - DAY,DOMINION HEADQUARTER,INT.,The Changing Face of Evil,1999-02-03,Deep Space Nine,570.txt,0.0
21759,21759,21759,21759,178,WEYOUN,"Really, Damar... I hope you won't allow that Cardassian-sized ego of yours to spoil our victory. And I do mean ""our victory."" Yours... mine...",19   INT. DOMINION HEADQUARTERS - DAY,DOMINION HEADQUARTER,INT.,The Changing Face of Evil,1999-02-03,Deep Space Nine,570.txt,0.3637
21760,21760,21760,21760,179,DAMAR,And the Breen.,19   INT. DOMINION HEADQUARTERS - DAY,DOMINION HEADQUARTER,INT.,The Changing Face of Evil,1999-02-03,Deep Space Nine,570.txt,0.0
21761,21761,21761,21761,180,WEYOUN,"Yes, and the Breen.",19   INT. DOMINION HEADQUARTERS - DAY,DOMINION HEADQUARTER,INT.,The Changing Face of Evil,1999-02-03,Deep Space Nine,570.txt,0.4019
21762,21762,21762,21762,181,DAMAR,"We're just one big, happy family, aren't we?",19   INT. DOMINION HEADQUARTERS - DAY,DOMINION HEADQUARTER,INT.,The Changing Face of Evil,1999-02-03,Deep Space Nine,570.txt,0.5719
21763,21763,21763,21763,182,WEYOUN,"I like it so much better when we agree on things, don't you?",19   INT. DOMINION HEADQUARTERS - DAY,DOMINION HEADQUARTER,INT.,The Changing Face of Evil,1999-02-03,Deep Space Nine,570.txt,0.0
21764,21764,21764,21764,183,SOLBOR,The text of the Kosst Amojan. As you requested...,20   INT. KAI WINN'S OFFICE,KAI WINN'S OFFICE,INT.,The Changing Face of Evil,1999-02-03,Deep Space Nine,570.txt,0.0
21765,21765,21765,21765,184,WINN,Very good.,20   INT. KAI WINN'S OFFICE,KAI WINN'S OFFICE,INT.,The Changing Face of Evil,1999-02-03,Deep Space Nine,570.txt,0.0
21766,21766,21766,21766,185,WINN,Well? Put it on my desk.,20   INT. KAI WINN'S OFFICE,KAI WINN'S OFFICE,INT.,The Changing Face of Evil,1999-02-03,Deep Space Nine,570.txt,0.0
21767,21767,21767,21767,186,SOLBOR,Eminence. May I speak frankly?,20   INT. KAI WINN'S OFFICE,KAI WINN'S OFFICE,INT.,The Changing Face of Evil,1999-02-03,Deep Space Nine,570.txt,0.0
21768,21768,21768,21768,187,WINN,If you must.,20   INT. KAI WINN'S OFFICE,KAI WINN'S OFFICE,INT.,The Changing Face of Evil,1999-02-03,Deep Space Nine,570.txt,0.0
21769,21769,21769,21769,188,SOLBOR,This book... it hasn't been removed from the archives -- not in seven hundred years.,20   INT. KAI WINN'S OFFICE,KAI WINN'S OFFICE,INT.,The Changing Face of Evil,1999-02-03,Deep Space Nine,570.txt,0.0
21770,21770,21770,21770,189,WINN,Your point being?,20   INT. KAI WINN'S OFFICE,KAI WINN'S OFFICE,INT.,The Changing Face of Evil,1999-02-03,Deep Space Nine,570.txt,0.0
21771,21771,21771,21771,190,SOLBOR,The knowledge it contains... about the Pah-wraiths... it's said to be very dangerous.,20   INT. KAI WINN'S OFFICE,KAI WINN'S OFFICE,INT.,The Changing Face of Evil,1999-02-03,Deep Space Nine,570.txt,0.0
21772,21772,21772,21772,191,WINN,Knowledge is never dangerous -- in the right hands.,20   INT. KAI WINN'S OFFICE,KAI WINN'S OFFICE,INT.,The Changing Face of Evil,1999-02-03,Deep Space Nine,570.txt,0.0
21773,21773,21773,21773,192,SOLBOR,"There's an old saying... ""He who studies evil, is studied by evil.""",20   INT. KAI WINN'S OFFICE,KAI WINN'S OFFICE,INT.,The Changing Face of Evil,1999-02-03,Deep Space Nine,570.txt,0.0
21774,21774,21774,21774,193,WINN,I'll keep that in mind. Now give me the book...,20   INT. KAI WINN'S OFFICE,KAI WINN'S OFFICE,INT.,The Changing Face of Evil,1999-02-03,Deep Space Nine,570.txt,0.0
21775,21775,21775,21775,194,DUKAT,"Your concern for her eminence is acknowledged and appreciated. Nevertheless, you must do as she says. I will see to it that no harm comes to her.",20   INT. KAI WINN'S OFFICE,KAI WINN'S OFFICE,INT.,The Changing Face of Evil,1999-02-03,Deep Space Nine,570.txt,0.0
21776,21776,21776,21776,195,WINN,There. That should make you feel better.,20   INT. KAI WINN'S OFFICE,KAI WINN'S OFFICE,INT.,The Changing Face of Evil,1999-02-03,Deep Space Nine,570.txt,0.0
21777,21777,21777,21777,196,SOLBOR,"I wish it did. But this man... he arrives one day on Deep Space Nine and the next, he's become your closest advisor. What do we know about him? Where does he come from? What does he want?",20   INT. KAI WINN'S OFFICE,KAI WINN'S OFFICE,INT.,The Changing Face of Evil,1999-02-03,Deep Space Nine,570.txt,0.0
21778,21778,21778,21778,197,DUKAT,I want only to serve the Kai.,20   INT. KAI WINN'S OFFICE,KAI WINN'S OFFICE,INT.,The Changing Face of Evil,1999-02-03,Deep Space Nine,570.txt,0.0
21779,21779,21779,21779,198,SOLBOR,"This is his idea, isn't it? To study that hateful book.",20   INT. KAI WINN'S OFFICE,KAI WINN'S OFFICE,INT.,The Changing Face of Evil,1999-02-03,Deep Space Nine,570.txt,0.0
21780,21780,21780,21780,199,WINN,Anjohl was sent to me by the Prophets. That's all I need to know -- that's all anyone needs to know.,20   INT. KAI WINN'S OFFICE,KAI WINN'S OFFICE,INT.,The Changing Face of Evil,1999-02-03,Deep Space Nine,570.txt,0.0
21781,21781,21781,21781,200,DUKAT,I have no idea why I was chosen. But who are we to question the ways of the Prophets?,20   INT. KAI WINN'S OFFICE,KAI WINN'S OFFICE,INT.,The Changing Face of Evil,1999-02-03,Deep Space Nine,570.txt,0.0
21782,21782,21782,21782,201,WINN,Perhaps it would be best if you were to go to the temple and ask the Prophets forgiveness for questioning their wisdom.,20   INT. KAI WINN'S OFFICE,KAI WINN'S OFFICE,INT.,The Changing Face of Evil,1999-02-03,Deep Space Nine,570.txt,0.0
21783,21783,21783,21783,202,WINN,Solbor --,20   INT. KAI WINN'S OFFICE,KAI WINN'S OFFICE,INT.,The Changing Face of Evil,1999-02-03,Deep Space Nine,570.txt,0.0
21784,21784,21784,21784,203,WINN,The key.,20   INT. KAI WINN'S OFFICE,KAI WINN'S OFFICE,INT.,The Changing Face of Evil,1999-02-03,Deep Space Nine,570.txt,0.0
