Unnamed: 0.2,Unnamed: 0.1,Unnamed: 0,index,line,character,quote,scene,location,view,episode,date,series,file,sentiment
107701,107701,107701,107701,239,SABIN,"Captain, there is a basis which will be clear in a moment. Mister Tarses, isn't it true that you deliberately and premeditatively lied when you filled out your personnel application and compounded that lie by repeating it to this committee?",24   INT. INTERROGATION ROOM - A DAY LATER,INTERROGATION ROO,INT.,The Drumhead,1991-02-07,The Next Generation,195.txt,0.0
107702,107702,107702,107702,240,TARSES,What -- ?,24   INT. INTERROGATION ROOM - A DAY LATER,INTERROGATION ROO,INT.,The Drumhead,1991-02-07,The Next Generation,195.txt,0.0
107703,107703,107703,107703,241,SABIN,Isn't - it - true... that the paternal grandfather of whom you speak was not Vulcan... but was in fact a Romulan? That it is Romulan blood you carry... and a Romulan heritage that you honor?,24   INT. INTERROGATION ROOM - A DAY LATER,INTERROGATION ROO,INT.,The Drumhead,1991-02-07,The Next Generation,195.txt,0.0
107704,107704,107704,107704,242,SABIN,"We're waiting, Mister Tarses.",24   INT. INTERROGATION ROOM - A DAY LATER,INTERROGATION ROO,INT.,The Drumhead,1991-02-07,The Next Generation,195.txt,0.0
107705,107705,107705,107705,243,TARSES,On the advice of my counsel... I refuse to answer the question... in that... the answer... may serve... to incriminate me.,24   INT. INTERROGATION ROOM - A DAY LATER,INTERROGATION ROO,INT.,The Drumhead,1991-02-07,The Next Generation,195.txt,0.0
107706,107706,107706,107706,244,WORF,"Ensign Bailey, you and Crewman Marcus will coordinate to track Tarses' movements for the last five years. Ensign Kellogg, I want a list of all his relatives... his known associates... especially old school friends...",27   INT. OBSERVATION LOUNGE,OBSERVATION LOUNGE,INT.,The Drumhead,1991-02-07,The Next Generation,195.txt,0.0
107707,107707,107707,107707,245,WORF,And make arrangements to do an encephalographic polygraph scan...,27   INT. OBSERVATION LOUNGE,OBSERVATION LOUNGE,INT.,The Drumhead,1991-02-07,The Next Generation,195.txt,0.0
107708,107708,107708,107708,246,PICARD,Mister Worf...,27   INT. OBSERVATION LOUNGE,OBSERVATION LOUNGE,INT.,The Drumhead,1991-02-07,The Next Generation,195.txt,0.0
107709,107709,107709,107709,247,WORF,"Yes, Captain?",27   INT. OBSERVATION LOUNGE,OBSERVATION LOUNGE,INT.,The Drumhead,1991-02-07,The Next Generation,195.txt,0.0
107710,107710,107710,107710,248,PICARD,I need to speak with you.,27   INT. OBSERVATION LOUNGE,OBSERVATION LOUNGE,INT.,The Drumhead,1991-02-07,The Next Generation,195.txt,0.0
107711,107711,107711,107711,249,WORF,You are dismissed. Please get your reports to me as soon as possible.,27   INT. OBSERVATION LOUNGE,OBSERVATION LOUNGE,INT.,The Drumhead,1991-02-07,The Next Generation,195.txt,0.0
107712,107712,107712,107712,250,PICARD,What is going on here?,27   INT. OBSERVATION LOUNGE,OBSERVATION LOUNGE,INT.,The Drumhead,1991-02-07,The Next Generation,195.txt,0.0
107713,107713,107713,107713,251,WORF,Captain... I am conducting the investigation of Simon Tarses.,27   INT. OBSERVATION LOUNGE,OBSERVATION LOUNGE,INT.,The Drumhead,1991-02-07,The Next Generation,195.txt,0.0
107714,107714,107714,107714,252,PICARD,"What has happened to us, Mister Worf?",27   INT. OBSERVATION LOUNGE,OBSERVATION LOUNGE,INT.,The Drumhead,1991-02-07,The Next Generation,195.txt,0.0
107715,107715,107715,107715,253,WORF,Sir?,27   INT. OBSERVATION LOUNGE,OBSERVATION LOUNGE,INT.,The Drumhead,1991-02-07,The Next Generation,195.txt,0.0
107716,107716,107716,107716,254,PICARD,I think... we're putting on a drumhead trial...,27   INT. OBSERVATION LOUNGE,OBSERVATION LOUNGE,INT.,The Drumhead,1991-02-07,The Next Generation,195.txt,0.0
107717,107717,107717,107717,255,WORF,I don't understand...,27   INT. OBSERVATION LOUNGE,OBSERVATION LOUNGE,INT.,The Drumhead,1991-02-07,The Next Generation,195.txt,0.0
107718,107718,107718,107718,256,PICARD,Five hundred years ago military officers would upend a drum on the battlefield... sit at it and dispense summary justice... decisions were quick... punishments severe... appeals denied. Those who came to a drumhead were doomed.,27   INT. OBSERVATION LOUNGE,OBSERVATION LOUNGE,INT.,The Drumhead,1991-02-07,The Next Generation,195.txt,0.0
107719,107719,107719,107719,257,WORF,But... we know there is a traitor here. J'Dan has admitted his guilt.,27   INT. OBSERVATION LOUNGE,OBSERVATION LOUNGE,INT.,The Drumhead,1991-02-07,The Next Generation,195.txt,0.0
107720,107720,107720,107720,258,PICARD,That's true. And he will stand for his crimes.,27   INT. OBSERVATION LOUNGE,OBSERVATION LOUNGE,INT.,The Drumhead,1991-02-07,The Next Generation,195.txt,0.0
107721,107721,107721,107721,259,WORF,Tarses has all but done the same.,27   INT. OBSERVATION LOUNGE,OBSERVATION LOUNGE,INT.,The Drumhead,1991-02-07,The Next Generation,195.txt,0.0
107722,107722,107722,107722,260,PICARD,How?,27   INT. OBSERVATION LOUNGE,OBSERVATION LOUNGE,INT.,The Drumhead,1991-02-07,The Next Generation,195.txt,0.0
107723,107723,107723,107723,261,WORF,He refused to answer the question... about his Romulan grandfather.,27   INT. OBSERVATION LOUNGE,OBSERVATION LOUNGE,INT.,The Drumhead,1991-02-07,The Next Generation,195.txt,0.0
107724,107724,107724,107724,262,PICARD,"That is not a crime, Worf. Nor can we infer his guilt because he did not respond.",27   INT. OBSERVATION LOUNGE,OBSERVATION LOUNGE,INT.,The Drumhead,1991-02-07,The Next Generation,195.txt,0.0
107725,107725,107725,107725,263,WORF,"If a man is not afraid of the truth, he would answer.",27   INT. OBSERVATION LOUNGE,OBSERVATION LOUNGE,INT.,The Drumhead,1991-02-07,The Next Generation,195.txt,0.0
107726,107726,107726,107726,264,PICARD,No. We must not let ourselves think that. The Seventh Guarantee is one of the most important rights granted by the Federation. We cannot use one of the fundamental principles of our Constitution and turn it against a citizen.,27   INT. OBSERVATION LOUNGE,OBSERVATION LOUNGE,INT.,The Drumhead,1991-02-07,The Next Generation,195.txt,0.0
107727,107727,107727,107727,265,WORF,Sir... the Federation does have enemies... we must seek them out...,27   INT. OBSERVATION LOUNGE,OBSERVATION LOUNGE,INT.,The Drumhead,1991-02-07,The Next Generation,195.txt,0.0
107728,107728,107728,107728,266,PICARD,"Yes... that's how it starts. But the road from legitimate suspicion to rampant paranoia is shorter than we might think. Something is wrong here, Worf... I don't like what we have become.",27   INT. OBSERVATION LOUNGE,OBSERVATION LOUNGE,INT.,The Drumhead,1991-02-07,The Next Generation,195.txt,0.0
107729,107729,107729,107729,267,PICARD,"Here you are, Mister Tarses... do you care for lemon?",28   INT. PICARD'S QUARTERS,PICARD'S QUARTERS,INT.,The Drumhead,1991-02-07,The Next Generation,195.txt,0.0
107730,107730,107730,107730,268,TARSES,"No, thank you, sir. This is fine.",28   INT. PICARD'S QUARTERS,PICARD'S QUARTERS,INT.,The Drumhead,1991-02-07,The Next Generation,195.txt,0.0
107731,107731,107731,107731,269,PICARD,"Tell me a little about yourself, Crewman... I know you were born on Mars Colony...",28   INT. PICARD'S QUARTERS,PICARD'S QUARTERS,INT.,The Drumhead,1991-02-07,The Next Generation,195.txt,0.0
107732,107732,107732,107732,270,TARSES,"Yes, sir... All my life I wanted to be in Starfleet. I went to the Academy's program for enlisted personnel... took training as a medical technician... served at several outposts... and the day I was posted to the Enterprise was the happiest day of my life.",28   INT. PICARD'S QUARTERS,PICARD'S QUARTERS,INT.,The Drumhead,1991-02-07,The Next Generation,195.txt,0.0
107733,107733,107733,107733,271,PICARD,Did you ever consider applying to the Academy... going the whole route and becoming an officer?,28   INT. PICARD'S QUARTERS,PICARD'S QUARTERS,INT.,The Drumhead,1991-02-07,The Next Generation,195.txt,0.0
107734,107734,107734,107734,272,TARSES,My parents wanted me to... and I thought about it... I used to sit under this big tree near the parade grounds...,28   INT. PICARD'S QUARTERS,PICARD'S QUARTERS,INT.,The Drumhead,1991-02-07,The Next Generation,195.txt,0.0
107735,107735,107735,107735,273,PICARD,An elm tree? With a circular bench?,28   INT. PICARD'S QUARTERS,PICARD'S QUARTERS,INT.,The Drumhead,1991-02-07,The Next Generation,195.txt,0.0
107736,107736,107736,107736,274,TARSES,That's the one...,28   INT. PICARD'S QUARTERS,PICARD'S QUARTERS,INT.,The Drumhead,1991-02-07,The Next Generation,195.txt,0.0
107737,107737,107737,107737,275,PICARD,I spent many an hour there. It was my favorite spot to study.,28   INT. PICARD'S QUARTERS,PICARD'S QUARTERS,INT.,The Drumhead,1991-02-07,The Next Generation,195.txt,0.0
107738,107738,107738,107738,276,TARSES,I used to sit... and watch the drills... and picture myself an officer. I knew it would make my mother happy...,28   INT. PICARD'S QUARTERS,PICARD'S QUARTERS,INT.,The Drumhead,1991-02-07,The Next Generation,195.txt,0.0
107739,107739,107739,107739,277,PICARD,But you didn't do it.,28   INT. PICARD'S QUARTERS,PICARD'S QUARTERS,INT.,The Drumhead,1991-02-07,The Next Generation,195.txt,0.0
107740,107740,107740,107740,278,TARSES,"No... I was eighteen, and eager... the last thing I wanted to do was spend four years sitting in classrooms... I wanted to be out there... traveling the stars... I didn't want to wait for anything...",28   INT. PICARD'S QUARTERS,PICARD'S QUARTERS,INT.,The Drumhead,1991-02-07,The Next Generation,195.txt,0.0
107741,107741,107741,107741,279,TARSES,"And now... it's done, isn't it? My career in Starfleet is finished...",28   INT. PICARD'S QUARTERS,PICARD'S QUARTERS,INT.,The Drumhead,1991-02-07,The Next Generation,195.txt,0.0
107742,107742,107742,107742,280,PICARD,Not if you aren't guilty.,28   INT. PICARD'S QUARTERS,PICARD'S QUARTERS,INT.,The Drumhead,1991-02-07,The Next Generation,195.txt,0.0
107743,107743,107743,107743,281,TARSES,It doesn't matter. I lied on my application... and that mistake will be with me for the rest of my life.,28   INT. PICARD'S QUARTERS,PICARD'S QUARTERS,INT.,The Drumhead,1991-02-07,The Next Generation,195.txt,0.0
107744,107744,107744,107744,282,TARSES,I couldn't wait to get started... and now it's over...,28   INT. PICARD'S QUARTERS,PICARD'S QUARTERS,INT.,The Drumhead,1991-02-07,The Next Generation,195.txt,0.0
107745,107745,107745,107745,283,ADMIRAL SATIE,Mister Worf has found a brother who still lives on Mars Colony... contact someone there and have him interviewed...,29   INT. CORRIDOR - A LITTLE LATER,CORRIDO,INT.,The Drumhead,1991-02-07,The Next Generation,195.txt,0.0
107746,107746,107746,107746,284,PICARD,Admiral Satie...,29   INT. CORRIDOR - A LITTLE LATER,CORRIDO,INT.,The Drumhead,1991-02-07,The Next Generation,195.txt,0.0
107747,107747,107747,107747,285,ADMIRAL SATIE,... and start a background check into all his friends from the Academy training program.,29   INT. CORRIDOR - A LITTLE LATER,CORRIDO,INT.,The Drumhead,1991-02-07,The Next Generation,195.txt,0.0
107748,107748,107748,107748,286,ADMIRAL SATIE,"Yes, Captain?",29   INT. CORRIDOR - A LITTLE LATER,CORRIDO,INT.,The Drumhead,1991-02-07,The Next Generation,195.txt,0.0
107749,107749,107749,107749,287,PICARD,I'd like to talk to you.,29   INT. CORRIDOR - A LITTLE LATER,CORRIDO,INT.,The Drumhead,1991-02-07,The Next Generation,195.txt,0.0
107750,107750,107750,107750,288,ADMIRAL SATIE,Of course.,29   INT. CORRIDOR - A LITTLE LATER,CORRIDO,INT.,The Drumhead,1991-02-07,The Next Generation,195.txt,0.0
107751,107751,107751,107751,289,PICARD,In private...,29   INT. CORRIDOR - A LITTLE LATER,CORRIDO,INT.,The Drumhead,1991-02-07,The Next Generation,195.txt,0.0
107752,107752,107752,107752,290,PICARD,... and off the record.,29   INT. CORRIDOR - A LITTLE LATER,CORRIDO,INT.,The Drumhead,1991-02-07,The Next Generation,195.txt,0.0
107753,107753,107753,107753,291,ADMIRAL SATIE,"Of course, Captain. After all... you are my partner in this.",29   INT. CORRIDOR - A LITTLE LATER,CORRIDO,INT.,The Drumhead,1991-02-07,The Next Generation,195.txt,0.0
107754,107754,107754,107754,292,ADMIRAL SATIE,I cannot possibly believe you mean this.,30   INT. READY ROOM,READY ROOM,INT.,The Drumhead,1991-02-07,The Next Generation,195.txt,0.0
107755,107755,107755,107755,293,PICARD,But I do. This must stop. It's gone too far... you lied to him about the Engine Room -- there was no volatile chemical found there...,30   INT. READY ROOM,READY ROOM,INT.,The Drumhead,1991-02-07,The Next Generation,195.txt,0.0
107756,107756,107756,107756,294,ADMIRAL SATIE,It's just a tactic... a way of applying pressure.,30   INT. READY ROOM,READY ROOM,INT.,The Drumhead,1991-02-07,The Next Generation,195.txt,0.0
107757,107757,107757,107757,295,PICARD,We are hounding an innocent man.,30   INT. READY ROOM,READY ROOM,INT.,The Drumhead,1991-02-07,The Next Generation,195.txt,0.0
107758,107758,107758,107758,296,ADMIRAL SATIE,"And how, may I ask, have you managed to determine that?",30   INT. READY ROOM,READY ROOM,INT.,The Drumhead,1991-02-07,The Next Generation,195.txt,0.0
107759,107759,107759,107759,297,PICARD,I talked with him.,30   INT. READY ROOM,READY ROOM,INT.,The Drumhead,1991-02-07,The Next Generation,195.txt,0.0
107760,107760,107760,107760,298,ADMIRAL SATIE,I see. And he told you he was a victim of circumstance... blameless and pure...,30   INT. READY ROOM,READY ROOM,INT.,The Drumhead,1991-02-07,The Next Generation,195.txt,0.0
107761,107761,107761,107761,299,PICARD,No... he admits his mistake in falsifying his application... but that doesn't make him a traitor.,30   INT. READY ROOM,READY ROOM,INT.,The Drumhead,1991-02-07,The Next Generation,195.txt,0.0
107762,107762,107762,107762,300,ADMIRAL SATIE,Can you be so incredibly naive... ?,30   INT. READY ROOM,READY ROOM,INT.,The Drumhead,1991-02-07,The Next Generation,195.txt,0.0
107763,107763,107763,107763,301,ADMIRAL SATIE,Captain... do you know how I have spent the last four years? Traveling from planet to Starbase to planet...,30   INT. READY ROOM,READY ROOM,INT.,The Drumhead,1991-02-07,The Next Generation,195.txt,0.0
107764,107764,107764,107764,302,ADMIRAL SATIE,I have no home... I live on starships and shuttlecraft... I haven't seen a family member in years... I have no friends.,30   INT. READY ROOM,READY ROOM,INT.,The Drumhead,1991-02-07,The Next Generation,195.txt,0.0
107765,107765,107765,107765,303,ADMIRAL SATIE,But I have a purpose. My father taught me... from the time I was a little girl still clutching a blanket... that the United Federation of Planets is the most remarkable institution ever conceived. It is my cause to make sure that this extraordinary union is preserved...,30   INT. READY ROOM,READY ROOM,INT.,The Drumhead,1991-02-07,The Next Generation,195.txt,0.0
107766,107766,107766,107766,304,ADMIRAL SATIE,"I cannot imagine why you are suddenly trying to block this investigation... there have been others, in the past, who got in my way. They came to regret it.",30   INT. READY ROOM,READY ROOM,INT.,The Drumhead,1991-02-07,The Next Generation,195.txt,0.0
107767,107767,107767,107767,305,PICARD,"The hearings on Simon Tarses must stop. If necessary, I will go to Starfleet Command.",30   INT. READY ROOM,READY ROOM,INT.,The Drumhead,1991-02-07,The Next Generation,195.txt,0.0
107768,107768,107768,107768,306,ADMIRAL SATIE,"Captain, I have news for you... I've been in constant contact with Starfleet Command. And the hearings aren't going to stop -- they're going to be expanded.",30   INT. READY ROOM,READY ROOM,INT.,The Drumhead,1991-02-07,The Next Generation,195.txt,0.0
107769,107769,107769,107769,307,PICARD,What are you saying -- ?,30   INT. READY ROOM,READY ROOM,INT.,The Drumhead,1991-02-07,The Next Generation,195.txt,0.0
107770,107770,107770,107770,308,ADMIRAL SATIE,I am going to get to the heart of this conspiracy... if it means investigating every last person on this ship. And every hearing from now on will be held in the presence of Admiral Thomas Henry of Starfleet Security. I've requested that he be brought here at once...,30   INT. READY ROOM,READY ROOM,INT.,The Drumhead,1991-02-07,The Next Generation,195.txt,0.0
107771,107771,107771,107771,309,PICARD,You never told me about this --,30   INT. READY ROOM,READY ROOM,INT.,The Drumhead,1991-02-07,The Next Generation,195.txt,0.0
107772,107772,107772,107772,310,ADMIRAL SATIE,I report directly to Starfleet Command. I do not require your permission or your approval for my decisions.,30   INT. READY ROOM,READY ROOM,INT.,The Drumhead,1991-02-07,The Next Generation,195.txt,0.0
107773,107773,107773,107773,311,PICARD,Admiral... what you're doing here... is unethical... it's immoral... and I will fight it.,30   INT. READY ROOM,READY ROOM,INT.,The Drumhead,1991-02-07,The Next Generation,195.txt,0.0
107774,107774,107774,107774,312,ADMIRAL SATIE,"Do what you must, Captain. And so will I.",30   INT. READY ROOM,READY ROOM,INT.,The Drumhead,1991-02-07,The Next Generation,195.txt,0.0
107775,107775,107775,107775,313,DATA,"Captain, the warp engines are back on line. We are ready to commence restart sequences.",30B  INT. BRIDGE - A LITTLE LATER,BRIDG,INT.,The Drumhead,1991-02-07,The Next Generation,195.txt,0.0
107776,107776,107776,107776,314,DATA,Sir?,30B  INT. BRIDGE - A LITTLE LATER,BRIDG,INT.,The Drumhead,1991-02-07,The Next Generation,195.txt,0.0
107777,107777,107777,107777,315,PICARD,"Yes... ? Oh... yes, Mister Data. Proceed.",30B  INT. BRIDGE - A LITTLE LATER,BRIDG,INT.,The Drumhead,1991-02-07,The Next Generation,195.txt,0.0
107778,107778,107778,107778,316,PIKER,"Are you all right, Captain?",30B  INT. BRIDGE - A LITTLE LATER,BRIDG,INT.,The Drumhead,1991-02-07,The Next Generation,195.txt,0.0
107779,107779,107779,107779,317,PICARD,"Yes, of course. Just a bit -- preoccupied.",30B  INT. BRIDGE - A LITTLE LATER,BRIDG,INT.,The Drumhead,1991-02-07,The Next Generation,195.txt,0.0
107780,107780,107780,107780,318,NELLEN,Admiral Satie has ordered you to report to the interrogation room at oh-nine-hundred hours tomorrow morning. You are to be questioned before the committee.,30B  INT. BRIDGE - A LITTLE LATER,BRIDG,INT.,The Drumhead,1991-02-07,The Next Generation,195.txt,0.0
107781,107781,107781,107781,319,SABIN,Your full name?,31   INT. INTERROGATION ROOM,INTERROGATION ROOM,INT.,The Drumhead,1991-02-07,The Next Generation,195.txt,0.0
107782,107782,107782,107782,320,PICARD,Jean-Luc Picard.,31   INT. INTERROGATION ROOM,INTERROGATION ROOM,INT.,The Drumhead,1991-02-07,The Next Generation,195.txt,0.0
107783,107783,107783,107783,321,SABIN,Rank and position?,31   INT. INTERROGATION ROOM,INTERROGATION ROOM,INT.,The Drumhead,1991-02-07,The Next Generation,195.txt,0.0
107784,107784,107784,107784,322,PICARD,"Captain, Federation Starship Enterprise.",31   INT. INTERROGATION ROOM,INTERROGATION ROOM,INT.,The Drumhead,1991-02-07,The Next Generation,195.txt,0.0
107785,107785,107785,107785,323,SABIN,How long have you held that post?,31   INT. INTERROGATION ROOM,INTERROGATION ROOM,INT.,The Drumhead,1991-02-07,The Next Generation,195.txt,0.0
107786,107786,107786,107786,324,PICARD,Over three years. Since Stardate 41140.,31   INT. INTERROGATION ROOM,INTERROGATION ROOM,INT.,The Drumhead,1991-02-07,The Next Generation,195.txt,0.0
107787,107787,107787,107787,325,SABIN,Very well. Admiral?,31   INT. INTERROGATION ROOM,INTERROGATION ROOM,INT.,The Drumhead,1991-02-07,The Next Generation,195.txt,0.0
107788,107788,107788,107788,326,PICARD,If you don't mind... I would like to address the committee.,31   INT. INTERROGATION ROOM,INTERROGATION ROOM,INT.,The Drumhead,1991-02-07,The Next Generation,195.txt,0.0
107789,107789,107789,107789,327,ADMIRAL SATIE,"If you have a statement, you'll get an opportunity to make it later --",31   INT. INTERROGATION ROOM,INTERROGATION ROOM,INT.,The Drumhead,1991-02-07,The Next Generation,195.txt,0.0
107790,107790,107790,107790,328,PICARD,"I believe that Chapter Four, Article Twelve of the Uniform Code of Justice grants me the right to make a statement before questioning begins...",31   INT. INTERROGATION ROOM,INTERROGATION ROOM,INT.,The Drumhead,1991-02-07,The Next Generation,195.txt,0.0
107791,107791,107791,107791,329,ADMIRAL SATIE,Very well.,31   INT. INTERROGATION ROOM,INTERROGATION ROOM,INT.,The Drumhead,1991-02-07,The Next Generation,195.txt,0.0
107792,107792,107792,107792,330,PICARD,"I am deeply concerned by what is happening here. It began when we apprehended a spy, a man who admitted his guilt and who will answer for his crime. But the hunt didn't stop there. Another man, Simon Tarses, was brought to trial -- and it was a trial, no matter what others may call it.",31   INT. INTERROGATION ROOM,INTERROGATION ROOM,INT.,The Drumhead,1991-02-07,The Next Generation,195.txt,0.0
107793,107793,107793,107793,331,PICARD,"Unfortunately, it was a trial based on insinuation and innuendo. Nothing substantive against Crewman Tarses was offered, much less proven.",31   INT. INTERROGATION ROOM,INTERROGATION ROOM,INT.,The Drumhead,1991-02-07,The Next Generation,195.txt,0.0
107794,107794,107794,107794,332,PICARD,"This man has a Romulan grandfather. For that, his career stands in ruins. Have we become so fearful? Have we become so cowardly that we must extinguish a man because he carries the blood of a current enemy?",31   INT. INTERROGATION ROOM,INTERROGATION ROOM,INT.,The Drumhead,1991-02-07,The Next Generation,195.txt,0.0
107795,107795,107795,107795,333,PICARD,"I remind you... we are not descended from cowardly people. We come from those who were willing to think the unthinkable, speak the unspeakable...",31   INT. INTERROGATION ROOM,INTERROGATION ROOM,INT.,The Drumhead,1991-02-07,The Next Generation,195.txt,0.0
107796,107796,107796,107796,334,PICARD ,"... and to defend with passion ideas and causes which were, at the moment, unpopular.",31   INT. INTERROGATION ROOM,INTERROGATION ROOM,INT.,The Drumhead,1991-02-07,The Next Generation,195.txt,0.0
107797,107797,107797,107797,335,PICARD,"Admiral, let us not condemn Simon Tarses or anyone else on the basis of half-truth. I implore you... do not continue with this proceeding. End it here.",31   INT. INTERROGATION ROOM,INTERROGATION ROOM,INT.,The Drumhead,1991-02-07,The Next Generation,195.txt,0.0
107798,107798,107798,107798,336,ADMIRAL SATIE,"(beat; still looking down, soft and calm) Captain Picard... do you believe in the Prime Directive?",31   INT. INTERROGATION ROOM,INTERROGATION ROOM,INT.,The Drumhead,1991-02-07,The Next Generation,195.txt,0.0
107799,107799,107799,107799,337,PICARD,Of course.,31   INT. INTERROGATION ROOM,INTERROGATION ROOM,INT.,The Drumhead,1991-02-07,The Next Generation,195.txt,0.0
107800,107800,107800,107800,338,ADMIRAL SATIE,"In fact, it is Starfleet General Order Number One, isn't it?",31   INT. INTERROGATION ROOM,INTERROGATION ROOM,INT.,The Drumhead,1991-02-07,The Next Generation,195.txt,0.0
107801,107801,107801,107801,339,PICARD,"Your point, Admiral... ?",31   INT. INTERROGATION ROOM,INTERROGATION ROOM,INT.,The Drumhead,1991-02-07,The Next Generation,195.txt,0.0
107802,107802,107802,107802,340,ADMIRAL SATIE,"Would it surprise you to learn that you have violated the Prime Directive a total of nine times since you took command of the Enterprise? (without allowing him to answer) I must say, Captain, it surprised the hell out of me.",31   INT. INTERROGATION ROOM,INTERROGATION ROOM,INT.,The Drumhead,1991-02-07,The Next Generation,195.txt,0.0
107803,107803,107803,107803,341,PICARD,My reports to Starfleet document the circumstances in each of those instances --,31   INT. INTERROGATION ROOM,INTERROGATION ROOM,INT.,The Drumhead,1991-02-07,The Next Generation,195.txt,0.0
107804,107804,107804,107804,342,ADMIRAL SATIE,"Yes, we're looking into those reports, Captain, very closely into those reports... after which I'm sure we'll have more questions for you about your so-called commitment to Starfleet's Prime Directive.",31   INT. INTERROGATION ROOM,INTERROGATION ROOM,INT.,The Drumhead,1991-02-07,The Next Generation,195.txt,0.0
107805,107805,107805,107805,343,SABIN,"Captain, could you explain just what happened on Stardate 44390?",31   INT. INTERROGATION ROOM,INTERROGATION ROOM,INT.,The Drumhead,1991-02-07,The Next Generation,195.txt,0.0
107806,107806,107806,107806,344,PICARD,Excuse me?,31   INT. INTERROGATION ROOM,INTERROGATION ROOM,INT.,The Drumhead,1991-02-07,The Next Generation,195.txt,0.0
107807,107807,107807,107807,345,SABIN,Let me refresh your memory. You were transporting a Vulcan ambassador... T'Pel...,31   INT. INTERROGATION ROOM,INTERROGATION ROOM,INT.,The Drumhead,1991-02-07,The Next Generation,195.txt,0.0
107808,107808,107808,107808,346,PICARD,"I was following orders to deliver the ambassador to a destination near the Neutral Zone, and --",31   INT. INTERROGATION ROOM,INTERROGATION ROOM,INT.,The Drumhead,1991-02-07,The Next Generation,195.txt,0.0
107809,107809,107809,107809,347,ADMIRAL SATIE,I don't think we need the preamble.,31   INT. INTERROGATION ROOM,INTERROGATION ROOM,INT.,The Drumhead,1991-02-07,The Next Generation,195.txt,0.0
107810,107810,107810,107810,348,SABIN,"In fact, she was not a Vulcan at all, was she? She was a Romulan spy.",31   INT. INTERROGATION ROOM,INTERROGATION ROOM,INT.,The Drumhead,1991-02-07,The Next Generation,195.txt,0.0
107811,107811,107811,107811,349,PICARD,That's correct.,31   INT. INTERROGATION ROOM,INTERROGATION ROOM,INT.,The Drumhead,1991-02-07,The Next Generation,195.txt,0.0
107812,107812,107812,107812,350,SABIN,A spy whom you delivered back into the hands of the enemy.,31   INT. INTERROGATION ROOM,INTERROGATION ROOM,INT.,The Drumhead,1991-02-07,The Next Generation,195.txt,0.0
107813,107813,107813,107813,351,ADMIRAL SATIE,"Tell me, Captain... when the deception was revealed... and she stood proudly on the Bridge of a Romulan ship... did you make any effort to retrieve her?",31   INT. INTERROGATION ROOM,INTERROGATION ROOM,INT.,The Drumhead,1991-02-07,The Next Generation,195.txt,0.0
107814,107814,107814,107814,352,PICARD,No.,31   INT. INTERROGATION ROOM,INTERROGATION ROOM,INT.,The Drumhead,1991-02-07,The Next Generation,195.txt,0.0
