Unnamed: 0.2,Unnamed: 0.1,Unnamed: 0,index,line,character,quote,scene,location,view,episode,date,series,file,sentiment
129682,129682,129682,129682,104,DATA,"You sent for me, sir?",9    INT. CAPTAIN'S READY ROOM - VIEWSCREEN (OPTICAL),CAPTAIN'S READY ROOM - VIEWSCREEN,INT.,The Measure of a Man,1988-12-14,The Next Generation,135.txt,0.0
129683,129683,129683,129683,105,PICARD,"Please, sit down. We've got a problem.",9    INT. CAPTAIN'S READY ROOM - VIEWSCREEN (OPTICAL),CAPTAIN'S READY ROOM - VIEWSCREEN,INT.,The Measure of a Man,1988-12-14,The Next Generation,135.txt,0.0
129684,129684,129684,129684,106,DATA,"I find myself in agreement with that assessment of the situation, sir.",9    INT. CAPTAIN'S READY ROOM - VIEWSCREEN (OPTICAL),CAPTAIN'S READY ROOM - VIEWSCREEN,INT.,The Measure of a Man,1988-12-14,The Next Generation,135.txt,0.0
129685,129685,129685,129685,107,PICARD,Your service to this ship has been exemplary. I don't want to lose you.,9    INT. CAPTAIN'S READY ROOM - VIEWSCREEN (OPTICAL),CAPTAIN'S READY ROOM - VIEWSCREEN,INT.,The Measure of a Man,1988-12-14,The Next Generation,135.txt,0.0
129686,129686,129686,129686,108,DATA,I am pleased to hear you say so. Thank you.,9    INT. CAPTAIN'S READY ROOM - VIEWSCREEN (OPTICAL),CAPTAIN'S READY ROOM - VIEWSCREEN,INT.,The Measure of a Man,1988-12-14,The Next Generation,135.txt,0.0
129687,129687,129687,129687,109,PICARD,There is a solution which presents itself.,9    INT. CAPTAIN'S READY ROOM - VIEWSCREEN (OPTICAL),CAPTAIN'S READY ROOM - VIEWSCREEN,INT.,The Measure of a Man,1988-12-14,The Next Generation,135.txt,0.0
129688,129688,129688,129688,110,DATA,"Yes, sir?",9    INT. CAPTAIN'S READY ROOM - VIEWSCREEN (OPTICAL),CAPTAIN'S READY ROOM - VIEWSCREEN,INT.,The Measure of a Man,1988-12-14,The Next Generation,135.txt,0.0
129689,129689,129689,129689,111,PICARD,"Undergo the procedure, then the transfer order becomes moot.",9    INT. CAPTAIN'S READY ROOM - VIEWSCREEN (OPTICAL),CAPTAIN'S READY ROOM - VIEWSCREEN,INT.,The Measure of a Man,1988-12-14,The Next Generation,135.txt,0.0
129690,129690,129690,129690,112,DATA,I will not submit to this procedure.,9    INT. CAPTAIN'S READY ROOM - VIEWSCREEN (OPTICAL),CAPTAIN'S READY ROOM - VIEWSCREEN,INT.,The Measure of a Man,1988-12-14,The Next Generation,135.txt,0.0
129691,129691,129691,129691,113,PICARD,"Data, I understand your objections to this procedure, but I also have to consider Starfleet's interests. If Commander Maddox is correct there is a possibility that many more beings such as yourself could be constructed.",9    INT. CAPTAIN'S READY ROOM - VIEWSCREEN (OPTICAL),CAPTAIN'S READY ROOM - VIEWSCREEN,INT.,The Measure of a Man,1988-12-14,The Next Generation,135.txt,0.0
129692,129692,129692,129692,114,DATA,"True, but possibility is a word which can encompass any number of outcomes -- good and bad.",9    INT. CAPTAIN'S READY ROOM - VIEWSCREEN (OPTICAL),CAPTAIN'S READY ROOM - VIEWSCREEN,INT.,The Measure of a Man,1988-12-14,The Next Generation,135.txt,0.0
129693,129693,129693,129693,115,PICARD,"But if he's right, Starfleet would be immeasurably enriched.",9    INT. CAPTAIN'S READY ROOM - VIEWSCREEN (OPTICAL),CAPTAIN'S READY ROOM - VIEWSCREEN,INT.,The Measure of a Man,1988-12-14,The Next Generation,135.txt,0.0
129694,129694,129694,129694,116,DATA,"Captain, I am a Starfleet officer. Can they force me to do this?",9    INT. CAPTAIN'S READY ROOM - VIEWSCREEN (OPTICAL),CAPTAIN'S READY ROOM - VIEWSCREEN,INT.,The Measure of a Man,1988-12-14,The Next Generation,135.txt,0.0
129695,129695,129695,129695,117,PICARD,It's precisely because you are a Starfleet officer that they can. We take an oath to serve. In this case this is the form your service is taking.,9    INT. CAPTAIN'S READY ROOM - VIEWSCREEN (OPTICAL),CAPTAIN'S READY ROOM - VIEWSCREEN,INT.,The Measure of a Man,1988-12-14,The Next Generation,135.txt,0.0
129696,129696,129696,129696,118,DATA,"Sir, Lieutenant La Forge's eyes are far superior to human biological eyes, true?",9    INT. CAPTAIN'S READY ROOM - VIEWSCREEN (OPTICAL),CAPTAIN'S READY ROOM - VIEWSCREEN,INT.,The Measure of a Man,1988-12-14,The Next Generation,135.txt,0.0
129697,129697,129697,129697,119,PICARD,Yes.,9    INT. CAPTAIN'S READY ROOM - VIEWSCREEN (OPTICAL),CAPTAIN'S READY ROOM - VIEWSCREEN,INT.,The Measure of a Man,1988-12-14,The Next Generation,135.txt,0.0
129698,129698,129698,129698,120,DATA,Then why are not all human officers required to have their eyes replaced with cybernetic implants?,9    INT. CAPTAIN'S READY ROOM - VIEWSCREEN (OPTICAL),CAPTAIN'S READY ROOM - VIEWSCREEN,INT.,The Measure of a Man,1988-12-14,The Next Generation,135.txt,0.0
129699,129699,129699,129699,121,DATA,I see. It is precisely because I am not human.,9    INT. CAPTAIN'S READY ROOM - VIEWSCREEN (OPTICAL),CAPTAIN'S READY ROOM - VIEWSCREEN,INT.,The Measure of a Man,1988-12-14,The Next Generation,135.txt,0.0
129700,129700,129700,129700,122,PICARD,"That will be all, Mister Data. (jabs open the com on his desk) Computer. Pull all relevant Starfleet regulations concerning officer transfers.",9    INT. CAPTAIN'S READY ROOM - VIEWSCREEN (OPTICAL),CAPTAIN'S READY ROOM - VIEWSCREEN,INT.,The Measure of a Man,1988-12-14,The Next Generation,135.txt,0.0
129701,129701,129701,129701,123,COMPUTER,Working.,9    INT. CAPTAIN'S READY ROOM - VIEWSCREEN (OPTICAL),CAPTAIN'S READY ROOM - VIEWSCREEN,INT.,The Measure of a Man,1988-12-14,The Next Generation,135.txt,0.0
129702,129702,129702,129702,124,PHILLIPA,"My God, twice in as many days.",10   INT. JAG OFFICE,JAG OFFICE,INT.,The Measure of a Man,1988-12-14,The Next Generation,135.txt,0.0
129703,129703,129703,129703,125,PICARD,I need your help.,10   INT. JAG OFFICE,JAG OFFICE,INT.,The Measure of a Man,1988-12-14,The Next Generation,135.txt,0.0
129704,129704,129704,129704,126,PHILLIPA,An historic moment.,10   INT. JAG OFFICE,JAG OFFICE,INT.,The Measure of a Man,1988-12-14,The Next Generation,135.txt,0.0
129705,129705,129705,129705,127,PICARD,"I've been trying to make heads or tails of this gibberish, and it's finally defeated me. My android officer has been transferred so he can undergo a highly dangerous procedure. I want to stop it.",10   INT. JAG OFFICE,JAG OFFICE,INT.,The Measure of a Man,1988-12-14,The Next Generation,135.txt,0.0
129706,129706,129706,129706,128,PHILLIPA,"He can refuse to undergo this procedure, but we can't stop the transfer.",10   INT. JAG OFFICE,JAG OFFICE,INT.,The Measure of a Man,1988-12-14,The Next Generation,135.txt,0.0
129707,129707,129707,129707,129,PICARD,Once Maddox has Data under his control anything could happen. I don't trust that man.,10   INT. JAG OFFICE,JAG OFFICE,INT.,The Measure of a Man,1988-12-14,The Next Generation,135.txt,0.0
129708,129708,129708,129708,130,PHILLIPA,We agree to certain risks when we join Starfleet.,10   INT. JAG OFFICE,JAG OFFICE,INT.,The Measure of a Man,1988-12-14,The Next Generation,135.txt,0.0
129709,129709,129709,129709,131,PICARD,"Acceptable risks, justified risks, yes, but I can't accept this. It's unfair and unjust. What about his rights...",10   INT. JAG OFFICE,JAG OFFICE,INT.,The Measure of a Man,1988-12-14,The Next Generation,135.txt,0.0
129710,129710,129710,129710,132,PHILLIPA,All this passion over a machine.,10   INT. JAG OFFICE,JAG OFFICE,INT.,The Measure of a Man,1988-12-14,The Next Generation,135.txt,0.0
129711,129711,129711,129711,133,PICARD,(raising a warning finger) Don't start. Is there an option?,10   INT. JAG OFFICE,JAG OFFICE,INT.,The Measure of a Man,1988-12-14,The Next Generation,135.txt,0.0
129712,129712,129712,129712,134,PHILLIPA,There's always an option. He can resign.,10   INT. JAG OFFICE,JAG OFFICE,INT.,The Measure of a Man,1988-12-14,The Next Generation,135.txt,0.0
129713,129713,129713,129713,135,PHILLIPA,So you came to me for help.,10   INT. JAG OFFICE,JAG OFFICE,INT.,The Measure of a Man,1988-12-14,The Next Generation,135.txt,0.0
129714,129714,129714,129714,136,PICARD,"(stiff because he thinks she's taunting him) Yes, I came to you. You're the JAG officer in this sector. I had to come to you.",10   INT. JAG OFFICE,JAG OFFICE,INT.,The Measure of a Man,1988-12-14,The Next Generation,135.txt,0.0
129715,129715,129715,129715,137,PHILLIPA,"Wait! I didn't mean it that way. I'm... I'm glad that you thought you could... well, come to me.",10   INT. JAG OFFICE,JAG OFFICE,INT.,The Measure of a Man,1988-12-14,The Next Generation,135.txt,0.0
129716,129716,129716,129716,138,PICARD,Trust is too painful a word.,10   INT. JAG OFFICE,JAG OFFICE,INT.,The Measure of a Man,1988-12-14,The Next Generation,135.txt,0.0
129717,129717,129717,129717,139,PHILLIPA,I wish things were different for us.,10   INT. JAG OFFICE,JAG OFFICE,INT.,The Measure of a Man,1988-12-14,The Next Generation,135.txt,0.0
129718,129718,129718,129718,140,MADDOX,"""When in disgrace with fortune and men's eyes, I all alone beweep my outcast state... "" Is it just words to you, or do you fathom the meaning?",11   INT. DATA'S QUARTERS (OPTICAL),DATA'S QUARTERS,INT.,The Measure of a Man,1988-12-14,The Next Generation,135.txt,0.0
129719,129719,129719,129719,141,DATA,It is customary to request permission before entering an individual's quarters.,11   INT. DATA'S QUARTERS (OPTICAL),DATA'S QUARTERS,INT.,The Measure of a Man,1988-12-14,The Next Generation,135.txt,0.0
129720,129720,129720,129720,142,MADDOX,"I thought we could talk this out, that I could try to reassure you. Your memories and knowledge will remain intact.",11   INT. DATA'S QUARTERS (OPTICAL),DATA'S QUARTERS,INT.,The Measure of a Man,1988-12-14,The Next Generation,135.txt,0.0
129721,129721,129721,129721,143,DATA,"Reduced to mere sterile facts of the events. The substance, the flavor of the moment could be lost. Take games of chance...",11   INT. DATA'S QUARTERS (OPTICAL),DATA'S QUARTERS,INT.,The Measure of a Man,1988-12-14,The Next Generation,135.txt,0.0
129722,129722,129722,129722,144,MADDOX,Games of chance?,11   INT. DATA'S QUARTERS (OPTICAL),DATA'S QUARTERS,INT.,The Measure of a Man,1988-12-14,The Next Generation,135.txt,0.0
129723,129723,129723,129723,145,DATA,"Yes, I had read and absorbed every treatise and textbook upon the subject, and felt myself tolerably well prepared for the experience. Yet, when I finally played poker, I discovered that the reality bore little resemblance to the rules.",11   INT. DATA'S QUARTERS (OPTICAL),DATA'S QUARTERS,INT.,The Measure of a Man,1988-12-14,The Next Generation,135.txt,0.0
129724,129724,129724,129724,146,MADDOX,The point being?,11   INT. DATA'S QUARTERS (OPTICAL),DATA'S QUARTERS,INT.,The Measure of a Man,1988-12-14,The Next Generation,135.txt,0.0
129725,129725,129725,129725,147,DATA,"That while I believe that you can download the information contained in the positronic brain, I do not think you have acquired the expertise necessary to preserve the heart of those experiences. There is an ineffable quality to memory that I do not believe can survive the shutdown of my core.",11   INT. DATA'S QUARTERS (OPTICAL),DATA'S QUARTERS,INT.,The Measure of a Man,1988-12-14,The Next Generation,135.txt,0.0
129726,129726,129726,129726,148,MADDOX,"(looking at Data with wonder) Ineffable quality. I would rather that we had done this together, but one way or the other we are doing it. You're under my command.",11   INT. DATA'S QUARTERS (OPTICAL),DATA'S QUARTERS,INT.,The Measure of a Man,1988-12-14,The Next Generation,135.txt,0.0
129727,129727,129727,129727,149,DATA,"No, sir, I am not under your nor anyone else's command. I have resigned from Starfleet.",11   INT. DATA'S QUARTERS (OPTICAL),DATA'S QUARTERS,INT.,The Measure of a Man,1988-12-14,The Next Generation,135.txt,0.0
129728,129728,129728,129728,150,MADDOX,Resigned. You can't.,11   INT. DATA'S QUARTERS (OPTICAL),DATA'S QUARTERS,INT.,The Measure of a Man,1988-12-14,The Next Generation,135.txt,0.0
129729,129729,129729,129729,151,DATA,"I regret the decision, but I must. I am the culmination of one man's dream. This is not ego or vanity, but when Doctor Soong created me he added to the substance of the universe. If by your experiments I am destroyed, something unique and wonderful will be lost. I cannot permit that, I must protect the dream.",11   INT. DATA'S QUARTERS (OPTICAL),DATA'S QUARTERS,INT.,The Measure of a Man,1988-12-14,The Next Generation,135.txt,0.0
129730,129730,129730,129730,152,MADDOX,"And so must I. Keep packing, you will be reporting.",11   INT. DATA'S QUARTERS (OPTICAL),DATA'S QUARTERS,INT.,The Measure of a Man,1988-12-14,The Next Generation,135.txt,0.0
129731,129731,129731,129731,153,PICARD ,"Captain's log, supplemental. Commander Bruce Maddox, having been thwarted by Data's abrupt resignation from Starfleet is now seeking a legal remedy for his woes. Captain Louvois has requested my presence at those discussions.",12   INT. JAG OFFICE,JAG OFFICE,INT.,The Measure of a Man,1988-12-14,The Next Generation,135.txt,0.0
129732,129732,129732,129732,154,MADDOX,Your response is emotional and irrational. You're endowing Data with human characteristics because it looks human. But it's not. If it were a box on wheels I wouldn't be facing this opposition.,12   INT. JAG OFFICE,JAG OFFICE,INT.,The Measure of a Man,1988-12-14,The Next Generation,135.txt,0.0
129733,129733,129733,129733,155,PHILLIPA,"Overt sentimentalism is not one of Captain Picard's failings. Trust me, I know.",12   INT. JAG OFFICE,JAG OFFICE,INT.,The Measure of a Man,1988-12-14,The Next Generation,135.txt,0.0
129734,129734,129734,129734,156,PICARD,"Data is a valued member of my crew, an outstanding bridge officer, a --",12   INT. JAG OFFICE,JAG OFFICE,INT.,The Measure of a Man,1988-12-14,The Next Generation,135.txt,0.0
129735,129735,129735,129735,157,MADDOX,"If I'm permitted to make this experiment the horizons for human achievement become boundless. Consider, every ship in the Federation with a Data on board. Utilizing their tremendous capabilities. Acting as our hands and eyes in dangerous situations. That is worth a little inconvenience.",12   INT. JAG OFFICE,JAG OFFICE,INT.,The Measure of a Man,1988-12-14,The Next Generation,135.txt,0.0
129736,129736,129736,129736,158,PHILLIPA,"Look, you're preaching to the choir here. So why don't you get to the point?",12   INT. JAG OFFICE,JAG OFFICE,INT.,The Measure of a Man,1988-12-14,The Next Generation,135.txt,0.0
129737,129737,129737,129737,159,MADDOX,(palms flat on the desk he leans in on her) Data must not be permitted to resign.,12   INT. JAG OFFICE,JAG OFFICE,INT.,The Measure of a Man,1988-12-14,The Next Generation,135.txt,0.0
129738,129738,129738,129738,160,PICARD,He's an officer in Starfleet. He has certain rights...,12   INT. JAG OFFICE,JAG OFFICE,INT.,The Measure of a Man,1988-12-14,The Next Generation,135.txt,0.0
129739,129739,129739,129739,161,MADDOX,Rights! Rights! I'm sick to death of hearing about rights! What about my right not to have my life work subverted by blind ignorance?,12   INT. JAG OFFICE,JAG OFFICE,INT.,The Measure of a Man,1988-12-14,The Next Generation,135.txt,0.0
129740,129740,129740,129740,162,PHILLIPA,"We have rule of law in this Federation. You can't simply seize people, and experiment with them to prove your pet theories.",12   INT. JAG OFFICE,JAG OFFICE,INT.,The Measure of a Man,1988-12-14,The Next Generation,135.txt,0.0
129741,129741,129741,129741,163,MADDOX,"Now you're doing it. Data is an extraordinary piece of engineering, but it is a machine. If you permit it to resign it will destroy years of work in robotics. Starfleet doesn't have to allow the resignation --",12   INT. JAG OFFICE,JAG OFFICE,INT.,The Measure of a Man,1988-12-14,The Next Generation,135.txt,0.0
129742,129742,129742,129742,164,PICARD,"Starfleet is not an organization that ignores its own regulations when they become inconvenient. Whether you like it or not, Data (separating and punctuating each word) does... have... rights.",12   INT. JAG OFFICE,JAG OFFICE,INT.,The Measure of a Man,1988-12-14,The Next Generation,135.txt,0.0
129743,129743,129743,129743,165,MADDOX,(visibly calming himself and ignoring Picard) Let me put it another way. Would you permit the computer on the Enterprise to refuse a refit?,12   INT. JAG OFFICE,JAG OFFICE,INT.,The Measure of a Man,1988-12-14,The Next Generation,135.txt,0.0
129744,129744,129744,129744,166,PHILLIPA,"An interesting point, but the Enterprise computer is property. Is Data?",12   INT. JAG OFFICE,JAG OFFICE,INT.,The Measure of a Man,1988-12-14,The Next Generation,135.txt,0.0
129745,129745,129745,129745,167,MADDOX,Of course.,12   INT. JAG OFFICE,JAG OFFICE,INT.,The Measure of a Man,1988-12-14,The Next Generation,135.txt,0.0
129746,129746,129746,129746,168,PHILLIPA,There might be law to support that position.,12   INT. JAG OFFICE,JAG OFFICE,INT.,The Measure of a Man,1988-12-14,The Next Generation,135.txt,0.0
129747,129747,129747,129747,169,PICARD,A decision with such broad-ranging implications must be supported by an official ruling. And I trust you will apply the same zeal to your research that you used during the Stargazer court-martial.,12   INT. JAG OFFICE,JAG OFFICE,INT.,The Measure of a Man,1988-12-14,The Next Generation,135.txt,0.0
129748,129748,129748,129748,170,WESLEY,You're supposed to rip the wrapping off a present.,13   INT. TEN-FORWARD,TEN-FORWARD,INT.,The Measure of a Man,1988-12-14,The Next Generation,135.txt,0.0
129749,129749,129749,129749,171,DATA,"But with the application of a little care, Wes, the paper can be utilized again.",13   INT. TEN-FORWARD,TEN-FORWARD,INT.,The Measure of a Man,1988-12-14,The Next Generation,135.txt,0.0
129750,129750,129750,129750,172,WESLEY,You're missing the point.,13   INT. TEN-FORWARD,TEN-FORWARD,INT.,The Measure of a Man,1988-12-14,The Next Generation,135.txt,0.0
129751,129751,129751,129751,173,DATA,"The Dream of the Fire, by K'Ratak. Thank you, Worf.",13   INT. TEN-FORWARD,TEN-FORWARD,INT.,The Measure of a Man,1988-12-14,The Next Generation,135.txt,0.0
129752,129752,129752,129752,174,WORF,It was in the hands of the Klingons that the novel attained its full stature.,13   INT. TEN-FORWARD,TEN-FORWARD,INT.,The Measure of a Man,1988-12-14,The Next Generation,135.txt,0.0
129753,129753,129753,129753,175,PULASKI,"I couldn't disagree more, but we'll save that argument for another day. Now listen carefully. I didn't get you a present --",13   INT. TEN-FORWARD,TEN-FORWARD,INT.,The Measure of a Man,1988-12-14,The Next Generation,135.txt,0.0
129754,129754,129754,129754,176,DATA,That is quite all right. None was expected...,13   INT. TEN-FORWARD,TEN-FORWARD,INT.,The Measure of a Man,1988-12-14,The Next Generation,135.txt,0.0
129755,129755,129755,129755,177,PULASKI,Instead I'm going to give you something far more valuable -- my advice. You've spent years in the womb of Starfleet. Now you're about to start a new life. You'd be wise to consider the experiences offered by groundside living.,13   INT. TEN-FORWARD,TEN-FORWARD,INT.,The Measure of a Man,1988-12-14,The Next Generation,135.txt,0.0
129756,129756,129756,129756,178,DATA,"Thank you. I will take that under advisement. (noticing Geordi sitting alone in a corner nursing a drink) Excuse me, please. Is something wrong?",13   INT. TEN-FORWARD,TEN-FORWARD,INT.,The Measure of a Man,1988-12-14,The Next Generation,135.txt,0.0
129757,129757,129757,129757,179,GEORDI,Of course there is. You're going away.,13   INT. TEN-FORWARD,TEN-FORWARD,INT.,The Measure of a Man,1988-12-14,The Next Generation,135.txt,0.0
129758,129758,129758,129758,180,DATA,"No one regrets the necessity more than I, but you do understand my reasons?",13   INT. TEN-FORWARD,TEN-FORWARD,INT.,The Measure of a Man,1988-12-14,The Next Generation,135.txt,0.0
129759,129759,129759,129759,181,GEORDI,"Oh yeah, I understand. I just don't like your being forced out. It's not fair.",13   INT. TEN-FORWARD,TEN-FORWARD,INT.,The Measure of a Man,1988-12-14,The Next Generation,135.txt,0.0
129760,129760,129760,129760,182,DATA,"Doctor Pulaski would, at this juncture, no doubt remind us that life is rarely fair.",13   INT. TEN-FORWARD,TEN-FORWARD,INT.,The Measure of a Man,1988-12-14,The Next Generation,135.txt,0.0
129761,129761,129761,129761,183,GEORDI,"Sorry, but that doesn't make it any easier.",13   INT. TEN-FORWARD,TEN-FORWARD,INT.,The Measure of a Man,1988-12-14,The Next Generation,135.txt,0.0
129762,129762,129762,129762,184,DATA,"(slowly, a little awkwardly) I shall... miss you.",13   INT. TEN-FORWARD,TEN-FORWARD,INT.,The Measure of a Man,1988-12-14,The Next Generation,135.txt,0.0
129763,129763,129763,129763,185,GEORDI,"Me too. (he gives Data a fierce hug) You take care, Data.",13   INT. TEN-FORWARD,TEN-FORWARD,INT.,The Measure of a Man,1988-12-14,The Next Generation,135.txt,0.0
129764,129764,129764,129764,186,RIKER,Deanna... does Data have... do you feel anything from him?,13   INT. TEN-FORWARD,TEN-FORWARD,INT.,The Measure of a Man,1988-12-14,The Next Generation,135.txt,0.0
129765,129765,129765,129765,187,TROI,I can't sense anything from Data. But that proves nothing. There are many minds from which I can read no meaning.,13   INT. TEN-FORWARD,TEN-FORWARD,INT.,The Measure of a Man,1988-12-14,The Next Generation,135.txt,0.0
129766,129766,129766,129766,188,RIKER,"There's got to be more to him than software, nets and chips.",13   INT. TEN-FORWARD,TEN-FORWARD,INT.,The Measure of a Man,1988-12-14,The Next Generation,135.txt,0.0
129767,129767,129767,129767,189,TROI,It is possible that Commander Maddox is correct and we are anthropomorphizing Data. Assigning to him emotions and responses which he may not have.,13   INT. TEN-FORWARD,TEN-FORWARD,INT.,The Measure of a Man,1988-12-14,The Next Generation,135.txt,0.0
129768,129768,129768,129768,190,RIKER,I'm not sure I see that as a problem.,13   INT. TEN-FORWARD,TEN-FORWARD,INT.,The Measure of a Man,1988-12-14,The Next Generation,135.txt,0.0
129769,129769,129769,129769,191,MADDOX,A little farewell celebration?,13   INT. TEN-FORWARD,TEN-FORWARD,INT.,The Measure of a Man,1988-12-14,The Next Generation,135.txt,0.0
129770,129770,129770,129770,192,RIKER,"Yes, to which I don't recall inviting you.",13   INT. TEN-FORWARD,TEN-FORWARD,INT.,The Measure of a Man,1988-12-14,The Next Generation,135.txt,0.0
129771,129771,129771,129771,193,MADDOX,I couldn't miss this. I can't wait to hear Data's plans.,13   INT. TEN-FORWARD,TEN-FORWARD,INT.,The Measure of a Man,1988-12-14,The Next Generation,135.txt,0.0
129772,129772,129772,129772,194,DATA,"They are currently somewhat indefinite, but my programming offers a number of alternatives. (crossing to Wesley, and dropping an arm over the boy's shoulders) I am considering teaching. I have had some success with my star pupil.",13   INT. TEN-FORWARD,TEN-FORWARD,INT.,The Measure of a Man,1988-12-14,The Next Generation,135.txt,0.0
129773,129773,129773,129773,195,MADDOX,I have a better idea. Carnival work. They could bill you as the walking encyclopedia. Ask him any question --,13   INT. TEN-FORWARD,TEN-FORWARD,INT.,The Measure of a Man,1988-12-14,The Next Generation,135.txt,0.0
129774,129774,129774,129774,196,PICARD,"Number One, Captain Louvois has called. We're expected in her office. Meet me in Transporter Room Five.",13   INT. TEN-FORWARD,TEN-FORWARD,INT.,The Measure of a Man,1988-12-14,The Next Generation,135.txt,0.0
129775,129775,129775,129775,197,RIKER,On my way. I know you're just leaving. I'll escort you.,13   INT. TEN-FORWARD,TEN-FORWARD,INT.,The Measure of a Man,1988-12-14,The Next Generation,135.txt,0.0
129776,129776,129776,129776,198,PHILLIPA,"I have completed my research, and based on the Acts of Gould passed in the early twenty-first century, Data is the property of Starfleet. He cannot resign and he cannot refuse to cooperate with Commander Maddox.",14   INT. JAG OFFICE,JAG OFFICE,INT.,The Measure of a Man,1988-12-14,The Next Generation,135.txt,0.0
129777,129777,129777,129777,199,PICARD,And if I challenge this ruling?,14   INT. JAG OFFICE,JAG OFFICE,INT.,The Measure of a Man,1988-12-14,The Next Generation,135.txt,0.0
129778,129778,129778,129778,200,PHILLIPA,I will be required to hold a hearing.,14   INT. JAG OFFICE,JAG OFFICE,INT.,The Measure of a Man,1988-12-14,The Next Generation,135.txt,0.0
129779,129779,129779,129779,201,PICARD,Then I so challenge. Convene your hearing.,14   INT. JAG OFFICE,JAG OFFICE,INT.,The Measure of a Man,1988-12-14,The Next Generation,135.txt,0.0
129780,129780,129780,129780,202,PHILLIPA,"Captain, that would be exceedingly difficult. This is a new base. I have no staff --",14   INT. JAG OFFICE,JAG OFFICE,INT.,The Measure of a Man,1988-12-14,The Next Generation,135.txt,0.0
129781,129781,129781,129781,203,PICARD,Surely there are regulations to cover this eventuality.,14   INT. JAG OFFICE,JAG OFFICE,INT.,The Measure of a Man,1988-12-14,The Next Generation,135.txt,0.0
129782,129782,129782,129782,204,PHILLIPA,There are. I can use serving officers as legal counsel. You as senior officer would defend.,14   INT. JAG OFFICE,JAG OFFICE,INT.,The Measure of a Man,1988-12-14,The Next Generation,135.txt,0.0
129783,129783,129783,129783,205,PICARD,Very well.,14   INT. JAG OFFICE,JAG OFFICE,INT.,The Measure of a Man,1988-12-14,The Next Generation,135.txt,0.0
129784,129784,129784,129784,206,RIKER,And who gets the unenviable task of prosecuting this case?,14   INT. JAG OFFICE,JAG OFFICE,INT.,The Measure of a Man,1988-12-14,The Next Generation,135.txt,0.0
129785,129785,129785,129785,207,PHILLIPA,You do. The next most senior officer aboard defendant's ship.,14   INT. JAG OFFICE,JAG OFFICE,INT.,The Measure of a Man,1988-12-14,The Next Generation,135.txt,0.0
129786,129786,129786,129786,208,RIKER,"I can't. I won't. Data's my friend, my comrade. We've served together and I not only respect him, I have affection for him.",14   INT. JAG OFFICE,JAG OFFICE,INT.,The Measure of a Man,1988-12-14,The Next Generation,135.txt,0.0
129787,129787,129787,129787,209,PHILLIPA,"This isn't about friendship. This is about duty, and how we search for truth.",14   INT. JAG OFFICE,JAG OFFICE,INT.,The Measure of a Man,1988-12-14,The Next Generation,135.txt,0.0
