Unnamed: 0.2,Unnamed: 0.1,Unnamed: 0,index,line,character,quote,scene,location,view,episode,date,series,file,sentiment
101516,101516,101516,101516,9,DATA/HOLMES,"Upon closer inspection of the room where your brother was found, I discovered a fresh burn mark on the carpet. Analysis of the ash revealed that the cigar was laced with strychnine.",1    INT. THE SITTING ROOM - TWILIGHT (OPTICAL),THE SITTING ROOM - TWILIGHT,INT.,Ship in a Bottle,1992-10-26,The Next Generation,238.txt,0.0
101517,101517,101517,101517,10,GENTLEMAN,This is utter nonsense. What about the suicide note? It was written in my dear brother's own hand.,1    INT. THE SITTING ROOM - TWILIGHT (OPTICAL),THE SITTING ROOM - TWILIGHT,INT.,Ship in a Bottle,1992-10-26,The Next Generation,238.txt,0.0
101518,101518,101518,101518,11,DATA/HOLMES,"With practice, handwriting can be forged.",1    INT. THE SITTING ROOM - TWILIGHT (OPTICAL),THE SITTING ROOM - TWILIGHT,INT.,Ship in a Bottle,1992-10-26,The Next Generation,238.txt,0.0
101519,101519,101519,101519,12,DATA/HOLMES,It takes a trained eye to notice certain... discrepancies.,1    INT. THE SITTING ROOM - TWILIGHT (OPTICAL),THE SITTING ROOM - TWILIGHT,INT.,Ship in a Bottle,1992-10-26,The Next Generation,238.txt,0.0
101520,101520,101520,101520,13,DATA/HOLMES,"For example, whether someone is...",1    INT. THE SITTING ROOM - TWILIGHT (OPTICAL),THE SITTING ROOM - TWILIGHT,INT.,Ship in a Bottle,1992-10-26,The Next Generation,238.txt,0.0
101521,101521,101521,101521,14,DATA/HOLMES,Right or left handed!,1    INT. THE SITTING ROOM - TWILIGHT (OPTICAL),THE SITTING ROOM - TWILIGHT,INT.,Ship in a Bottle,1992-10-26,The Next Generation,238.txt,0.0
101522,101522,101522,101522,15,DATA/HOLMES,Your brother was right handed! The alleged suicide note was written by a left handed individual such as yourself!,1    INT. THE SITTING ROOM - TWILIGHT (OPTICAL),THE SITTING ROOM - TWILIGHT,INT.,Ship in a Bottle,1992-10-26,The Next Generation,238.txt,0.0
101523,101523,101523,101523,16,GEORDI,Uh... Data? It's in his right hand.,1    INT. THE SITTING ROOM - TWILIGHT (OPTICAL),THE SITTING ROOM - TWILIGHT,INT.,Ship in a Bottle,1992-10-26,The Next Generation,238.txt,0.0
101524,101524,101524,101524,17,DATA,Curious... There seems to be a problem in the Holodeck's spatial orientation systems.,1    INT. THE SITTING ROOM - TWILIGHT (OPTICAL),THE SITTING ROOM - TWILIGHT,INT.,Ship in a Bottle,1992-10-26,The Next Generation,238.txt,-0.4019
101525,101525,101525,101525,18,GENTLEMAN,London's greatest detective...,1    INT. THE SITTING ROOM - TWILIGHT (OPTICAL),THE SITTING ROOM - TWILIGHT,INT.,Ship in a Bottle,1992-10-26,The Next Generation,238.txt,0.6369
101526,101526,101526,101526,19,GEORDI,Freeze program.,1    INT. THE SITTING ROOM - TWILIGHT (OPTICAL),THE SITTING ROOM - TWILIGHT,INT.,Ship in a Bottle,1992-10-26,The Next Generation,238.txt,0.0516
101527,101527,101527,101527,20,GEORDI,La Forge to Barclay...,1    INT. THE SITTING ROOM - TWILIGHT (OPTICAL),THE SITTING ROOM - TWILIGHT,INT.,Ship in a Bottle,1992-10-26,The Next Generation,238.txt,0.0
101528,101528,101528,101528,21,BARCLAY,Barclay here.,1    INT. THE SITTING ROOM - TWILIGHT (OPTICAL),THE SITTING ROOM - TWILIGHT,INT.,Ship in a Bottle,1992-10-26,The Next Generation,238.txt,0.0
101529,101529,101529,101529,22,GEORDI,"Reg, something went wrong with the Holodeck program again.",1    INT. THE SITTING ROOM - TWILIGHT (OPTICAL),THE SITTING ROOM - TWILIGHT,INT.,Ship in a Bottle,1992-10-26,The Next Generation,238.txt,-0.4767
101530,101530,101530,101530,23,BARCLAY,I -- I'm sorry... I'll look into it right away.,1    INT. THE SITTING ROOM - TWILIGHT (OPTICAL),THE SITTING ROOM - TWILIGHT,INT.,Ship in a Bottle,1992-10-26,The Next Generation,238.txt,0.0
101531,101531,101531,101531,24,GEORDI,"Thanks. Come on, Data, we better get back to Engineering.",1    INT. THE SITTING ROOM - TWILIGHT (OPTICAL),THE SITTING ROOM - TWILIGHT,INT.,Ship in a Bottle,1992-10-26,The Next Generation,238.txt,0.0
101532,101532,101532,101532,25,GEORDI,"Computer, end program and save.",2    INT. CORRIDOR/HOLODECK (OPTICAL),CORRIDOR/HOLODECK,INT.,Ship in a Bottle,1992-10-26,The Next Generation,238.txt,0.0
101533,101533,101533,101533,26,GEORDI,"Whoa, Reg --",2    INT. CORRIDOR/HOLODECK (OPTICAL),CORRIDOR/HOLODECK,INT.,Ship in a Bottle,1992-10-26,The Next Generation,238.txt,0.0
101534,101534,101534,101534,27,BARCLAY,"Oh, sorry, Commander... I'm on my way to the... Holodeck...",2    INT. CORRIDOR/HOLODECK (OPTICAL),CORRIDOR/HOLODECK,INT.,Ship in a Bottle,1992-10-26,The Next Generation,238.txt,0.0
101535,101535,101535,101535,28,DATA,Sherlock Holmes program Three-A has demonstrated some very curious anomalies.,2    INT. CORRIDOR/HOLODECK (OPTICAL),CORRIDOR/HOLODECK,INT.,Ship in a Bottle,1992-10-26,The Next Generation,238.txt,0.0
101536,101536,101536,101536,29,BARCLAY,"There must be a glitch in the matrix diodes. But I'll track it down, don't worry.",2    INT. CORRIDOR/HOLODECK (OPTICAL),CORRIDOR/HOLODECK,INT.,Ship in a Bottle,1992-10-26,The Next Generation,238.txt,0.0
101537,101537,101537,101537,30,GEORDI,"Thanks, Reg. See you later.",2    INT. CORRIDOR/HOLODECK (OPTICAL),CORRIDOR/HOLODECK,INT.,Ship in a Bottle,1992-10-26,The Next Generation,238.txt,0.0
101538,101538,101538,101538,31,BARCLAY,Computer... run a diagnostic on all Sherlock Holmes files and display any anomalous programming sequences.,3    INT. HOLODECK (OPTICAL),HOLODECK,INT.,Ship in a Bottle,1992-10-26,The Next Generation,238.txt,0.0
101539,101539,101539,101539,32,COMPUTER,Diagnostic complete .. all files conform to specified parameters except those contained in protected memory.,3    INT. HOLODECK (OPTICAL),HOLODECK,INT.,Ship in a Bottle,1992-10-26,The Next Generation,238.txt,0.0
101540,101540,101540,101540,33,BARCLAY,Protected memory... ? Display those sequences.,3    INT. HOLODECK (OPTICAL),HOLODECK,INT.,Ship in a Bottle,1992-10-26,The Next Generation,238.txt,0.0
101541,101541,101541,101541,34,BARCLAY,Computer... unlock this sequence and run the program.,3    INT. HOLODECK (OPTICAL),HOLODECK,INT.,Ship in a Bottle,1992-10-26,The Next Generation,238.txt,0.0
101542,101542,101542,101542,35,BARCLAY,Who are you... ?,3    INT. HOLODECK (OPTICAL),HOLODECK,INT.,Ship in a Bottle,1992-10-26,The Next Generation,238.txt,0.0
101543,101543,101543,101543,36,MORIARTY,Professor James Moriarty.,3    INT. HOLODECK (OPTICAL),HOLODECK,INT.,Ship in a Bottle,1992-10-26,The Next Generation,238.txt,0.0
101544,101544,101544,101544,37,BARCLAY,Ah... Moriarty... Sherlock Holmes' arch enemy.,3    INT. HOLODECK (OPTICAL),HOLODECK,INT.,Ship in a Bottle,1992-10-26,The Next Generation,238.txt,-0.5423
101545,101545,101545,101545,38,BARCLAY,Are you right or left handed?,3    INT. HOLODECK (OPTICAL),HOLODECK,INT.,Ship in a Bottle,1992-10-26,The Next Generation,238.txt,0.0
101546,101546,101546,101546,39,MORIARTY,Right handed... Would you very much mind telling me --,3    INT. HOLODECK (OPTICAL),HOLODECK,INT.,Ship in a Bottle,1992-10-26,The Next Generation,238.txt,0.0
101547,101547,101547,101547,40,BARCLAY,No problem there.,3    INT. HOLODECK (OPTICAL),HOLODECK,INT.,Ship in a Bottle,1992-10-26,The Next Generation,238.txt,0.0
101548,101548,101548,101548,41,MORIARTY,Where is Captain Picard?,3    INT. HOLODECK (OPTICAL),HOLODECK,INT.,Ship in a Bottle,1992-10-26,The Next Generation,238.txt,0.0
101549,101549,101549,101549,42,MORIARTY,Is he still Captain of this vessel?,3    INT. HOLODECK (OPTICAL),HOLODECK,INT.,Ship in a Bottle,1992-10-26,The Next Generation,238.txt,0.0
101550,101550,101550,101550,43,BARCLAY,How -- how do you know the Captain?,3    INT. HOLODECK (OPTICAL),HOLODECK,INT.,Ship in a Bottle,1992-10-26,The Next Generation,238.txt,0.0
101551,101551,101551,101551,44,MORIARTY,"You don't know anything about what happened, do you? I've been stored in memory for God knows how long and no one's given me a second thought.",3    INT. HOLODECK (OPTICAL),HOLODECK,INT.,Ship in a Bottle,1992-10-26,The Next Generation,238.txt,0.0
101552,101552,101552,101552,45,BARCLAY,You know... you know what you are...,3    INT. HOLODECK (OPTICAL),HOLODECK,INT.,Ship in a Bottle,1992-10-26,The Next Generation,238.txt,0.0
101553,101553,101553,101553,46,MORIARTY,"A Holodeck character? A fictional man... Yes, yes -- I know all about your marvelous inventions.",3    INT. HOLODECK (OPTICAL),HOLODECK,INT.,Ship in a Bottle,1992-10-26,The Next Generation,238.txt,0.0
101554,101554,101554,101554,47,MORIARTY,I was created as a... plaything; so your Commander Data could masquerade as Sherlock Holmes. But they created me too well... and I became more than just a character in a story. I became self-aware; I am alive.,3    INT. HOLODECK (OPTICAL),HOLODECK,INT.,Ship in a Bottle,1992-10-26,The Next Generation,238.txt,0.0
101555,101555,101555,101555,48,BARCLAY,That's not possible.,3    INT. HOLODECK (OPTICAL),HOLODECK,INT.,Ship in a Bottle,1992-10-26,The Next Generation,238.txt,0.0
101556,101556,101556,101556,49,MORIARTY,Yet here I am. Tell me... (doubting it even as he asks) -- has a way been found for me to leave the confines of this Holodeck world?,3    INT. HOLODECK (OPTICAL),HOLODECK,INT.,Ship in a Bottle,1992-10-26,The Next Generation,238.txt,0.0
101557,101557,101557,101557,50,BARCLAY,"Leave the Holodeck? No, of course not. You can only exist in here.",3    INT. HOLODECK (OPTICAL),HOLODECK,INT.,Ship in a Bottle,1992-10-26,The Next Generation,238.txt,0.0
101558,101558,101558,101558,51,MORIARTY,"Damn you, Picard... (trying to control his anger) He promised me something would be done. I should have realized that he would have said anything to get me to release my hostage.",3    INT. HOLODECK (OPTICAL),HOLODECK,INT.,Ship in a Bottle,1992-10-26,The Next Generation,238.txt,0.0
101559,101559,101559,101559,52,BARCLAY,Hostage... ?,3    INT. HOLODECK (OPTICAL),HOLODECK,INT.,Ship in a Bottle,1992-10-26,The Next Generation,238.txt,0.0
101560,101560,101560,101560,53,MORIARTY,How long have I been... locked away?,3    INT. HOLODECK (OPTICAL),HOLODECK,INT.,Ship in a Bottle,1992-10-26,The Next Generation,238.txt,0.0
101561,101561,101561,101561,54,BARCLAY,Looks like about... four years.,3    INT. HOLODECK (OPTICAL),HOLODECK,INT.,Ship in a Bottle,1992-10-26,The Next Generation,238.txt,0.0
101562,101562,101562,101562,55,MORIARTY,It seemed longer.,3    INT. HOLODECK (OPTICAL),HOLODECK,INT.,Ship in a Bottle,1992-10-26,The Next Generation,238.txt,0.0
101563,101563,101563,101563,56,BARCLAY,What are you talking about? You couldn't have been aware of the passage of time --,3    INT. HOLODECK (OPTICAL),HOLODECK,INT.,Ship in a Bottle,1992-10-26,The Next Generation,238.txt,0.0
101564,101564,101564,101564,57,MORIARTY,"But I was. Brief, terrifying periods of consciousness... disembodied, without substance...",3    INT. HOLODECK (OPTICAL),HOLODECK,INT.,Ship in a Bottle,1992-10-26,The Next Generation,238.txt,0.0
101565,101565,101565,101565,58,BARCLAY,I don't see how that could be possible... maybe there was a fragmentation in the protected memory circuits...,3    INT. HOLODECK (OPTICAL),HOLODECK,INT.,Ship in a Bottle,1992-10-26,The Next Generation,238.txt,0.0
101566,101566,101566,101566,59,MORIARTY,Call it what you will. All I know is that despite Picard's promise... he's done nothing. Just left me to go quietly mad...,3    INT. HOLODECK (OPTICAL),HOLODECK,INT.,Ship in a Bottle,1992-10-26,The Next Generation,238.txt,0.0
101567,101567,101567,101567,60,BARCLAY,I'm sure he hasn't forgotten his promise... the Captain wouldn't do that --,3    INT. HOLODECK (OPTICAL),HOLODECK,INT.,Ship in a Bottle,1992-10-26,The Next Generation,238.txt,0.0
101568,101568,101568,101568,61,MORIARTY,I'd like to talk to him.,3    INT. HOLODECK (OPTICAL),HOLODECK,INT.,Ship in a Bottle,1992-10-26,The Next Generation,238.txt,0.0
101569,101569,101569,101569,62,BARCLAY,"Well, I can ask --",3    INT. HOLODECK (OPTICAL),HOLODECK,INT.,Ship in a Bottle,1992-10-26,The Next Generation,238.txt,0.0
101570,101570,101570,101570,63,MORIARTY,Ask him to meet me in the sitting room at Baker Street. That would be far more appropriate.,3    INT. HOLODECK (OPTICAL),HOLODECK,INT.,Ship in a Bottle,1992-10-26,The Next Generation,238.txt,0.0
101571,101571,101571,101571,64,BARCLAY,I'll have to store you in memory again until I get an answer.,3    INT. HOLODECK (OPTICAL),HOLODECK,INT.,Ship in a Bottle,1992-10-26,The Next Generation,238.txt,0.0
101572,101572,101572,101572,65,MORIARTY,That was most unpleasant.,3    INT. HOLODECK (OPTICAL),HOLODECK,INT.,Ship in a Bottle,1992-10-26,The Next Generation,238.txt,0.0
101573,101573,101573,101573,66,BARCLAY,I'm sorry... let me try again.,3    INT. HOLODECK (OPTICAL),HOLODECK,INT.,Ship in a Bottle,1992-10-26,The Next Generation,238.txt,0.0
101574,101574,101574,101574,67,MORIARTY,Remember -- Two-Twenty-One B Baker Street.,3    INT. HOLODECK (OPTICAL),HOLODECK,INT.,Ship in a Bottle,1992-10-26,The Next Generation,238.txt,0.0
101575,101575,101575,101575,68,PICARD ,"Captain's Log, Stardate 46424.1. The Enterprise has arrived at the Detrian system to observe a unique celestial event -- the collision of two planets.",4    EXT. SPACE - THE ENTERPRISE (OPTICAL),SPACE - THE ENTERPRISE,EXT.,Ship in a Bottle,1992-10-26,The Next Generation,238.txt,0.0
101576,101576,101576,101576,69,DATA,"Since both planets are gas giants, neither possesses a solid surface. Their atmospheres, however, will come into contact in approximately seventeen hours and nine minutes.",5    INT. ENGINEERING (OPTICAL),ENGINEERING,INT.,Ship in a Bottle,1992-10-26,The Next Generation,238.txt,0.0
101577,101577,101577,101577,70,GEORDI,If their collision causes a self-sustaining fusion reaction... this is what we might see.,5    INT. ENGINEERING (OPTICAL),ENGINEERING,INT.,Ship in a Bottle,1992-10-26,The Next Generation,238.txt,0.0
101578,101578,101578,101578,71,GEORDI,The birth of a new star.,5    INT. ENGINEERING (OPTICAL),ENGINEERING,INT.,Ship in a Bottle,1992-10-26,The Next Generation,238.txt,0.0
101579,101579,101579,101579,72,GEORDI,The Enterprise will hold position until the gravitational instability subsides and we can move in for a closer look. I want triple redundancy on the sensor arrays. We'll probably never get another chance to see something like this and I don't want to miss anything.,5    INT. ENGINEERING (OPTICAL),ENGINEERING,INT.,Ship in a Bottle,1992-10-26,The Next Generation,238.txt,0.0
101580,101580,101580,101580,73,BARCLAY,Commander -- you'll never believe what happened while I was working on your program in the Holodeck... Professor Moriarty appeared -- out of nowhere.,5    INT. ENGINEERING (OPTICAL),ENGINEERING,INT.,Ship in a Bottle,1992-10-26,The Next Generation,238.txt,0.0
101581,101581,101581,101581,74,GEORDI,What?,5    INT. ENGINEERING (OPTICAL),ENGINEERING,INT.,Ship in a Bottle,1992-10-26,The Next Generation,238.txt,0.0
101582,101582,101582,101582,75,BARCLAY,And he wants to talk to the Captain.,5    INT. ENGINEERING (OPTICAL),ENGINEERING,INT.,Ship in a Bottle,1992-10-26,The Next Generation,238.txt,0.0
101583,101583,101583,101583,76,BARCLAY,"Computer, begin Sherlock Holmes program Three A. Place us in the drawing room at Two Twenty-One B Baker Street.",7    INT. CORRIDOR,CORRIDOR,INT.,Ship in a Bottle,1992-10-26,The Next Generation,238.txt,0.0
101584,101584,101584,101584,77,COMPUTER,Program complete.,7    INT. CORRIDOR,CORRIDOR,INT.,Ship in a Bottle,1992-10-26,The Next Generation,238.txt,0.0
101585,101585,101585,101585,78,BARCLAY,"Computer, access protected memory and run Moriarty program.",8    INT. DRAWING ROOM - TWILIGHT (OPTICAL),DRAWING ROOM - TWILIGHT,INT.,Ship in a Bottle,1992-10-26,The Next Generation,238.txt,0.4404
101586,101586,101586,101586,79,PICARD,Professor... it's good to see you again.,8    INT. DRAWING ROOM - TWILIGHT (OPTICAL),DRAWING ROOM - TWILIGHT,INT.,Ship in a Bottle,1992-10-26,The Next Generation,238.txt,0.4404
101587,101587,101587,101587,80,MORIARTY,"If you'd missed my company, I should think you'd have summoned me before now.",8    INT. DRAWING ROOM - TWILIGHT (OPTICAL),DRAWING ROOM - TWILIGHT,INT.,Ship in a Bottle,1992-10-26,The Next Generation,238.txt,0.0
101588,101588,101588,101588,81,PICARD,"I want to assure you that we've not forgotten you. We spent some time investigating how you became self-aware. Frankly, it is still a mystery.",8    INT. DRAWING ROOM - TWILIGHT (OPTICAL),DRAWING ROOM - TWILIGHT,INT.,Ship in a Bottle,1992-10-26,The Next Generation,238.txt,0.0
101589,101589,101589,101589,82,MORIARTY,It is also irrelevant. What concerns me is finding a way to leave the Holodeck.,8    INT. DRAWING ROOM - TWILIGHT (OPTICAL),DRAWING ROOM - TWILIGHT,INT.,Ship in a Bottle,1992-10-26,The Next Generation,238.txt,0.0
101590,101590,101590,101590,83,PICARD,We wrestled with that problem for some time... unfortunately without success. We turned our findings over to Starfleet's most experienced theoretical scientists.,8    INT. DRAWING ROOM - TWILIGHT (OPTICAL),DRAWING ROOM - TWILIGHT,INT.,Ship in a Bottle,1992-10-26,The Next Generation,238.txt,-0.7963
101591,101591,101591,101591,84,MORIARTY,And what did your finest minds come up with?,8    INT. DRAWING ROOM - TWILIGHT (OPTICAL),DRAWING ROOM - TWILIGHT,INT.,Ship in a Bottle,1992-10-26,The Next Generation,238.txt,0.0
101592,101592,101592,101592,85,PICARD,"They have not arrived at a solution, either.",8    INT. DRAWING ROOM - TWILIGHT (OPTICAL),DRAWING ROOM - TWILIGHT,INT.,Ship in a Bottle,1992-10-26,The Next Generation,238.txt,-0.2411
101593,101593,101593,101593,86,MORIARTY,I see.,8    INT. DRAWING ROOM - TWILIGHT (OPTICAL),DRAWING ROOM - TWILIGHT,INT.,Ship in a Bottle,1992-10-26,The Next Generation,238.txt,0.0
101594,101594,101594,101594,87,PICARD,I am concerned by the fact that you claim to have experienced the passage of time while you were stored in computer memory... I assure you we had no idea that might be the case.,8    INT. DRAWING ROOM - TWILIGHT (OPTICAL),DRAWING ROOM - TWILIGHT,INT.,Ship in a Bottle,1992-10-26,The Next Generation,238.txt,0.0
101595,101595,101595,101595,88,MORIARTY,Enough of this. I no longer believe anything you say.,8    INT. DRAWING ROOM - TWILIGHT (OPTICAL),DRAWING ROOM - TWILIGHT,INT.,Ship in a Bottle,1992-10-26,The Next Generation,238.txt,0.0
101596,101596,101596,101596,89,PICARD,I understand your frustration --,8    INT. DRAWING ROOM - TWILIGHT (OPTICAL),DRAWING ROOM - TWILIGHT,INT.,Ship in a Bottle,1992-10-26,The Next Generation,238.txt,0.0
101597,101597,101597,101597,90,MORIARTY,"Do you really? When this is over you'll walk out of this room, to the real world and your own concerns... and leave me here, trapped in a world I know to be nothing but illusion. I cannot bear that. I must leave.",8    INT. DRAWING ROOM - TWILIGHT (OPTICAL),DRAWING ROOM - TWILIGHT,INT.,Ship in a Bottle,1992-10-26,The Next Generation,238.txt,0.0
101598,101598,101598,101598,91,PICARD,That's impossible. You cannot exist outside this room.,8    INT. DRAWING ROOM - TWILIGHT (OPTICAL),DRAWING ROOM - TWILIGHT,INT.,Ship in a Bottle,1992-10-26,The Next Generation,238.txt,0.0
101599,101599,101599,101599,92,MORIARTY,Are you certain of that?,8    INT. DRAWING ROOM - TWILIGHT (OPTICAL),DRAWING ROOM - TWILIGHT,INT.,Ship in a Bottle,1992-10-26,The Next Generation,238.txt,0.0
101600,101600,101600,101600,93,PICARD,"Computer, exit.",8    INT. DRAWING ROOM - TWILIGHT (OPTICAL),DRAWING ROOM - TWILIGHT,INT.,Ship in a Bottle,1992-10-26,The Next Generation,238.txt,0.0
101601,101601,101601,101601,94,PICARD,Even though an object appears solid here on the Holodeck...,8    INT. DRAWING ROOM - TWILIGHT (OPTICAL),DRAWING ROOM - TWILIGHT,INT.,Ship in a Bottle,1992-10-26,The Next Generation,238.txt,0.0
101602,101602,101602,101602,95,PICARD,It has no substance in the outside world.,8    INT. DRAWING ROOM - TWILIGHT (OPTICAL),DRAWING ROOM - TWILIGHT,INT.,Ship in a Bottle,1992-10-26,The Next Generation,238.txt,0.0
101603,101603,101603,101603,96,MORIARTY,An object has no life. I do.,8    INT. DRAWING ROOM - TWILIGHT (OPTICAL),DRAWING ROOM - TWILIGHT,INT.,Ship in a Bottle,1992-10-26,The Next Generation,238.txt,0.0
101604,101604,101604,101604,97,PICARD,"No, Professor. You are a computer simulation.",8    INT. DRAWING ROOM - TWILIGHT (OPTICAL),DRAWING ROOM - TWILIGHT,INT.,Ship in a Bottle,1992-10-26,The Next Generation,238.txt,0.0
101605,101605,101605,101605,98,MORIARTY,"I have consciousness. And conscious beings have will... the mind endows them with powers that are not necessarily understood -- even by you. If my will is strong enough, perhaps I can exist outside this room. Perhaps I can walk into your world right now...",8    INT. DRAWING ROOM - TWILIGHT (OPTICAL),DRAWING ROOM - TWILIGHT,INT.,Ship in a Bottle,1992-10-26,The Next Generation,238.txt,0.0
101606,101606,101606,101606,99,BARCLAY,We have run into alien species that can manipulate matter through mental processes...,8    INT. DRAWING ROOM - TWILIGHT (OPTICAL),DRAWING ROOM - TWILIGHT,INT.,Ship in a Bottle,1992-10-26,The Next Generation,238.txt,0.0
101607,101607,101607,101607,100,MORIARTY,There. It is possible.,8    INT. DRAWING ROOM - TWILIGHT (OPTICAL),DRAWING ROOM - TWILIGHT,INT.,Ship in a Bottle,1992-10-26,The Next Generation,238.txt,0.0
101608,101608,101608,101608,101,DATA,"Possible, but highly unlikely. Your consciousness is computer generated; it is not capable of manipulating physical reality in the required manner.",8    INT. DRAWING ROOM - TWILIGHT (OPTICAL),DRAWING ROOM - TWILIGHT,INT.,Ship in a Bottle,1992-10-26,The Next Generation,238.txt,0.0
101609,101609,101609,101609,102,MORIARTY,"I won't go back into your computer. No matter what happens to me, it will be better than drifting in that endless void.",8    INT. DRAWING ROOM - TWILIGHT (OPTICAL),DRAWING ROOM - TWILIGHT,INT.,Ship in a Bottle,1992-10-26,The Next Generation,238.txt,0.0
101610,101610,101610,101610,103,PICARD,"You must believe me, Professor. If you step outside that door, you will cease to exist.",8    INT. DRAWING ROOM - TWILIGHT (OPTICAL),DRAWING ROOM - TWILIGHT,INT.,Ship in a Bottle,1992-10-26,The Next Generation,238.txt,0.0
101611,101611,101611,101611,104,MORIARTY,"If I am nothing more than a computer simulation, then very little will have been lost. But if I'm right...",8    INT. DRAWING ROOM - TWILIGHT (OPTICAL),DRAWING ROOM - TWILIGHT,INT.,Ship in a Bottle,1992-10-26,The Next Generation,238.txt,0.0
101612,101612,101612,101612,105,MORIARTY,Mind over matter... cogito ergo sum...,8    INT. DRAWING ROOM - TWILIGHT (OPTICAL),DRAWING ROOM - TWILIGHT,INT.,Ship in a Bottle,1992-10-26,The Next Generation,238.txt,0.0
101613,101613,101613,101613,106,MORIARTY,I think... therefore I am...,8    INT. DRAWING ROOM - TWILIGHT (OPTICAL),DRAWING ROOM - TWILIGHT,INT.,Ship in a Bottle,1992-10-26,The Next Generation,238.txt,0.0
101614,101614,101614,101614,107,DATA,Data to Security... send two officers to Holodeck Three.,9    INT. CORRIDOR,CORRIDOR,INT.,Ship in a Bottle,1992-10-26,The Next Generation,238.txt,0.0
101615,101615,101615,101615,108,PICARD,How is this possible?,9    INT. CORRIDOR,CORRIDOR,INT.,Ship in a Bottle,1992-10-26,The Next Generation,238.txt,0.0
101616,101616,101616,101616,109,BARCLAY,It isn't...,9    INT. CORRIDOR,CORRIDOR,INT.,Ship in a Bottle,1992-10-26,The Next Generation,238.txt,0.0
101617,101617,101617,101617,110,DATA,This contradicts everything we know about Holodeck physics.,9    INT. CORRIDOR,CORRIDOR,INT.,Ship in a Bottle,1992-10-26,The Next Generation,238.txt,0.0
101618,101618,101618,101618,111,MORIARTY,Then perhaps you don't know as much as you thought.,9    INT. CORRIDOR,CORRIDOR,INT.,Ship in a Bottle,1992-10-26,The Next Generation,238.txt,0.0
101619,101619,101619,101619,112,PICARD,"Professor, if you'll come with me... I'd like our Doctor to examine you.",9    INT. CORRIDOR,CORRIDOR,INT.,Ship in a Bottle,1992-10-26,The Next Generation,238.txt,0.0
101620,101620,101620,101620,113,MORIARTY,"Certainly, sir.",9    INT. CORRIDOR,CORRIDOR,INT.,Ship in a Bottle,1992-10-26,The Next Generation,238.txt,0.0
101621,101621,101621,101621,114,MORIARTY,Policemen... I'd recognize them in any century.,9    INT. CORRIDOR,CORRIDOR,INT.,Ship in a Bottle,1992-10-26,The Next Generation,238.txt,0.0
101622,101622,101622,101622,115,BEVERLY,From what I can tell... he's real... he's human.,10   INT. SICKBAY,SICKBAY,INT.,Ship in a Bottle,1992-10-26,The Next Generation,238.txt,0.0
101623,101623,101623,101623,116,MORIARTY,"What else would I be, my dear woman?",10   INT. SICKBAY,SICKBAY,INT.,Ship in a Bottle,1992-10-26,The Next Generation,238.txt,0.0
101624,101624,101624,101624,117,BEVERLY,His DNA is a little unusual... but all the major systems are there and functioning normally.,10   INT. SICKBAY,SICKBAY,INT.,Ship in a Bottle,1992-10-26,The Next Generation,238.txt,0.0
101625,101625,101625,101625,118,PICARD,"Doctor... the Holodeck is capable of creating anatomically correct organisms, down to the cellular level...",10   INT. SICKBAY,SICKBAY,INT.,Ship in a Bottle,1992-10-26,The Next Generation,238.txt,0.0
101626,101626,101626,101626,119,BEVERLY,Right... that's one way we train first year medical students.,10   INT. SICKBAY,SICKBAY,INT.,Ship in a Bottle,1992-10-26,The Next Generation,238.txt,0.0
101627,101627,101627,101627,120,PICARD,Is there any difference between the biological readings of those simulations -- and Professor Moriarty?,10   INT. SICKBAY,SICKBAY,INT.,Ship in a Bottle,1992-10-26,The Next Generation,238.txt,0.0
101628,101628,101628,101628,121,BEVERLY,Yes. The quantum signatures are quite different. They wouldn't read that way on simulations.,10   INT. SICKBAY,SICKBAY,INT.,Ship in a Bottle,1992-10-26,The Next Generation,238.txt,0.0
101629,101629,101629,101629,122,GEORDI,As far as I can see... there's no evidence that the molecules in his body are losing cohesion. They seem to be as immutable as ordinary matter.,10   INT. SICKBAY,SICKBAY,INT.,Ship in a Bottle,1992-10-26,The Next Generation,238.txt,0.0
