Unnamed: 0.2,Unnamed: 0.1,Unnamed: 0,index,line,character,quote,scene,location,view,episode,date,series,file,sentiment
55657,55657,55657,55657,371,ROM,I gave all my latinum to Major Kira for the Bajoran War Orphans Fund. She kissed me.,34   INT. PROMENADE,PROMENADE,INT.,Ferengi Love Songs,1997-01-30,Deep Space Nine,518.txt,0.0
55658,55658,55658,55658,372,LEETA,"Oh, Rom...",34   INT. PROMENADE,PROMENADE,INT.,Ferengi Love Songs,1997-01-30,Deep Space Nine,518.txt,0.0
55659,55659,55659,55659,373,LEETA,You did that for me?,34   INT. PROMENADE,PROMENADE,INT.,Ferengi Love Songs,1997-01-30,Deep Space Nine,518.txt,0.0
55660,55660,55660,55660,374,ROM,I did it for us. Now we have nothing but our love.,34   INT. PROMENADE,PROMENADE,INT.,Ferengi Love Songs,1997-01-30,Deep Space Nine,518.txt,0.0
55661,55661,55661,55661,375,LEETA,That's all we need. That and my salary from Quark's.,34   INT. PROMENADE,PROMENADE,INT.,Ferengi Love Songs,1997-01-30,Deep Space Nine,518.txt,0.0
55662,55662,55662,55662,376,BASHIR,"Well done, Chief -- or should I call you Cupid?",34   INT. PROMENADE,PROMENADE,INT.,Ferengi Love Songs,1997-01-30,Deep Space Nine,518.txt,0.0
55663,55663,55663,55663,377,O'BRIEN,What can I say? I'm an incurable romantic.,34   INT. PROMENADE,PROMENADE,INT.,Ferengi Love Songs,1997-01-30,Deep Space Nine,518.txt,0.0
55664,55664,55664,55664,378,ISHKA,"Quark, where've you been all day?",36   INT. ISHKA'S HOUSE - LIVING ROOM (VPB) ,ISHKA'S HOUSE - LIVING ROOM,INT.,Ferengi Love Songs,1997-01-30,Deep Space Nine,518.txt,0.0
55665,55665,55665,55665,379,QUARK,With the Nagus. He made me his First Clerk.,36   INT. ISHKA'S HOUSE - LIVING ROOM (VPB) ,ISHKA'S HOUSE - LIVING ROOM,INT.,Ferengi Love Songs,1997-01-30,Deep Space Nine,518.txt,0.0
55666,55666,55666,55666,380,ISHKA,"I see... well then you've had a miserable day, haven't you?",36   INT. ISHKA'S HOUSE - LIVING ROOM (VPB) ,ISHKA'S HOUSE - LIVING ROOM,INT.,Ferengi Love Songs,1997-01-30,Deep Space Nine,518.txt,0.0
55667,55667,55667,55667,381,QUARK,Maybe the worst day of my life. How did you know?,36   INT. ISHKA'S HOUSE - LIVING ROOM (VPB) ,ISHKA'S HOUSE - LIVING ROOM,INT.,Ferengi Love Songs,1997-01-30,Deep Space Nine,518.txt,0.0
55668,55668,55668,55668,382,ISHKA,The market exchange is down a hundred and ninety-nine points.,36   INT. ISHKA'S HOUSE - LIVING ROOM (VPB) ,ISHKA'S HOUSE - LIVING ROOM,INT.,Ferengi Love Songs,1997-01-30,Deep Space Nine,518.txt,0.0
55669,55669,55669,55669,383,QUARK,I don't know if I should tell you this -- but I have to tell someone. The Nagus...,36   INT. ISHKA'S HOUSE - LIVING ROOM (VPB) ,ISHKA'S HOUSE - LIVING ROOM,INT.,Ferengi Love Songs,1997-01-30,Deep Space Nine,518.txt,0.0
55670,55670,55670,55670,384,QUARK,He isn't...,36   INT. ISHKA'S HOUSE - LIVING ROOM (VPB) ,ISHKA'S HOUSE - LIVING ROOM,INT.,Ferengi Love Songs,1997-01-30,Deep Space Nine,518.txt,0.0
55671,55671,55671,55671,385,ISHKA,I know. His memory isn't what it used to be. Did you try stroking his lobes?,36   INT. ISHKA'S HOUSE - LIVING ROOM (VPB) ,ISHKA'S HOUSE - LIVING ROOM,INT.,Ferengi Love Songs,1997-01-30,Deep Space Nine,518.txt,0.0
55672,55672,55672,55672,386,QUARK,"No, I didn't stroke his lobes!",36   INT. ISHKA'S HOUSE - LIVING ROOM (VPB) ,ISHKA'S HOUSE - LIVING ROOM,INT.,Ferengi Love Songs,1997-01-30,Deep Space Nine,518.txt,0.0
55673,55673,55673,55673,387,ISHKA,"It helps focus him. It's also not a bad idea to repeat what you say to him... it sometimes takes two, even three times before he'll retain it.",36   INT. ISHKA'S HOUSE - LIVING ROOM (VPB) ,ISHKA'S HOUSE - LIVING ROOM,INT.,Ferengi Love Songs,1997-01-30,Deep Space Nine,518.txt,0.0
55674,55674,55674,55674,388,QUARK,You two weren't just lovers... you've been helping him run things... you're the power behind the throne!,36   INT. ISHKA'S HOUSE - LIVING ROOM (VPB) ,ISHKA'S HOUSE - LIVING ROOM,INT.,Ferengi Love Songs,1997-01-30,Deep Space Nine,518.txt,0.0
55675,55675,55675,55675,389,ISHKA,"I wouldn't go that far. I just helped him a little, guided him -- a leveraged buyout here... some momentum investing there...",36   INT. ISHKA'S HOUSE - LIVING ROOM (VPB) ,ISHKA'S HOUSE - LIVING ROOM,INT.,Ferengi Love Songs,1997-01-30,Deep Space Nine,518.txt,0.0
55676,55676,55676,55676,390,QUARK,"Why didn't you tell me? If I'd known what was going on, I never would have --",36   INT. ISHKA'S HOUSE - LIVING ROOM (VPB) ,ISHKA'S HOUSE - LIVING ROOM,INT.,Ferengi Love Songs,1997-01-30,Deep Space Nine,518.txt,0.0
55677,55677,55677,55677,391,ISHKA,Never would have what?,36   INT. ISHKA'S HOUSE - LIVING ROOM (VPB) ,ISHKA'S HOUSE - LIVING ROOM,INT.,Ferengi Love Songs,1997-01-30,Deep Space Nine,518.txt,0.0
55678,55678,55678,55678,392,ISHKA,"Oh, Quark... You turned Zek against me, didn't you? You filled his head with all those lies about me.",36   INT. ISHKA'S HOUSE - LIVING ROOM (VPB) ,ISHKA'S HOUSE - LIVING ROOM,INT.,Ferengi Love Songs,1997-01-30,Deep Space Nine,518.txt,0.0
55679,55679,55679,55679,393,QUARK,I didn't know.,36   INT. ISHKA'S HOUSE - LIVING ROOM (VPB) ,ISHKA'S HOUSE - LIVING ROOM,INT.,Ferengi Love Songs,1997-01-30,Deep Space Nine,518.txt,0.0
55680,55680,55680,55680,394,ISHKA,Who put you up to this?,36   INT. ISHKA'S HOUSE - LIVING ROOM (VPB) ,ISHKA'S HOUSE - LIVING ROOM,INT.,Ferengi Love Songs,1997-01-30,Deep Space Nine,518.txt,0.0
55681,55681,55681,55681,395,QUARK,Who do you think?,36   INT. ISHKA'S HOUSE - LIVING ROOM (VPB) ,ISHKA'S HOUSE - LIVING ROOM,INT.,Ferengi Love Songs,1997-01-30,Deep Space Nine,518.txt,0.0
55682,55682,55682,55682,396,ISHKA,Brunt. What did he offer you? Your business license back?,36   INT. ISHKA'S HOUSE - LIVING ROOM (VPB) ,ISHKA'S HOUSE - LIVING ROOM,INT.,Ferengi Love Songs,1997-01-30,Deep Space Nine,518.txt,0.0
55683,55683,55683,55683,397,QUARK,"""A Ferengi without profit is no Ferengi at all."" You taught me that.",36   INT. ISHKA'S HOUSE - LIVING ROOM (VPB) ,ISHKA'S HOUSE - LIVING ROOM,INT.,Ferengi Love Songs,1997-01-30,Deep Space Nine,518.txt,-0.1326
55684,55684,55684,55684,398,ISHKA,"The Rules of Acquisition aren't going to help you now, Quark.",36   INT. ISHKA'S HOUSE - LIVING ROOM (VPB) ,ISHKA'S HOUSE - LIVING ROOM,INT.,Ferengi Love Songs,1997-01-30,Deep Space Nine,518.txt,-0.3089
55685,55685,55685,55685,399,QUARK,A hundred and ninety-nine point slide...,36   INT. ISHKA'S HOUSE - LIVING ROOM (VPB) ,ISHKA'S HOUSE - LIVING ROOM,INT.,Ferengi Love Songs,1997-01-30,Deep Space Nine,518.txt,0.0
55686,55686,55686,55686,400,ISHKA,And that's just the beginning. Congratulations. You've not only destroyed my life and Zek's life... you may have triggered the destruction of the entire Ferengi economy. I hope it was worth it.,36   INT. ISHKA'S HOUSE - LIVING ROOM (VPB) ,ISHKA'S HOUSE - LIVING ROOM,INT.,Ferengi Love Songs,1997-01-30,Deep Space Nine,518.txt,0.0
55687,55687,55687,55687,401,BRUNT ,"My, aren't we early today.",37   INT. TOWER OF COMMERCE - CHAMBER OF PETITIONERS,TOWER OF COMMERC,INT.,Ferengi Love Songs,1997-01-30,Deep Space Nine,518.txt,0.0
55688,55688,55688,55688,402,BRUNT,"But I suppose, after yesterday's fiasco, you have no alternative. A hundred and ninety-nine point plummet... Haven't seen that steep a market slide since Grand Nagus Smeet. And you know what happened to him...",37   INT. TOWER OF COMMERCE - CHAMBER OF PETITIONERS,TOWER OF COMMERC,INT.,Ferengi Love Songs,1997-01-30,Deep Space Nine,518.txt,0.0
55689,55689,55689,55689,403,QUARK,The only Grand Nagus to be assassinated while in office...,37   INT. TOWER OF COMMERCE - CHAMBER OF PETITIONERS,TOWER OF COMMERC,INT.,Ferengi Love Songs,1997-01-30,Deep Space Nine,518.txt,0.0
55690,55690,55690,55690,404,BRUNT,What was the name of his First Clerk? I believe they buried them together.,37   INT. TOWER OF COMMERCE - CHAMBER OF PETITIONERS,TOWER OF COMMERC,INT.,Ferengi Love Songs,1997-01-30,Deep Space Nine,518.txt,0.0
55691,55691,55691,55691,405,QUARK,I'm sure we'll do better today.,37   INT. TOWER OF COMMERCE - CHAMBER OF PETITIONERS,TOWER OF COMMERC,INT.,Ferengi Love Songs,1997-01-30,Deep Space Nine,518.txt,0.0
55692,55692,55692,55692,406,BRUNT,"No, you won't. The Market Exchange will remain closed today. The F.C.A. Board of Liquidators has called an emergency meeting with the Grand Nagus. We have some... questions to ask him. And by the time we're through... you'll both be out of a job.",37   INT. TOWER OF COMMERCE - CHAMBER OF PETITIONERS,TOWER OF COMMERC,INT.,Ferengi Love Songs,1997-01-30,Deep Space Nine,518.txt,0.0
55693,55693,55693,55693,407,QUARK,"Why are you picking on me? I've done everything you've asked, haven't I?",37   INT. TOWER OF COMMERCE - CHAMBER OF PETITIONERS,TOWER OF COMMERC,INT.,Ferengi Love Songs,1997-01-30,Deep Space Nine,518.txt,0.0
55694,55694,55694,55694,408,BRUNT,Everything.,37   INT. TOWER OF COMMERCE - CHAMBER OF PETITIONERS,TOWER OF COMMERC,INT.,Ferengi Love Songs,1997-01-30,Deep Space Nine,518.txt,0.0
55695,55695,55695,55695,409,BRUNT,Grand Nagus Brunt. Daddy will be so proud.,37   INT. TOWER OF COMMERCE - CHAMBER OF PETITIONERS,TOWER OF COMMERC,INT.,Ferengi Love Songs,1997-01-30,Deep Space Nine,518.txt,0.0
55696,55696,55696,55696,410,QUARK,"You knew the truth about the Nagus all along, didn't you?",37   INT. TOWER OF COMMERCE - CHAMBER OF PETITIONERS,TOWER OF COMMERC,INT.,Ferengi Love Songs,1997-01-30,Deep Space Nine,518.txt,0.0
55697,55697,55697,55697,411,BRUNT,"You mean about Zek's failing memory? (feigning a memory search) Let me think... now that you mention it... yes, I did.",37   INT. TOWER OF COMMERCE - CHAMBER OF PETITIONERS,TOWER OF COMMERC,INT.,Ferengi Love Songs,1997-01-30,Deep Space Nine,518.txt,0.0
55698,55698,55698,55698,412,QUARK,"That's why you wanted to destroy his relationship with my mother -- not to protect him, but to expose him.",37   INT. TOWER OF COMMERCE - CHAMBER OF PETITIONERS,TOWER OF COMMERC,INT.,Ferengi Love Songs,1997-01-30,Deep Space Nine,518.txt,0.0
55699,55699,55699,55699,413,BRUNT,"I couldn't have done it without you. I feel almost... grateful. Which is why I'm going to let you keep your new business license. Now put down those PADDS, pack your things, and scurry back to that little bar of yours.",37   INT. TOWER OF COMMERCE - CHAMBER OF PETITIONERS,TOWER OF COMMERC,INT.,Ferengi Love Songs,1997-01-30,Deep Space Nine,518.txt,0.0
55700,55700,55700,55700,414,ISHKA ,"So how come you're still here, Quark?",37   INT. TOWER OF COMMERCE - CHAMBER OF PETITIONERS,TOWER OF COMMERC,INT.,Ferengi Love Songs,1997-01-30,Deep Space Nine,518.txt,0.0
55701,55701,55701,55701,415,ISHKA,"After all, Brunt is right. You should be back on Deep Space Nine, celebrating your victory. You've proven yourself a true Ferengi. You've betrayed friends and family for personal gain.",37   INT. TOWER OF COMMERCE - CHAMBER OF PETITIONERS,TOWER OF COMMERC,INT.,Ferengi Love Songs,1997-01-30,Deep Space Nine,518.txt,0.0
55702,55702,55702,55702,416,QUARK,It sounds so good when you say it.,37   INT. TOWER OF COMMERCE - CHAMBER OF PETITIONERS,TOWER OF COMMERC,INT.,Ferengi Love Songs,1997-01-30,Deep Space Nine,518.txt,0.0
55703,55703,55703,55703,417,ISHKA,But?,37   INT. TOWER OF COMMERCE - CHAMBER OF PETITIONERS,TOWER OF COMMERC,INT.,Ferengi Love Songs,1997-01-30,Deep Space Nine,518.txt,0.0
55704,55704,55704,55704,418,QUARK,I think I've been hanging around Hew-mons too long. I think I'm developing a... a...,37   INT. TOWER OF COMMERCE - CHAMBER OF PETITIONERS,TOWER OF COMMERC,INT.,Ferengi Love Songs,1997-01-30,Deep Space Nine,518.txt,0.0
55705,55705,55705,55705,419,ISHKA,Conscience?,37   INT. TOWER OF COMMERCE - CHAMBER OF PETITIONERS,TOWER OF COMMERC,INT.,Ferengi Love Songs,1997-01-30,Deep Space Nine,518.txt,0.0
55706,55706,55706,55706,420,QUARK,"It's been coming for a long time. I've fought against it -- really I have! But living with those people, day in and day out... being exposed to their ethics... their morality... it's like I've been brainwashed.",37   INT. TOWER OF COMMERCE - CHAMBER OF PETITIONERS,TOWER OF COMMERC,INT.,Ferengi Love Songs,1997-01-30,Deep Space Nine,518.txt,0.0
55707,55707,55707,55707,421,ISHKA,You poor boy.,37   INT. TOWER OF COMMERCE - CHAMBER OF PETITIONERS,TOWER OF COMMERC,INT.,Ferengi Love Songs,1997-01-30,Deep Space Nine,518.txt,0.0
55708,55708,55708,55708,422,QUARK,"Moogie, I'm serious!",37   INT. TOWER OF COMMERCE - CHAMBER OF PETITIONERS,TOWER OF COMMERC,INT.,Ferengi Love Songs,1997-01-30,Deep Space Nine,518.txt,0.0
55709,55709,55709,55709,423,ISHKA,"I know you are. And I know how important your problems are to you. But frankly, Quark, right now -- I don't give a damn about them! We've got much bigger problems to deal with. Do you want Brunt to become Nagus?",37   INT. TOWER OF COMMERCE - CHAMBER OF PETITIONERS,TOWER OF COMMERC,INT.,Ferengi Love Songs,1997-01-30,Deep Space Nine,518.txt,0.0
55710,55710,55710,55710,424,QUARK,Of course not. He was willing to throw our entire economy into chaos just so he could grab power.,37   INT. TOWER OF COMMERCE - CHAMBER OF PETITIONERS,TOWER OF COMMERC,INT.,Ferengi Love Songs,1997-01-30,Deep Space Nine,518.txt,0.0
55711,55711,55711,55711,425,ISHKA,(playing devil's advocate) Sounds like a true Ferengi to me.,37   INT. TOWER OF COMMERCE - CHAMBER OF PETITIONERS,TOWER OF COMMERC,INT.,Ferengi Love Songs,1997-01-30,Deep Space Nine,518.txt,0.0
55712,55712,55712,55712,426,QUARK,"A Ferengi, maybe. But not a Nagus. A Nagus has to be better than that. His personal greed has to reflect the public's greed.",37   INT. TOWER OF COMMERCE - CHAMBER OF PETITIONERS,TOWER OF COMMERC,INT.,Ferengi Love Songs,1997-01-30,Deep Space Nine,518.txt,0.0
55713,55713,55713,55713,427,ISHKA,Like Zek.,37   INT. TOWER OF COMMERCE - CHAMBER OF PETITIONERS,TOWER OF COMMERC,INT.,Ferengi Love Songs,1997-01-30,Deep Space Nine,518.txt,0.0
55714,55714,55714,55714,428,QUARK,Exactly.,37   INT. TOWER OF COMMERCE - CHAMBER OF PETITIONERS,TOWER OF COMMERC,INT.,Ferengi Love Songs,1997-01-30,Deep Space Nine,518.txt,0.0
55715,55715,55715,55715,429,ISHKA,So what are we going to do about it?,37   INT. TOWER OF COMMERCE - CHAMBER OF PETITIONERS,TOWER OF COMMERC,INT.,Ferengi Love Songs,1997-01-30,Deep Space Nine,518.txt,0.0
55716,55716,55716,55716,430,ZEK ,Did you see their faces? They thought they had me.,41   INT. TOWER OF COMMERCE - CHAMBER OF PETITIONERS,TOWER OF COMMERC,INT.,Ferengi Love Songs,1997-01-30,Deep Space Nine,518.txt,0.0
55717,55717,55717,55717,431,ZEK,"But we showed them. I answered every question, didn't I?",41   INT. TOWER OF COMMERCE - CHAMBER OF PETITIONERS,TOWER OF COMMERC,INT.,Ferengi Love Songs,1997-01-30,Deep Space Nine,518.txt,0.0
55718,55718,55718,55718,432,QUARK,You certainly did.,41   INT. TOWER OF COMMERCE - CHAMBER OF PETITIONERS,TOWER OF COMMERC,INT.,Ferengi Love Songs,1997-01-30,Deep Space Nine,518.txt,0.34
55719,55719,55719,55719,433,ZEK,The state of the trade negotiations with the Breen...,41   INT. TOWER OF COMMERCE - CHAMBER OF PETITIONERS,TOWER OF COMMERC,INT.,Ferengi Love Songs,1997-01-30,Deep Space Nine,518.txt,0.0
55720,55720,55720,55720,434,ZEK ,... why I dumped our lokar bean investments... why I insisted we buy up every bit of jevonite we could get our hands on.,41   INT. TOWER OF COMMERCE - CHAMBER OF PETITIONERS,TOWER OF COMMERC,INT.,Ferengi Love Songs,1997-01-30,Deep Space Nine,518.txt,-0.4019
55721,55721,55721,55721,435,QUARK,"You were brilliant. For a moment there, I actually thought Brunt's head was going to explode with frustration.",41   INT. TOWER OF COMMERCE - CHAMBER OF PETITIONERS,TOWER OF COMMERC,INT.,Ferengi Love Songs,1997-01-30,Deep Space Nine,518.txt,0.0
55722,55722,55722,55722,436,ZEK,"By the time I'm done with him, he'll wish it had. He underestimated me. And he underestimated you, too.",41   INT. TOWER OF COMMERCE - CHAMBER OF PETITIONERS,TOWER OF COMMERC,INT.,Ferengi Love Songs,1997-01-30,Deep Space Nine,518.txt,0.0
55723,55723,55723,55723,437,QUARK,Me? I did nothing.,41   INT. TOWER OF COMMERCE - CHAMBER OF PETITIONERS,TOWER OF COMMERC,INT.,Ferengi Love Songs,1997-01-30,Deep Space Nine,518.txt,0.0
55724,55724,55724,55724,438,ZEK,"Nonsense. I might've fooled those Liquidators, but I'm not fooling myself. I'm becoming forgetful. At times, my memory betrays me.",41   INT. TOWER OF COMMERCE - CHAMBER OF PETITIONERS,TOWER OF COMMERC,INT.,Ferengi Love Songs,1997-01-30,Deep Space Nine,518.txt,0.0
55725,55725,55725,55725,439,QUARK,I hear the Vulcans have been very successful at treating memory loss.,41   INT. TOWER OF COMMERCE - CHAMBER OF PETITIONERS,TOWER OF COMMERC,INT.,Ferengi Love Songs,1997-01-30,Deep Space Nine,518.txt,0.0
55726,55726,55726,55726,440,ZEK,"Vulcans, huh? Never liked them. No appreciation of profit. But they do make good doctors. Make an appointment for me.",41   INT. TOWER OF COMMERCE - CHAMBER OF PETITIONERS,TOWER OF COMMERC,INT.,Ferengi Love Songs,1997-01-30,Deep Space Nine,518.txt,0.0
55727,55727,55727,55727,441,ZEK,"I'll never forget what you did for me, Rom --",41   INT. TOWER OF COMMERCE - CHAMBER OF PETITIONERS,TOWER OF COMMERC,INT.,Ferengi Love Songs,1997-01-30,Deep Space Nine,518.txt,0.0
55728,55728,55728,55728,442,QUARK,It's Quark.,41   INT. TOWER OF COMMERCE - CHAMBER OF PETITIONERS,TOWER OF COMMERC,INT.,Ferengi Love Songs,1997-01-30,Deep Space Nine,518.txt,0.0
55729,55729,55729,55729,443,ZEK,"Gotcha. I may have lost my memory, but not my sense of humor.",41   INT. TOWER OF COMMERCE - CHAMBER OF PETITIONERS,TOWER OF COMMERC,INT.,Ferengi Love Songs,1997-01-30,Deep Space Nine,518.txt,0.0
55730,55730,55730,55730,444,ZEK,"As far as I'm concerned, you're still my First Clerk.",41   INT. TOWER OF COMMERCE - CHAMBER OF PETITIONERS,TOWER OF COMMERC,INT.,Ferengi Love Songs,1997-01-30,Deep Space Nine,518.txt,0.0
55731,55731,55731,55731,445,QUARK,"I'm honored, Oh, Shrewd One. But I'm afraid your confidence in me is misplaced. Maihar'du?",41   INT. TOWER OF COMMERCE - CHAMBER OF PETITIONERS,TOWER OF COMMERC,INT.,Ferengi Love Songs,1997-01-30,Deep Space Nine,518.txt,0.0
55732,55732,55732,55732,446,ZEK,"Quark, I find this newfound modesty of yours very annoying. I need a financial advisor and you're it.",41   INT. TOWER OF COMMERCE - CHAMBER OF PETITIONERS,TOWER OF COMMERC,INT.,Ferengi Love Songs,1997-01-30,Deep Space Nine,518.txt,0.0
55733,55733,55733,55733,447,QUARK,"If you insist. But first, let me introduce you to my financial advisor...",41   INT. TOWER OF COMMERCE - CHAMBER OF PETITIONERS,TOWER OF COMMERC,INT.,Ferengi Love Songs,1997-01-30,Deep Space Nine,518.txt,0.0
55734,55734,55734,55734,448,ZEK,Don't tell me...,41   INT. TOWER OF COMMERCE - CHAMBER OF PETITIONERS,TOWER OF COMMERC,INT.,Ferengi Love Songs,1997-01-30,Deep Space Nine,518.txt,0.0
55735,55735,55735,55735,449,ISHKA,Zekkie...,41   INT. TOWER OF COMMERCE - CHAMBER OF PETITIONERS,TOWER OF COMMERC,INT.,Ferengi Love Songs,1997-01-30,Deep Space Nine,518.txt,0.0
55736,55736,55736,55736,450,ZEK,Quark -- why'd you bring that female here?,41   INT. TOWER OF COMMERCE - CHAMBER OF PETITIONERS,TOWER OF COMMERC,INT.,Ferengi Love Songs,1997-01-30,Deep Space Nine,518.txt,0.0
55737,55737,55737,55737,451,QUARK,Because the Nagus deserves the best financial advisor there is -- and that's my Moogie. All the advice I gave you today came from her.,41   INT. TOWER OF COMMERCE - CHAMBER OF PETITIONERS,TOWER OF COMMERC,INT.,Ferengi Love Songs,1997-01-30,Deep Space Nine,518.txt,0.0
55738,55738,55738,55738,452,ISHKA,"I'm not going to lie to you, Zekkie. I believe in equal rights for females. And someday, I hope you will, too. But I'd never do anything to hurt you.",41   INT. TOWER OF COMMERCE - CHAMBER OF PETITIONERS,TOWER OF COMMERC,INT.,Ferengi Love Songs,1997-01-30,Deep Space Nine,518.txt,0.0
55739,55739,55739,55739,453,ZEK,What about all those rumors Quark told me?,41   INT. TOWER OF COMMERCE - CHAMBER OF PETITIONERS,TOWER OF COMMERC,INT.,Ferengi Love Songs,1997-01-30,Deep Space Nine,518.txt,0.0
55740,55740,55740,55740,454,ISHKA,"They were lies. Tell him, Quark.",41   INT. TOWER OF COMMERCE - CHAMBER OF PETITIONERS,TOWER OF COMMERC,INT.,Ferengi Love Songs,1997-01-30,Deep Space Nine,518.txt,0.0
55741,55741,55741,55741,455,QUARK,I guess I stretched the truth here and there...,41   INT. TOWER OF COMMERCE - CHAMBER OF PETITIONERS,TOWER OF COMMERC,INT.,Ferengi Love Songs,1997-01-30,Deep Space Nine,518.txt,0.0
55742,55742,55742,55742,456,ZEK,"Quark, you're fired. The question is... what am I going to do with you?",41   INT. TOWER OF COMMERCE - CHAMBER OF PETITIONERS,TOWER OF COMMERC,INT.,Ferengi Love Songs,1997-01-30,Deep Space Nine,518.txt,0.0
55743,55743,55743,55743,457,ISHKA,Anything you want.,41   INT. TOWER OF COMMERCE - CHAMBER OF PETITIONERS,TOWER OF COMMERC,INT.,Ferengi Love Songs,1997-01-30,Deep Space Nine,518.txt,0.0
55744,55744,55744,55744,458,ZEK,What man could resist an offer like that?,41   INT. TOWER OF COMMERCE - CHAMBER OF PETITIONERS,TOWER OF COMMERC,INT.,Ferengi Love Songs,1997-01-30,Deep Space Nine,518.txt,0.0
55745,55745,55745,55745,459,ISHKA,Let's go home and I'll make dinner.,41   INT. TOWER OF COMMERCE - CHAMBER OF PETITIONERS,TOWER OF COMMERC,INT.,Ferengi Love Songs,1997-01-30,Deep Space Nine,518.txt,0.0
55746,55746,55746,55746,460,ZEK,"No, you won't. Maihar'du will prepare it. I have other plans for you...",41   INT. TOWER OF COMMERCE - CHAMBER OF PETITIONERS,TOWER OF COMMERC,INT.,Ferengi Love Songs,1997-01-30,Deep Space Nine,518.txt,0.0
55747,55747,55747,55747,461,ISHKA,"Oh, Zekkie...",41   INT. TOWER OF COMMERCE - CHAMBER OF PETITIONERS,TOWER OF COMMERC,INT.,Ferengi Love Songs,1997-01-30,Deep Space Nine,518.txt,0.0
55748,55748,55748,55748,462,ISHKA ,Quark -- dinner's on the table.,42   INT. ISHKA'S HOUSE - BEDROOM,ISHKA'S HOUS,INT.,Ferengi Love Songs,1997-01-30,Deep Space Nine,518.txt,0.0
55749,55749,55749,55749,463,QUARK,Be right there.,42   INT. ISHKA'S HOUSE - BEDROOM,ISHKA'S HOUS,INT.,Ferengi Love Songs,1997-01-30,Deep Space Nine,518.txt,0.0
55750,55750,55750,55750,464,ISHKA,Leave some room.,42   INT. ISHKA'S HOUSE - BEDROOM,ISHKA'S HOUS,INT.,Ferengi Love Songs,1997-01-30,Deep Space Nine,518.txt,0.0
55751,55751,55751,55751,465,QUARK,For what?,42   INT. ISHKA'S HOUSE - BEDROOM,ISHKA'S HOUS,INT.,Ferengi Love Songs,1997-01-30,Deep Space Nine,518.txt,0.0
55752,55752,55752,55752,466,ISHKA,For these.,42   INT. ISHKA'S HOUSE - BEDROOM,ISHKA'S HOUS,INT.,Ferengi Love Songs,1997-01-30,Deep Space Nine,518.txt,0.0
55753,55753,55753,55753,467,QUARK,My Marauder Mo action figures. I thought you'd thrown these out...,42   INT. ISHKA'S HOUSE - BEDROOM,ISHKA'S HOUS,INT.,Ferengi Love Songs,1997-01-30,Deep Space Nine,518.txt,0.0
55754,55754,55754,55754,468,ISHKA,"All these years, I've been keeping them in storage for you. I figured you'd want to take them back to Deep Space Nine with you.",42   INT. ISHKA'S HOUSE - BEDROOM,ISHKA'S HOUS,INT.,Ferengi Love Songs,1997-01-30,Deep Space Nine,518.txt,0.0
55755,55755,55755,55755,469,QUARK,I sure do. Do you have any idea how much these are worth?,42   INT. ISHKA'S HOUSE - BEDROOM,ISHKA'S HOUS,INT.,Ferengi Love Songs,1997-01-30,Deep Space Nine,518.txt,0.0
55756,55756,55756,55756,470,ISHKA,Not as much as if you'd kept them in the original packaging... which is what I told you at the time.,42   INT. ISHKA'S HOUSE - BEDROOM,ISHKA'S HOUS,INT.,Ferengi Love Songs,1997-01-30,Deep Space Nine,518.txt,0.0
55757,55757,55757,55757,471,QUARK,"Even then, you were handing out sound financial advice. Thanks, Moogie.",42   INT. ISHKA'S HOUSE - BEDROOM,ISHKA'S HOUS,INT.,Ferengi Love Songs,1997-01-30,Deep Space Nine,518.txt,0.0
55758,55758,55758,55758,472,ISHKA,"No, thank you, Quark.",42   INT. ISHKA'S HOUSE - BEDROOM,ISHKA'S HOUS,INT.,Ferengi Love Songs,1997-01-30,Deep Space Nine,518.txt,0.0
55759,55759,55759,55759,473,BRUNT,"Brunt, F.C.A.",42   INT. ISHKA'S HOUSE - BEDROOM,ISHKA'S HOUS,INT.,Ferengi Love Songs,1997-01-30,Deep Space Nine,518.txt,0.0
55760,55760,55760,55760,474,QUARK,But for how much longer?,42   INT. ISHKA'S HOUSE - BEDROOM,ISHKA'S HOUS,INT.,Ferengi Love Songs,1997-01-30,Deep Space Nine,518.txt,0.0
55761,55761,55761,55761,475,BRUNT,"Don't worry about me, Quark. I'm a survivor. So, the happy couple is back together... If the people only knew...",42   INT. ISHKA'S HOUSE - BEDROOM,ISHKA'S HOUS,INT.,Ferengi Love Songs,1997-01-30,Deep Space Nine,518.txt,0.0
55762,55762,55762,55762,476,QUARK,"But they don't, and you're not going to tell them.",42   INT. ISHKA'S HOUSE - BEDROOM,ISHKA'S HOUS,INT.,Ferengi Love Songs,1997-01-30,Deep Space Nine,518.txt,0.0
55763,55763,55763,55763,477,BRUNT,Really? Why shouldn't I?,42   INT. ISHKA'S HOUSE - BEDROOM,ISHKA'S HOUS,INT.,Ferengi Love Songs,1997-01-30,Deep Space Nine,518.txt,0.0
55764,55764,55764,55764,478,QUARK,Because the Nagus is ready for you. If you go up against him... you'll lose and you know it.,42   INT. ISHKA'S HOUSE - BEDROOM,ISHKA'S HOUS,INT.,Ferengi Love Songs,1997-01-30,Deep Space Nine,518.txt,0.0
55765,55765,55765,55765,479,BRUNT,I hate losing.,42   INT. ISHKA'S HOUSE - BEDROOM,ISHKA'S HOUS,INT.,Ferengi Love Songs,1997-01-30,Deep Space Nine,518.txt,0.0
55766,55766,55766,55766,480,QUARK,What Ferengi doesn't?,42   INT. ISHKA'S HOUSE - BEDROOM,ISHKA'S HOUS,INT.,Ferengi Love Songs,1997-01-30,Deep Space Nine,518.txt,0.0
55767,55767,55767,55767,481,BRUNT,I may not be able to destroy the Nagus... but you're a different story.,42   INT. ISHKA'S HOUSE - BEDROOM,ISHKA'S HOUS,INT.,Ferengi Love Songs,1997-01-30,Deep Space Nine,518.txt,0.0
55768,55768,55768,55768,482,QUARK,You're going to revoke my license again? I don't think the Nagus would like that.,42   INT. ISHKA'S HOUSE - BEDROOM,ISHKA'S HOUS,INT.,Ferengi Love Songs,1997-01-30,Deep Space Nine,518.txt,0.0
55769,55769,55769,55769,483,BRUNT,"On the contrary. I want you back in business. It gives me an opportunity to keep my eye on you. Because one day, you're going to make a mistake. And on that day, you're going to lose more than your license.",42   INT. ISHKA'S HOUSE - BEDROOM,ISHKA'S HOUS,INT.,Ferengi Love Songs,1997-01-30,Deep Space Nine,518.txt,0.0
